year,group,title,funded,proposed_by,summary,website
2023,1,The future of DBI (extension 1),10000,Kirill Müller,"This proposal mostly focuses on the maintenance and support for {DBI}, the {DBItest} test suite, and the three backends to open-source databases ({RSQLite}, {RMariaDB} and {RPostgres}). Keeping compatibility with the evolving ecosystem (OS, databases, R itself, other packages) is vital for the long-term success of the project.",NA
2023,1,Secure TLS Communications for R,10000,Charlie Gao,"The project aims to implement secure connections with a TLS layer for encrypted communications in distributed systems used by statisticians and data scientists. The current lack of secure communication tools restricts the use of existing R packages for long-running tasks to trusted local networks, posing security risks in compromised or untrusted environments. The proposed solution addresses this gap by providing encryption and authentication of endpoints, ensuring data security in line with industry standards.",NA
2023,1,volcalc: Calculate predicted volatility of chemical compounds,12265,Kristina Riemer,"This ISC funded project focuses on the development of the volcalc R package, which automates the estimation of compound volatility based on their chemical structure. The package streamlines the process by downloading chemical structure data, parsing it to identify functional groups, and utilizing the SIMPOL.1 algorithm to predict volatility using functional groups and molecular weight. The compounds are then assigned volatility categories based on a reference environment. This project aims to enhance the package by expanding its compatibility to work with any chemical compound with structural information from various databases. Additionally, improvements in testing and documentation will be implemented to enhance the reliability of the package.",NA
2023,1,autotest: Automated testing of R packages,3000,Mark Padgham,"The project aims to develop an R package to automate property-based testing procedures in R, building upon the existing ""typetracer"" package. The new package will utilize ""typetracer"" to infer properties of function parameters and systematically mutate or randomize these properties to facilitate automated testing. The package will inherit the GPL-3 license from its predecessor and will be submitted to CRAN for wider dissemination. This initiative aligns with the goal of promoting efficient and reliable testing practices within the R community.",NA
2023,1,api2r: An R Package for Auto-Generating R API Clients,15750,Jon Harmon,"This project aims to develop an R package called api2r, which will automate the creation of R package structures for APIs that adhere to the OpenAPI Specification (OAS). By leveraging the OAS as a foundation, api2r will significantly reduce the time and effort required to build API clients in R. This initiative hopes to have a widespread impact within the R community, benefiting data scientists, researchers, and developers who regularly interact with diverse APIs. To ensure its functionality and effectiveness, the development process will involve generating packages based on at least three authentic OpenAPI specifications.",NA
2022,2,D3po: R Package for Easy Interactive D3 Visualization With Shiny,8000,"Mauricio ""Pacho"" Vargas Sepulveda","The D3po: R Package for Easy Interactive D3 Visualization With Shiny project plans to finish a new version of d3po and include maps and other plot types available in highcharts. This project aims to provide out-of-the-box high-quality visualizations with minimum time and coding effort.
The ultimate aim of the project is to produce a package that:
",NA
2022,2,"Tooling and Guidance for Translations of Markdown-Based R Content (Quarto, R Markdown)",8000,Maëlle Salmon,"Tooling and Guidance for Translations of Markdown-Based R Content (Quarto, R Markdown) focuses on the achievement of a first version of translated material, both technically (tooling to create an automatically translated document) and linguistically (glossary). With this proposal, the project will aim to share the rOpenSci workflow with others via the creation of an R package including extensive documentation.",NA
2022,2,Online Submission and Review Infrastructure for the R Journal,22000,Simon Urbanek,"The Online Submission and Review Infrastructure for the R Journal ISC-funded project aims to address problems with the current all-manual revision infrastructure for submissions in the R Journal. The project proposes the development and deployment of an online, web-based system that ties into the existing status management infrastructure but allows for reviews and submission management to be performed online. The ISC funds will be used to assist with the development of an online front-end for the management of articles for the R Journal, including submission, checking, and peer-review tracking of articles. The system will leverage the existing rj and rjtools packages which provide the back-end, but will add a web interface to the process from submission to reviews and article management.",NA
2022,2,Upgrading SatRdays Website Template,6000,Ben Ubah,"The Upgrading SatRdays Website Template project addresses the SatRdays event website templates, which are used by the R community looking to run a SatRday event. The goal of this project is to upgrade the SatRdays website template with a view to make it easy for R community organizers to spin up their own SatRday website without deep knowledge of technologies like Hugo (upon which the current template is based using an R package like blogdown. There will also be documentation of this development with easy-to-follow instructions that are beginner-friendly.",NA
2022,2,Building the “Spatial Data Science With R” Educational Materials and Pedagogical Infrastructure,25000,Orhun Aydin,The Building the “Spatial Data Science With R” Educational Materials and Pedagogical Infrastructure project proposes to deliver a set of self-contained online training modules on spatial and spatiotemporal data science with R. The modules will consist of focus-areas pertinent to topics frequently requested by the spatial R community using a large number of packages from CRAN Spatial Task View and Spatiotemporal Task View. The deliverable will provide the R Consortium and community with the materials needed to solicit more lessons from the community while ensuring uniformity across lessons.,NA
2022,1,Iterdatasampler: Expanding the lterdatasampler package,15000,Julien Brun and Allison Horst,"Expanding the lterdatasampler Package addresses the need for accessible and relevant datasets in data science education. It aims to provide modern, curated, and approachable environmental data samples from the US Long Term Ecological Research Network (LTER) through the lterdatasampler R package. By offering datasets that save time for instructors, engage students with meaningful data, and foster discussions based on real-world questions.The package serves as a valuable resource for teaching introductory statistics and data science in R. The project seeks funding to expand the package to include data samples from all 28 LTER network sites, with the goal of modernizing course materials with real-world environmental datasets.",NA
2022,1,Femr: Finite Element Method for Solving PDEs in R,20000,Laura Sangalli,"Femr: There is a need for implementing finite element methods (FEM) in R to solve partial differential equations (PDEs). PDEs are crucial mathematical tools used for modeling complex phenomena in various scientific and engineering fields. However, the absence of FEM implementations in R necessitates the reliance on external software, discouraging the statistical community from developing methods involving PDEs and hindering the learning of this essential mathematical tool. The goal of the project is to develop the femR package, which will provide a finite element basis for solving second-order linear elliptic PDEs on general two-dimensional spatial domains in R.
This package will complement the existing deSolve package and enable users to employ finite elements instead of finite differences for solving PDEs on more diverse spatial domains. The development process will include providing comprehensive examples and a final vignette to guide users in utilizing the package's functionalities.",NA
2022,1,Continuing to Improve R’s Ability to Visualise and Explore Missing Values,5000,Nicholas Tierney,"The proposal for “Continuing to Improve R’s Ability to Visualise and Explore Missing Values” addresses missing values in data analysis. Missing values are often dropped by default in data analysis in various stages. There is often not even a warning displayed to alert the user of missing values being dropped or discarded. This means values can be dropped without the user knowing, leading to issues such as potential bias, where missing values might be occurring in high numbers in particular groups.
The proposal for the ISC-funded project addressed this problem in four parts:",NA
2022,1,Dengue Data Hub,2000,Thiyanga Talagala,"The Dengue Data Hub project helps addresses data packages related to Dengue. Dengue is a mosquito-borne viral disease that has spread fast throughout the world, primarily in urban and semi-urban regions. The goal of the Dengue Data Hub is to provide the research community with a unified dataset helpful for dengue research and reproducibility of research. The project proposes the creation of an R package for aggregating dengue data from several sources and the ability to share them in tidy format. Based on the proposal, there will also be tutorials and good documentation for using the “Dengue Data Hub” interface. This will motivate epidemiology researchers to utilize R to analyze their data.",NA
2021,2,"Preparing CRAN for the Retirement of rgdal, rgeos and maptools",17000,Edzer Pebesma,"The retirement of rgdal, rgeos, and maptools presents a significant impact on the CRAN community, these packages are scheduled for retirement by the end of 2023. In response, a proposal for an ISC Funded project has been put forward to tackle this challenge. Preparing CRAN for the Retirement of rgdal, rgeos and maptools focuses on finding suitable alternatives for the functionalities offered by the retiring packages and providing guidance to package maintainers on necessary adjustments and migration steps. By doing so, it aims to minimize disruption to CRAN packages and existing R scripts, ensuring the overall stability and robustness of the CRAN ecosystem. The retirement process will simplify the maintenance of the ""R Spatial stack"" and contribute to the long-term health of the CRAN ecosystem.",NA
2021,2,R Package for the ICESat-2 Altimeter Data,4840,Lampros Mouselimis,"R Package for the ICESat-2 Altimeter Data aims to create an R package specifically designed for accessing ICESat-2 satellite data through the OpenAltimetry API. Addressing the lack of existing R packages for downloading geospatial data in specific formats, the package will enable R users to download ICESat-2 data, list available data based on a bounding box or named location, create simple feature objects using the sf package, and visualize the output data using popular geospatial R packages such as leaflet or mapview. The proposed ISC-funded project will enhance the capabilities of R users working with geospatial datasets, facilitating data exploration, analysis, and visualization within the R environment for improved geospatial research and applications.",NA
2021,2,The Future of DBI,17000,Kirill Müller,"The Future of DBI focuses on the advancements achieved with support from the ISC, including bringing the existing DBI backend, RSQLite, up to specification and implementing two new compliant backends, RMariaDB and RPostgres. This project mostly focuses on the maintenance and support for {DBI}, the {DBItest} test suite, and the three backends to open-source databases ({RSQLite}, {RMariaDB} and {RPostgres}). Ensuring compatibility with evolving elements such as OS, databases, R, and other packages is vital for long-term success. The proposal also includes modules for redesigning the database interface, efficient storage, and arithmetic for big integers, decimals with fixed width and precision, investigating Apache Arrow as an interface, and relational data models with R, with the option to adjust the scope as needed.",NA
2021,2,Data Science and Machine Learning Training Workshop Using R Programming Language,5200,Timothy A. Ogunleye,"We want to conduct training workshops on data science and machine learning with R. Out of nearly 60 countries that form the continent, we carefully selected four countries – one from each of the North, South, West, and East Africa. Nigeria is considered for the West Africa, Kenya is chosen from the East Africa, Sudan from the North Africa, while Zimbabwe is selected from the South African countries. We have 2 volunteers each, who are experts in the field of data science and machine learning with R, from the selected countries. We have also recruited 2 tutors for each country, making a total of 8. These tutors would serve as training assistants to the coordinators. Training materials are to be prepared by the coordinators. Therefore, the coordinators are expected to teach the contents of the training materials.",NA
2021,1,Accounting/Auditing Gap-Analysis,7000,Felix Schildorfer,"There are more and more accountants and auditors who want to start using R and dig into data science. They usually have particular tasks on hand that they want to complete, facilitate, or automate. While they often have some basic stats skills and may be some coding basics, understanding the R landscape and relating tasks and processes to locate and use relevant R packages and tutorials is an extreme challenge. While other areas like finance or pharmaceuticals already have extensive infrastructure to support R newcomers (Working Groups, Courses, Task Views, etc.) accounting and auditing do not. This becomes an obstacle for such professionals - which find the “coding” part difficult on their own but doing so without any support or knowing the appropriate package becomes a nightmare.
This is why R Business put together this project with the aim to gauge the landscape of what functionalities are available for Auditors in the R ecosystem and how the existing functionalities can be mapped to routine accounting/auditing tasks. We will complete a systematic survey of the CRAN-ecosystem for accounting/auditing tasks to establish a mapping and identify gaps. The project will contribute to the development of the R Business ISC working group by attracting interested accounting/auditing professionals, industry bodies and R community members. This will then in turn lead to increased use of R/RStudio, development new application domains for data science, and enhancement of the quality of accounting/auditing services.",NA
2021,1,Extendr - Rust extensions for R.,15000,Andy Thomason,Rust extension framework for R.,NA
2021,1,Google Earth Engine with R,5500,Cesar Luis Aybar Camacho,"Google Earth Engine (GEE) is the most popular and advanced cloud platform designed for planetary-scale environmental data analysis. Its multi-petabyte data catalog and computation services are just accessed via Python and JavaScript client libraries. In order to facilitate its use within R, six months ago, rgee was released on CRAN using reticulate to wrap the GEE Python API. Although rgee provides a familiar interface and simple integration to other R packages (e.g., sf, raster, dplyr), the lack of tutorials and examples makes it difficult for new users to adopt.
The main goal of this project is to leverage the documentation. For this purpose, three main tasks have been proposed: (1) create a new version of rgee with support for shiny and markdown, (2) create rgeeExtra, which extends the functionalities of rgee, and finally write (3) rgeebook, a reference book with best practices and examples of GEE API usage.",NA
2021,1,Improving Translations in R,0,Michael Chirico,"This project will provide a better formalization of translation procedures for R to be more sustainable and more scalable. In the process, it will broaden the inclusivity of R by growing the sub-community of R users comfortable producing translations and extending the reach of the R project to more non-English audiences.",NA
2021,1,Minimizing wastage of blood products,11200,Balasubramanian Narasimhan,"Guan et al. 2017 (Proc Natl Acad Sci U S A 114 (43): 11368–73) used two years worth of data to formulate and solve an optimization problem to predict platelet usage and minimize waste. Two open-source R packages were developed for this purpose:
- Platelet Inventory Prediction or pip (https://github.com/bnaras/pip) a package that is the core ML prediction engine that uses a given set of features described in the above publication
- Stanford Blood Center Platelet Inventory Prediction or SBCpip (https://github.com/bnaras/SBCpip) that was customized to the data workflow at SHC. SBCpip was meant to be site specific.
There have been a number of requests from sites wishing to deploy the software locally. The current project will generalize the model, generalize it to address more blood products with different shelf lives, provide customizations for local use, and create easily deployable solutions.",NA
2021,1,R for Engineering Applications,3000,Benaiah Chibuokem Ubah,"R for Engineering Applications is a proposed project with the aim to attract engineers and diversify the use of the R language to the broad engineering domain – electrical, electronic, communications, robotics, etc engineering. The idea is similar to such projects as R in Finance, R in Insurance, BioConductor (R in Bio-informatics), R in Environmental Statistics, etc.",NA
2021,1,Setting up an R-Girls-Schools Network,5000,Dr. Razia Ghani,"Globally, women, especially from deprived socio-economic and diverse ethnic backgrounds, are under-represented in data science. A major factor is that data science does not feature in the school curriculum which means that teachers are unaware of the enhancements data science can bring to learning and development in and beyond the school. We propose an ongoing project, called R-Girls-School Network (short name R-Girls) to address this and are keen to link up with others.
We are a multi-disciplinary team that includes an educationalist, subject teachers, a data scientist and administrator who will begin to develop and implement a data science curriculum using R in Green Oak Academy – an inner-city school in the UK serving girls from deprived, ethnically diverse backgrounds aged 11-16 years; independently rated as Good with Outstanding for Behaviour and Attitudes.
Since GOA follows the UK national curriculum, which is used in 10,000+ schools and 160 countries, our work will have a broad appeal. In due course we will develop ready-to-use bite-sized learning materials (10-15 mins) for teachers of core subjects (maths, statistics, science, geography) to use via RStudio cloud. The lessons will be tested with teachers and pupils and then incorporated into the school timetable across all five-year groups (age 11-16 years), culminating in an R-Data Story project and in due course, an annual R-Girls virtual conference open to any girl and girls' school in the world.
R-GS will be supported by a website for showcasing the work of pupils and sharing resources.",NA
2021,1,deposits: Deposit Research Data Anywhere,16000,Mark Padgham,"Publicly depositing datasets associated with published research is becoming more common, partly due to journals increasingly requiring data sharing, and partly though more general and ongoing cultural changes in relation to data sharing. Yet data sharing is often seen as time consuming, particularly in order to meet the expectations of individual data repositories. While documentation and training can help get users familiar with processes of data sharing, browser-based data and metadata submission workflows can only be so fast, are not easily reproduced, and do not facilitate regular or automated updates of data and metadata. Better programmatic tools can transform data sharing from a mountainous climb into a pit of success.
This project will develop a unified interface to many different research data repositories, and which will function along the lines of dplyr through ""verbs"" that work identically across many ""backend"" data repositories. The package will initially provide access to a few of the most common data repositories, yet will implement a modular/plugin system to enable users to contribute their own plugins to extend functionality to other repositories. Users will be able to authenticate, prepare data and metadata, and finally to submit, fetch, and browse data.",NA
2020,2,Development and maintenance of the Windows build infrastructure (Top level project proposal),46800,Jeroen Ooms,"As of R 4.0.0 (released April 2020), R for Windows uses a brand new toolchain bundle called rtools40. This version upgrades the mingw-gcc toolchains to version 8.3.0, and introduces a powerful new build system based on the widely used msys2 platform, which makes it easier to maintain R itself, as well as system libraries needed for developing R and R-packages.
The current project seeks to build out this system to improve tooling for building and debugging on Windows, and move towards a scalable build infrastructure, which is transparent, extensible, and fully automated. Thereby we can empower development on Windows, and support further growth of the R ecosystem while relieving work for CRAN and R-core members.",NA
2020,2,Interactive visualisations in R via R-to-JavaScript-transpilation,9688,Chun Fung Kwok,"This project aims to make creating flexible interactive visualisation accessible to a wider R community. By implementing an R-to-JavaScript transpiler, i.e. a program that translates R code into JavaScript code, it lets R users develop JavaScript(JS) applications using solely the R syntax. This eliminates the need to pick up an entire new language, makes it easy for R users to learn and experiment with JS technologies and gives direct and full access to all existing JS libraries. The transpiler is distributed as a regular R package, and it can be used standalone or to complement existing packages, including Rmarkdown, shiny and V8.",https://github.com/kcf-jackson/sketch and https://cran.r-project.org/package=sketch
2020,1,Consolidating R-Ladies Global organisational guidance and wisdom,4000,Maëlle Salmon,"R-Ladies Global is a successful, growing organization aiming at increasing gender diversity in the R community. R-Ladies Global is a Top-Level Project of the ISC. R-Ladies Global guidance for starting and running a chapter, as well as overseeing chapters around the world, and for the rotating curator account, grew organically. The information is fragmented and exists in different formats: several Markdown and PDF Documents and wiki entries in a GitHub repository. This impedes the optimal finding of resources by those who need them, and also impedes contributions. This project aims to consolidate existing R-Ladies Global guidance into a well-structured and continuously deployed online book, with its source open on GitHub, as ( R ) Markdown documents woven together, and whose maintenance will be an R-Ladies major priority task.
The project will create a web based manuscript containing all the necessary information to understand what the R-Ladies organization is about, its structure and how to contribute to its mission. Information will be collated and organized leveraging the experience of R-Ladies organizers and volunteers that, over the past 4 years, contributed to the establishment and growth of one of the most active and successful communities in the data science realm. This book will be a crucial resource for R-Ladies and other organizations that are looking to consolidate or create their own guidance.",https://github.com/rladies/starter-kit
2020,1,Database interoperability for spatial objects in R,6000,Etienne Racine,"Manipulating spatial data in R sometimes requires interaction with a spatial database: the data doesn't fit in memory, or simply because this is where the data is. The `sf` package already supports the PostGIS spatial database, but this project will extend the compatibility and make it easier to integrate in the `dplyr` workflow (with `dbplyr`). We also want to make it easier to add support for new database backends. We'll create a new `sfdbi` package to centralize the interface between `sf` and databases and remove dependencies in `sf`. If you want to contribute, or if you'd like to suggest a database, make sure to join the `sfdbi` repo.",https://github.com/r-spatial/sfdbi
