year,group,title,funded,proposed_by,summary,website
2020,1,HTTP testing in R Book,16000,Maëlle Salmon,"More and more R packages access resources on the web, and play crucial roles in workflows: data access and updates for CRM reports (Hubspot APIs), for scientific publications (scientific web APIs, Open Science Framework). Like for all other packages, appropriate unit testing can make them more robust. Their unit testing brings special challenges: dependence of tests on a good internet connection, testing in the absence of authentication secrets, etc. Having tests fail due to resources being down or slow, during development or on CRAN, means a time loss for everyone involved (slower development, messages from CRAN). Although many packages accessing remote resources are well tested, there is a lack of resources around best practices for HTTP testing in packages using httr, crul, or curl. The best guidance to date about HTTP testing for R packages to our knowledge is a forum entry that pre-dates the development of relatively new packages for HTTP testing that have now been released on CRAN: vcr and webmockr by Scott Chamberlain, httptest by Neal Richardson, presser by Gábor Csárdi. This project aims at curating a free, central reference for developers of R packages accessing web resources, to help them have a faster and more robust development. We shall develop an useful guidance, in the form of a open-source web-based book.",https://github.com/ropensci-books/http-testing
2020,1,MATTER 2.0: larger-than-memory data for R,35000,Olga Vitek,"The project develops the MATTER 2.0 package for computing with larger-than-memory data in R. It extends the functionality of the existing MATTER package to any disk data format and in-memory layout. It also extends MATTER's implementation with ALTREP to provide seamless interoperation with existing code, and various performance improvements critical for rapid prototyping of new statistical methods.",https://github.com/kuwisdelu/matter
2020,1,Spatiotemporal Data and Analytics,10000,Benedikt Gräler,"Many data sets are recorded irregular in space and time. Movement of people driving the spread of an disease, or the distribution of current and future cases are per se irregular spatiotemporal data and only two of many examples. Being able to easily visualise, aggregate and model irregular spatiotemporal data will help to better understand and forecast underlying processes. Filling the gap for irregular spatiotemporal data and providing direct interaction with analytical tools will ease the analysis for researchers. We will develop the sftime package to a mature state so that the suite of modern spatial and spatiotemporal data representations in R includes irregular spatiotemporal data. After doing this, we will modify the geostatistical modelling package gstat and the spatial copula modelling package spcopula to support the new data representation classes of sf, stars and sftime.",https://github.com/BenGraeler/STDataAndAnalytics/
2020,1,The RECON COVID-19 challenge: leveraging the R community to improve COVID-19 analytics resources,23300,Thibaut Jombart,"The RECON COVID-19 challenge aims to bring together the infectious disease modelling, epidemiology and R communities to improve analytics resources for the COVID-19 response via a website which will provide a platform to centralise, curate and update R development tasks relevant to the COVID-19 response. Similar to the Open Street Map Tasking Manager (tasks.hotosm.org), this platform will allow potential contributors to quickly identify outstanding tasks submitted by groups involved in the response to COVID-19 and ensure that developments follow the highest scientific and technical standards.
While this project is aimed at leveraging R tools for helping to respond to COVID-19, we expect that it will lead to long-lasting developments of partnerships between the R and epidemiological communities, and that the resources developed will become key assets for supporting outbreak responses well beyond this pandemic.",https://www.repidemicsconsortium.org/2020-06-09-covid-challenge/
2020,1,sftrack v1.0: Stable API for a broad adoption,5000,Mathieu Basille,"sftrack' is a modern approach for tracking data in R. In response to the large diversity of ad-hoc solutions, in part outdated, we propose a generic and flexible approach that support all stages of movement studies (pre-processing, post-processing and analysis). 'sftrack' provides two central classes for tracking data (points) and movement data (steps), and basic functions to build, handle, summarize and plot them. Version 1.0 of 'sftrack' will be finalized and submitted to CRAN, and will already incorporate converters from/to classes of major existing tracking packages. We will further work with all tracking package developers willing to fully integrate the solution offered by 'sftrack' into their package data flow.",https://github.com/mablab/sftrack
2019,2,An External R Sampling Profiler,8500,Aaron Jacobs,"Many R users will be familiar with using the built-in sampling profiler 'Rprof()' to generate data on what their code is doing, and there are several excellent tools to facilitate understanding these samples (or serve as a front-end), including the 'profvis' package. However, the reach of these tools is limited: the profiler is “internal”, in the sense that it must be manually switched on to work, either during interactive work (for example, to profile an individual function), or perhaps by modifying the script to include 'Rprof()' calls before running it again. It cannot be used to understand R code that is already running, a capability that has proven extremely useful for diagnosing and fixing performance issues (or other bugs) in production environments.
Several existing programming languages have one or more “external” profilers available, which can attach to a running process and read its memory contents to understand what is currently happening. This project aims to build such a tool for R.",https://github.com/atheriel/xrprof
2019,2,CVXR,9500,David W Kang,"Optimization is at the core of statistical estimation and machine learning methodology. There are a number of R packages such as optimx, nloptr, ROI which either implement solvers for a wide variety of problems, or provide an interface to other solvers. The R package CVXR takes a different approach, implementing a Domain Specific Language (Fu, Narasimhan, and Boyd 2019) for formulating and solving convex optimization problems, just as cvxpy does for python. As shown in a number of examples on the CVXR website, the applications range from finance, machine learning, and to theoretical and applied statistics. Using a disciplined convex programming (DCP) approach, CVXR acts as a great tool for both prototyping and developing new methodologies as well as for quick, high-level, formulation and solution of statistical and machine learning problems.",https://github.com/cvxgrp/CVXR
2019,2,Flipbooks,6699,Evangeline Reynolds,"Just as classic flip books allow their readers to observe changes in a scene, coding Flipbooks allow readers to progressively track the changes of code and its output by “flipping” through their digital pages. Flipbooks are useful tools for communicating and teaching because they break down code for incremental, stepwise presentation so that audiences can easily understand each step. Flipbook-building tools automate the deconstruction and reconstruction of coding pipelines which means that building a Flipbook from existing code poses little additional burden to creators. The next stage for this project is to develop the current Flipbook-building tools into a reliable and easy-to-use R package (development is ongoing at https://github.com/EvaMaeRey/flipbookr) and also to provide educational guidance for creating Flipbooks.",https://github.com/EvaMaeRey/flipbookr
2019,2,R Package Risk Assessment Application,16800,Andrew Nicholls,"The R Validation Hub is an active R Consortium Working Group. It is a cross-industry initiative whose mission is to enable the use of R by the Bio-Pharmaceutical Industry in a regulatory setting, where the output may be used in submissions to regulatory agencies. This project sits within phase 2 of the R Validation Hub's road map. During this phase the group will develop several tools that can be used by those wishing to use R packages within a bio-pharmaceutical regulatory setting. The aim of this specific project is to standardise and simplify the risk assessment of R packages, reducing the burden of package evaluation/testing that would otherwise fall on internal R programming experts. The project will deliver a Shiny application to aid in the assessment and documentation of package risk.",https://www.pharmar.org/
2019,2,"RcppDeepState, a simple way to fuzz test compiled code in R packages",34000,Toby Hocking,"Abstract: Fuzzers are computer programs that send other programs inputs that may fall outside the domain of expected values, thus revealing subtle bugs. DeepState is a testing framework that allows easy testing of C/C++ programs with sophisticated fuzzers, and supports multiple back-ends for testing. DeepState has been used to test critical C++ software, including Google's leveldb. R has some simple random testers, but no coverage-driven fuzzers that learn to produce problematic inputs. We propose to create the R packages RcppDeepState and RcppDeepStateTools which will provide easy-to-use functions for using DeepState with R packages that use C/C++ code via Rcpp. This project will thus provide the first easy-to-use solution for R programmers that want to fuzz test their C/C++ code with existing tools such as AFL, and it will provide a framework for interfacing future coverage-driven fuzzers or symbolic execution tools. We also propose to use these new tools on a wide range of R packages in order to identify bugs in their C/C++ code.
One masters student will be recruited to implement this project during Jan-Dec 2020 at the School of Informatics, Computing, and Cyber Systems at Northern Arizona University. Interested students should apply by emailing a resume/CV along with a cover letter to project supervisors toby.hocking@nau.edu and alex.groce@nau.edu.",https://github.com/akhikolla/RcppDeepState
2019,2,Symbolic mathematics in R with SymPy,10000,Mikkel Meyer Andersen,"R's ability to do symbolic mathematics is largely restricted to finding derivatives. There are many tasks involving symbolic math that are of interest to R users, e.g. inversion of symbolic matrices, limits and solving non-linear equations. Users must resort to other software for such tasks and many R users (especially outside of academia) do not readily have access to such software.
The Python library SymPy is open source, has a stable group of developers and is powerful. As such, R users can just switch to Python and SymPy for symbolic math. However it is often very convenient to stay in the same environment to use familiar syntax and to utilise available libraries (e.g. to generate problems using symbolic math together with the exams package or to first handle symbolic computations and then afterwards move on to a numerical evaluations of the results). We will achieve this by making SymPy functionality available for R users via an R package.
Currently only few R packages for doing symbolic mathematics are available: Two of these are Ryacas and rSymPy. Ryacas is built around Yacas, and although Yacas can solve many problems and is extensible, the community is relatively small and Yacas is not as powerful as SymPy for certain routine tasks (e.g. integration and solving equations). rSymPy on the other hand is based on technology that requires much technical work to install and use.
The website of the project is:
https://github.com/r-cas/caracas/
Please contribute by testing, writing documentation, opening issues, submitting pull requests or something else!",https://github.com/r-cas/caracas/
2019,2,Tidy spatial networks in R,9000,"Lucas van der Meer, Robin Lovelace, Andrea Gilardi, Lorena Abad","R is currently lacking a generally applicable, modern and easy-to-use way of handling all kinds of spatial networks. ""Tidy spatial networks in R"" aims to address this issue by developing and publishing the sfnetworks package. The package, and documentation around it, will provide a bridge between network analysis and spatial analysis communities. For this, an sfnetwork class that will work with both tidygraph and sf frameworks and functions. R-users will be encouraged to contribute and engage with the package development during a hackathon organized next to the eRum 2020.",https://luukvdmeer.github.io/sfnetworks/
2019,2,d3po: R package for easy interactive D3 visualization with Shiny,4000,Mauricio Vargas Sepúlveda,"R already features excellent visualization libraries such as D3 (via the r2d3 package), plotly or highcharter. However, though those enable the creation of great looking visualisations they have very steep learning curves, require understanding of JavaScript or rely on non-free software that might be out of reach for governments and NGOs. Our intention is to solve those problems by releasing d3po. It shall be an intermediate layer between the user and D3 by providing “templates”, enabling high quality interactive visualizations oriented to and designed to be used with Shiny and Rmarkdown, and also proving easy internationalization. Please join us, this needs D3 and R skilled minds!",https://github.com/pachamaltese/d3po
2019,2,webchem: accessing chemical information from the web,6000,"Eric Scott, Tamas Stirling","webchem: accessing chemical information from the web
A vast amount of chemical information is freely available on the internet. The data are used by millions of professionals around the world, for purposes like pharmaceutical research, chemical process design, or environmental impact assessment, to name a few. webchem is an R project that aims to help these professionals by providing a single point programmable access to all major chemical databases around the world. The project started in 2016 and currently supports more than 10 databases. If you are interested, join us and help us build the tool that biologists and chemists will absolutely love.",https://github.com/ropensci/webchem
2019,1,Enhancing usability of sample size calculations and power analyses in R with a Task View page and accompanying tutorials,13912,Richard Webster,"Sample size calculation and power analysis are fundamental for study design, yet they are challenging to do in the R programming language due to limited inter-package documentation. It is difficult to find the required functionality within the sea of open source packages. Indeed, there is no systematic R resource that allows users to search for whether a particular study design and corresponding statistical test has a power analysis implemented in R.
Our aims are to improve usability of power analyses performed in R, to facilitate proper design and analysis of data, and promote reproducible research.
Our duel approach is to create a Task View page for sample size calculations & power analyses, as well as a series of tutorials to reduce the R users' learning curve. Addressing the usability of sample size calculation / power analyses will benefit a broad spectrum of R users, as this is a vital component for study design, result interpretability and reproducibility.",https://cheori.org/samplesize/
2019,1,Expanding the ‘metaverse'; an R ecosystem for meta-research,20171,Martin Westgate,"Evidence synthesis is the process of identifying, collating and summarizing primary scientific research to provide reliable, transparent summaries such as systematic reviews and meta-analyses. Despite their importance for linking research with policy, however, evidence synthesis projects are often time-consuming, expensive, and difficult to update. Open and reproducible workflows would help address these problems, but these workflows are poorly supported by the current package environment, preventing access by new users and hindering uptake of the well-developed suite of statistical tools for meta-analysis in R. The metaverse project will integrate and expand tools to support evidence synthesis and meta-research in R; suggest flexible workflows to complete these projects in a straightforward and open manner; and provide a collector package allowing easy access to these developments for new and experienced users.",https://rmetaverse.github.io
2019,1,R-global: analysing spatial data globally,10000,Edzer Pebesma,"Currently, a number of R spatial functions assume that coordinates are two-dimensional, taken from a ""flat"" space, and may or may not work for geographical (long/lat) coordinates, depicting points on a globe. This project will try to make such functions more robust and helpful for the the case of geographical coordinates. It will reconsider the concept of a bounding box, and build an interface to the S2 geometry library (http://s2geometry.io/), which powers several modern systems that assume geographic coordinates.",http://s2geometry.io/
2019,1,sftraj: A central class for tracking and movement data,10000,Mathieu Basille,"Movement defined broadly plays a central and growing role in fields as diverse as transportation, sport, ecology, music, medicine, and data science. Sampling movements results in tracking data, in the form of geographic (x,y,z) and temporal coordinates (t). Despite this common nature, there is a critical lack of standard infrastructure to deal with movement. With a sharp increase of the use of R for movement studies (more than 70 % of movement studies used R in 2018), the Movement community in R is at the same time very dynamic and very fragmented; in 2018 there was 57 packages that process, visualize and analyze tracking data, one third of which worked in isolation, not being linked to any other tracking package. We aim to develop a central trajectory class to support all stages of movement studies (pre-processing, post-processing and analysis).
We propose a sftraj package offering a generic and flexible approach. The only aim of the package will be to present a central class and basic functions to build, handle, summarize and plot movement data. Our project relies on three complementary pillars: a broad involvement of the movement community, a robust conceptual data model, and a sf-based implementation in R. The first stage of the work will specifically involve the Movement community in R. During this stage, we will open contributions of use cases for the package (using GitHub's issue system), which set practical goals for the development of the package. Use cases describe the workflow that is expected from both users' and developers' perspectives, and thus the capabilities that a trajectory package needs to offer. The package specifications and development will aim at addressing all use cases described, to make sure the solution provided is relevant for a wide array of users and package developers.",https://github.com/mablab/sftraj
2018,2,Catalyzing R-hub adoption through R package developer advocacy,46050,Maëlle Salmon,"After the continuing technical progress of R-hub over the last two years, this project aims at catalizing its adoption by R package developers of all levels through developer advocacy. Indeed, R-hub is currently a successful and very valuable project, but it is not documented thoroughly, which hinders its wider adoption by package developers. This project shall answer this concern by three main actions: improving R-hub documentation, making R-hub better known in the community and making the R-hub web site more attractive to, and easier to use by, R developers and users via the ingestion of METACRAN services and the creation of a R-hub blog.",https://blog.r-hub.io
2018,2,Data-Driven Discovery and Tracking of R Consortium Activities,5250,Benaiah Chibuokem Ubah,"This project proposes an infrastructure that provides a data-driven approach to render the yearly activities of the R Consortium, by deploying web pages for discovering and tracking ISC Funded Projects, RUGS and Marketing activities. These pages are planned to appear like dashboards summarizing activities in interactive tables and charts, presenting several views, trends and insights to what R Consortium has achieved over time. The project hopes that presenting these achievements in a data-driven manner to the R community, the data science community and prospective R Consortium members will promote greater transparency, productivity and community inclusiveness around R Consortium activities.",https://benubah.github.io/r-community-explorer/rugs.html
2018,2,Editorial assistance for the R Journal,50000,Dianne Cook,"This project supports the operation of the R Journal. There are two aspects, one is to fund an editorial assistant to send reminders about reviews, and assist with typesetting and copyediting issues. The second part is to explore updating the technical operations of the journal production.",https://rjpilot.netlify.app/
2018,2,Licensing R - Guidelines and tools,6000,Colin Fay,"Licensing is a vital part of Open Source. It provides guidelines for interacting with a program, and for making code accessible and reusable (or not). It provides a way to make code open source, in a way one wants to share it, protecting how it will be used and reused. Licensing is also challenging and complex: there are a lot of available licenses, and the choice is influenced by how you import and interact with elements from other packages and/or programs.
With this project, we propose to explore and document the current state of open source licenses in R, and to decipher compatibility and incompatibly elements inside these licenses, to help developers chose the best suited licence for their project.",https://github.com/ThinkR-open/isc-proposal-licence/ and https://thinkr-open.github.io/licensing-r/intro.html#getting-a-more-global-idea and https://github.com/ThinkR-open/isc-proposal-licence/blob/master/proposal_licence.md
2018,2,Next-generation text layout in grid and ggplot2,25000,Claus Wilke,"Text is a key component of any data visualization. We need to label axes and legends, we need to annotate or highlight specific data points, and we need to provide plot titles and captions. The R graphics package ggplot2 provides numerous features to customize the labeling and annotation of plots, but ultimately it is limited by the current capabilities of the underlying graphics libary it uses, grid. Grid can draw simple text strings or mathematical expressions (via plotmath) in different colors, sizes, and fonts. However, it lacks functionality for changing formatting within a string (e.g., draw a single word in italics or in a different color), and it also cannot draw text boxes, where the text is enclosed in a box with defined margins, padding, or background color. This project will support the development of a new package, gridtext, that will alleviate these text formatting limitations. The project will also support efforts to make these new capabilities available from within ggplot2.",https://wilkelab.org/gridtext/
2018,2,Strengthening of R in support of spatial data infrastructures management : geometa and ows4R R packages,20000,Emmanuel Blondel,"The project aims to strengthen the role of R in support of Spatial Data Infrastructures (SDI) management, through major enhancements of the geometa R package which offers tools for reading and writing ISO/OGC geographic metadata, including ISO 19115, 19110, and 19119 through the ISO 19139 XML format. This also extends to the Geographic Markup Language (GML - ISO 19136) used for describing geographic data. The use of geometa in combination with publication tools such as ows4R ( https://cran.r-project.org/package=ows4R ) and geosapi (https://cran.r-project.org/package=geosapi) fosters the use of R software to ease the management and publication of metadata documents and related datasets in web catalogues, and then allows to move forward with a real R implementation of spatial data management plans based on FAIR (Findable, Accessible Interoperable and Reusable) principles.
The workplan includes several activities such as working on the completeness of the ISO 19115 (ISO 19115-1 and 19115-2) data model in geometa, functions to read/write multilingual metadata documents, and an increased metadata validation capability with a validator targeting the EU INSPIRE directive. Finally, functions will be made available to convert between geometa ISO/OGC metadata objects and other known metadata objects such as NetCDF-CF and EML (Ecological Metadata Language) to foster metadata interoperability. By providing these R tools, we seek to facilitate the work of spatial data (GIS) managers, but also data scientists, whatever the thematic domain, whose daily tasks consist in handling data, describing them with metadata and publishing datasets.",NA
