act,scene,character,dialogue,line_number
Act IV,Scene I,First Witch,In the poison'd entrails throw.,1443
Act IV,Scene I,First Witch,"Toad, that under cold stone",1444
Act IV,Scene I,First Witch,Days and nights has thirty-one,1445
Act IV,Scene I,First Witch,"Swelter'd venom sleeping got,",1446
Act IV,Scene I,First Witch,Boil thou first i' the charmed pot.,1447
Act IV,Scene I,All,"Double, double toil and trouble;",1448
Act IV,Scene I,All,"Fire burn, and cauldron bubble.",1449
Act IV,Scene I,Second Witch,"Fillet of a fenny snake,",1450
Act IV,Scene I,Second Witch,In the cauldron boil and bake;,1451
Act IV,Scene I,Second Witch,"Eye of newt and toe of frog,",1452
Act IV,Scene I,Second Witch,"Wool of bat and tongue of dog,",1453
Act IV,Scene I,Second Witch,"Adder's fork and blind-worm's sting,",1454
Act IV,Scene I,Second Witch,"Lizard's leg and owlet's wing,",1455
Act IV,Scene I,Second Witch,"For a charm of powerful trouble,",1456
Act IV,Scene I,Second Witch,Like a hell-broth boil and bubble.,1457
Act IV,Scene I,All,"Double, double toil and trouble;",1458
Act IV,Scene I,All,Fire burn and cauldron bubble.,1459
Act IV,Scene I,Third Witch,"Scale of dragon, tooth of wolf,",1460
Act IV,Scene I,Third Witch,"Witches' mummy, maw and gulf",1461
Act IV,Scene I,Third Witch,"Of the ravin'd salt-sea shark,",1462
Act IV,Scene I,Third Witch,"Root of hemlock digg'd i' the dark,",1463
Act IV,Scene I,Third Witch,"Liver of blaspheming Jew,",1464
Act IV,Scene I,Third Witch,"Gall of goat, and slips of yew",1465
Act IV,Scene I,Third Witch,"Silver'd in the moon's eclipse,",1466
Act IV,Scene I,Third Witch,"Nose of Turk and Tartar's lips,",1467
Act IV,Scene I,Third Witch,Finger of birth-strangled babe,1468
Act IV,Scene I,Third Witch,"Ditch-deliver'd by a drab,",1469
Act IV,Scene I,Third Witch,Make the gruel thick and slab:,1470
Act IV,Scene I,Third Witch,"Add thereto a tiger's chaudron,",1471
Act IV,Scene I,Third Witch,For the ingredients of our cauldron.,1472
Act IV,Scene I,All,"Double, double toil and trouble;",1473
Act IV,Scene I,All,Fire burn and cauldron bubble.,1474
Act IV,Scene I,Second Witch,"Cool it with a baboon's blood,",1475
Act IV,Scene I,Second Witch,Then the charm is firm and good.,1476
Act IV,Scene I,[stage direction],Enter HECATE to the other three Witches,NA
Act IV,Scene I,Hecate,O well done! I commend your pains;,1477
Act IV,Scene I,Hecate,And every one shall share i' the gains;,1478
Act IV,Scene I,Hecate,"And now about the cauldron sing,",1479
Act IV,Scene I,Hecate,"Live elves and fairies in a ring,",1480
Act IV,Scene I,Hecate,Enchanting all that you put in.,1481
Act IV,Scene I,[stage direction],"Music and a song: 'Black spirits,'  &amp; c",NA
Act IV,Scene I,[stage direction],HECATE retires,NA
Act IV,Scene I,Second Witch,"By the pricking of my thumbs,",1482
Act IV,Scene I,Second Witch,Something wicked this way comes.,1483
Act IV,Scene I,Second Witch,"Open, locks,",1484
Act IV,Scene I,Second Witch,Whoever knocks!,1485
Act IV,Scene I,[stage direction],Enter MACBETH,NA
Act IV,Scene I,Macbeth,"How now, you secret, black, and midnight hags!",1486
Act IV,Scene I,Macbeth,What is't you do?,1487
Act IV,Scene I,All,A deed without a name.,1488
Act IV,Scene I,Macbeth,"I conjure you, by that which you profess,",1489
Act IV,Scene I,Macbeth,"Howe'er you come to know it, answer me:",1490
Act IV,Scene I,Macbeth,Though you untie the winds and let them fight,1491
Act IV,Scene I,Macbeth,Against the churches; though the yesty waves,1492
Act IV,Scene I,Macbeth,Confound and swallow navigation up;,1493
Act IV,Scene I,Macbeth,Though bladed corn be lodged and trees blown down;,1494
Act IV,Scene I,Macbeth,Though castles topple on their warders' heads;,1495
Act IV,Scene I,Macbeth,Though palaces and pyramids do slope,1496
Act IV,Scene I,Macbeth,Their heads to their foundations; though the treasure,1497
Act IV,Scene I,Macbeth,"Of nature's germens tumble all together,",1498
Act IV,Scene I,Macbeth,Even till destruction sicken; answer me,1499
Act IV,Scene I,Macbeth,To what I ask you.,1500
Act IV,Scene I,First Witch,Speak.,1501
Act IV,Scene I,Second Witch,Demand.,1502
Act IV,Scene I,Third Witch,We'll answer.,1503
Act IV,Scene I,First Witch,"Say, if thou'dst rather hear it from our mouths,",1504
Act IV,Scene I,First Witch,Or from our masters?,1505
Act IV,Scene I,Macbeth,Call 'em; let me see 'em.,1506
Act IV,Scene I,First Witch,"Pour in sow's blood, that hath eaten",1507
Act IV,Scene I,First Witch,Her nine farrow; grease that's sweaten,1508
Act IV,Scene I,First Witch,From the murderer's gibbet throw,1509
Act IV,Scene I,First Witch,Into the flame.,1510
Act IV,Scene I,All,"Come, high or low;",1511
Act IV,Scene I,All,Thyself and office deftly show!,1512
Act IV,Scene I,[stage direction],Thunder. First Apparition: an armed Head,NA
Act IV,Scene I,Macbeth,"Tell me, thou unknown power,--",1513
Act IV,Scene I,First Witch,He knows thy thought:,1514
Act IV,Scene I,First Witch,"Hear his speech, but say thou nought.",1515
Act IV,Scene I,First Apparition,Macbeth! Macbeth! Macbeth! beware Macduff;,1516
Act IV,Scene I,First Apparition,Beware the thane of Fife. Dismiss me. Enough.,1517
Act IV,Scene I,[stage direction],Descends,NA
Act IV,Scene I,Macbeth,"Whate'er thou art, for thy good caution, thanks;",1518
Act IV,Scene I,Macbeth,Thou hast harp'd my fear aright: but one,1519
Act IV,Scene I,Macbeth,"word more,--",1520
Act IV,Scene I,First Witch,"He will not be commanded: here's another,",1521
Act IV,Scene I,First Witch,More potent than the first.,1522
Act IV,Scene I,[stage direction],Thunder. Second Apparition: A bloody Child,NA
Act IV,Scene I,Second Apparition,Macbeth! Macbeth! Macbeth!,1523
Act IV,Scene I,Macbeth,"Had I three ears, I'ld hear thee.",1524
Act IV,Scene I,Second Apparition,"Be bloody, bold, and resolute; laugh to scorn",1525
Act IV,Scene I,Second Apparition,"The power of man, for none of woman born",1526
Act IV,Scene I,Second Apparition,Shall harm Macbeth.,1527
Act IV,Scene I,[stage direction],Descends,NA
Act IV,Scene I,Macbeth,"Then live, Macduff: what need I fear of thee?",1528
Act IV,Scene I,Macbeth,"But yet I'll make assurance double sure,",1529
Act IV,Scene I,Macbeth,And take a bond of fate: thou shalt not live;,1530
Act IV,Scene I,Macbeth,"That I may tell pale-hearted fear it lies,",1531
Act IV,Scene I,Macbeth,And sleep in spite of thunder.,1532
Act IV,Scene I,[stage direction],"Thunder. Third Apparition: a Child crowned, with a tree in his hand",NA
Act IV,Scene I,Macbeth,What is this,1533
Act IV,Scene I,Macbeth,"That rises like the issue of a king,",1534
Act IV,Scene I,Macbeth,And wears upon his baby-brow the round,1535
Act IV,Scene I,Macbeth,And top of sovereignty?,1536
Act IV,Scene I,All,"Listen, but speak not to't.",1537
Act IV,Scene I,Third Apparition,"Be lion-mettled, proud; and take no care",1538
Act IV,Scene I,Third Apparition,"Who chafes, who frets, or where conspirers are:",1539
Act IV,Scene I,Third Apparition,Macbeth shall never vanquish'd be until,1540
Act IV,Scene I,Third Apparition,Great Birnam wood to high Dunsinane hill,1541
Act IV,Scene I,Third Apparition,Shall come against him.,1542
Act IV,Scene I,[stage direction],Descends,NA
Act IV,Scene I,Macbeth,That will never be,1543
Act IV,Scene I,Macbeth,"Who can impress the forest, bid the tree",1544
Act IV,Scene I,Macbeth,Unfix his earth-bound root? Sweet bodements! good!,1545
Act IV,Scene I,Macbeth,"Rebellion's head, rise never till the wood",1546
Act IV,Scene I,Macbeth,"Of Birnam rise, and our high-placed Macbeth",1547
Act IV,Scene I,Macbeth,"Shall live the lease of nature, pay his breath",1548
Act IV,Scene I,Macbeth,To time and mortal custom. Yet my heart,1549
Act IV,Scene I,Macbeth,"Throbs to know one thing: tell me, if your art",1550
Act IV,Scene I,Macbeth,Can tell so much: shall Banquo's issue ever,1551
Act IV,Scene I,Macbeth,Reign in this kingdom?,1552
Act IV,Scene I,All,Seek to know no more.,1553
Act IV,Scene I,Macbeth,"I will be satisfied: deny me this,",1554
Act IV,Scene I,Macbeth,And an eternal curse fall on you! Let me know.,1555
Act IV,Scene I,Macbeth,Why sinks that cauldron? and what noise is this?,1556
Act IV,Scene I,[stage direction],Hautboys,NA
Act IV,Scene I,First Witch,Show!,1557
Act IV,Scene I,Second Witch,Show!,1558
Act IV,Scene I,Third Witch,Show!,1559
Act IV,Scene I,All,"Show his eyes, and grieve his heart;",1560
Act IV,Scene I,All,"Come like shadows, so depart!",1561
Act IV,Scene I,[stage direction],"A show of Eight Kings, the last with a glass in his hand; GHOST OF BANQUO following",NA
Act IV,Scene I,Macbeth,Thou art too like the spirit of Banquo: down!,1562
Act IV,Scene I,Macbeth,"Thy crown does sear mine eye-balls. And thy hair,",1563
Act IV,Scene I,Macbeth,"Thou other gold-bound brow, is like the first.",1564
Act IV,Scene I,Macbeth,A third is like the former. Filthy hags!,1565
Act IV,Scene I,Macbeth,"Why do you show me this? A fourth! Start, eyes!",1566
Act IV,Scene I,Macbeth,"What, will the line stretch out to the crack of doom?",1567
Act IV,Scene I,Macbeth,Another yet! A seventh! I'll see no more:,1568
Act IV,Scene I,Macbeth,"And yet the eighth appears, who bears a glass",1569
Act IV,Scene I,Macbeth,Which shows me many more; and some I see,1570
Act IV,Scene I,Macbeth,That two-fold balls and treble scepters carry:,1571
Act IV,Scene I,Macbeth,"Horrible sight! Now, I see, 'tis true;",1572
Act IV,Scene I,Macbeth,"For the blood-bolter'd Banquo smiles upon me,",1573
Act IV,Scene I,Macbeth,And points at them for his.,1574
Act IV,Scene I,[stage direction],Apparitions vanish,NA
Act IV,Scene I,Macbeth,"What, is this so?",1575
Act IV,Scene I,First Witch,"Ay, sir, all this is so: but why",1576
Act IV,Scene I,First Witch,Stands Macbeth thus amazedly?,1577
Act IV,Scene I,First Witch,"Come, sisters, cheer we up his sprites,",1578
Act IV,Scene I,First Witch,And show the best of our delights:,1579
Act IV,Scene I,First Witch,"I'll charm the air to give a sound,",1580
Act IV,Scene I,First Witch,While you perform your antic round:,1581
Act IV,Scene I,First Witch,"That this great king may kindly say,",1582
Act IV,Scene I,First Witch,Our duties did his welcome pay.,1583
Act IV,Scene I,[stage direction],"Music. The witches dance and then vanish, with HECATE",NA
Act IV,Scene I,Macbeth,Where are they? Gone? Let this pernicious hour,1584
Act IV,Scene I,Macbeth,Stand aye accursed in the calendar!,1585
Act IV,Scene I,Macbeth,"Come in, without there!",1586
Act IV,Scene I,[stage direction],Enter LENNOX,NA
Act IV,Scene I,Lennox,What's your grace's will?,1587
Act IV,Scene I,Macbeth,Saw you the weird sisters?,1588
Act IV,Scene I,Lennox,"No, my lord.",1589
Act IV,Scene I,Macbeth,Came they not by you?,1590
Act IV,Scene I,Lennox,"No, indeed, my lord.",1591
Act IV,Scene I,Macbeth,Infected be the air whereon they ride;,1592
Act IV,Scene I,Macbeth,And damn'd all those that trust them! I did hear,1593
Act IV,Scene I,Macbeth,The galloping of horse: who was't came by?,1594
Act IV,Scene I,Lennox,"'Tis two or three, my lord, that bring you word",1595
Act IV,Scene I,Lennox,Macduff is fled to England.,1596
Act IV,Scene I,Macbeth,Fled to England!,1597
Act IV,Scene I,Lennox,"Ay, my good lord.",1598
Act IV,Scene I,Macbeth,"Time, thou anticipatest my dread exploits:",1599
Act IV,Scene I,Macbeth,The flighty purpose never is o'ertook,1600
Act IV,Scene I,Macbeth,Unless the deed go with it; from this moment,1601
Act IV,Scene I,Macbeth,The very firstlings of my heart shall be,1602
Act IV,Scene I,Macbeth,"The firstlings of my hand. And even now,",1603
Act IV,Scene I,Macbeth,"To crown my thoughts with acts, be it thought and done:",1604
Act IV,Scene I,Macbeth,The castle of Macduff I will surprise;,1605
Act IV,Scene I,Macbeth,Seize upon Fife; give to the edge o' the sword,1606
Act IV,Scene I,Macbeth,"His wife, his babes, and all unfortunate souls",1607
Act IV,Scene I,Macbeth,That trace him in his line. No boasting like a fool;,1608
Act IV,Scene I,Macbeth,This deed I'll do before this purpose cool.,1609
Act IV,Scene I,Macbeth,But no more sights!--Where are these gentlemen?,1610
Act IV,Scene I,Macbeth,"Come, bring me where they are.",1611
Act IV,Scene I,[stage direction],Exeunt,NA
Act IV,Scene II,[stage direction],"Enter LADY MACDUFF, her Son, and ROSS",NA
Act IV,Scene II,Lady Macduff,"What had he done, to make him fly the land?",1612
Act IV,Scene II,Ross,"You must have patience, madam.",1613
Act IV,Scene II,Lady Macduff,He had none:,1614
Act IV,Scene II,Lady Macduff,"His flight was madness: when our actions do not,",1615
Act IV,Scene II,Lady Macduff,Our fears do make us traitors.,1616
Act IV,Scene II,Ross,You know not,1617
Act IV,Scene II,Ross,Whether it was his wisdom or his fear.,1618
Act IV,Scene II,Lady Macduff,"Wisdom! to leave his wife, to leave his babes,",1619
Act IV,Scene II,Lady Macduff,His mansion and his titles in a place,1620
Act IV,Scene II,Lady Macduff,From whence himself does fly? He loves us not;,1621
Act IV,Scene II,Lady Macduff,"He wants the natural touch: for the poor wren,",1622
Act IV,Scene II,Lady Macduff,"The most diminutive of birds, will fight,",1623
Act IV,Scene II,Lady Macduff,"Her young ones in her nest, against the owl.",1624
Act IV,Scene II,Lady Macduff,All is the fear and nothing is the love;,1625
Act IV,Scene II,Lady Macduff,"As little is the wisdom, where the flight",1626
Act IV,Scene II,Lady Macduff,So runs against all reason.,1627
Act IV,Scene II,Ross,"My dearest coz,",1628
Act IV,Scene II,Ross,"I pray you, school yourself: but for your husband,",1629
Act IV,Scene II,Ross,"He is noble, wise, judicious, and best knows",1630
Act IV,Scene II,Ross,The fits o' the season. I dare not speak,1631
Act IV,Scene II,Ross,much further;,1632
Act IV,Scene II,Ross,"But cruel are the times, when we are traitors",1633
Act IV,Scene II,Ross,"And do not know ourselves, when we hold rumour",1634
Act IV,Scene II,Ross,"From what we fear, yet know not what we fear,",1635
Act IV,Scene II,Ross,But float upon a wild and violent sea,1636
Act IV,Scene II,Ross,Each way and move. I take my leave of you:,1637
Act IV,Scene II,Ross,Shall not be long but I'll be here again:,1638
Act IV,Scene II,Ross,"Things at the worst will cease, or else climb upward",1639
Act IV,Scene II,Ross,"To what they were before. My pretty cousin,",1640
Act IV,Scene II,Ross,Blessing upon you!,1641
Act IV,Scene II,Lady Macduff,"Father'd he is, and yet he's fatherless.",1642
Act IV,Scene II,Ross,"I am so much a fool, should I stay longer,",1643
Act IV,Scene II,Ross,It would be my disgrace and your discomfort:,1644
Act IV,Scene II,Ross,I take my leave at once.,1645
Act IV,Scene II,[stage direction],Exit,NA
Act IV,Scene II,Lady Macduff,"Sirrah, your father's dead;",1646
Act IV,Scene II,Lady Macduff,And what will you do now? How will you live?,1647
Act IV,Scene II,Son,"As birds do, mother.",1648
Act IV,Scene II,Lady Macduff,"What, with worms and flies?",1649
Act IV,Scene II,Son,"With what I get, I mean; and so do they.",1650
Act IV,Scene II,Lady Macduff,"Poor bird! thou'ldst never fear the net nor lime,",1651
Act IV,Scene II,Lady Macduff,The pitfall nor the gin.,1652
Act IV,Scene II,Son,"Why should I, mother? Poor birds they are not set for.",1653
Act IV,Scene II,Son,"My father is not dead, for all your saying.",1654
Act IV,Scene II,Lady Macduff,"Yes, he is dead; how wilt thou do for a father?",1655
Act IV,Scene II,Son,"Nay, how will you do for a husband?",1656
Act IV,Scene II,Lady Macduff,"Why, I can buy me twenty at any market.",1657
Act IV,Scene II,Son,Then you'll buy 'em to sell again.,1658
Act IV,Scene II,Lady Macduff,"Thou speak'st with all thy wit: and yet, i' faith,",1659
Act IV,Scene II,Lady Macduff,With wit enough for thee.,1660
Act IV,Scene II,Son,"Was my father a traitor, mother?",1661
Act IV,Scene II,Lady Macduff,"Ay, that he was.",1662
Act IV,Scene II,Son,What is a traitor?,1663
Act IV,Scene II,Lady Macduff,"Why, one that swears and lies.",1664
Act IV,Scene II,Son,And be all traitors that do so?,1665
Act IV,Scene II,Lady Macduff,"Every one that does so is a traitor, and must be hanged.",1666
Act IV,Scene II,Son,And must they all be hanged that swear and lie?,1667
Act IV,Scene II,Lady Macduff,Every one.,1668
Act IV,Scene II,Son,Who must hang them?,1669
Act IV,Scene II,Lady Macduff,"Why,  the honest men.",1670
Act IV,Scene II,Son,"Then the liars and swearers are fools,",1671
Act IV,Scene II,Son,for there are liars and swearers enow to beat,1672
Act IV,Scene II,Son,the honest men and hang up them.,1673
Act IV,Scene II,Lady Macduff,"Now, God help thee, poor monkey!",1674
Act IV,Scene II,Lady Macduff,But how wilt thou do for a father?,1675
Act IV,Scene II,Son,"If he were dead, you'ld weep for",1676
Act IV,Scene II,Son,"him: if you would not, it were a good sign",1677
Act IV,Scene II,Son,that I should quickly have a new father.,1678
Act IV,Scene II,Lady Macduff,"Poor prattler, how thou talk'st!",1679
Act IV,Scene II,[stage direction],Enter a Messenger,NA
Act IV,Scene II,Messenger,"Bless you, fair dame! I am not to you known,",1680
Act IV,Scene II,Messenger,Though in your state of honour I am perfect.,1681
Act IV,Scene II,Messenger,I doubt some danger does approach you nearly:,1682
Act IV,Scene II,Messenger,"If you will take a homely man's advice,",1683
Act IV,Scene II,Messenger,"Be not found here; hence, with your little ones.",1684
Act IV,Scene II,Messenger,"To fright you thus, methinks, I am too savage;",1685
Act IV,Scene II,Messenger,"To do worse to you were fell cruelty,",1686
Act IV,Scene II,Messenger,Which is too nigh your person. Heaven preserve you!,1687
Act IV,Scene II,Messenger,I dare abide no longer.,1688
Act IV,Scene II,[stage direction],Exit,NA
Act IV,Scene II,Lady Macduff,Whither should I fly?,1689
Act IV,Scene II,Lady Macduff,I have done no harm. But I remember now,1690
Act IV,Scene II,Lady Macduff,I am in this earthly world; where to do harm,1691
Act IV,Scene II,Lady Macduff,"Is often laudable, to do good sometime",1692
Act IV,Scene II,Lady Macduff,"Accounted dangerous folly: why then, alas,",1693
Act IV,Scene II,Lady Macduff,"Do I put up that womanly defence,",1694
Act IV,Scene II,Lady Macduff,To say I have done no harm?,1695
Act IV,Scene II,[stage direction],Enter Murderers,NA
Act IV,Scene II,Lady Macduff,What are these faces?,1696
Act IV,Scene II,First Murderer,Where is your husband?,1697
Act IV,Scene II,Lady Macduff,"I hope, in no place so unsanctified",1698
Act IV,Scene II,Lady Macduff,Where such as thou mayst find him.,1699
Act IV,Scene II,First Murderer,He's a traitor.,1700
Act IV,Scene II,Son,"Thou liest, thou shag-hair'd villain!",1701
Act IV,Scene II,First Murderer,"What, you egg!",1702
Act IV,Scene II,[stage direction],Stabbing him,NA
Act IV,Scene II,First Murderer,Young fry of treachery!,1703
Act IV,Scene II,Son,"He has kill'd me, mother:",1704
Act IV,Scene II,Son,"Run away, I pray you!",1705
Act IV,Scene II,[stage direction],Dies,NA
Act IV,Scene II,[stage direction],"Exit LADY MACDUFF, crying 'Murder!' Exeunt Murderers, following her",NA
Act IV,Scene III,[stage direction],Enter MALCOLM and MACDUFF,NA
Act IV,Scene III,Malcolm,"Let us seek out some desolate shade, and there",1706
Act IV,Scene III,Malcolm,Weep our sad bosoms empty.,1707
Act IV,Scene III,Macduff,Let us rather,1708
Act IV,Scene III,Macduff,"Hold fast the mortal sword, and like good men",1709
Act IV,Scene III,Macduff,Bestride our down-fall'n birthdom: each new morn,1710
Act IV,Scene III,Macduff,"New widows howl, new orphans cry, new sorrows",1711
Act IV,Scene III,Macduff,"Strike heaven on the face, that it resounds",1712
Act IV,Scene III,Macduff,As if it felt with Scotland and yell'd out,1713
Act IV,Scene III,Macduff,Like syllable of dolour.,1714
Act IV,Scene III,Malcolm,"What I believe I'll wail,",1715
Act IV,Scene III,Malcolm,"What know believe, and what I can redress,",1716
Act IV,Scene III,Malcolm,"As I shall find the time to friend, I will.",1717
Act IV,Scene III,Malcolm,"What you have spoke, it may be so perchance.",1718
Act IV,Scene III,Malcolm,"This tyrant, whose sole name blisters our tongues,",1719
Act IV,Scene III,Malcolm,Was once thought honest: you have loved him well.,1720
Act IV,Scene III,Malcolm,He hath not touch'd you yet. I am young;,1721
Act IV,Scene III,Malcolm,but something,1722
Act IV,Scene III,Malcolm,"You may deserve of him through me, and wisdom",1723
Act IV,Scene III,Malcolm,To offer up a weak poor innocent lamb,1724
Act IV,Scene III,Malcolm,To appease an angry god.,1725
Act IV,Scene III,Macduff,I am not treacherous.,1726
Act IV,Scene III,Malcolm,But Macbeth is.,1727
Act IV,Scene III,Malcolm,A good and virtuous nature may recoil,1728
Act IV,Scene III,Malcolm,In an imperial charge. But I shall crave,1729
Act IV,Scene III,Malcolm,your pardon;,1730
Act IV,Scene III,Malcolm,That which you are my thoughts cannot transpose:,1731
Act IV,Scene III,Malcolm,"Angels are bright still, though the brightest fell;",1732
Act IV,Scene III,Malcolm,"Though all things foul would wear the brows of grace,",1733
Act IV,Scene III,Malcolm,Yet grace must still look so.,1734
Act IV,Scene III,Macduff,I have lost my hopes.,1735
Act IV,Scene III,Malcolm,Perchance even there where I did find my doubts.,1736
Act IV,Scene III,Malcolm,"Why in that rawness left you wife and child,",1737
Act IV,Scene III,Malcolm,"Those precious motives, those strong knots of love,",1738
Act IV,Scene III,Malcolm,"Without leave-taking? I pray you,",1739
Act IV,Scene III,Malcolm,"Let not my jealousies be your dishonours,",1740
Act IV,Scene III,Malcolm,"But mine own safeties. You may be rightly just,",1741
Act IV,Scene III,Malcolm,Whatever I shall think.,1742
Act IV,Scene III,Macduff,"Bleed, bleed, poor country!",1743
Act IV,Scene III,Macduff,"Great tyranny! lay thou thy basis sure,",1744
Act IV,Scene III,Macduff,For goodness dare not cheque thee: wear thou,1745
Act IV,Scene III,Macduff,thy wrongs;,1746
Act IV,Scene III,Macduff,"The title is affeer'd! Fare thee well, lord:",1747
Act IV,Scene III,Macduff,I would not be the villain that thou think'st,1748
Act IV,Scene III,Macduff,"For the whole space that's in the tyrant's grasp,",1749
Act IV,Scene III,Macduff,And the rich East to boot.,1750
Act IV,Scene III,Malcolm,Be not offended:,1751
Act IV,Scene III,Malcolm,I speak not as in absolute fear of you.,1752
Act IV,Scene III,Malcolm,I think our country sinks beneath the yoke;,1753
Act IV,Scene III,Malcolm,"It weeps, it bleeds; and each new day a gash",1754
Act IV,Scene III,Malcolm,Is added to her wounds: I think withal,1755
Act IV,Scene III,Malcolm,There would be hands uplifted in my right;,1756
Act IV,Scene III,Malcolm,And here from gracious England have I offer,1757
Act IV,Scene III,Malcolm,"Of goodly thousands: but, for all this,",1758
Act IV,Scene III,Malcolm,"When I shall tread upon the tyrant's head,",1759
Act IV,Scene III,Malcolm,"Or wear it on my sword, yet my poor country",1760
Act IV,Scene III,Malcolm,"Shall have more vices than it had before,",1761
Act IV,Scene III,Malcolm,"More suffer and more sundry ways than ever,",1762
Act IV,Scene III,Malcolm,By him that shall succeed.,1763
Act IV,Scene III,Macduff,What should he be?,1764
Act IV,Scene III,Malcolm,It is myself I mean: in whom I know,1765
Act IV,Scene III,Malcolm,All the particulars of vice so grafted,1766
Act IV,Scene III,Malcolm,"That, when they shall be open'd, black Macbeth",1767
Act IV,Scene III,Malcolm,"Will seem as pure as snow, and the poor state",1768
Act IV,Scene III,Malcolm,"Esteem him as a lamb, being compared",1769
Act IV,Scene III,Malcolm,With my confineless harms.,1770
Act IV,Scene III,Macduff,Not in the legions,1771
Act IV,Scene III,Macduff,Of horrid hell can come a devil more damn'd,1772
Act IV,Scene III,Macduff,In evils to top Macbeth.,1773
Act IV,Scene III,Malcolm,"I grant him bloody,",1774
Act IV,Scene III,Malcolm,"Luxurious, avaricious, false, deceitful,",1775
Act IV,Scene III,Malcolm,"Sudden, malicious, smacking of every sin",1776
Act IV,Scene III,Malcolm,"That has a name: but there's no bottom, none,",1777
Act IV,Scene III,Malcolm,"In my voluptuousness: your wives, your daughters,",1778
Act IV,Scene III,Malcolm,"Your matrons and your maids, could not fill up",1779
Act IV,Scene III,Malcolm,"The cistern of my lust, and my desire",1780
Act IV,Scene III,Malcolm,All continent impediments would o'erbear,1781
Act IV,Scene III,Malcolm,That did oppose my will: better Macbeth,1782
Act IV,Scene III,Malcolm,Than such an one to reign.,1783
Act IV,Scene III,Macduff,Boundless intemperance,1784
Act IV,Scene III,Macduff,In nature is a tyranny; it hath been,1785
Act IV,Scene III,Macduff,The untimely emptying of the happy throne,1786
Act IV,Scene III,Macduff,And fall of many kings. But fear not yet,1787
Act IV,Scene III,Macduff,To take upon you what is yours: you may,1788
Act IV,Scene III,Macduff,"Convey your pleasures in a spacious plenty,",1789
Act IV,Scene III,Macduff,"And yet seem cold, the time you may so hoodwink.",1790
Act IV,Scene III,Macduff,We have willing dames enough: there cannot be,1791
Act IV,Scene III,Macduff,"That vulture in you, to devour so many",1792
Act IV,Scene III,Macduff,"As will to greatness dedicate themselves,",1793
Act IV,Scene III,Macduff,Finding it so inclined.,1794
Act IV,Scene III,Malcolm,With this there grows,1795
Act IV,Scene III,Malcolm,In my most ill-composed affection such,1796
Act IV,Scene III,Malcolm,"A stanchless avarice that, were I king,",1797
Act IV,Scene III,Malcolm,"I should cut off the nobles for their lands,",1798
Act IV,Scene III,Malcolm,Desire his jewels and this other's house:,1799
Act IV,Scene III,Malcolm,And my more-having would be as a sauce,1800
Act IV,Scene III,Malcolm,To make me hunger more; that I should forge,1801
Act IV,Scene III,Malcolm,"Quarrels unjust against the good and loyal,",1802
Act IV,Scene III,Malcolm,Destroying them for wealth.,1803
Act IV,Scene III,Macduff,This avarice,1804
Act IV,Scene III,Macduff,"Sticks deeper, grows with more pernicious root",1805
Act IV,Scene III,Macduff,"Than summer-seeming lust, and it hath been",1806
Act IV,Scene III,Macduff,The sword of our slain kings: yet do not fear;,1807
