act,scene,character,dialogue,line_number
Act III,Scene II,Lady Macbeth,Where our desire is got without content:,1092
Act III,Scene II,Lady Macbeth,'Tis safer to be that which we destroy,1093
Act III,Scene II,Lady Macbeth,Than by destruction dwell in doubtful joy.,1094
Act III,Scene II,[stage direction],Enter MACBETH,NA
Act III,Scene II,Lady Macbeth,"How now, my lord! why do you keep alone,",1095
Act III,Scene II,Lady Macbeth,"Of sorriest fancies your companions making,",1096
Act III,Scene II,Lady Macbeth,Using those thoughts which should indeed have died,1097
Act III,Scene II,Lady Macbeth,With them they think on? Things without all remedy,1098
Act III,Scene II,Lady Macbeth,Should be without regard: what's done is done.,1099
Act III,Scene II,Macbeth,"We have scotch'd the snake, not kill'd it:",1100
Act III,Scene II,Macbeth,"She'll close and be herself, whilst our poor malice",1101
Act III,Scene II,Macbeth,Remains in danger of her former tooth.,1102
Act III,Scene II,Macbeth,"But let the frame of things disjoint, both the",1103
Act III,Scene II,Macbeth,"worlds suffer,",1104
Act III,Scene II,Macbeth,Ere we will eat our meal in fear and sleep,1105
Act III,Scene II,Macbeth,In the affliction of these terrible dreams,1106
Act III,Scene II,Macbeth,"That shake us nightly: better be with the dead,",1107
Act III,Scene II,Macbeth,"Whom we, to gain our peace, have sent to peace,",1108
Act III,Scene II,Macbeth,Than on the torture of the mind to lie,1109
Act III,Scene II,Macbeth,In restless ecstasy. Duncan is in his grave;,1110
Act III,Scene II,Macbeth,After life's fitful fever he sleeps well;,1111
Act III,Scene II,Macbeth,"Treason has done his worst: nor steel, nor poison,",1112
Act III,Scene II,Macbeth,"Malice domestic, foreign levy, nothing,",1113
Act III,Scene II,Macbeth,Can touch him further.,1114
Act III,Scene II,Lady Macbeth,Come on;,1115
Act III,Scene II,Lady Macbeth,"Gentle my lord, sleek o'er your rugged looks;",1116
Act III,Scene II,Lady Macbeth,Be bright and jovial among your guests to-night.,1117
Act III,Scene II,Macbeth,"So shall I, love; and so, I pray, be you:",1118
Act III,Scene II,Macbeth,Let your remembrance apply to Banquo;,1119
Act III,Scene II,Macbeth,"Present him eminence, both with eye and tongue:",1120
Act III,Scene II,Macbeth,"Unsafe the while, that we",1121
Act III,Scene II,Macbeth,"Must lave our honours in these flattering streams,",1122
Act III,Scene II,Macbeth,"And make our faces vizards to our hearts,",1123
Act III,Scene II,Macbeth,Disguising what they are.,1124
Act III,Scene II,Lady Macbeth,You must leave this.,1125
Act III,Scene II,Macbeth,"O, full of scorpions is my mind, dear wife!",1126
Act III,Scene II,Macbeth,"Thou know'st that Banquo, and his Fleance, lives.",1127
Act III,Scene II,Lady Macbeth,But in them nature's copy's not eterne.,1128
Act III,Scene II,Macbeth,There's comfort yet; they are assailable;,1129
Act III,Scene II,Macbeth,Then be thou jocund: ere the bat hath flown,1130
Act III,Scene II,Macbeth,"His cloister'd flight, ere to black Hecate's summons",1131
Act III,Scene II,Macbeth,The shard-borne beetle with his drowsy hums,1132
Act III,Scene II,Macbeth,"Hath rung night's yawning peal, there shall be done",1133
Act III,Scene II,Macbeth,A deed of dreadful note.,1134
Act III,Scene II,Lady Macbeth,What's to be done?,1135
Act III,Scene II,Macbeth,"Be innocent of the knowledge, dearest chuck,",1136
Act III,Scene II,Macbeth,"Till thou applaud the deed. Come, seeling night,",1137
Act III,Scene II,Macbeth,Scarf up the tender eye of pitiful day;,1138
Act III,Scene II,Macbeth,And with thy bloody and invisible hand,1139
Act III,Scene II,Macbeth,Cancel and tear to pieces that great bond,1140
Act III,Scene II,Macbeth,Which keeps me pale! Light thickens; and the crow,1141
Act III,Scene II,Macbeth,Makes wing to the rooky wood:,1142
Act III,Scene II,Macbeth,Good things of day begin to droop and drowse;,1143
Act III,Scene II,Macbeth,While night's black agents to their preys do rouse.,1144
Act III,Scene II,Macbeth,Thou marvell'st at my words: but hold thee still;,1145
Act III,Scene II,Macbeth,Things bad begun make strong themselves by ill.,1146
Act III,Scene II,Macbeth,"So, prithee, go with me.",1147
Act III,Scene II,[stage direction],Exeunt,NA
Act III,Scene III,[stage direction],Enter three Murderers,NA
Act III,Scene III,First Murderer,But who did bid thee join with us?,1148
Act III,Scene III,Third Murderer,Macbeth.,1149
Act III,Scene III,Second Murderer,"He needs not our mistrust, since he delivers",1150
Act III,Scene III,Second Murderer,Our offices and what we have to do,1151
Act III,Scene III,Second Murderer,To the direction just.,1152
Act III,Scene III,First Murderer,Then stand with us.,1153
Act III,Scene III,First Murderer,The west yet glimmers with some streaks of day:,1154
Act III,Scene III,First Murderer,Now spurs the lated traveller apace,1155
Act III,Scene III,First Murderer,To gain the timely inn; and near approaches,1156
Act III,Scene III,First Murderer,The subject of our watch.,1157
Act III,Scene III,Third Murderer,Hark! I hear horses.,1158
Act III,Scene III,Banquo,"[Within]  Give us a light there, ho!",1159
Act III,Scene III,Second Murderer,Then 'tis he: the rest,1160
Act III,Scene III,Second Murderer,That are within the note of expectation,1161
Act III,Scene III,Second Murderer,Already are i' the court.,1162
Act III,Scene III,First Murderer,His horses go about.,1163
Act III,Scene III,Third Murderer,"Almost a mile: but he does usually,",1164
Act III,Scene III,Third Murderer,"So all men do, from hence to the palace gate",1165
Act III,Scene III,Third Murderer,Make it their walk.,1166
Act III,Scene III,Second Murderer,"A light, a light!",1167
Act III,Scene III,[stage direction],"Enter BANQUO, and FLEANCE with a torch",NA
Act III,Scene III,Third Murderer,'Tis he.,1168
Act III,Scene III,First Murderer,Stand to't.,1169
Act III,Scene III,Banquo,It will be rain to-night.,1170
Act III,Scene III,First Murderer,Let it come down.,1171
Act III,Scene III,[stage direction],They set upon BANQUO,NA
Act III,Scene III,Banquo,"O, treachery! Fly, good Fleance, fly, fly, fly!",1172
Act III,Scene III,Banquo,Thou mayst revenge. O slave!,1173
Act III,Scene III,[stage direction],Dies. FLEANCE escapes,NA
Act III,Scene III,Third Murderer,Who did strike out the light?,1174
Act III,Scene III,First Murderer,Wast not the way?,1175
Act III,Scene III,Third Murderer,There's but one down; the son is fled.,1176
Act III,Scene III,Second Murderer,We have lost,1177
Act III,Scene III,Second Murderer,Best half of our affair.,1178
Act III,Scene III,First Murderer,"Well, let's away, and say how much is done.",1179
Act III,Scene III,[stage direction],Exeunt,NA
Act III,Scene IV,[stage direction],"A banquet prepared. Enter MACBETH, LADY MACBETH, ROSS, LENNOX, Lords, and Attendants",NA
Act III,Scene IV,Macbeth,You know your own degrees; sit down: at first,1180
Act III,Scene IV,Macbeth,And last the hearty welcome.,1181
Act III,Scene IV,Lords,Thanks to your majesty.,1182
Act III,Scene IV,Macbeth,"Ourself will mingle with society,",1183
Act III,Scene IV,Macbeth,And play the humble host.,1184
Act III,Scene IV,Macbeth,"Our hostess keeps her state, but in best time",1185
Act III,Scene IV,Macbeth,We will require her welcome.,1186
Act III,Scene IV,Lady Macbeth,"Pronounce it for me, sir, to all our friends;",1187
Act III,Scene IV,Lady Macbeth,For my heart speaks they are welcome.,1188
Act III,Scene IV,[stage direction],First Murderer appears at the door,NA
Act III,Scene IV,Macbeth,"See, they encounter thee with their hearts' thanks.",1189
Act III,Scene IV,Macbeth,Both sides are even: here I'll sit i' the midst:,1190
Act III,Scene IV,Macbeth,Be large in mirth; anon we'll drink a measure,1191
Act III,Scene IV,Macbeth,The table round.,1192
Act III,Scene IV,[stage direction],Approaching the door,NA
Act III,Scene IV,Macbeth,There's blood on thy face.,1193
Act III,Scene IV,First Murderer,'Tis Banquo's then.,1194
Act III,Scene IV,Macbeth,'Tis better thee without than he within.,1195
Act III,Scene IV,Macbeth,Is he dispatch'd?,1196
Act III,Scene IV,First Murderer,"My lord, his throat is cut; that I did for him.",1197
Act III,Scene IV,Macbeth,Thou art the best o' the cut-throats: yet he's good,1198
Act III,Scene IV,Macbeth,"That did the like for Fleance: if thou didst it,",1199
Act III,Scene IV,Macbeth,Thou art the nonpareil.,1200
Act III,Scene IV,First Murderer,"Most royal sir,",1201
Act III,Scene IV,First Murderer,Fleance is 'scaped.,1202
Act III,Scene IV,Macbeth,"Then comes my fit again: I had else been perfect,",1203
Act III,Scene IV,Macbeth,"Whole as the marble, founded as the rock,",1204
Act III,Scene IV,Macbeth,As broad and general as the casing air:,1205
Act III,Scene IV,Macbeth,"But now I am cabin'd, cribb'd, confined, bound in",1206
Act III,Scene IV,Macbeth,To saucy doubts and fears. But Banquo's safe?,1207
Act III,Scene IV,First Murderer,"Ay, my good lord: safe in a ditch he bides,",1208
Act III,Scene IV,First Murderer,With twenty trenched gashes on his head;,1209
Act III,Scene IV,First Murderer,The least a death to nature.,1210
Act III,Scene IV,Macbeth,Thanks for that:,1211
Act III,Scene IV,Macbeth,There the grown serpent lies; the worm that's fled,1212
Act III,Scene IV,Macbeth,"Hath nature that in time will venom breed,",1213
Act III,Scene IV,Macbeth,No teeth for the present. Get thee gone: to-morrow,1214
Act III,Scene IV,Macbeth,"We'll hear, ourselves, again.",1215
Act III,Scene IV,[stage direction],Exit Murderer,NA
Act III,Scene IV,Lady Macbeth,"My royal lord,",1216
Act III,Scene IV,Lady Macbeth,You do not give the cheer: the feast is sold,1217
Act III,Scene IV,Lady Macbeth,"That is not often vouch'd, while 'tis a-making,",1218
Act III,Scene IV,Lady Macbeth,'Tis given with welcome: to feed were best at home;,1219
Act III,Scene IV,Lady Macbeth,From thence the sauce to meat is ceremony;,1220
Act III,Scene IV,Lady Macbeth,Meeting were bare without it.,1221
Act III,Scene IV,Macbeth,Sweet remembrancer!,1222
Act III,Scene IV,Macbeth,"Now, good digestion wait on appetite,",1223
Act III,Scene IV,Macbeth,And health on both!,1224
Act III,Scene IV,Lennox,May't please your highness sit.,1225
Act III,Scene IV,[stage direction],"The GHOST OF BANQUO enters, and sits in MACBETH's place",NA
Act III,Scene IV,Macbeth,"Here had we now our country's honour roof'd,",1226
Act III,Scene IV,Macbeth,Were the graced person of our Banquo present;,1227
Act III,Scene IV,Macbeth,Who may I rather challenge for unkindness,1228
Act III,Scene IV,Macbeth,Than pity for mischance!,1229
Act III,Scene IV,Ross,"His absence, sir,",1230
Act III,Scene IV,Ross,Lays blame upon his promise. Please't your highness,1231
Act III,Scene IV,Ross,To grace us with your royal company.,1232
Act III,Scene IV,Macbeth,The table's full.,1233
Act III,Scene IV,Lennox,"Here is a place reserved, sir.",1234
Act III,Scene IV,Macbeth,Where?,1235
Act III,Scene IV,Lennox,"Here, my good lord. What is't that moves your highness?",1236
Act III,Scene IV,Macbeth,Which of you have done this?,1237
Act III,Scene IV,Lords,"What, my good lord?",1238
Act III,Scene IV,Macbeth,Thou canst not say I did it: never shake,1239
Act III,Scene IV,Macbeth,Thy gory locks at me.,1240
Act III,Scene IV,Ross,"Gentlemen, rise: his highness is not well.",1241
Act III,Scene IV,Lady Macbeth,"Sit, worthy friends: my lord is often thus,",1242
Act III,Scene IV,Lady Macbeth,"And hath been from his youth: pray you, keep seat;",1243
Act III,Scene IV,Lady Macbeth,The fit is momentary; upon a thought,1244
Act III,Scene IV,Lady Macbeth,"He will again be well: if much you note him,",1245
Act III,Scene IV,Lady Macbeth,You shall offend him and extend his passion:,1246
Act III,Scene IV,Lady Macbeth,"Feed, and regard him not. Are you a man?",1247
Act III,Scene IV,Macbeth,"Ay, and a bold one, that dare look on that",1248
Act III,Scene IV,Macbeth,Which might appal the devil.,1249
Act III,Scene IV,Lady Macbeth,O proper stuff!,1250
Act III,Scene IV,Lady Macbeth,This is the very painting of your fear:,1251
Act III,Scene IV,Lady Macbeth,"This is the air-drawn dagger which, you said,",1252
Act III,Scene IV,Lady Macbeth,"Led you to Duncan. O, these flaws and starts,",1253
Act III,Scene IV,Lady Macbeth,"Impostors to true fear, would well become",1254
Act III,Scene IV,Lady Macbeth,"A woman's story at a winter's fire,",1255
Act III,Scene IV,Lady Macbeth,Authorized by her grandam. Shame itself!,1256
Act III,Scene IV,Lady Macbeth,"Why do you make such faces? When all's done,",1257
Act III,Scene IV,Lady Macbeth,You look but on a stool.,1258
Act III,Scene IV,Macbeth,"Prithee, see there! behold! look! lo!",1259
Act III,Scene IV,Macbeth,how say you?,1260
Act III,Scene IV,Macbeth,"Why, what care I? If thou canst nod, speak too.",1261
Act III,Scene IV,Macbeth,If charnel-houses and our graves must send,1262
Act III,Scene IV,Macbeth,"Those that we bury back, our monuments",1263
Act III,Scene IV,Macbeth,Shall be the maws of kites.,1264
Act III,Scene IV,[stage direction],GHOST OF BANQUO vanishes,NA
Act III,Scene IV,Lady Macbeth,"What, quite unmann'd in folly?",1265
Act III,Scene IV,Macbeth,"If I stand here, I saw him.",1266
Act III,Scene IV,Lady Macbeth,"Fie, for shame!",1267
Act III,Scene IV,Macbeth,"Blood hath been shed ere now, i' the olden time,",1268
Act III,Scene IV,Macbeth,Ere human statute purged the gentle weal;,1269
Act III,Scene IV,Macbeth,"Ay, and since too, murders have been perform'd",1270
Act III,Scene IV,Macbeth,"Too terrible for the ear: the times have been,",1271
Act III,Scene IV,Macbeth,"That, when the brains were out, the man would die,",1272
Act III,Scene IV,Macbeth,"And there an end; but now they rise again,",1273
Act III,Scene IV,Macbeth,"With twenty mortal murders on their crowns,",1274
Act III,Scene IV,Macbeth,And push us from our stools: this is more strange,1275
Act III,Scene IV,Macbeth,Than such a murder is.,1276
Act III,Scene IV,Lady Macbeth,"My worthy lord,",1277
Act III,Scene IV,Lady Macbeth,Your noble friends do lack you.,1278
Act III,Scene IV,Macbeth,I do forget.,1279
Act III,Scene IV,Macbeth,"Do not muse at me, my most worthy friends,",1280
Act III,Scene IV,Macbeth,"I have a strange infirmity, which is nothing",1281
Act III,Scene IV,Macbeth,"To those that know me. Come, love and health to all;",1282
Act III,Scene IV,Macbeth,Then I'll sit down. Give me some wine; fill full.,1283
Act III,Scene IV,Macbeth,"I drink to the general joy o' the whole table,",1284
Act III,Scene IV,Macbeth,"And to our dear friend Banquo, whom we miss;",1285
Act III,Scene IV,Macbeth,"Would he were here! to all, and him, we thirst,",1286
Act III,Scene IV,Macbeth,And all to all.,1287
Act III,Scene IV,Lords,"Our duties, and the pledge.",1288
Act III,Scene IV,[stage direction],Re-enter GHOST OF BANQUO,NA
Act III,Scene IV,Macbeth,Avaunt! and quit my sight! let the earth hide thee!,1289
Act III,Scene IV,Macbeth,"Thy bones are marrowless, thy blood is cold;",1290
Act III,Scene IV,Macbeth,Thou hast no speculation in those eyes,1291
Act III,Scene IV,Macbeth,Which thou dost glare with!,1292
Act III,Scene IV,Lady Macbeth,"Think of this, good peers,",1293
Act III,Scene IV,Lady Macbeth,But as a thing of custom: 'tis no other;,1294
Act III,Scene IV,Lady Macbeth,Only it spoils the pleasure of the time.,1295
Act III,Scene IV,Macbeth,"What man dare, I dare:",1296
Act III,Scene IV,Macbeth,"Approach thou like the rugged Russian bear,",1297
Act III,Scene IV,Macbeth,"The arm'd rhinoceros, or the Hyrcan tiger;",1298
Act III,Scene IV,Macbeth,"Take any shape but that, and my firm nerves",1299
Act III,Scene IV,Macbeth,"Shall never tremble: or be alive again,",1300
Act III,Scene IV,Macbeth,And dare me to the desert with thy sword;,1301
Act III,Scene IV,Macbeth,"If trembling I inhabit then, protest me",1302
Act III,Scene IV,Macbeth,"The baby of a girl. Hence, horrible shadow!",1303
Act III,Scene IV,Macbeth,"Unreal mockery, hence!",1304
Act III,Scene IV,[stage direction],GHOST OF BANQUO vanishes,NA
Act III,Scene IV,Macbeth,"Why, so: being gone,",1305
Act III,Scene IV,Macbeth,"I am a man again. Pray you, sit still.",1306
Act III,Scene IV,Lady Macbeth,"You have displaced the mirth, broke the good meeting,",1307
Act III,Scene IV,Lady Macbeth,With most admired disorder.,1308
Act III,Scene IV,Macbeth,"Can such things be,",1309
Act III,Scene IV,Macbeth,"And overcome us like a summer's cloud,",1310
Act III,Scene IV,Macbeth,Without our special wonder? You make me strange,1311
Act III,Scene IV,Macbeth,"Even to the disposition that I owe,",1312
Act III,Scene IV,Macbeth,"When now I think you can behold such sights,",1313
Act III,Scene IV,Macbeth,"And keep the natural ruby of your cheeks,",1314
Act III,Scene IV,Macbeth,When mine is blanched with fear.,1315
Act III,Scene IV,Ross,"What sights, my lord?",1316
Act III,Scene IV,Lady Macbeth,"I pray you, speak not; he grows worse and worse;",1317
Act III,Scene IV,Lady Macbeth,"Question enrages him. At once, good night:",1318
Act III,Scene IV,Lady Macbeth,"Stand not upon the order of your going,",1319
Act III,Scene IV,Lady Macbeth,But go at once.,1320
Act III,Scene IV,Lennox,Good night; and better health,1321
Act III,Scene IV,Lennox,Attend his majesty!,1322
Act III,Scene IV,Lady Macbeth,A kind good night to all!,1323
Act III,Scene IV,[stage direction],Exeunt all but MACBETH and LADY MACBETH,NA
Act III,Scene IV,Macbeth,"It will have blood; they say, blood will have blood:",1324
Act III,Scene IV,Macbeth,Stones have been known to move and trees to speak;,1325
Act III,Scene IV,Macbeth,Augurs and understood relations have,1326
Act III,Scene IV,Macbeth,By magot-pies and choughs and rooks brought forth,1327
Act III,Scene IV,Macbeth,The secret'st man of blood. What is the night?,1328
Act III,Scene IV,Lady Macbeth,"Almost at odds with morning, which is which.",1329
Act III,Scene IV,Macbeth,"How say'st thou, that Macduff denies his person",1330
Act III,Scene IV,Macbeth,At our great bidding?,1331
Act III,Scene IV,Lady Macbeth,"Did you send to him, sir?",1332
Act III,Scene IV,Macbeth,I hear it by the way; but I will send:,1333
Act III,Scene IV,Macbeth,There's not a one of them but in his house,1334
Act III,Scene IV,Macbeth,"I keep a servant fee'd. I will to-morrow,",1335
Act III,Scene IV,Macbeth,"And betimes I will, to the weird sisters:",1336
Act III,Scene IV,Macbeth,"More shall they speak; for now I am bent to know,",1337
Act III,Scene IV,Macbeth,"By the worst means, the worst. For mine own good,",1338
Act III,Scene IV,Macbeth,All causes shall give way: I am in blood,1339
Act III,Scene IV,Macbeth,"Stepp'd in so far that, should I wade no more,",1340
Act III,Scene IV,Macbeth,Returning were as tedious as go o'er:,1341
Act III,Scene IV,Macbeth,"Strange things I have in head, that will to hand;",1342
Act III,Scene IV,Macbeth,Which must be acted ere they may be scann'd.,1343
Act III,Scene IV,Lady Macbeth,"You lack the season of all natures, sleep.",1344
Act III,Scene IV,Macbeth,"Come, we'll to sleep. My strange and self-abuse",1345
Act III,Scene IV,Macbeth,Is the initiate fear that wants hard use:,1346
Act III,Scene IV,Macbeth,We are yet but young in deed.,1347
Act III,Scene IV,[stage direction],Exeunt,NA
Act III,Scene V,[stage direction],Thunder. Enter the three Witches meeting HECATE,NA
Act III,Scene V,First Witch,"Why, how now, Hecate! you look angerly.",1348
Act III,Scene V,Hecate,"Have I not reason, beldams as you are,",1349
Act III,Scene V,Hecate,Saucy and overbold? How did you dare,1350
Act III,Scene V,Hecate,To trade and traffic with Macbeth,1351
Act III,Scene V,Hecate,In riddles and affairs of death;,1352
Act III,Scene V,Hecate,"And I, the mistress of your charms,",1353
Act III,Scene V,Hecate,"The close contriver of all harms,",1354
Act III,Scene V,Hecate,"Was never call'd to bear my part,",1355
Act III,Scene V,Hecate,Or show the glory of our art?,1356
Act III,Scene V,Hecate,"And, which is worse, all you have done",1357
Act III,Scene V,Hecate,"Hath been but for a wayward son,",1358
Act III,Scene V,Hecate,"Spiteful and wrathful, who, as others do,",1359
Act III,Scene V,Hecate,"Loves for his own ends, not for you.",1360
Act III,Scene V,Hecate,"But make amends now: get you gone,",1361
Act III,Scene V,Hecate,And at the pit of Acheron,1362
Act III,Scene V,Hecate,Meet me i' the morning: thither he,1363
Act III,Scene V,Hecate,Will come to know his destiny:,1364
Act III,Scene V,Hecate,"Your vessels and your spells provide,",1365
Act III,Scene V,Hecate,Your charms and every thing beside.,1366
Act III,Scene V,Hecate,I am for the air; this night I'll spend,1367
Act III,Scene V,Hecate,Unto a dismal and a fatal end:,1368
Act III,Scene V,Hecate,Great business must be wrought ere noon:,1369
Act III,Scene V,Hecate,Upon the corner of the moon,1370
Act III,Scene V,Hecate,There hangs a vaporous drop profound;,1371
Act III,Scene V,Hecate,I'll catch it ere it come to ground:,1372
Act III,Scene V,Hecate,And that distill'd by magic sleights,1373
Act III,Scene V,Hecate,Shall raise such artificial sprites,1374
Act III,Scene V,Hecate,As by the strength of their illusion,1375
Act III,Scene V,Hecate,Shall draw him on to his confusion:,1376
Act III,Scene V,Hecate,"He shall spurn fate, scorn death, and bear",1377
Act III,Scene V,Hecate,"He hopes 'bove wisdom, grace and fear:",1378
Act III,Scene V,Hecate,"And you all know, security",1379
Act III,Scene V,Hecate,Is mortals' chiefest enemy.,1380
Act III,Scene V,[stage direction],"Music and a song within: 'Come away, come away,'  &amp; c",NA
Act III,Scene V,Hecate,"Hark! I am call'd; my little spirit, see,",1381
Act III,Scene V,Hecate,"Sits in a foggy cloud, and stays for me.",1382
Act III,Scene V,[stage direction],Exit,NA
Act III,Scene V,First Witch,"Come, let's make haste; she'll soon be back again.",1383
Act III,Scene V,[stage direction],Exeunt,NA
Act III,Scene VI,[stage direction],Enter LENNOX and another Lord,NA
Act III,Scene VI,Lennox,"My former speeches have but hit your thoughts,",1384
Act III,Scene VI,Lennox,"Which can interpret further: only, I say,",1385
Act III,Scene VI,Lennox,Things have been strangely borne. The,1386
Act III,Scene VI,Lennox,gracious Duncan,1387
Act III,Scene VI,Lennox,"Was pitied of Macbeth: marry, he was dead:",1388
Act III,Scene VI,Lennox,And the right-valiant Banquo walk'd too late;,1389
Act III,Scene VI,Lennox,"Whom, you may say, if't please you, Fleance kill'd,",1390
Act III,Scene VI,Lennox,For Fleance fled: men must not walk too late.,1391
Act III,Scene VI,Lennox,Who cannot want the thought how monstrous,1392
Act III,Scene VI,Lennox,It was for Malcolm and for Donalbain,1393
Act III,Scene VI,Lennox,To kill their gracious father? damned fact!,1394
Act III,Scene VI,Lennox,How it did grieve Macbeth! did he not straight,1395
Act III,Scene VI,Lennox,"In pious rage the two delinquents tear,",1396
Act III,Scene VI,Lennox,That were the slaves of drink and thralls of sleep?,1397
Act III,Scene VI,Lennox,"Was not that nobly done? Ay, and wisely too;",1398
Act III,Scene VI,Lennox,For 'twould have anger'd any heart alive,1399
Act III,Scene VI,Lennox,"To hear the men deny't. So that, I say,",1400
Act III,Scene VI,Lennox,He has borne all things well: and I do think,1401
Act III,Scene VI,Lennox,That had he Duncan's sons under his key--,1402
Act III,Scene VI,Lennox,"As, an't please heaven, he shall not--they",1403
Act III,Scene VI,Lennox,should find,1404
Act III,Scene VI,Lennox,What 'twere to kill a father; so should Fleance.,1405
Act III,Scene VI,Lennox,"But, peace! for from broad words and 'cause he fail'd",1406
Act III,Scene VI,Lennox,"His presence at the tyrant's feast, I hear",1407
Act III,Scene VI,Lennox,"Macduff lives in disgrace: sir, can you tell",1408
Act III,Scene VI,Lennox,Where he bestows himself?,1409
Act III,Scene VI,Lord,"The son of Duncan,",1410
Act III,Scene VI,Lord,From whom this tyrant holds the due of birth,1411
Act III,Scene VI,Lord,"Lives in the English court, and is received",1412
Act III,Scene VI,Lord,Of the most pious Edward with such grace,1413
Act III,Scene VI,Lord,That the malevolence of fortune nothing,1414
Act III,Scene VI,Lord,Takes from his high respect: thither Macduff,1415
Act III,Scene VI,Lord,"Is gone to pray the holy king, upon his aid",1416
Act III,Scene VI,Lord,To wake Northumberland and warlike Siward:,1417
Act III,Scene VI,Lord,"That, by the help of these--with Him above",1418
Act III,Scene VI,Lord,To ratify the work--we may again,1419
Act III,Scene VI,Lord,"Give to our tables meat, sleep to our nights,",1420
Act III,Scene VI,Lord,"Free from our feasts and banquets bloody knives,",1421
Act III,Scene VI,Lord,Do faithful homage and receive free honours:,1422
Act III,Scene VI,Lord,All which we pine for now: and this report,1423
Act III,Scene VI,Lord,Hath so exasperate the king that he,1424
Act III,Scene VI,Lord,Prepares for some attempt of war.,1425
Act III,Scene VI,Lennox,Sent he to Macduff?,1426
Act III,Scene VI,Lord,"He did: and with an absolute 'Sir, not I,'",1427
Act III,Scene VI,Lord,"The cloudy messenger turns me his back,",1428
Act III,Scene VI,Lord,"And hums, as who should say 'You'll rue the time",1429
Act III,Scene VI,Lord,That clogs me with this answer.',1430
Act III,Scene VI,Lennox,And that well might,1431
Act III,Scene VI,Lennox,"Advise him to a caution, to hold what distance",1432
Act III,Scene VI,Lennox,His wisdom can provide. Some holy angel,1433
Act III,Scene VI,Lennox,Fly to the court of England and unfold,1434
Act III,Scene VI,Lennox,"His message ere he come, that a swift blessing",1435
Act III,Scene VI,Lennox,May soon return to this our suffering country,1436
Act III,Scene VI,Lennox,Under a hand accursed!,1437
Act III,Scene VI,Lord,I'll send my prayers with him.,1438
Act III,Scene VI,[stage direction],Exeunt,NA
Act IV,Scene I,[stage direction],Thunder. Enter the three Witches,NA
Act IV,Scene I,First Witch,Thrice the brinded cat hath mew'd.,1439
Act IV,Scene I,Second Witch,Thrice and once the hedge-pig whined.,1440
Act IV,Scene I,Third Witch,"Harpier cries 'Tis time, 'tis time.",1441
Act IV,Scene I,First Witch,Round about the cauldron go;,1442
