act,scene,character,dialogue,line_number
Act II,Scene III,Porter,"'Faith sir, we were carousing till the",728
Act II,Scene III,Porter,"second cock: and drink, sir, is a great",729
Act II,Scene III,Porter,provoker of three things.,730
Act II,Scene III,Macduff,What three things does drink especially provoke?,731
Act II,Scene III,Porter,"Marry, sir, nose-painting, sleep, and",732
Act II,Scene III,Porter,"urine. Lechery, sir, it provokes, and unprovokes;",733
Act II,Scene III,Porter,"it provokes the desire, but it takes",734
Act II,Scene III,Porter,"away the performance: therefore, much drink",735
Act II,Scene III,Porter,may be said to be an equivocator with lechery:,736
Act II,Scene III,Porter,"it makes him, and it mars him; it sets",737
Act II,Scene III,Porter,"him on, and it takes him off; it persuades him,",738
Act II,Scene III,Porter,"and disheartens him; makes him stand to, and",739
Act II,Scene III,Porter,"not stand to; in conclusion, equivocates him",740
Act II,Scene III,Porter,"in a sleep, and, giving him the lie, leaves him.",741
Act II,Scene III,Macduff,I believe drink gave thee the lie last night.,742
Act II,Scene III,Porter,"That it did, sir, i' the very throat on",743
Act II,Scene III,Porter,"me: but I requited him for his lie; and, I",744
Act II,Scene III,Porter,"think, being too strong for him, though he took",745
Act II,Scene III,Porter,"up my legs sometime, yet I made a shift to cast",746
Act II,Scene III,Porter,him.,747
Act II,Scene III,Macduff,Is thy master stirring?,748
Act II,Scene III,[stage direction],Enter MACBETH,NA
Act II,Scene III,Macduff,Our knocking has awaked him; here he comes.,749
Act II,Scene III,Lennox,"Good morrow, noble sir.",750
Act II,Scene III,Macbeth,"Good morrow, both.",751
Act II,Scene III,Macduff,"Is the king stirring, worthy thane?",752
Act II,Scene III,Macbeth,Not yet.,753
Act II,Scene III,Macduff,He did command me to call timely on him:,754
Act II,Scene III,Macduff,I have almost slipp'd the hour.,755
Act II,Scene III,Macbeth,I'll bring you to him.,756
Act II,Scene III,Macduff,I know this is a joyful trouble to you;,757
Act II,Scene III,Macduff,But yet 'tis one.,758
Act II,Scene III,Macbeth,The labour we delight in physics pain.,759
Act II,Scene III,Macbeth,This is the door.,760
Act II,Scene III,Macduff,"I'll make so bold to call,",761
Act II,Scene III,Macduff,For 'tis my limited service.,762
Act II,Scene III,[stage direction],Exit,NA
Act II,Scene III,Lennox,Goes the king hence to-day?,763
Act II,Scene III,Macbeth,He does: he did appoint so.,764
Act II,Scene III,Lennox,"The night has been unruly: where we lay,",765
Act II,Scene III,Lennox,"Our chimneys were blown down; and, as they say,",766
Act II,Scene III,Lennox,"Lamentings heard i' the air; strange screams of death,",767
Act II,Scene III,Lennox,And prophesying with accents terrible,768
Act II,Scene III,Lennox,Of dire combustion and confused events,769
Act II,Scene III,Lennox,New hatch'd to the woeful time: the obscure bird,770
Act II,Scene III,Lennox,"Clamour'd the livelong night: some say, the earth",771
Act II,Scene III,Lennox,Was feverous and did shake.,772
Act II,Scene III,Macbeth,'Twas a rough night.,773
Act II,Scene III,Lennox,My young remembrance cannot parallel,774
Act II,Scene III,Lennox,A fellow to it.,775
Act II,Scene III,[stage direction],Re-enter MACDUFF,NA
Act II,Scene III,Macduff,"O horror, horror, horror! Tongue nor heart",776
Act II,Scene III,Macduff,Cannot conceive nor name thee!,777
Act II,Scene III,Lennox,What's the matter.,778
Act II,Scene III,Macduff,Confusion now hath made his masterpiece!,779
Act II,Scene III,Macduff,Most sacrilegious murder hath broke ope,780
Act II,Scene III,Macduff,"The Lord's anointed temple, and stole thence",781
Act II,Scene III,Macduff,The life o' the building!,782
Act II,Scene III,Macbeth,What is 't you say? the life?,783
Act II,Scene III,Lennox,Mean you his majesty?,784
Act II,Scene III,Macduff,"Approach the chamber, and destroy your sight",785
Act II,Scene III,Macduff,With a new Gorgon: do not bid me speak;,786
Act II,Scene III,Macduff,"See, and then speak yourselves.",787
Act II,Scene III,[stage direction],Exeunt MACBETH and LENNOX,NA
Act II,Scene III,Macduff,"Awake, awake!",788
Act II,Scene III,Macduff,Ring the alarum-bell. Murder and treason!,789
Act II,Scene III,Macduff,Banquo and Donalbain! Malcolm! awake!,790
Act II,Scene III,Macduff,"Shake off this downy sleep, death's counterfeit,",791
Act II,Scene III,Macduff,"And look on death itself! up, up, and see",792
Act II,Scene III,Macduff,The great doom's image! Malcolm! Banquo!,793
Act II,Scene III,Macduff,"As from your graves rise up, and walk like sprites,",794
Act II,Scene III,Macduff,To countenance this horror! Ring the bell.,795
Act II,Scene III,[stage direction],Bell rings,NA
Act II,Scene III,[stage direction],Enter LADY MACBETH,NA
Act II,Scene III,Lady Macbeth,"What's the business,",796
Act II,Scene III,Lady Macbeth,That such a hideous trumpet calls to parley,797
Act II,Scene III,Lady Macbeth,"The sleepers of the house? speak, speak!",798
Act II,Scene III,Macduff,"O gentle lady,",799
Act II,Scene III,Macduff,'Tis not for you to hear what I can speak:,800
Act II,Scene III,Macduff,"The repetition, in a woman's ear,",801
Act II,Scene III,Macduff,Would murder as it fell.,802
Act II,Scene III,[stage direction],Enter BANQUO,NA
Act II,Scene III,Macduff,"O Banquo, Banquo,",803
Act II,Scene III,Macduff,Our royal master 's murder'd!,804
Act II,Scene III,Lady Macbeth,"Woe, alas!",805
Act II,Scene III,Lady Macbeth,"What, in our house?",806
Act II,Scene III,Banquo,Too cruel any where.,807
Act II,Scene III,Banquo,"Dear Duff, I prithee, contradict thyself,",808
Act II,Scene III,Banquo,And say it is not so.,809
Act II,Scene III,[stage direction],"Re-enter MACBETH and LENNOX, with ROSS",NA
Act II,Scene III,Macbeth,"Had I but died an hour before this chance,",810
Act II,Scene III,Macbeth,"I had lived a blessed time; for, from this instant,",811
Act II,Scene III,Macbeth,There 's nothing serious in mortality:,812
Act II,Scene III,Macbeth,All is but toys: renown and grace is dead;,813
Act II,Scene III,Macbeth,"The wine of life is drawn, and the mere lees",814
Act II,Scene III,Macbeth,Is left this vault to brag of.,815
Act II,Scene III,[stage direction],Enter MALCOLM and DONALBAIN,NA
Act II,Scene III,Donalbain,What is amiss?,816
Act II,Scene III,Macbeth,"You are, and do not know't:",817
Act II,Scene III,Macbeth,"The spring, the head, the fountain of your blood",818
Act II,Scene III,Macbeth,Is stopp'd; the very source of it is stopp'd.,819
Act II,Scene III,Macduff,Your royal father 's murder'd.,820
Act II,Scene III,Malcolm,"O, by whom?",821
Act II,Scene III,Lennox,"Those of his chamber, as it seem'd, had done 't:",822
Act II,Scene III,Lennox,Their hands and faces were an badged with blood;,823
Act II,Scene III,Lennox,"So were their daggers, which unwiped we found",824
Act II,Scene III,Lennox,Upon their pillows:,825
Act II,Scene III,Lennox,"They stared, and were distracted; no man's life",826
Act II,Scene III,Lennox,Was to be trusted with them.,827
Act II,Scene III,Macbeth,"O, yet I do repent me of my fury,",828
Act II,Scene III,Macbeth,That I did kill them.,829
Act II,Scene III,Macduff,Wherefore did you so?,830
Act II,Scene III,Macbeth,"Who can be wise, amazed, temperate and furious,",831
Act II,Scene III,Macbeth,"Loyal and neutral, in a moment? No man:",832
Act II,Scene III,Macbeth,The expedition my violent love,833
Act II,Scene III,Macbeth,"Outrun the pauser, reason. Here lay Duncan,",834
Act II,Scene III,Macbeth,His silver skin laced with his golden blood;,835
Act II,Scene III,Macbeth,And his gash'd stabs look'd like a breach in nature,836
Act II,Scene III,Macbeth,"For ruin's wasteful entrance: there, the murderers,",837
Act II,Scene III,Macbeth,"Steep'd in the colours of their trade, their daggers",838
Act II,Scene III,Macbeth,"Unmannerly breech'd with gore: who could refrain,",839
Act II,Scene III,Macbeth,"That had a heart to love, and in that heart",840
Act II,Scene III,Macbeth,Courage to make 's love kno wn?,841
Act II,Scene III,Lady Macbeth,"Help me hence, ho!",842
Act II,Scene III,Macduff,Look to the lady.,843
Act II,Scene III,Malcolm,"[Aside to DONALBAIN]  Why do we hold our tongues,",844
Act II,Scene III,Malcolm,That most may claim this argument for ours?,845
Act II,Scene III,Donalbain,"[Aside to MALCOLM]  What should be spoken here,",846
Act II,Scene III,Donalbain,"where our fate,",847
Act II,Scene III,Donalbain,"Hid in an auger-hole, may rush, and seize us?",848
Act II,Scene III,Donalbain,Let 's away;,849
Act II,Scene III,Donalbain,Our tears are not yet brew'd.,850
Act II,Scene III,Malcolm,[Aside to DONALBAIN]        Nor our strong sorrow,851
Act II,Scene III,Malcolm,Upon the foot of motion.,852
Act II,Scene III,Banquo,Look to the lady:,853
Act II,Scene III,[stage direction],LADY MACBETH is carried out,NA
Act II,Scene III,Banquo,"And when we have our naked frailties hid,",854
Act II,Scene III,Banquo,"That suffer in exposure, let us meet,",855
Act II,Scene III,Banquo,"And question this most bloody piece of work,",856
Act II,Scene III,Banquo,To know it further. Fears and scruples shake us:,857
Act II,Scene III,Banquo,In the great hand of God I stand; and thence,858
Act II,Scene III,Banquo,Against the undivulged pretence I fight,859
Act II,Scene III,Banquo,Of treasonous malice.,860
Act II,Scene III,Macduff,And so do I.,861
Act II,Scene III,All,So all.,862
Act II,Scene III,Macbeth,"Let's briefly put on manly readiness,",863
Act II,Scene III,Macbeth,And meet i' the hall together.,864
Act II,Scene III,All,Well contented.,865
Act II,Scene III,[stage direction],Exeunt all but Malcolm and Donalbain.,NA
Act II,Scene III,Malcolm,What will you do? Let's not consort with them:,866
Act II,Scene III,Malcolm,To show an unfelt sorrow is an office,867
Act II,Scene III,Malcolm,Which the false man does easy. I'll to England.,868
Act II,Scene III,Donalbain,"To Ireland, I; our separated fortune",869
Act II,Scene III,Donalbain,"Shall keep us both the safer: where we are,",870
Act II,Scene III,Donalbain,"There's daggers in men's smiles: the near in blood,",871
Act II,Scene III,Donalbain,The nearer bloody.,872
Act II,Scene III,Malcolm,This murderous shaft that's shot,873
Act II,Scene III,Malcolm,"Hath not yet lighted, and our safest way",874
Act II,Scene III,Malcolm,"Is to avoid the aim. Therefore, to horse;",875
Act II,Scene III,Malcolm,"And let us not be dainty of leave-taking,",876
Act II,Scene III,Malcolm,But shift away: there's warrant in that theft,877
Act II,Scene III,Malcolm,"Which steals itself, when there's no mercy left.",878
Act II,Scene III,[stage direction],Exeunt,NA
Act II,Scene IV,[stage direction],Enter ROSS and an old Man,NA
Act II,Scene IV,Old Man,Threescore and ten I can remember well:,879
Act II,Scene IV,Old Man,Within the volume of which time I have seen,880
Act II,Scene IV,Old Man,Hours dreadful and things strange; but this sore night,881
Act II,Scene IV,Old Man,Hath trifled former knowings.,882
Act II,Scene IV,Ross,"Ah, good father,",883
Act II,Scene IV,Ross,"Thou seest, the heavens, as troubled with man's act,",884
Act II,Scene IV,Ross,"Threaten his bloody stage: by the clock, 'tis day,",885
Act II,Scene IV,Ross,And yet dark night strangles the travelling lamp:,886
Act II,Scene IV,Ross,"Is't night's predominance, or the day's shame,",887
Act II,Scene IV,Ross,"That darkness does the face of earth entomb,",888
Act II,Scene IV,Ross,When living light should kiss it?,889
Act II,Scene IV,Old Man,"'Tis unnatural,",890
Act II,Scene IV,Old Man,"Even like the deed that's done. On Tuesday last,",891
Act II,Scene IV,Old Man,"A falcon, towering in her pride of place,",892
Act II,Scene IV,Old Man,Was by a mousing owl hawk'd at and kill'd.,893
Act II,Scene IV,Ross,And Duncan's horses--a thing most strange and certain--,894
Act II,Scene IV,Ross,"Beauteous and swift, the minions of their race,",895
Act II,Scene IV,Ross,"Turn'd wild in nature, broke their stalls, flung out,",896
Act II,Scene IV,Ross,"Contending 'gainst obedience, as they would make",897
Act II,Scene IV,Ross,War with mankind.,898
Act II,Scene IV,Old Man,'Tis said they eat each other.,899
Act II,Scene IV,Ross,"They did so, to the amazement of mine eyes",900
Act II,Scene IV,Ross,That look'd upon't. Here comes the good Macduff.,901
Act II,Scene IV,[stage direction],Enter MACDUFF,NA
Act II,Scene IV,Ross,"How goes the world, sir, now?",902
Act II,Scene IV,Macduff,"Why, see you not?",903
Act II,Scene IV,Ross,Is't known who did this more than bloody deed?,904
Act II,Scene IV,Macduff,Those that Macbeth hath slain.,905
Act II,Scene IV,Ross,"Alas, the day!",906
Act II,Scene IV,Ross,What good could they pretend?,907
Act II,Scene IV,Macduff,They were suborn'd:,908
Act II,Scene IV,Macduff,"Malcolm and Donalbain, the king's two sons,",909
Act II,Scene IV,Macduff,Are stol'n away and fled; which puts upon them,910
Act II,Scene IV,Macduff,Suspicion of the deed.,911
Act II,Scene IV,Ross,'Gainst nature still!,912
Act II,Scene IV,Ross,"Thriftless ambition, that wilt ravin up",913
Act II,Scene IV,Ross,Thine own life's means! Then 'tis most like,914
Act II,Scene IV,Ross,The sovereignty will fall upon Macbeth.,915
Act II,Scene IV,Macduff,"He is already named, and gone to Scone",916
Act II,Scene IV,Macduff,To be invested.,917
Act II,Scene IV,Ross,Where is Duncan's body?,918
Act II,Scene IV,Macduff,"Carried to Colmekill,",919
Act II,Scene IV,Macduff,"The sacred storehouse of his predecessors,",920
Act II,Scene IV,Macduff,And guardian of their bones.,921
Act II,Scene IV,Ross,Will you to Scone?,922
Act II,Scene IV,Macduff,"No, cousin, I'll to Fife.",923
Act II,Scene IV,Ross,"Well, I will thither.",924
Act II,Scene IV,Macduff,"Well, may you see things well done there: adieu!",925
Act II,Scene IV,Macduff,Lest our old robes sit easier than our new!,926
Act II,Scene IV,Ross,"Farewell, father.",927
Act II,Scene IV,Old Man,God's benison go with you; and with those,928
Act II,Scene IV,Old Man,"That would make good of bad, and friends of foes!",929
Act II,Scene IV,[stage direction],Exeunt,NA
Act III,Scene I,[stage direction],Enter BANQUO,NA
Act III,Scene I,Banquo,"Thou hast it now: king, Cawdor, Glamis, all,",930
Act III,Scene I,Banquo,"As the weird women promised, and, I fear,",931
Act III,Scene I,Banquo,Thou play'dst most foully for't: yet it was said,932
Act III,Scene I,Banquo,"It should not stand in thy posterity,",933
Act III,Scene I,Banquo,But that myself should be the root and father,934
Act III,Scene I,Banquo,Of many kings. If there come truth from them--,935
Act III,Scene I,Banquo,"As upon thee, Macbeth, their speeches shine--",936
Act III,Scene I,Banquo,"Why, by the verities on thee made good,",937
Act III,Scene I,Banquo,"May they not be my oracles as well,",938
Act III,Scene I,Banquo,And set me up in hope? But hush! no more.,939
Act III,Scene I,[stage direction],"Sennet sounded. Enter MACBETH, as king, LADY  MACBETH, as queen, LENNOX, ROSS, Lords, Ladies, and Attendants",NA
Act III,Scene I,Macbeth,Here's our chief guest.,940
Act III,Scene I,Lady Macbeth,"If he had been forgotten,",941
Act III,Scene I,Lady Macbeth,"It had been as a gap in our great feast,",942
Act III,Scene I,Lady Macbeth,And all-thing unbecoming.,943
Act III,Scene I,Macbeth,"To-night we hold a solemn supper sir,",944
Act III,Scene I,Macbeth,And I'll request your presence.,945
Act III,Scene I,Banquo,Let your highness,946
Act III,Scene I,Banquo,Command upon me; to the which my duties,947
Act III,Scene I,Banquo,Are with a most indissoluble tie,948
Act III,Scene I,Banquo,For ever knit.,949
Act III,Scene I,Macbeth,Ride you this afternoon?,950
Act III,Scene I,Banquo,"Ay, my good lord.",951
Act III,Scene I,Macbeth,"We should have else desired your good advice,",952
Act III,Scene I,Macbeth,"Which still hath been both grave and prosperous,",953
Act III,Scene I,Macbeth,In this day's council; but we'll take to-morrow.,954
Act III,Scene I,Macbeth,Is't far you ride?,955
Act III,Scene I,Banquo,"As far, my lord, as will fill up the time",956
Act III,Scene I,Banquo,"'Twixt this and supper: go not my horse the better,",957
Act III,Scene I,Banquo,I must become a borrower of the night,958
Act III,Scene I,Banquo,For a dark hour or twain.,959
Act III,Scene I,Macbeth,Fail not our feast.,960
Act III,Scene I,Banquo,"My lord, I will not.",961
Act III,Scene I,Macbeth,"We hear, our bloody cousins are bestow'd",962
Act III,Scene I,Macbeth,"In England and in Ireland, not confessing",963
Act III,Scene I,Macbeth,"Their cruel parricide, filling their hearers",964
Act III,Scene I,Macbeth,"With strange invention: but of that to-morrow,",965
Act III,Scene I,Macbeth,When therewithal we shall have cause of state,966
Act III,Scene I,Macbeth,"Craving us jointly. Hie you to horse: adieu,",967
Act III,Scene I,Macbeth,Till you return at night. Goes Fleance with you?,968
Act III,Scene I,Banquo,"Ay, my good lord: our time does call upon 's.",969
Act III,Scene I,Macbeth,I wish your horses swift and sure of foot;,970
Act III,Scene I,Macbeth,And so I do commend you to their backs. Farewell.,971
Act III,Scene I,[stage direction],Exit BANQUO,NA
Act III,Scene I,Macbeth,Let every man be master of his time,972
Act III,Scene I,Macbeth,Till seven at night: to make society,973
Act III,Scene I,Macbeth,"The sweeter welcome, we will keep ourself",974
Act III,Scene I,Macbeth,"Till supper-time alone: while then, God be with you!",975
Act III,Scene I,[stage direction],"Exeunt all but MACBETH, and an attendant",NA
Act III,Scene I,Macbeth,"Sirrah, a word with you: attend those men",976
Act III,Scene I,Macbeth,Our pleasure?,977
Act III,Scene I,Attendant,"They are, my lord, without the palace gate.",978
Act III,Scene I,Macbeth,Bring them before us.,979
Act III,Scene I,[stage direction],Exit Attendant,NA
Act III,Scene I,Macbeth,To be thus is nothing;,980
Act III,Scene I,Macbeth,But to be safely thus.--Our fears in Banquo,981
Act III,Scene I,Macbeth,Stick deep; and in his royalty of nature,982
Act III,Scene I,Macbeth,Reigns that which would be fear'd: 'tis much he dares;,983
Act III,Scene I,Macbeth,"And, to that dauntless temper of his mind,",984
Act III,Scene I,Macbeth,He hath a wisdom that doth guide his valour,985
Act III,Scene I,Macbeth,To act in safety. There is none but he,986
Act III,Scene I,Macbeth,"Whose being I do fear: and, under him,",987
Act III,Scene I,Macbeth,"My Genius is rebuked; as, it is said,",988
Act III,Scene I,Macbeth,Mark Antony's was by Caesar. He chid the sisters,989
Act III,Scene I,Macbeth,"When first they put the name of king upon me,",990
Act III,Scene I,Macbeth,And bade them speak to him: then prophet-like,991
Act III,Scene I,Macbeth,They hail'd him father to a line of kings:,992
Act III,Scene I,Macbeth,"Upon my head they placed a fruitless crown,",993
Act III,Scene I,Macbeth,"And put a barren sceptre in my gripe,",994
Act III,Scene I,Macbeth,"Thence to be wrench'd with an unlineal hand,",995
Act III,Scene I,Macbeth,"No son of mine succeeding. If 't be so,",996
Act III,Scene I,Macbeth,For Banquo's issue have I filed my mind;,997
Act III,Scene I,Macbeth,For them the gracious Duncan have I murder'd;,998
Act III,Scene I,Macbeth,Put rancours in the vessel of my peace,999
Act III,Scene I,Macbeth,Only for them; and mine eternal jewel,1000
Act III,Scene I,Macbeth,"Given to the common enemy of man,",1001
Act III,Scene I,Macbeth,"To make them kings, the seed of Banquo kings!",1002
Act III,Scene I,Macbeth,"Rather than so, come fate into the list.",1003
Act III,Scene I,Macbeth,And champion me to the utterance! Who's there!,1004
Act III,Scene I,[stage direction],"Re-enter Attendant, with two Murderers",NA
Act III,Scene I,Macbeth,"Now go to the door, and stay there till we call.",1005
Act III,Scene I,[stage direction],Exit Attendant,NA
Act III,Scene I,Macbeth,Was it not yesterday we spoke together?,1006
Act III,Scene I,First Murderer,"It was, so please your highness.",1007
Act III,Scene I,Macbeth,"Well then, now",1008
Act III,Scene I,Macbeth,Have you consider'd of my speeches? Know,1009
Act III,Scene I,Macbeth,That it was he in the times past which held you,1010
Act III,Scene I,Macbeth,"So under fortune, which you thought had been",1011
Act III,Scene I,Macbeth,Our innocent self: this I made good to you,1012
Act III,Scene I,Macbeth,"In our last conference, pass'd in probation with you,",1013
Act III,Scene I,Macbeth,"How you were borne in hand, how cross'd,",1014
Act III,Scene I,Macbeth,"the instruments,",1015
Act III,Scene I,Macbeth,"Who wrought with them, and all things else that might",1016
Act III,Scene I,Macbeth,To half a soul and to a notion crazed,1017
Act III,Scene I,Macbeth,Say 'Thus did Banquo.',1018
Act III,Scene I,First Murderer,You made it known to us.,1019
Act III,Scene I,Macbeth,"I did so, and went further, which is now",1020
Act III,Scene I,Macbeth,Our point of second meeting. Do you find,1021
Act III,Scene I,Macbeth,Your patience so predominant in your nature,1022
Act III,Scene I,Macbeth,That you can let this go? Are you so gospell'd,1023
Act III,Scene I,Macbeth,"To pray for this good man and for his issue,",1024
Act III,Scene I,Macbeth,Whose heavy hand hath bow'd you to the grave,1025
Act III,Scene I,Macbeth,And beggar'd yours for ever?,1026
Act III,Scene I,First Murderer,"We are men, my liege.",1027
Act III,Scene I,Macbeth,"Ay, in the catalogue ye go for men;",1028
Act III,Scene I,Macbeth,"As hounds and greyhounds, mongrels, spaniels, curs,",1029
Act III,Scene I,Macbeth,"Shoughs, water-rugs and demi-wolves, are clept",1030
Act III,Scene I,Macbeth,All by the name of dogs: the valued file,1031
Act III,Scene I,Macbeth,"Distinguishes the swift, the slow, the subtle,",1032
Act III,Scene I,Macbeth,"The housekeeper, the hunter, every one",1033
Act III,Scene I,Macbeth,According to the gift which bounteous nature,1034
Act III,Scene I,Macbeth,Hath in him closed; whereby he does receive,1035
Act III,Scene I,Macbeth,Particular addition. from the bill,1036
Act III,Scene I,Macbeth,That writes them all alike: and so of men.,1037
Act III,Scene I,Macbeth,"Now, if you have a station in the file,",1038
Act III,Scene I,Macbeth,"Not i' the worst rank of manhood, say 't;",1039
Act III,Scene I,Macbeth,"And I will put that business in your bosoms,",1040
Act III,Scene I,Macbeth,"Whose execution takes your enemy off,",1041
Act III,Scene I,Macbeth,"Grapples you to the heart and love of us,",1042
Act III,Scene I,Macbeth,"Who wear our health but sickly in his life,",1043
Act III,Scene I,Macbeth,Which in his death were perfect.,1044
Act III,Scene I,Second Murderer,"I am one, my liege,",1045
Act III,Scene I,Second Murderer,Whom the vile blows and buffets of the world,1046
Act III,Scene I,Second Murderer,Have so incensed that I am reckless what,1047
Act III,Scene I,Second Murderer,I do to spite the world.,1048
Act III,Scene I,First Murderer,And I another,1049
Act III,Scene I,First Murderer,"So weary with disasters, tugg'd with fortune,",1050
Act III,Scene I,First Murderer,"That I would set my lie on any chance,",1051
Act III,Scene I,First Murderer,"To mend it, or be rid on't.",1052
Act III,Scene I,Macbeth,Both of you,1053
Act III,Scene I,Macbeth,Know Banquo was your enemy.,1054
Act III,Scene I,Both Murderers,"True, my lord.",1055
Act III,Scene I,Macbeth,"So is he mine; and in such bloody distance,",1056
Act III,Scene I,Macbeth,That every minute of his being thrusts,1057
Act III,Scene I,Macbeth,Against my near'st of life: and though I could,1058
Act III,Scene I,Macbeth,With barefaced power sweep him from my sight,1059
Act III,Scene I,Macbeth,"And bid my will avouch it, yet I must not,",1060
Act III,Scene I,Macbeth,"For certain friends that are both his and mine,",1061
Act III,Scene I,Macbeth,"Whose loves I may not drop, but wail his fall",1062
Act III,Scene I,Macbeth,"Who I myself struck down; and thence it is,",1063
Act III,Scene I,Macbeth,"That I to your assistance do make love,",1064
Act III,Scene I,Macbeth,Masking the business from the common eye,1065
Act III,Scene I,Macbeth,For sundry weighty reasons.,1066
Act III,Scene I,Second Murderer,"We shall, my lord,",1067
Act III,Scene I,Second Murderer,Perform what you command us.,1068
Act III,Scene I,First Murderer,Though our lives--,1069
Act III,Scene I,Macbeth,Your spirits shine through you. Within this hour at most,1070
Act III,Scene I,Macbeth,I will advise you where to plant yourselves;,1071
Act III,Scene I,Macbeth,"Acquaint you with the perfect spy o' the time,",1072
Act III,Scene I,Macbeth,"The moment on't; for't must be done to-night,",1073
Act III,Scene I,Macbeth,And something from the palace; always thought,1074
Act III,Scene I,Macbeth,That I require a clearness: and with him--,1075
Act III,Scene I,Macbeth,To leave no rubs nor botches in the work--,1076
Act III,Scene I,Macbeth,"Fleance his son, that keeps him company,",1077
Act III,Scene I,Macbeth,Whose absence is no less material to me,1078
Act III,Scene I,Macbeth,"Than is his father's, must embrace the fate",1079
Act III,Scene I,Macbeth,Of that dark hour. Resolve yourselves apart:,1080
Act III,Scene I,Macbeth,I'll come to you anon.,1081
Act III,Scene I,Both Murderers,"We are resolved, my lord.",1082
Act III,Scene I,Macbeth,I'll call upon you straight: abide within.,1083
Act III,Scene I,[stage direction],Exeunt Murderers,NA
Act III,Scene I,Macbeth,"It is concluded. Banquo, thy soul's flight,",1084
Act III,Scene I,Macbeth,"If it find heaven, must find it out to-night.",1085
Act III,Scene I,[stage direction],Exit,NA
Act III,Scene II,[stage direction],Enter LADY MACBETH and a Servant,NA
Act III,Scene II,Lady Macbeth,Is Banquo gone from court?,1086
Act III,Scene II,Servant,"Ay, madam, but returns again to-night.",1087
Act III,Scene II,Lady Macbeth,"Say to the king, I would attend his leisure",1088
Act III,Scene II,Lady Macbeth,For a few words.,1089
Act III,Scene II,Servant,"Madam, I will.",1090
Act III,Scene II,[stage direction],Exit,NA
Act III,Scene II,Lady Macbeth,"Nought's had, all's spent,",1091
