act,scene,character,dialogue,line_number
Act III,Scene I,Mercutio,soon moody to be moved.,1437
Act III,Scene I,Benvolio,And what to?,1438
Act III,Scene I,Mercutio,"Nay, an there were two such, we should have none",1439
Act III,Scene I,Mercutio,"shortly, for one would kill the other. Thou! why,",1440
Act III,Scene I,Mercutio,"thou wilt quarrel with a man that hath a hair more,",1441
Act III,Scene I,Mercutio,"or a hair less, in his beard, than thou hast: thou",1442
Act III,Scene I,Mercutio,"wilt quarrel with a man for cracking nuts, having no",1443
Act III,Scene I,Mercutio,other reason but because thou hast hazel eyes: what,1444
Act III,Scene I,Mercutio,eye but such an eye would spy out such a quarrel?,1445
Act III,Scene I,Mercutio,Thy head is as fun of quarrels as an egg is full of,1446
Act III,Scene I,Mercutio,"meat, and yet thy head hath been beaten as addle as",1447
Act III,Scene I,Mercutio,an egg for quarrelling: thou hast quarrelled with a,1448
Act III,Scene I,Mercutio,"man for coughing in the street, because he hath",1449
Act III,Scene I,Mercutio,wakened thy dog that hath lain asleep in the sun:,1450
Act III,Scene I,Mercutio,didst thou not fall out with a tailor for wearing,1451
Act III,Scene I,Mercutio,"his new doublet before Easter? with another, for",1452
Act III,Scene I,Mercutio,tying his new shoes with old riband? and yet thou,1453
Act III,Scene I,Mercutio,wilt tutor me from quarrelling!,1454
Act III,Scene I,Benvolio,"An I were so apt to quarrel as thou art, any man",1455
Act III,Scene I,Benvolio,should buy the fee-simple of my life for an hour and a quarter.,1456
Act III,Scene I,Mercutio,The fee-simple! O simple!,1457
Act III,Scene I,Benvolio,"By my head, here come the Capulets.",1458
Act III,Scene I,Mercutio,"By my heel, I care not.",1459
Act III,Scene I,[stage direction],Enter TYBALT and others,NA
Act III,Scene I,Tybalt,"Follow me close, for I will speak to them.",1460
Act III,Scene I,Tybalt,"Gentlemen, good den: a word with one of you.",1461
Act III,Scene I,Mercutio,And but one word with one of us? couple it with,1462
Act III,Scene I,Mercutio,something; make it a word and a blow.,1463
Act III,Scene I,Tybalt,"You shall find me apt enough to that, sir, an you",1464
Act III,Scene I,Tybalt,will give me occasion.,1465
Act III,Scene I,Mercutio,Could you not take some occasion without giving?,1466
Act III,Scene I,Tybalt,"Mercutio, thou consort'st with Romeo,--",1467
Act III,Scene I,Mercutio,"Consort! what, dost thou make us minstrels? an",1468
Act III,Scene I,Mercutio,"thou make minstrels of us, look to hear nothing but",1469
Act III,Scene I,Mercutio,discords: here's my fiddlestick; here's that shall,1470
Act III,Scene I,Mercutio,"make you dance. 'Zounds, consort!",1471
Act III,Scene I,Benvolio,We talk here in the public haunt of men:,1472
Act III,Scene I,Benvolio,"Either withdraw unto some private place,",1473
Act III,Scene I,Benvolio,"And reason coldly of your grievances,",1474
Act III,Scene I,Benvolio,Or else depart; here all eyes gaze on us.,1475
Act III,Scene I,Mercutio,"Men's eyes were made to look, and let them gaze;",1476
Act III,Scene I,Mercutio,"I will not budge for no man's pleasure, I.",1477
Act III,Scene I,[stage direction],Enter ROMEO,NA
Act III,Scene I,Tybalt,"Well, peace be with you, sir: here comes my man.",1478
Act III,Scene I,Mercutio,"But I'll be hanged, sir, if he wear your livery:",1479
Act III,Scene I,Mercutio,"Marry, go before to field, he'll be your follower;",1480
Act III,Scene I,Mercutio,Your worship in that sense may call him 'man.',1481
Act III,Scene I,Tybalt,"Romeo, the hate I bear thee can afford",1482
Act III,Scene I,Tybalt,"No better term than this,--thou art a villain.",1483
Act III,Scene I,Romeo,"Tybalt, the reason that I have to love thee",1484
Act III,Scene I,Romeo,Doth much excuse the appertaining rage,1485
Act III,Scene I,Romeo,To such a greeting: villain am I none;,1486
Act III,Scene I,Romeo,Therefore farewell; I see thou know'st me not.,1487
Act III,Scene I,Tybalt,"Boy, this shall not excuse the injuries",1488
Act III,Scene I,Tybalt,That thou hast done me; therefore turn and draw.,1489
Act III,Scene I,Romeo,"I do protest, I never injured thee,",1490
Act III,Scene I,Romeo,"But love thee better than thou canst devise,",1491
Act III,Scene I,Romeo,Till thou shalt know the reason of my love:,1492
Act III,Scene I,Romeo,"And so, good Capulet,--which name I tender",1493
Act III,Scene I,Romeo,"As dearly as my own,--be satisfied.",1494
Act III,Scene I,Mercutio,"O calm, dishonourable, vile submission!",1495
Act III,Scene I,Mercutio,Alla stoccata carries it away.,1496
Act III,Scene I,[stage direction],Draws,NA
Act III,Scene I,Mercutio,"Tybalt, you rat-catcher, will you walk?",1497
Act III,Scene I,Tybalt,What wouldst thou have with me?,1498
Act III,Scene I,Mercutio,"Good king of cats, nothing but one of your nine",1499
Act III,Scene I,Mercutio,"lives; that I mean to make bold withal, and as you",1500
Act III,Scene I,Mercutio,"shall use me hereafter, drybeat the rest of the",1501
Act III,Scene I,Mercutio,eight. Will you pluck your sword out of his pitcher,1502
Act III,Scene I,Mercutio,"by the ears? make haste, lest mine be about your",1503
Act III,Scene I,Mercutio,ears ere it be out.,1504
Act III,Scene I,Tybalt,I am for you.,1505
Act III,Scene I,[stage direction],Drawing,NA
Act III,Scene I,Romeo,"Gentle Mercutio, put thy rapier up.",1506
Act III,Scene I,Mercutio,"Come, sir, your passado.",1507
Act III,Scene I,[stage direction],They fight,NA
Act III,Scene I,Romeo,"Draw, Benvolio; beat down their weapons.",1508
Act III,Scene I,Romeo,"Gentlemen, for shame, forbear this outrage!",1509
Act III,Scene I,Romeo,"Tybalt, Mercutio, the prince expressly hath",1510
Act III,Scene I,Romeo,Forbidden bandying in Verona streets:,1511
Act III,Scene I,Romeo,"Hold, Tybalt! good Mercutio!",1512
Act III,Scene I,[stage direction],"TYBALT under ROMEO's arm stabs MERCUTIO, and flies with his followers",NA
Act III,Scene I,Mercutio,I am hurt.,1513
Act III,Scene I,Mercutio,A plague o' both your houses! I am sped.,1514
Act III,Scene I,Mercutio,"Is he gone, and hath nothing?",1515
Act III,Scene I,Benvolio,"What, art thou hurt?",1516
Act III,Scene I,Mercutio,"Ay, ay, a scratch, a scratch; marry, 'tis enough.",1517
Act III,Scene I,Mercutio,"Where is my page? Go, villain, fetch a surgeon.",1518
Act III,Scene I,[stage direction],Exit Page,NA
Act III,Scene I,Romeo,"Courage, man; the hurt cannot be much.",1519
Act III,Scene I,Mercutio,"No, 'tis not so deep as a well, nor so wide as a",1520
Act III,Scene I,Mercutio,"church-door; but 'tis enough,'twill serve: ask for",1521
Act III,Scene I,Mercutio,"me to-morrow, and you shall find me a grave man. I",1522
Act III,Scene I,Mercutio,"am peppered, I warrant, for this world. A plague o'",1523
Act III,Scene I,Mercutio,"both your houses! 'Zounds, a dog, a rat, a mouse, a",1524
Act III,Scene I,Mercutio,"cat, to scratch a man to death! a braggart, a",1525
Act III,Scene I,Mercutio,"rogue, a villain, that fights by the book of",1526
Act III,Scene I,Mercutio,arithmetic! Why the devil came you between us? I,1527
Act III,Scene I,Mercutio,was hurt under your arm.,1528
Act III,Scene I,Romeo,I thought all for the best.,1529
Act III,Scene I,Mercutio,"Help me into some house, Benvolio,",1530
Act III,Scene I,Mercutio,Or I shall faint. A plague o' both your houses!,1531
Act III,Scene I,Mercutio,"They have made worms' meat of me: I have it,",1532
Act III,Scene I,Mercutio,And soundly too: your houses!,1533
Act III,Scene I,[stage direction],Exeunt MERCUTIO and BENVOLIO,NA
Act III,Scene I,Romeo,"This gentleman, the prince's near ally,",1534
Act III,Scene I,Romeo,"My very friend, hath got his mortal hurt",1535
Act III,Scene I,Romeo,In my behalf; my reputation stain'd,1536
Act III,Scene I,Romeo,"With Tybalt's slander,--Tybalt, that an hour",1537
Act III,Scene I,Romeo,"Hath been my kinsman! O sweet Juliet,",1538
Act III,Scene I,Romeo,Thy beauty hath made me effeminate,1539
Act III,Scene I,Romeo,And in my temper soften'd valour's steel!,1540
Act III,Scene I,[stage direction],Re-enter BENVOLIO,NA
Act III,Scene I,Benvolio,"O Romeo, Romeo, brave Mercutio's dead!",1541
Act III,Scene I,Benvolio,"That gallant spirit hath aspired the clouds,",1542
Act III,Scene I,Benvolio,Which too untimely here did scorn the earth.,1543
Act III,Scene I,Romeo,This day's black fate on more days doth depend;,1544
Act III,Scene I,Romeo,"This but begins the woe, others must end.",1545
Act III,Scene I,Benvolio,Here comes the furious Tybalt back again.,1546
Act III,Scene I,Romeo,"Alive, in triumph! and Mercutio slain!",1547
Act III,Scene I,Romeo,"Away to heaven, respective lenity,",1548
Act III,Scene I,Romeo,And fire-eyed fury be my conduct now!,1549
Act III,Scene I,[stage direction],Re-enter TYBALT,NA
Act III,Scene I,Romeo,"Now, Tybalt, take the villain back again,",1550
Act III,Scene I,Romeo,That late thou gavest me; for Mercutio's soul,1551
Act III,Scene I,Romeo,"Is but a little way above our heads,",1552
Act III,Scene I,Romeo,Staying for thine to keep him company:,1553
Act III,Scene I,Romeo,"Either thou, or I, or both, must go with him.",1554
Act III,Scene I,Tybalt,"Thou, wretched boy, that didst consort him here,",1555
Act III,Scene I,Tybalt,Shalt with him hence.,1556
Act III,Scene I,Romeo,This shall determine that.,1557
Act III,Scene I,[stage direction],They fight; TYBALT falls,NA
Act III,Scene I,Benvolio,"Romeo, away, be gone!",1558
Act III,Scene I,Benvolio,"The citizens are up, and Tybalt slain.",1559
Act III,Scene I,Benvolio,"Stand not amazed: the prince will doom thee death,",1560
Act III,Scene I,Benvolio,"If thou art taken: hence, be gone, away!",1561
Act III,Scene I,Romeo,"O, I am fortune's fool!",1562
Act III,Scene I,Benvolio,Why dost thou stay?,1563
Act III,Scene I,[stage direction],Exit ROMEO,NA
Act III,Scene I,[stage direction],"Enter Citizens,  &amp; c",NA
Act III,Scene I,First Citizen,Which way ran he that kill'd Mercutio?,1564
Act III,Scene I,First Citizen,"Tybalt, that murderer, which way ran he?",1565
Act III,Scene I,Benvolio,There lies that Tybalt.,1566
Act III,Scene I,First Citizen,"Up, sir, go with me;",1567
Act III,Scene I,First Citizen,"I charge thee in the princes name, obey.",1568
Act III,Scene I,[stage direction],"Enter Prince, attended; MONTAGUE, CAPULET, their Wives, and others",NA
Act III,Scene I,Prince,Where are the vile beginners of this fray?,1569
Act III,Scene I,Benvolio,"O noble prince, I can discover all",1570
Act III,Scene I,Benvolio,The unlucky manage of this fatal brawl:,1571
Act III,Scene I,Benvolio,"There lies the man, slain by young Romeo,",1572
Act III,Scene I,Benvolio,"That slew thy kinsman, brave Mercutio.",1573
Act III,Scene I,Lady Capulet,"Tybalt, my cousin! O my brother's child!",1574
Act III,Scene I,Lady Capulet,"O prince! O cousin! husband! O, the blood is spilt",1575
Act III,Scene I,Lady Capulet,"O my dear kinsman! Prince, as thou art true,",1576
Act III,Scene I,Lady Capulet,"For blood of ours, shed blood of Montague.",1577
Act III,Scene I,Lady Capulet,"O cousin, cousin!",1578
Act III,Scene I,Prince,"Benvolio, who began this bloody fray?",1579
Act III,Scene I,Benvolio,"Tybalt, here slain, whom Romeo's hand did slay;",1580
Act III,Scene I,Benvolio,"Romeo that spoke him fair, bade him bethink",1581
Act III,Scene I,Benvolio,"How nice the quarrel was, and urged withal",1582
Act III,Scene I,Benvolio,Your high displeasure: all this uttered,1583
Act III,Scene I,Benvolio,"With gentle breath, calm look, knees humbly bow'd,",1584
Act III,Scene I,Benvolio,Could not take truce with the unruly spleen,1585
Act III,Scene I,Benvolio,"Of Tybalt deaf to peace, but that he tilts",1586
Act III,Scene I,Benvolio,"With piercing steel at bold Mercutio's breast,",1587
Act III,Scene I,Benvolio,"Who all as hot, turns deadly point to point,",1588
Act III,Scene I,Benvolio,"And, with a martial scorn, with one hand beats",1589
Act III,Scene I,Benvolio,"Cold death aside, and with the other sends",1590
Act III,Scene I,Benvolio,"It back to Tybalt, whose dexterity,",1591
Act III,Scene I,Benvolio,"Retorts it: Romeo he cries aloud,",1592
Act III,Scene I,Benvolio,"'Hold, friends! friends, part!' and, swifter than",1593
Act III,Scene I,Benvolio,"his tongue,",1594
Act III,Scene I,Benvolio,"His agile arm beats down their fatal points,",1595
Act III,Scene I,Benvolio,And 'twixt them rushes; underneath whose arm,1596
Act III,Scene I,Benvolio,An envious thrust from Tybalt hit the life,1597
Act III,Scene I,Benvolio,"Of stout Mercutio, and then Tybalt fled;",1598
Act III,Scene I,Benvolio,"But by and by comes back to Romeo,",1599
Act III,Scene I,Benvolio,"Who had but newly entertain'd revenge,",1600
Act III,Scene I,Benvolio,"And to 't they go like lightning, for, ere I",1601
Act III,Scene I,Benvolio,"Could draw to part them, was stout Tybalt slain.",1602
Act III,Scene I,Benvolio,"And, as he fell, did Romeo turn and fly.",1603
Act III,Scene I,Benvolio,"This is the truth, or let Benvolio die.",1604
Act III,Scene I,Lady Capulet,He is a kinsman to the Montague;,1605
Act III,Scene I,Lady Capulet,Affection makes him false; he speaks not true:,1606
Act III,Scene I,Lady Capulet,"Some twenty of them fought in this black strife,",1607
Act III,Scene I,Lady Capulet,And all those twenty could but kill one life.,1608
Act III,Scene I,Lady Capulet,"I beg for justice, which thou, prince, must give;",1609
Act III,Scene I,Lady Capulet,"Romeo slew Tybalt, Romeo must not live.",1610
Act III,Scene I,Prince,"Romeo slew him, he slew Mercutio;",1611
Act III,Scene I,Prince,Who now the price of his dear blood doth owe?,1612
Act III,Scene I,Montague,"Not Romeo, prince, he was Mercutio's friend;",1613
Act III,Scene I,Montague,"His fault concludes but what the law should end,",1614
Act III,Scene I,Montague,The life of Tybalt.,1615
Act III,Scene I,Prince,And for that offence,1616
Act III,Scene I,Prince,Immediately we do exile him hence:,1617
Act III,Scene I,Prince,"I have an interest in your hate's proceeding,",1618
Act III,Scene I,Prince,My blood for your rude brawls doth lie a-bleeding;,1619
Act III,Scene I,Prince,But I'll amerce you with so strong a fine,1620
Act III,Scene I,Prince,That you shall all repent the loss of mine:,1621
Act III,Scene I,Prince,I will be deaf to pleading and excuses;,1622
Act III,Scene I,Prince,Nor tears nor prayers shall purchase out abuses:,1623
Act III,Scene I,Prince,"Therefore use none: let Romeo hence in haste,",1624
Act III,Scene I,Prince,"Else, when he's found, that hour is his last.",1625
Act III,Scene I,Prince,Bear hence this body and attend our will:,1626
Act III,Scene I,Prince,"Mercy but murders, pardoning those that kill.",1627
Act III,Scene I,[stage direction],Exeunt,NA
Act III,Scene II,[stage direction],Enter JULIET,NA
Act III,Scene II,Juliet,"Gallop apace, you fiery-footed steeds,",1628
Act III,Scene II,Juliet,Towards Phoebus' lodging: such a wagoner,1629
Act III,Scene II,Juliet,"As Phaethon would whip you to the west,",1630
Act III,Scene II,Juliet,And bring in cloudy night immediately.,1631
Act III,Scene II,Juliet,"Spread thy close curtain, love-performing night,",1632
Act III,Scene II,Juliet,That runaway's eyes may wink and Romeo,1633
Act III,Scene II,Juliet,"Leap to these arms, untalk'd of and unseen.",1634
Act III,Scene II,Juliet,Lovers can see to do their amorous rites,1635
Act III,Scene II,Juliet,"By their own beauties; or, if love be blind,",1636
Act III,Scene II,Juliet,"It best agrees with night. Come, civil night,",1637
Act III,Scene II,Juliet,"Thou sober-suited matron, all in black,",1638
Act III,Scene II,Juliet,"And learn me how to lose a winning match,",1639
Act III,Scene II,Juliet,Play'd for a pair of stainless maidenhoods:,1640
Act III,Scene II,Juliet,"Hood my unmann'd blood, bating in my cheeks,",1641
Act III,Scene II,Juliet,"With thy black mantle; till strange love, grown bold,",1642
Act III,Scene II,Juliet,Think true love acted simple modesty.,1643
Act III,Scene II,Juliet,"Come, night; come, Romeo; come, thou day in night;",1644
Act III,Scene II,Juliet,For thou wilt lie upon the wings of night,1645
Act III,Scene II,Juliet,Whiter than new snow on a raven's back.,1646
Act III,Scene II,Juliet,"Come, gentle night, come, loving, black-brow'd night,",1647
Act III,Scene II,Juliet,"Give me my Romeo; and, when he shall die,",1648
Act III,Scene II,Juliet,"Take him and cut him out in little stars,",1649
Act III,Scene II,Juliet,And he will make the face of heaven so fine,1650
Act III,Scene II,Juliet,That all the world will be in love with night,1651
Act III,Scene II,Juliet,And pay no worship to the garish sun.,1652
Act III,Scene II,Juliet,"O, I have bought the mansion of a love,",1653
Act III,Scene II,Juliet,"But not possess'd it, and, though I am sold,",1654
Act III,Scene II,Juliet,Not yet enjoy'd: so tedious is this day,1655
Act III,Scene II,Juliet,As is the night before some festival,1656
Act III,Scene II,Juliet,To an impatient child that hath new robes,1657
Act III,Scene II,Juliet,"And may not wear them. O, here comes my nurse,",1658
Act III,Scene II,Juliet,And she brings news; and every tongue that speaks,1659
Act III,Scene II,Juliet,But Romeo's name speaks heavenly eloquence.,1660
Act III,Scene II,[stage direction],"Enter Nurse, with cords",NA
Act III,Scene II,Juliet,"Now, nurse, what news? What hast thou there? the cords",1661
Act III,Scene II,Juliet,That Romeo bid thee fetch?,1662
Act III,Scene II,Nurse,"Ay, ay, the cords.",1663
Act III,Scene II,[stage direction],Throws them down,NA
Act III,Scene II,Juliet,Ay me! what news? why dost thou wring thy hands?,1664
Act III,Scene II,Nurse,"Ah, well-a-day! he's dead, he's dead, he's dead!",1665
Act III,Scene II,Nurse,"We are undone, lady, we are undone!",1666
Act III,Scene II,Nurse,"Alack the day! he's gone, he's kill'd, he's dead!",1667
Act III,Scene II,Juliet,Can heaven be so envious?,1668
Act III,Scene II,Nurse,"Romeo can,",1669
Act III,Scene II,Nurse,"Though heaven cannot: O Romeo, Romeo!",1670
Act III,Scene II,Nurse,Who ever would have thought it? Romeo!,1671
Act III,Scene II,Juliet,"What devil art thou, that dost torment me thus?",1672
Act III,Scene II,Juliet,This torture should be roar'd in dismal hell.,1673
Act III,Scene II,Juliet,"Hath Romeo slain himself? say thou but 'I,'",1674
Act III,Scene II,Juliet,And that bare vowel 'I' shall poison more,1675
Act III,Scene II,Juliet,Than the death-darting eye of cockatrice:,1676
Act III,Scene II,Juliet,"I am not I, if there be such an I;",1677
Act III,Scene II,Juliet,"Or those eyes shut, that make thee answer 'I.'",1678
Act III,Scene II,Juliet,"If he be slain, say 'I'; or if not, no:",1679
Act III,Scene II,Juliet,Brief sounds determine of my weal or woe.,1680
Act III,Scene II,Nurse,"I saw the wound, I saw it with mine eyes,--",1681
Act III,Scene II,Nurse,God save the mark!--here on his manly breast:,1682
Act III,Scene II,Nurse,"A piteous corse, a bloody piteous corse;",1683
Act III,Scene II,Nurse,"Pale, pale as ashes, all bedaub'd in blood,",1684
Act III,Scene II,Nurse,All in gore-blood; I swounded at the sight.,1685
Act III,Scene II,Juliet,"O, break, my heart! poor bankrupt, break at once!",1686
Act III,Scene II,Juliet,"To prison, eyes, ne'er look on liberty!",1687
Act III,Scene II,Juliet,"Vile earth, to earth resign; end motion here;",1688
Act III,Scene II,Juliet,And thou and Romeo press one heavy bier!,1689
Act III,Scene II,Nurse,"O Tybalt, Tybalt, the best friend I had!",1690
Act III,Scene II,Nurse,O courteous Tybalt! honest gentleman!,1691
Act III,Scene II,Nurse,That ever I should live to see thee dead!,1692
Act III,Scene II,Juliet,What storm is this that blows so contrary?,1693
Act III,Scene II,Juliet,"Is Romeo slaughter'd, and is Tybalt dead?",1694
Act III,Scene II,Juliet,"My dear-loved cousin, and my dearer lord?",1695
Act III,Scene II,Juliet,"Then, dreadful trumpet, sound the general doom!",1696
Act III,Scene II,Juliet,"For who is living, if those two are gone?",1697
Act III,Scene II,Nurse,"Tybalt is gone, and Romeo banished;",1698
Act III,Scene II,Nurse,"Romeo that kill'd him, he is banished.",1699
Act III,Scene II,Juliet,O God! did Romeo's hand shed Tybalt's blood?,1700
Act III,Scene II,Nurse,"It did, it did; alas the day, it did!",1701
Act III,Scene II,Juliet,"O serpent heart, hid with a flowering face!",1702
Act III,Scene II,Juliet,Did ever dragon keep so fair a cave?,1703
Act III,Scene II,Juliet,Beautiful tyrant! fiend angelical!,1704
Act III,Scene II,Juliet,Dove-feather'd raven! wolvish-ravening lamb!,1705
Act III,Scene II,Juliet,Despised substance of divinest show!,1706
Act III,Scene II,Juliet,"Just opposite to what thou justly seem'st,",1707
Act III,Scene II,Juliet,"A damned saint, an honourable villain!",1708
Act III,Scene II,Juliet,"O nature, what hadst thou to do in hell,",1709
Act III,Scene II,Juliet,When thou didst bower the spirit of a fiend,1710
Act III,Scene II,Juliet,In moral paradise of such sweet flesh?,1711
Act III,Scene II,Juliet,Was ever book containing such vile matter,1712
Act III,Scene II,Juliet,So fairly bound? O that deceit should dwell,1713
Act III,Scene II,Juliet,In such a gorgeous palace!,1714
Act III,Scene II,Nurse,"There's no trust,",1715
Act III,Scene II,Nurse,"No faith, no honesty in men; all perjured,",1716
Act III,Scene II,Nurse,"All forsworn, all naught, all dissemblers.",1717
Act III,Scene II,Nurse,"Ah, where's my man? give me some aqua vitae:",1718
Act III,Scene II,Nurse,"These griefs, these woes, these sorrows make me old.",1719
Act III,Scene II,Nurse,Shame come to Romeo!,1720
Act III,Scene II,Juliet,Blister'd be thy tongue,1721
Act III,Scene II,Juliet,For such a wish! he was not born to shame:,1722
Act III,Scene II,Juliet,Upon his brow shame is ashamed to sit;,1723
Act III,Scene II,Juliet,For 'tis a throne where honour may be crown'd,1724
Act III,Scene II,Juliet,Sole monarch of the universal earth.,1725
Act III,Scene II,Juliet,"O, what a beast was I to chide at him!",1726
Act III,Scene II,Nurse,Will you speak well of him that kill'd your cousin?,1727
Act III,Scene II,Juliet,Shall I speak ill of him that is my husband?,1728
Act III,Scene II,Juliet,"Ah, poor my lord, what tongue shall smooth thy name,",1729
Act III,Scene II,Juliet,"When I, thy three-hours wife, have mangled it?",1730
Act III,Scene II,Juliet,"But, wherefore, villain, didst thou kill my cousin?",1731
Act III,Scene II,Juliet,That villain cousin would have kill'd my husband:,1732
Act III,Scene II,Juliet,"Back, foolish tears, back to your native spring;",1733
Act III,Scene II,Juliet,"Your tributary drops belong to woe,",1734
Act III,Scene II,Juliet,"Which you, mistaking, offer up to joy.",1735
Act III,Scene II,Juliet,"My husband lives, that Tybalt would have slain;",1736
Act III,Scene II,Juliet,"And Tybalt's dead, that would have slain my husband:",1737
Act III,Scene II,Juliet,All this is comfort; wherefore weep I then?,1738
Act III,Scene II,Juliet,"Some word there was, worser than Tybalt's death,",1739
Act III,Scene II,Juliet,That murder'd me: I would forget it fain;,1740
Act III,Scene II,Juliet,"But, O, it presses to my memory,",1741
Act III,Scene II,Juliet,Like damned guilty deeds to sinners' minds:,1742
Act III,Scene II,Juliet,"'Tybalt is dead, and Romeo--banished;'",1743
Act III,Scene II,Juliet,"That 'banished,' that one word 'banished,'",1744
Act III,Scene II,Juliet,Hath slain ten thousand Tybalts. Tybalt's death,1745
Act III,Scene II,Juliet,"Was woe enough, if it had ended there:",1746
Act III,Scene II,Juliet,"Or, if sour woe delights in fellowship",1747
Act III,Scene II,Juliet,"And needly will be rank'd with other griefs,",1748
Act III,Scene II,Juliet,"Why follow'd not, when she said 'Tybalt's dead,'",1749
Act III,Scene II,Juliet,"Thy father, or thy mother, nay, or both,",1750
Act III,Scene II,Juliet,Which modern lamentations might have moved?,1751
Act III,Scene II,Juliet,"But with a rear-ward following Tybalt's death,",1752
Act III,Scene II,Juliet,"'Romeo is banished,' to speak that word,",1753
Act III,Scene II,Juliet,"Is father, mother, Tybalt, Romeo, Juliet,",1754
Act III,Scene II,Juliet,"All slain, all dead. 'Romeo is banished!'",1755
Act III,Scene II,Juliet,"There is no end, no limit, measure, bound,",1756
Act III,Scene II,Juliet,In that word's death; no words can that woe sound.,1757
Act III,Scene II,Juliet,"Where is my father, and my mother, nurse?",1758
Act III,Scene II,Nurse,Weeping and wailing over Tybalt's corse:,1759
Act III,Scene II,Nurse,Will you go to them? I will bring you thither.,1760
Act III,Scene II,Juliet,"Wash they his wounds with tears: mine shall be spent,",1761
Act III,Scene II,Juliet,"When theirs are dry, for Romeo's banishment.",1762
Act III,Scene II,Juliet,"Take up those cords: poor ropes, you are beguiled,",1763
Act III,Scene II,Juliet,Both you and I; for Romeo is exiled:,1764
Act III,Scene II,Juliet,He made you for a highway to my bed;,1765
Act III,Scene II,Juliet,"But I, a maid, die maiden-widowed.",1766
Act III,Scene II,Juliet,"Come, cords, come, nurse; I'll to my wedding-bed;",1767
Act III,Scene II,Juliet,"And death, not Romeo, take my maidenhead!",1768
Act III,Scene II,Nurse,Hie to your chamber: I'll find Romeo,1769
Act III,Scene II,Nurse,To comfort you: I wot well where he is.,1770
Act III,Scene II,Nurse,"Hark ye, your Romeo will be here at night:",1771
Act III,Scene II,Nurse,I'll to him; he is hid at Laurence' cell.,1772
Act III,Scene II,Juliet,"O, find him! give this ring to my true knight,",1773
Act III,Scene II,Juliet,And bid him come to take his last farewell.,1774
Act III,Scene II,[stage direction],Exeunt,NA
Act III,Scene III,[stage direction],Enter FRIAR LAURENCE,NA
Act III,Scene III,Friar Laurence,"Romeo, come forth; come forth, thou fearful man:",1775
Act III,Scene III,Friar Laurence,"Affliction is enamour'd of thy parts,",1776
Act III,Scene III,Friar Laurence,And thou art wedded to calamity.,1777
Act III,Scene III,[stage direction],Enter ROMEO,NA
Act III,Scene III,Romeo,"Father, what news? what is the prince's doom?",1778
Act III,Scene III,Romeo,"What sorrow craves acquaintance at my hand,",1779
