act,scene,character,dialogue,line_number
Act III,Scene V,Lady Capulet,"Here comes your father; tell him so yourself,",2118
Act III,Scene V,Lady Capulet,And see how he will take it at your hands.,2119
Act III,Scene V,[stage direction],Enter CAPULET and Nurse,NA
Act III,Scene V,Capulet,"When the sun sets, the air doth drizzle dew;",2120
Act III,Scene V,Capulet,But for the sunset of my brother's son,2121
Act III,Scene V,Capulet,It rains downright.,2122
Act III,Scene V,Capulet,"How now! a conduit, girl? what, still in tears?",2123
Act III,Scene V,Capulet,Evermore showering? In one little body,2124
Act III,Scene V,Capulet,"Thou counterfeit'st a bark, a sea, a wind;",2125
Act III,Scene V,Capulet,"For still thy eyes, which I may call the sea,",2126
Act III,Scene V,Capulet,"Do ebb and flow with tears; the bark thy body is,",2127
Act III,Scene V,Capulet,"Sailing in this salt flood; the winds, thy sighs;",2128
Act III,Scene V,Capulet,"Who, raging with thy tears, and they with them,",2129
Act III,Scene V,Capulet,"Without a sudden calm, will overset",2130
Act III,Scene V,Capulet,"Thy tempest-tossed body. How now, wife!",2131
Act III,Scene V,Capulet,Have you deliver'd to her our decree?,2132
Act III,Scene V,Lady Capulet,"Ay, sir; but she will none, she gives you thanks.",2133
Act III,Scene V,Lady Capulet,I would the fool were married to her grave!,2134
Act III,Scene V,Capulet,"Soft! take me with you, take me with you, wife.",2135
Act III,Scene V,Capulet,How! will she none? doth she not give us thanks?,2136
Act III,Scene V,Capulet,"Is she not proud? doth she not count her blest,",2137
Act III,Scene V,Capulet,"Unworthy as she is, that we have wrought",2138
Act III,Scene V,Capulet,So worthy a gentleman to be her bridegroom?,2139
Act III,Scene V,Juliet,"Not proud, you have; but thankful, that you have:",2140
Act III,Scene V,Juliet,Proud can I never be of what I hate;,2141
Act III,Scene V,Juliet,"But thankful even for hate, that is meant love.",2142
Act III,Scene V,Capulet,"How now, how now, chop-logic! What is this?",2143
Act III,Scene V,Capulet,"'Proud,' and 'I thank you,' and 'I thank you not;'",2144
Act III,Scene V,Capulet,"And yet 'not proud,' mistress minion, you,",2145
Act III,Scene V,Capulet,"Thank me no thankings, nor, proud me no prouds,",2146
Act III,Scene V,Capulet,"But fettle your fine joints 'gainst Thursday next,",2147
Act III,Scene V,Capulet,"To go with Paris to Saint Peter's Church,",2148
Act III,Scene V,Capulet,Or I will drag thee on a hurdle thither.,2149
Act III,Scene V,Capulet,"Out, you green-sickness carrion! out, you baggage!",2150
Act III,Scene V,Capulet,You tallow-face!,2151
Act III,Scene V,Lady Capulet,"Fie, fie! what, are you mad?",2152
Act III,Scene V,Juliet,"Good father, I beseech you on my knees,",2153
Act III,Scene V,Juliet,Hear me with patience but to speak a word.,2154
Act III,Scene V,Capulet,"Hang thee, young baggage! disobedient wretch!",2155
Act III,Scene V,Capulet,"I tell thee what: get thee to church o' Thursday,",2156
Act III,Scene V,Capulet,Or never after look me in the face:,2157
Act III,Scene V,Capulet,"Speak not, reply not, do not answer me;",2158
Act III,Scene V,Capulet,"My fingers itch. Wife, we scarce thought us blest",2159
Act III,Scene V,Capulet,That God had lent us but this only child;,2160
Act III,Scene V,Capulet,"But now I see this one is one too much,",2161
Act III,Scene V,Capulet,And that we have a curse in having her:,2162
Act III,Scene V,Capulet,"Out on her, hilding!",2163
Act III,Scene V,Nurse,God in heaven bless her!,2164
Act III,Scene V,Nurse,"You are to blame, my lord, to rate her so.",2165
Act III,Scene V,Capulet,"And why, my lady wisdom? hold your tongue,",2166
Act III,Scene V,Capulet,"Good prudence; smatter with your gossips, go.",2167
Act III,Scene V,Nurse,I speak no treason.,2168
Act III,Scene V,Capulet,"O, God ye god-den.",2169
Act III,Scene V,Nurse,May not one speak?,2170
Act III,Scene V,Capulet,"Peace, you mumbling fool!",2171
Act III,Scene V,Capulet,Utter your gravity o'er a gossip's bowl;,2172
Act III,Scene V,Capulet,For here we need it not.,2173
Act III,Scene V,Lady Capulet,You are too hot.,2174
Act III,Scene V,Capulet,God's bread! it makes me mad:,2175
Act III,Scene V,Capulet,"Day, night, hour, tide, time, work, play,",2176
Act III,Scene V,Capulet,"Alone, in company, still my care hath been",2177
Act III,Scene V,Capulet,To have her match'd: and having now provided,2178
Act III,Scene V,Capulet,"A gentleman of noble parentage,",2179
Act III,Scene V,Capulet,"Of fair demesnes, youthful, and nobly train'd,",2180
Act III,Scene V,Capulet,"Stuff'd, as they say, with honourable parts,",2181
Act III,Scene V,Capulet,Proportion'd as one's thought would wish a man;,2182
Act III,Scene V,Capulet,"And then to have a wretched puling fool,",2183
Act III,Scene V,Capulet,"A whining mammet, in her fortune's tender,",2184
Act III,Scene V,Capulet,"To answer 'I'll not wed; I cannot love,",2185
Act III,Scene V,Capulet,"I am too young; I pray you, pardon me.'",2186
Act III,Scene V,Capulet,"But, as you will not wed, I'll pardon you:",2187
Act III,Scene V,Capulet,Graze where you will you shall not house with me:,2188
Act III,Scene V,Capulet,"Look to't, think on't, I do not use to jest.",2189
Act III,Scene V,Capulet,"Thursday is near; lay hand on heart, advise:",2190
Act III,Scene V,Capulet,"An you be mine, I'll give you to my friend;",2191
Act III,Scene V,Capulet,"And you be not, hang, beg, starve, die in",2192
Act III,Scene V,Capulet,"the streets,",2193
Act III,Scene V,Capulet,"For, by my soul, I'll ne'er acknowledge thee,",2194
Act III,Scene V,Capulet,Nor what is mine shall never do thee good:,2195
Act III,Scene V,Capulet,"Trust to't, bethink you; I'll not be forsworn.",2196
Act III,Scene V,[stage direction],Exit,NA
Act III,Scene V,Juliet,"Is there no pity sitting in the clouds,",2197
Act III,Scene V,Juliet,That sees into the bottom of my grief?,2198
Act III,Scene V,Juliet,"O, sweet my mother, cast me not away!",2199
Act III,Scene V,Juliet,"Delay this marriage for a month, a week;",2200
Act III,Scene V,Juliet,"Or, if you do not, make the bridal bed",2201
Act III,Scene V,Juliet,In that dim monument where Tybalt lies.,2202
Act III,Scene V,Lady Capulet,"Talk not to me, for I'll not speak a word:",2203
Act III,Scene V,Lady Capulet,"Do as thou wilt, for I have done with thee.",2204
Act III,Scene V,[stage direction],Exit,NA
Act III,Scene V,Juliet,"O God!--O nurse, how shall this be prevented?",2205
Act III,Scene V,Juliet,"My husband is on earth, my faith in heaven;",2206
Act III,Scene V,Juliet,"How shall that faith return again to earth,",2207
Act III,Scene V,Juliet,Unless that husband send it me from heaven,2208
Act III,Scene V,Juliet,"By leaving earth? comfort me, counsel me.",2209
Act III,Scene V,Juliet,"Alack, alack, that heaven should practise stratagems",2210
Act III,Scene V,Juliet,Upon so soft a subject as myself!,2211
Act III,Scene V,Juliet,What say'st thou? hast thou not a word of joy?,2212
Act III,Scene V,Juliet,"Some comfort, nurse.",2213
Act III,Scene V,Nurse,"Faith, here it is.",2214
Act III,Scene V,Nurse,"Romeo is banish'd; and all the world to nothing,",2215
Act III,Scene V,Nurse,That he dares ne'er come back to challenge you;,2216
Act III,Scene V,Nurse,"Or, if he do, it needs must be by stealth.",2217
Act III,Scene V,Nurse,"Then, since the case so stands as now it doth,",2218
Act III,Scene V,Nurse,I think it best you married with the county.,2219
Act III,Scene V,Nurse,"O, he's a lovely gentleman!",2220
Act III,Scene V,Nurse,"Romeo's a dishclout to him: an eagle, madam,",2221
Act III,Scene V,Nurse,"Hath not so green, so quick, so fair an eye",2222
Act III,Scene V,Nurse,"As Paris hath. Beshrew my very heart,",2223
Act III,Scene V,Nurse,"I think you are happy in this second match,",2224
Act III,Scene V,Nurse,"For it excels your first: or if it did not,",2225
Act III,Scene V,Nurse,"Your first is dead; or 'twere as good he were,",2226
Act III,Scene V,Nurse,As living here and you no use of him.,2227
Act III,Scene V,Juliet,Speakest thou from thy heart?,2228
Act III,Scene V,Nurse,And from my soul too;,2229
Act III,Scene V,Nurse,Or else beshrew them both.,2230
Act III,Scene V,Juliet,Amen!,2231
Act III,Scene V,Nurse,What?,2232
Act III,Scene V,Juliet,"Well, thou hast comforted me marvellous much.",2233
Act III,Scene V,Juliet,"Go in: and tell my lady I am gone,",2234
Act III,Scene V,Juliet,"Having displeased my father, to Laurence' cell,",2235
Act III,Scene V,Juliet,To make confession and to be absolved.,2236
Act III,Scene V,Nurse,"Marry, I will; and this is wisely done.",2237
Act III,Scene V,[stage direction],Exit,NA
Act III,Scene V,Juliet,Ancient damnation! O most wicked fiend!,2238
Act III,Scene V,Juliet,"Is it more sin to wish me thus forsworn,",2239
Act III,Scene V,Juliet,Or to dispraise my lord with that same tongue,2240
Act III,Scene V,Juliet,Which she hath praised him with above compare,2241
Act III,Scene V,Juliet,"So many thousand times? Go, counsellor;",2242
Act III,Scene V,Juliet,Thou and my bosom henceforth shall be twain.,2243
Act III,Scene V,Juliet,"I'll to the friar, to know his remedy:",2244
Act III,Scene V,Juliet,"If all else fail, myself have power to die.",2245
Act III,Scene V,[stage direction],Exit,NA
Act IV,Scene I,[stage direction],Enter FRIAR LAURENCE and PARIS,NA
Act IV,Scene I,Friar Laurence,"On Thursday, sir? the time is very short.",2246
Act IV,Scene I,Paris,My father Capulet will have it so;,2247
Act IV,Scene I,Paris,And I am nothing slow to slack his haste.,2248
Act IV,Scene I,Friar Laurence,You say you do not know the lady's mind:,2249
Act IV,Scene I,Friar Laurence,"Uneven is the course, I like it not.",2250
Act IV,Scene I,Paris,"Immoderately she weeps for Tybalt's death,",2251
Act IV,Scene I,Paris,And therefore have I little talk'd of love;,2252
Act IV,Scene I,Paris,For Venus smiles not in a house of tears.,2253
Act IV,Scene I,Paris,"Now, sir, her father counts it dangerous",2254
Act IV,Scene I,Paris,"That she doth give her sorrow so much sway,",2255
Act IV,Scene I,Paris,"And in his wisdom hastes our marriage,",2256
Act IV,Scene I,Paris,To stop the inundation of her tears;,2257
Act IV,Scene I,Paris,"Which, too much minded by herself alone,",2258
Act IV,Scene I,Paris,May be put from her by society:,2259
Act IV,Scene I,Paris,Now do you know the reason of this haste.,2260
Act IV,Scene I,Friar Laurence,[Aside]  I would I knew not why it should be slow'd.,2261
Act IV,Scene I,Friar Laurence,"Look, sir, here comes the lady towards my cell.",2262
Act IV,Scene I,[stage direction],Enter JULIET,NA
Act IV,Scene I,Paris,"Happily met, my lady and my wife!",2263
Act IV,Scene I,Juliet,"That may be, sir, when I may be a wife.",2264
Act IV,Scene I,Paris,"That may be must be, love, on Thursday next.",2265
Act IV,Scene I,Juliet,What must be shall be.,2266
Act IV,Scene I,Friar Laurence,That's a certain text.,2267
Act IV,Scene I,Paris,Come you to make confession to this father?,2268
Act IV,Scene I,Juliet,"To answer that, I should confess to you.",2269
Act IV,Scene I,Paris,Do not deny to him that you love me.,2270
Act IV,Scene I,Juliet,I will confess to you that I love him.,2271
Act IV,Scene I,Paris,"So will ye, I am sure, that you love me.",2272
Act IV,Scene I,Juliet,"If I do so, it will be of more price,",2273
Act IV,Scene I,Juliet,"Being spoke behind your back, than to your face.",2274
Act IV,Scene I,Paris,"Poor soul, thy face is much abused with tears.",2275
Act IV,Scene I,Juliet,The tears have got small victory by that;,2276
Act IV,Scene I,Juliet,For it was bad enough before their spite.,2277
Act IV,Scene I,Paris,"Thou wrong'st it, more than tears, with that report.",2278
Act IV,Scene I,Juliet,"That is no slander, sir, which is a truth;",2279
Act IV,Scene I,Juliet,"And what I spake, I spake it to my face.",2280
Act IV,Scene I,Paris,"Thy face is mine, and thou hast slander'd it.",2281
Act IV,Scene I,Juliet,"It may be so, for it is not mine own.",2282
Act IV,Scene I,Juliet,"Are you at leisure, holy father, now;",2283
Act IV,Scene I,Juliet,Or shall I come to you at evening mass?,2284
Act IV,Scene I,Friar Laurence,"My leisure serves me, pensive daughter, now.",2285
Act IV,Scene I,Friar Laurence,"My lord, we must entreat the time alone.",2286
Act IV,Scene I,Paris,God shield I should disturb devotion!,2287
Act IV,Scene I,Paris,"Juliet, on Thursday early will I rouse ye:",2288
Act IV,Scene I,Paris,"Till then, adieu; and keep this holy kiss.",2289
Act IV,Scene I,[stage direction],Exit,NA
Act IV,Scene I,Juliet,"O shut the door! and when thou hast done so,",2290
Act IV,Scene I,Juliet,"Come weep with me; past hope, past cure, past help!",2291
Act IV,Scene I,Friar Laurence,"Ah, Juliet, I already know thy grief;",2292
Act IV,Scene I,Friar Laurence,It strains me past the compass of my wits:,2293
Act IV,Scene I,Friar Laurence,"I hear thou must, and nothing may prorogue it,",2294
Act IV,Scene I,Friar Laurence,On Thursday next be married to this county.,2295
Act IV,Scene I,Juliet,"Tell me not, friar, that thou hear'st of this,",2296
Act IV,Scene I,Juliet,Unless thou tell me how I may prevent it:,2297
Act IV,Scene I,Juliet,"If, in thy wisdom, thou canst give no help,",2298
Act IV,Scene I,Juliet,"Do thou but call my resolution wise,",2299
Act IV,Scene I,Juliet,And with this knife I'll help it presently.,2300
Act IV,Scene I,Juliet,"God join'd my heart and Romeo's, thou our hands;",2301
Act IV,Scene I,Juliet,"And ere this hand, by thee to Romeo seal'd,",2302
Act IV,Scene I,Juliet,"Shall be the label to another deed,",2303
Act IV,Scene I,Juliet,Or my true heart with treacherous revolt,2304
Act IV,Scene I,Juliet,"Turn to another, this shall slay them both:",2305
Act IV,Scene I,Juliet,"Therefore, out of thy long-experienced time,",2306
Act IV,Scene I,Juliet,"Give me some present counsel, or, behold,",2307
Act IV,Scene I,Juliet,'Twixt my extremes and me this bloody knife,2308
Act IV,Scene I,Juliet,"Shall play the umpire, arbitrating that",2309
Act IV,Scene I,Juliet,Which the commission of thy years and art,2310
Act IV,Scene I,Juliet,Could to no issue of true honour bring.,2311
Act IV,Scene I,Juliet,"Be not so long to speak; I long to die,",2312
Act IV,Scene I,Juliet,If what thou speak'st speak not of remedy.,2313
Act IV,Scene I,Friar Laurence,"Hold, daughter: I do spy a kind of hope,",2314
Act IV,Scene I,Friar Laurence,Which craves as desperate an execution.,2315
Act IV,Scene I,Friar Laurence,As that is desperate which we would prevent.,2316
Act IV,Scene I,Friar Laurence,"If, rather than to marry County Paris,",2317
Act IV,Scene I,Friar Laurence,"Thou hast the strength of will to slay thyself,",2318
Act IV,Scene I,Friar Laurence,Then is it likely thou wilt undertake,2319
Act IV,Scene I,Friar Laurence,"A thing like death to chide away this shame,",2320
Act IV,Scene I,Friar Laurence,That copest with death himself to scape from it:,2321
Act IV,Scene I,Friar Laurence,"And, if thou darest, I'll give thee remedy.",2322
Act IV,Scene I,Juliet,"O, bid me leap, rather than marry Paris,",2323
Act IV,Scene I,Juliet,From off the battlements of yonder tower;,2324
Act IV,Scene I,Juliet,Or walk in thievish ways; or bid me lurk,2325
Act IV,Scene I,Juliet,Where serpents are; chain me with roaring bears;,2326
Act IV,Scene I,Juliet,"Or shut me nightly in a charnel-house,",2327
Act IV,Scene I,Juliet,"O'er-cover'd quite with dead men's rattling bones,",2328
Act IV,Scene I,Juliet,With reeky shanks and yellow chapless skulls;,2329
Act IV,Scene I,Juliet,Or bid me go into a new-made grave,2330
Act IV,Scene I,Juliet,And hide me with a dead man in his shroud;,2331
Act IV,Scene I,Juliet,"Things that, to hear them told, have made me tremble;",2332
Act IV,Scene I,Juliet,"And I will do it without fear or doubt,",2333
Act IV,Scene I,Juliet,To live an unstain'd wife to my sweet love.,2334
Act IV,Scene I,Friar Laurence,"Hold, then; go home, be merry, give consent",2335
Act IV,Scene I,Friar Laurence,To marry Paris: Wednesday is to-morrow:,2336
Act IV,Scene I,Friar Laurence,To-morrow night look that thou lie alone;,2337
Act IV,Scene I,Friar Laurence,Let not thy nurse lie with thee in thy chamber:,2338
Act IV,Scene I,Friar Laurence,"Take thou this vial, being then in bed,",2339
Act IV,Scene I,Friar Laurence,And this distilled liquor drink thou off;,2340
Act IV,Scene I,Friar Laurence,When presently through all thy veins shall run,2341
Act IV,Scene I,Friar Laurence,"A cold and drowsy humour, for no pulse",2342
Act IV,Scene I,Friar Laurence,"Shall keep his native progress, but surcease:",2343
Act IV,Scene I,Friar Laurence,"No warmth, no breath, shall testify thou livest;",2344
Act IV,Scene I,Friar Laurence,The roses in thy lips and cheeks shall fade,2345
Act IV,Scene I,Friar Laurence,"To paly ashes, thy eyes' windows fall,",2346
Act IV,Scene I,Friar Laurence,"Like death, when he shuts up the day of life;",2347
Act IV,Scene I,Friar Laurence,"Each part, deprived of supple government,",2348
Act IV,Scene I,Friar Laurence,"Shall, stiff and stark and cold, appear like death:",2349
Act IV,Scene I,Friar Laurence,And in this borrow'd likeness of shrunk death,2350
Act IV,Scene I,Friar Laurence,"Thou shalt continue two and forty hours,",2351
Act IV,Scene I,Friar Laurence,And then awake as from a pleasant sleep.,2352
Act IV,Scene I,Friar Laurence,"Now, when the bridegroom in the morning comes",2353
Act IV,Scene I,Friar Laurence,"To rouse thee from thy bed, there art thou dead:",2354
Act IV,Scene I,Friar Laurence,"Then, as the manner of our country is,",2355
Act IV,Scene I,Friar Laurence,In thy best robes uncover'd on the bier,2356
Act IV,Scene I,Friar Laurence,Thou shalt be borne to that same ancient vault,2357
Act IV,Scene I,Friar Laurence,Where all the kindred of the Capulets lie.,2358
Act IV,Scene I,Friar Laurence,"In the mean time, against thou shalt awake,",2359
Act IV,Scene I,Friar Laurence,"Shall Romeo by my letters know our drift,",2360
Act IV,Scene I,Friar Laurence,And hither shall he come: and he and I,2361
Act IV,Scene I,Friar Laurence,"Will watch thy waking, and that very night",2362
Act IV,Scene I,Friar Laurence,Shall Romeo bear thee hence to Mantua.,2363
Act IV,Scene I,Friar Laurence,And this shall free thee from this present shame;,2364
Act IV,Scene I,Friar Laurence,"If no inconstant toy, nor womanish fear,",2365
Act IV,Scene I,Friar Laurence,Abate thy valour in the acting it.,2366
Act IV,Scene I,Juliet,"Give me, give me! O, tell not me of fear!",2367
Act IV,Scene I,Friar Laurence,"Hold; get you gone, be strong and prosperous",2368
Act IV,Scene I,Friar Laurence,In this resolve: I'll send a friar with speed,2369
Act IV,Scene I,Friar Laurence,"To Mantua, with my letters to thy lord.",2370
Act IV,Scene I,Juliet,Love give me strength! and strength shall help afford.,2371
Act IV,Scene I,Juliet,"Farewell, dear father!",2372
Act IV,Scene I,[stage direction],Exeunt,NA
Act IV,Scene II,[stage direction],"Enter CAPULET, LADY  CAPULET, Nurse, and two Servingmen",NA
Act IV,Scene II,Capulet,So many guests invite as here are writ.,2373
Act IV,Scene II,[stage direction],Exit First Servant,NA
Act IV,Scene II,Capulet,"Sirrah, go hire me twenty cunning cooks.",2374
Act IV,Scene II,Second Servant,"You shall have none ill, sir; for I'll try if they",2375
Act IV,Scene II,Second Servant,can lick their fingers.,2376
Act IV,Scene II,Capulet,How canst thou try them so?,2377
Act IV,Scene II,Second Servant,"Marry, sir, 'tis an ill cook that cannot lick his",2378
Act IV,Scene II,Second Servant,own fingers: therefore he that cannot lick his,2379
Act IV,Scene II,Second Servant,fingers goes not with me.,2380
Act IV,Scene II,Capulet,"Go, be gone.",2381
Act IV,Scene II,[stage direction],Exit Second Servant,NA
Act IV,Scene II,Capulet,We shall be much unfurnished for this time.,2382
Act IV,Scene II,Capulet,"What, is my daughter gone to Friar Laurence?",2383
Act IV,Scene II,Nurse,"Ay, forsooth.",2384
Act IV,Scene II,Capulet,"Well, he may chance to do some good on her:",2385
Act IV,Scene II,Capulet,A peevish self-will'd harlotry it is.,2386
Act IV,Scene II,Nurse,See where she comes from shrift with merry look.,2387
Act IV,Scene II,[stage direction],Enter JULIET,NA
Act IV,Scene II,Capulet,"How now, my headstrong! where have you been gadding?",2388
Act IV,Scene II,Juliet,Where I have learn'd me to repent the sin,2389
Act IV,Scene II,Juliet,Of disobedient opposition,2390
Act IV,Scene II,Juliet,"To you and your behests, and am enjoin'd",2391
Act IV,Scene II,Juliet,"By holy Laurence to fall prostrate here,",2392
Act IV,Scene II,Juliet,"And beg your pardon: pardon, I beseech you!",2393
Act IV,Scene II,Juliet,Henceforward I am ever ruled by you.,2394
Act IV,Scene II,Capulet,Send for the county; go tell him of this:,2395
Act IV,Scene II,Capulet,I'll have this knot knit up to-morrow morning.,2396
Act IV,Scene II,Juliet,I met the youthful lord at Laurence' cell;,2397
Act IV,Scene II,Juliet,"And gave him what becomed love I might,",2398
Act IV,Scene II,Juliet,Not step o'er the bounds of modesty.,2399
Act IV,Scene II,Capulet,"Why, I am glad on't; this is well: stand up:",2400
Act IV,Scene II,Capulet,This is as't should be. Let me see the county;,2401
Act IV,Scene II,Capulet,"Ay, marry, go, I say, and fetch him hither.",2402
Act IV,Scene II,Capulet,"Now, afore God! this reverend holy friar,",2403
Act IV,Scene II,Capulet,Our whole city is much bound to him.,2404
Act IV,Scene II,Juliet,"Nurse, will you go with me into my closet,",2405
Act IV,Scene II,Juliet,To help me sort such needful ornaments,2406
Act IV,Scene II,Juliet,As you think fit to furnish me to-morrow?,2407
Act IV,Scene II,Lady Capulet,"No, not till Thursday; there is time enough.",2408
Act IV,Scene II,Capulet,"Go, nurse, go with her: we'll to church to-morrow.",2409
Act IV,Scene II,[stage direction],Exeunt JULIET and Nurse,NA
Act IV,Scene II,Lady Capulet,We shall be short in our provision:,2410
Act IV,Scene II,Lady Capulet,'Tis now near night.,2411
Act IV,Scene II,Capulet,"Tush, I will stir about,",2412
Act IV,Scene II,Capulet,"And all things shall be well, I warrant thee, wife:",2413
Act IV,Scene II,Capulet,"Go thou to Juliet, help to deck up her;",2414
Act IV,Scene II,Capulet,I'll not to bed to-night; let me alone;,2415
Act IV,Scene II,Capulet,"I'll play the housewife for this once. What, ho!",2416
Act IV,Scene II,Capulet,"They are all forth. Well, I will walk myself",2417
Act IV,Scene II,Capulet,"To County Paris, to prepare him up",2418
Act IV,Scene II,Capulet,"Against to-morrow: my heart is wondrous light,",2419
Act IV,Scene II,Capulet,Since this same wayward girl is so reclaim'd.,2420
Act IV,Scene II,[stage direction],Exeunt,NA
Act IV,Scene III,[stage direction],Enter JULIET and Nurse,NA
Act IV,Scene III,Juliet,"Ay, those attires are best: but, gentle nurse,",2421
Act IV,Scene III,Juliet,"I pray thee, leave me to my self to-night,",2422
Act IV,Scene III,Juliet,For I have need of many orisons,2423
Act IV,Scene III,Juliet,"To move the heavens to smile upon my state,",2424
Act IV,Scene III,Juliet,"Which, well thou know'st, is cross, and full of sin.",2425
Act IV,Scene III,[stage direction],Enter LADY CAPULET,NA
Act IV,Scene III,Lady Capulet,"What, are you busy, ho? need you my help?",2426
Act IV,Scene III,Juliet,"No, madam; we have cull'd such necessaries",2427
Act IV,Scene III,Juliet,As are behoveful for our state to-morrow:,2428
Act IV,Scene III,Juliet,"So please you, let me now be left alone,",2429
Act IV,Scene III,Juliet,And let the nurse this night sit up with you;,2430
Act IV,Scene III,Juliet,"For, I am sure, you have your hands full all,",2431
Act IV,Scene III,Juliet,In this so sudden business.,2432
Act IV,Scene III,Lady Capulet,Good night:,2433
Act IV,Scene III,Lady Capulet,"Get thee to bed, and rest; for thou hast need.",2434
Act IV,Scene III,[stage direction],Exeunt LADY CAPULET and Nurse,NA
Act IV,Scene III,Juliet,Farewell! God knows when we shall meet again.,2435
Act IV,Scene III,Juliet,"I have a faint cold fear thrills through my veins,",2436
Act IV,Scene III,Juliet,That almost freezes up the heat of life:,2437
Act IV,Scene III,Juliet,I'll call them back again to comfort me:,2438
Act IV,Scene III,Juliet,Nurse! What should she do here?,2439
Act IV,Scene III,Juliet,My dismal scene I needs must act alone.,2440
Act IV,Scene III,Juliet,"Come, vial.",2441
Act IV,Scene III,Juliet,What if this mixture do not work at all?,2442
Act IV,Scene III,Juliet,Shall I be married then to-morrow morning?,2443
Act IV,Scene III,Juliet,"No, no: this shall forbid it: lie thou there.",2444
Act IV,Scene III,[stage direction],Laying down her dagger,NA
Act IV,Scene III,Juliet,"What if it be a poison, which the friar",2445
Act IV,Scene III,Juliet,"Subtly hath minister'd to have me dead,",2446
Act IV,Scene III,Juliet,"Lest in this marriage he should be dishonour'd,",2447
Act IV,Scene III,Juliet,Because he married me before to Romeo?,2448
Act IV,Scene III,Juliet,"I fear it is: and yet, methinks, it should not,",2449
Act IV,Scene III,Juliet,For he hath still been tried a holy man.,2450
Act IV,Scene III,Juliet,"How if, when I am laid into the tomb,",2451
Act IV,Scene III,Juliet,I wake before the time that Romeo,2452
Act IV,Scene III,Juliet,Come to redeem me? there's a fearful point!,2453
Act IV,Scene III,Juliet,"Shall I not, then, be stifled in the vault,",2454
Act IV,Scene III,Juliet,"To whose foul mouth no healthsome air breathes in,",2455
Act IV,Scene III,Juliet,And there die strangled ere my Romeo comes?,2456
Act IV,Scene III,Juliet,"Or, if I live, is it not very like,",2457
Act IV,Scene III,Juliet,"The horrible conceit of death and night,",2458
Act IV,Scene III,Juliet,"Together with the terror of the place,--",2459
Act IV,Scene III,Juliet,"As in a vault, an ancient receptacle,",2460
Act IV,Scene III,Juliet,"Where, for these many hundred years, the bones",2461
Act IV,Scene III,Juliet,Of all my buried ancestors are packed:,2462
Act IV,Scene III,Juliet,"Where bloody Tybalt, yet but green in earth,",2463
Act IV,Scene III,Juliet,"Lies festering in his shroud; where, as they say,",2464
