act,scene,character,dialogue,line_number
Act I,Scene V,Nurse,The only son of your great enemy.,730
Act I,Scene V,Juliet,My only love sprung from my only hate!,731
Act I,Scene V,Juliet,"Too early seen unknown, and known too late!",732
Act I,Scene V,Juliet,"Prodigious birth of love it is to me,",733
Act I,Scene V,Juliet,That I must love a loathed enemy.,734
Act I,Scene V,Nurse,What's this? what's this?,735
Act I,Scene V,Juliet,A rhyme I learn'd even now,736
Act I,Scene V,Juliet,Of one I danced withal.,737
Act I,Scene V,[stage direction],One calls within 'Juliet.',NA
Act I,Scene V,Nurse,"Anon, anon!",738
Act I,Scene V,Nurse,"Come, let's away; the strangers all are gone.",739
Act I,Scene V,[stage direction],Exeunt,NA
Act II,Prologue,[stage direction],Enter Chorus,NA
Act II,Prologue,Chorus,"Now old desire doth in his death-bed lie,",740
Act II,Prologue,Chorus,And young affection gapes to be his heir;,741
Act II,Prologue,Chorus,"That fair for which love groan'd for and would die,",742
Act II,Prologue,Chorus,"With tender Juliet match'd, is now not fair.",743
Act II,Prologue,Chorus,"Now Romeo is beloved and loves again,",744
Act II,Prologue,Chorus,"Alike betwitched by the charm of looks,",745
Act II,Prologue,Chorus,"But to his foe supposed he must complain,",746
Act II,Prologue,Chorus,And she steal love's sweet bait from fearful hooks:,747
Act II,Prologue,Chorus,"Being held a foe, he may not have access",748
Act II,Prologue,Chorus,To breathe such vows as lovers use to swear;,749
Act II,Prologue,Chorus,"And she as much in love, her means much less",750
Act II,Prologue,Chorus,To meet her new-beloved any where:,751
Act II,Prologue,Chorus,"But passion lends them power, time means, to meet",752
Act II,Prologue,Chorus,Tempering extremities with extreme sweet.,753
Act II,Prologue,[stage direction],Exit,NA
Act II,Scene I,[stage direction],Enter ROMEO,NA
Act II,Scene I,Romeo,Can I go forward when my heart is here?,754
Act II,Scene I,Romeo,"Turn back, dull earth, and find thy centre out.",755
Act II,Scene I,[stage direction],"He climbs the wall, and leaps down within it",NA
Act II,Scene I,[stage direction],Enter BENVOLIO and MERCUTIO,NA
Act II,Scene I,Benvolio,Romeo! my cousin Romeo!,756
Act II,Scene I,Mercutio,He is wise;,757
Act II,Scene I,Mercutio,"And, on my lie, hath stol'n him home to bed.",758
Act II,Scene I,Benvolio,"He ran this way, and leap'd this orchard wall:",759
Act II,Scene I,Benvolio,"Call, good Mercutio.",760
Act II,Scene I,Mercutio,"Nay, I'll conjure too.",761
Act II,Scene I,Mercutio,Romeo! humours! madman! passion! lover!,762
Act II,Scene I,Mercutio,Appear thou in the likeness of a sigh:,763
Act II,Scene I,Mercutio,"Speak but one rhyme, and I am satisfied;",764
Act II,Scene I,Mercutio,Cry but 'Ay me!' pronounce but 'love' and 'dove;',765
Act II,Scene I,Mercutio,"Speak to my gossip Venus one fair word,",766
Act II,Scene I,Mercutio,"One nick-name for her purblind son and heir,",767
Act II,Scene I,Mercutio,"Young Adam Cupid, he that shot so trim,",768
Act II,Scene I,Mercutio,When King Cophetua loved the beggar-maid!,769
Act II,Scene I,Mercutio,"He heareth not, he stirreth not, he moveth not;",770
Act II,Scene I,Mercutio,"The ape is dead, and I must conjure him.",771
Act II,Scene I,Mercutio,"I conjure thee by Rosaline's bright eyes,",772
Act II,Scene I,Mercutio,"By her high forehead and her scarlet lip,",773
Act II,Scene I,Mercutio,"By her fine foot, straight leg and quivering thigh",774
Act II,Scene I,Mercutio,"And the demesnes that there adjacent lie,",775
Act II,Scene I,Mercutio,That in thy likeness thou appear to us!,776
Act II,Scene I,Benvolio,"And if he hear thee, thou wilt anger him.",777
Act II,Scene I,Mercutio,This cannot anger him: 'twould anger him,778
Act II,Scene I,Mercutio,To raise a spirit in his mistress' circle,779
Act II,Scene I,Mercutio,"Of some strange nature, letting it there stand",780
Act II,Scene I,Mercutio,Till she had laid it and conjured it down;,781
Act II,Scene I,Mercutio,That were some spite: my invocation,782
Act II,Scene I,Mercutio,"Is fair and honest, and in his mistres s' name",783
Act II,Scene I,Mercutio,I conjure only but to raise up him.,784
Act II,Scene I,Benvolio,"Come, he hath hid himself among these trees,",785
Act II,Scene I,Benvolio,To be consorted with the humorous night:,786
Act II,Scene I,Benvolio,Blind is his love and best befits the dark.,787
Act II,Scene I,Mercutio,"If love be blind, love cannot hit the mark.",788
Act II,Scene I,Mercutio,"Now will he sit under a medlar tree,",789
Act II,Scene I,Mercutio,And wish his mistress were that kind of fruit,790
Act II,Scene I,Mercutio,"As maids call medlars, when they laugh alone.",791
Act II,Scene I,Mercutio,"Romeo, that she were, O, that she were",792
Act II,Scene I,Mercutio,"An open et caetera, thou a poperin pear!",793
Act II,Scene I,Mercutio,"Romeo, good night: I'll to my truckle-bed;",794
Act II,Scene I,Mercutio,This field-bed is too cold for me to sleep:,795
Act II,Scene I,Mercutio,"Come, shall we go?",796
Act II,Scene I,Benvolio,"Go, then; for 'tis in vain",797
Act II,Scene I,Benvolio,To seek him here that means not to be found.,798
Act II,Scene I,[stage direction],Exeunt,NA
Act II,Scene II,[stage direction],Enter ROMEO,NA
Act II,Scene II,Romeo,He jests at scars that never felt a wound.,799
Act II,Scene II,[stage direction],JULIET appears above at a window,NA
Act II,Scene II,Romeo,"But, soft! what light through yonder window breaks?",800
Act II,Scene II,Romeo,"It is the east, and Juliet is the sun.",801
Act II,Scene II,Romeo,"Arise, fair sun, and kill the envious moon,",802
Act II,Scene II,Romeo,"Who is already sick and pale with grief,",803
Act II,Scene II,Romeo,That thou her maid art far more fair than she:,804
Act II,Scene II,Romeo,"Be not her maid, since she is envious;",805
Act II,Scene II,Romeo,Her vestal livery is but sick and green,806
Act II,Scene II,Romeo,And none but fools do wear it; cast it off.,807
Act II,Scene II,Romeo,"It is my lady, O, it is my love!",808
Act II,Scene II,Romeo,"O, that she knew she were!",809
Act II,Scene II,Romeo,She speaks yet she says nothing: what of that?,810
Act II,Scene II,Romeo,Her eye discourses; I will answer it.,811
Act II,Scene II,Romeo,"I am too bold, 'tis not to me she speaks:",812
Act II,Scene II,Romeo,"Two of the fairest stars in all the heaven,",813
Act II,Scene II,Romeo,"Having some business, do entreat her eyes",814
Act II,Scene II,Romeo,To twinkle in their spheres till they return.,815
Act II,Scene II,Romeo,"What if her eyes were there, they in her head?",816
Act II,Scene II,Romeo,"The brightness of her cheek would shame those stars,",817
Act II,Scene II,Romeo,As daylight doth a lamp; her eyes in heaven,818
Act II,Scene II,Romeo,Would through the airy region stream so bright,819
Act II,Scene II,Romeo,That birds would sing and think it were not night.,820
Act II,Scene II,Romeo,"See, how she leans her cheek upon her hand!",821
Act II,Scene II,Romeo,"O, that I were a glove upon that hand,",822
Act II,Scene II,Romeo,That I might touch that cheek!,823
Act II,Scene II,Juliet,Ay me!,824
Act II,Scene II,Romeo,She speaks:,825
Act II,Scene II,Romeo,"O, speak again, bright angel! for thou art",826
Act II,Scene II,Romeo,"As glorious to this night, being o'er my head",827
Act II,Scene II,Romeo,As is a winged messenger of heaven,828
Act II,Scene II,Romeo,Unto the white-upturned wondering eyes,829
Act II,Scene II,Romeo,Of mortals that fall back to gaze on him,830
Act II,Scene II,Romeo,When he bestrides the lazy-pacing clouds,831
Act II,Scene II,Romeo,And sails upon the bosom of the air.,832
Act II,Scene II,Juliet,"O Romeo, Romeo! wherefore art thou Romeo?",833
Act II,Scene II,Juliet,Deny thy father and refuse thy name;,834
Act II,Scene II,Juliet,"Or, if thou wilt not, be but sworn my love,",835
Act II,Scene II,Juliet,And I'll no longer be a Capulet.,836
Act II,Scene II,Romeo,"[Aside]  Shall I hear more, or shall I speak at this?",837
Act II,Scene II,Juliet,'Tis but thy name that is my enemy;,838
Act II,Scene II,Juliet,"Thou art thyself, though not a Montague.",839
Act II,Scene II,Juliet,"What's Montague? it is nor hand, nor foot,",840
Act II,Scene II,Juliet,"Nor arm, nor face, nor any other part",841
Act II,Scene II,Juliet,"Belonging to a man. O, be some other name!",842
Act II,Scene II,Juliet,What's in a name? that which we call a rose,843
Act II,Scene II,Juliet,By any other name would smell as sweet;,844
Act II,Scene II,Juliet,"So Romeo would, were he not Romeo call'd,",845
Act II,Scene II,Juliet,Retain that dear perfection which he owes,846
Act II,Scene II,Juliet,"Without that title. Romeo, doff thy name,",847
Act II,Scene II,Juliet,And for that name which is no part of thee,848
Act II,Scene II,Juliet,Take all myself.,849
Act II,Scene II,Romeo,I take thee at thy word:,850
Act II,Scene II,Romeo,"Call me but love, and I'll be new baptized;",851
Act II,Scene II,Romeo,Henceforth I never will be Romeo.,852
Act II,Scene II,Juliet,What man art thou that thus bescreen'd in night,853
Act II,Scene II,Juliet,So stumblest on my counsel?,854
Act II,Scene II,Romeo,By a name,855
Act II,Scene II,Romeo,I know not how to tell thee who I am:,856
Act II,Scene II,Romeo,"My name, dear saint, is hateful to myself,",857
Act II,Scene II,Romeo,Because it is an enemy to thee;,858
Act II,Scene II,Romeo,"Had I it written, I would tear the word.",859
Act II,Scene II,Juliet,My ears have not yet drunk a hundred words,860
Act II,Scene II,Juliet,"Of that tongue's utterance, yet I know the sound:",861
Act II,Scene II,Juliet,Art thou not Romeo and a Montague?,862
Act II,Scene II,Romeo,"Neither, fair saint, if either thee dislike.",863
Act II,Scene II,Juliet,"How camest thou hither, tell me, and wherefore?",864
Act II,Scene II,Juliet,"The orchard walls are high and hard to climb,",865
Act II,Scene II,Juliet,"And the place death, considering who thou art,",866
Act II,Scene II,Juliet,If any of my kinsmen find thee here.,867
Act II,Scene II,Romeo,With love's light wings did I o'er-perch these walls;,868
Act II,Scene II,Romeo,"For stony limits cannot hold love out,",869
Act II,Scene II,Romeo,And what love can do that dares love attempt;,870
Act II,Scene II,Romeo,Therefore thy kinsmen are no let to me.,871
Act II,Scene II,Juliet,"If they do see thee, they will murder thee.",872
Act II,Scene II,Romeo,"Alack, there lies more peril in thine eye",873
Act II,Scene II,Romeo,"Than twenty of their swords: look thou but sweet,",874
Act II,Scene II,Romeo,And I am proof against their enmity.,875
Act II,Scene II,Juliet,I would not for the world they saw thee here.,876
Act II,Scene II,Romeo,I have night's cloak to hide me from their sight;,877
Act II,Scene II,Romeo,"And but thou love me, let them find me here:",878
Act II,Scene II,Romeo,"My life were better ended by their hate,",879
Act II,Scene II,Romeo,"Than death prorogued, wanting of thy love.",880
Act II,Scene II,Juliet,By whose direction found'st thou out this place?,881
Act II,Scene II,Romeo,"By love, who first did prompt me to inquire;",882
Act II,Scene II,Romeo,He lent me counsel and I lent him eyes.,883
Act II,Scene II,Romeo,"I am no pilot; yet, wert thou as far",884
Act II,Scene II,Romeo,"As that vast shore wash'd with the farthest sea,",885
Act II,Scene II,Romeo,I would adventure for such merchandise.,886
Act II,Scene II,Juliet,"Thou know'st the mask of night is on my face,",887
Act II,Scene II,Juliet,Else would a maiden blush bepaint my cheek,888
Act II,Scene II,Juliet,For that which thou hast heard me speak to-night,889
Act II,Scene II,Juliet,"Fain would I dwell on form, fain, fain deny",890
Act II,Scene II,Juliet,What I have spoke: but farewell compliment!,891
Act II,Scene II,Juliet,"Dost thou love me? I know thou wilt say 'Ay,'",892
Act II,Scene II,Juliet,"And I will take thy word: yet if thou swear'st,",893
Act II,Scene II,Juliet,Thou mayst prove false; at lovers' perjuries,894
Act II,Scene II,Juliet,"Then say, Jove laughs. O gentle Romeo,",895
Act II,Scene II,Juliet,"If thou dost love, pronounce it faithfully:",896
Act II,Scene II,Juliet,"Or if thou think'st I am too quickly won,",897
Act II,Scene II,Juliet,"I'll frown and be perverse an say thee nay,",898
Act II,Scene II,Juliet,"So thou wilt woo; but else, not for the world.",899
Act II,Scene II,Juliet,"In truth, fair Montague, I am too fond,",900
Act II,Scene II,Juliet,And therefore thou mayst think my 'havior light:,901
Act II,Scene II,Juliet,"But trust me, gentleman, I'll prove more true",902
Act II,Scene II,Juliet,Than those that have more cunning to be strange.,903
Act II,Scene II,Juliet,"I should have been more strange, I must confess,",904
Act II,Scene II,Juliet,"But that thou overheard'st, ere I was ware,",905
Act II,Scene II,Juliet,"My true love's passion: therefore pardon me,",906
Act II,Scene II,Juliet,"And not impute this yielding to light love,",907
Act II,Scene II,Juliet,Which the dark night hath so discovered.,908
Act II,Scene II,Romeo,"Lady, by yonder blessed moon I swear",909
Act II,Scene II,Romeo,That tips with silver all these fruit-tree tops--,910
Act II,Scene II,Juliet,"O, swear not by the moon, the inconstant moon,",911
Act II,Scene II,Juliet,"That monthly changes in her circled orb,",912
Act II,Scene II,Juliet,Lest that thy love prove likewise variable.,913
Act II,Scene II,Romeo,What shall I swear by?,914
Act II,Scene II,Juliet,Do not swear at all;,915
Act II,Scene II,Juliet,"Or, if thou wilt, swear by thy gracious self,",916
Act II,Scene II,Juliet,"Which is the god of my idolatry,",917
Act II,Scene II,Juliet,And I'll believe thee.,918
Act II,Scene II,Romeo,If my heart's dear love--,919
Act II,Scene II,Juliet,"Well, do not swear: although I joy in thee,",920
Act II,Scene II,Juliet,I have no joy of this contract to-night:,921
Act II,Scene II,Juliet,"It is too rash, too unadvised, too sudden;",922
Act II,Scene II,Juliet,"Too like the lightning, which doth cease to be",923
Act II,Scene II,Juliet,"Ere one can say 'It lightens.' Sweet, good night!",924
Act II,Scene II,Juliet,"This bud of love, by summer's ripening breath,",925
Act II,Scene II,Juliet,May prove a beauteous flower when next we meet.,926
Act II,Scene II,Juliet,"Good night, good night! as sweet repose and rest",927
Act II,Scene II,Juliet,Come to thy heart as that within my breast!,928
Act II,Scene II,Romeo,"O, wilt thou leave me so unsatisfied?",929
Act II,Scene II,Juliet,What satisfaction canst thou have to-night?,930
Act II,Scene II,Romeo,The exchange of thy love's faithful vow for mine.,931
Act II,Scene II,Juliet,I gave thee mine before thou didst request it:,932
Act II,Scene II,Juliet,And yet I would it were to give again.,933
Act II,Scene II,Romeo,"Wouldst thou withdraw it? for what purpose, love?",934
Act II,Scene II,Juliet,"But to be frank, and give it thee again.",935
Act II,Scene II,Juliet,And yet I wish but for the thing I have:,936
Act II,Scene II,Juliet,"My bounty is as boundless as the sea,",937
Act II,Scene II,Juliet,"My love as deep; the more I give to thee,",938
Act II,Scene II,Juliet,"The more I have, for both are infinite.",939
Act II,Scene II,[stage direction],Nurse calls within,NA
Act II,Scene II,Juliet,"I hear some noise within; dear love, adieu!",940
Act II,Scene II,Juliet,"Anon, good nurse! Sweet Montague, be true.",941
Act II,Scene II,Juliet,"Stay but a little, I will come again.",942
Act II,Scene II,[stage direction],"Exit, above",NA
Act II,Scene II,Romeo,"O blessed, blessed night! I am afeard.",943
Act II,Scene II,Romeo,"Being in night, all this is but a dream,",944
Act II,Scene II,Romeo,Too flattering-sweet to be substantial.,945
Act II,Scene II,[stage direction],"Re-enter JULIET, above",NA
Act II,Scene II,Juliet,"Three words, dear Romeo, and good night indeed.",946
Act II,Scene II,Juliet,"If that thy bent of love be honourable,",947
Act II,Scene II,Juliet,"Thy purpose marriage, send me word to-morrow,",948
Act II,Scene II,Juliet,"By one that I'll procure to come to thee,",949
Act II,Scene II,Juliet,Where and what time thou wilt perform the rite;,950
Act II,Scene II,Juliet,And all my fortunes at thy foot I'll lay,951
Act II,Scene II,Juliet,And follow thee my lord throughout the world.,952
Act II,Scene II,Nurse,[Within]  Madam!,953
Act II,Scene II,Juliet,"I come, anon.--But if thou mean'st not well,",954
Act II,Scene II,Juliet,I do beseech thee--,955
Act II,Scene II,Nurse,[Within]  Madam!,956
Act II,Scene II,Juliet,"By and by, I come:--",957
Act II,Scene II,Juliet,"To cease thy suit, and leave me to my grief:",958
Act II,Scene II,Juliet,To-morrow will I send.,959
Act II,Scene II,Romeo,So thrive my soul--,960
Act II,Scene II,Juliet,A thousand times good night!,961
Act II,Scene II,[stage direction],"Exit, above",NA
Act II,Scene II,Romeo,"A thousand times the worse, to want thy light.",962
Act II,Scene II,Romeo,"Love goes toward love, as schoolboys from",963
Act II,Scene II,Romeo,"their books,",964
Act II,Scene II,Romeo,"But love from love, toward school with heavy looks.",965
Act II,Scene II,[stage direction],Retiring,NA
Act II,Scene II,[stage direction],"Re-enter JULIET, above",NA
Act II,Scene II,Juliet,"Hist! Romeo, hist! O, for a falconer's voice,",966
Act II,Scene II,Juliet,To lure this tassel-gentle back again!,967
Act II,Scene II,Juliet,"Bondage is hoarse, and may not speak aloud;",968
Act II,Scene II,Juliet,"Else would I tear the cave where Echo lies,",969
Act II,Scene II,Juliet,"And make her airy tongue more hoarse than mine,",970
Act II,Scene II,Juliet,With repetition of my Romeo's name.,971
Act II,Scene II,Romeo,It is my soul that calls upon my name:,972
Act II,Scene II,Romeo,"How silver-sweet sound lovers' tongues by night,",973
Act II,Scene II,Romeo,Like softest music to attending ears!,974
Act II,Scene II,Juliet,Romeo!,975
Act II,Scene II,Romeo,My dear?,976
Act II,Scene II,Juliet,At what o'clock to-morrow,977
Act II,Scene II,Juliet,Shall I send to thee?,978
Act II,Scene II,Romeo,At the hour of nine.,979
Act II,Scene II,Juliet,I will not fail: 'tis twenty years till then.,980
Act II,Scene II,Juliet,I have forgot why I did call thee back.,981
Act II,Scene II,Romeo,Let me stand here till thou remember it.,982
Act II,Scene II,Juliet,"I shall forget, to have thee still stand there,",983
Act II,Scene II,Juliet,Remembering how I love thy company.,984
Act II,Scene II,Romeo,"And I'll still stay, to have thee still forget,",985
Act II,Scene II,Romeo,Forgetting any other home but this.,986
Act II,Scene II,Juliet,'Tis almost morning; I would have thee gone:,987
Act II,Scene II,Juliet,And yet no further than a wanton's bird;,988
Act II,Scene II,Juliet,"Who lets it hop a little from her hand,",989
Act II,Scene II,Juliet,"Like a poor prisoner in his twisted gyves,",990
Act II,Scene II,Juliet,"And with a silk thread plucks it back again,",991
Act II,Scene II,Juliet,So loving-jealous of his liberty.,992
Act II,Scene II,Romeo,I would I were thy bird.,993
Act II,Scene II,Juliet,"Sweet, so would I:",994
Act II,Scene II,Juliet,Yet I should kill thee with much cherishing.,995
Act II,Scene II,Juliet,"Good night, good night! parting is such",996
Act II,Scene II,Juliet,"sweet sorrow,",997
Act II,Scene II,Juliet,That I shall say good night till it be morrow.,998
Act II,Scene II,[stage direction],Exit above,NA
Act II,Scene II,Romeo,"Sleep dwell upon thine eyes, peace in thy breast!",999
Act II,Scene II,Romeo,"Would I were sleep and peace, so sweet to rest!",1000
Act II,Scene II,Romeo,"Hence will I to my ghostly father's cell,",1001
Act II,Scene II,Romeo,"His help to crave, and my dear hap to tell.",1002
Act II,Scene II,[stage direction],Exit,NA
Act II,Scene III,[stage direction],"Enter FRIAR LAURENCE, with a basket",NA
Act II,Scene III,Friar Laurence,"The grey-eyed morn smiles on the frowning night,",1003
Act II,Scene III,Friar Laurence,"Chequering the eastern clouds with streaks of light,",1004
Act II,Scene III,Friar Laurence,And flecked darkness like a drunkard reels,1005
Act II,Scene III,Friar Laurence,From forth day's path and Titan's fiery wheels:,1006
Act II,Scene III,Friar Laurence,"Now, ere the sun advance his burning eye,",1007
Act II,Scene III,Friar Laurence,"The day to cheer and night's dank dew to dry,",1008
Act II,Scene III,Friar Laurence,I must up-fill this osier cage of ours,1009
Act II,Scene III,Friar Laurence,With baleful weeds and precious-juiced flowers.,1010
Act II,Scene III,Friar Laurence,The earth that's nature's mother is her tomb;,1011
Act II,Scene III,Friar Laurence,"What is her burying grave that is her womb,",1012
Act II,Scene III,Friar Laurence,And from her womb children of divers kind,1013
Act II,Scene III,Friar Laurence,"We sucking on her natural bosom find,",1014
Act II,Scene III,Friar Laurence,"Many for many virtues excellent,",1015
Act II,Scene III,Friar Laurence,None but for some and yet all different.,1016
Act II,Scene III,Friar Laurence,"O, mickle is the powerful grace that lies",1017
Act II,Scene III,Friar Laurence,"In herbs, plants, stones, and their true qualities:",1018
Act II,Scene III,Friar Laurence,For nought so vile that on the earth doth live,1019
Act II,Scene III,Friar Laurence,"But to the earth some special good doth give,",1020
Act II,Scene III,Friar Laurence,Nor aught so good but strain'd from that fair use,1021
Act II,Scene III,Friar Laurence,"Revolts from true birth, stumbling on abuse:",1022
Act II,Scene III,Friar Laurence,"Virtue itself turns vice, being misapplied;",1023
Act II,Scene III,Friar Laurence,And vice sometimes by action dignified.,1024
Act II,Scene III,Friar Laurence,Within the infant rind of this small flower,1025
Act II,Scene III,Friar Laurence,Poison hath residence and medicine power:,1026
Act II,Scene III,Friar Laurence,"For this, being smelt, with that part cheers each part;",1027
Act II,Scene III,Friar Laurence,"Being tasted, slays all senses with the heart.",1028
Act II,Scene III,Friar Laurence,Two such opposed kings encamp them still,1029
Act II,Scene III,Friar Laurence,"In man as well as herbs, grace and rude will;",1030
Act II,Scene III,Friar Laurence,"And where the worser is predominant,",1031
Act II,Scene III,Friar Laurence,Full soon the canker death eats up that plant.,1032
Act II,Scene III,[stage direction],Enter ROMEO,NA
Act II,Scene III,Romeo,"Good morrow, father.",1033
Act II,Scene III,Friar Laurence,Benedicite!,1034
Act II,Scene III,Friar Laurence,What early tongue so sweet saluteth me?,1035
Act II,Scene III,Friar Laurence,"Young son, it argues a distemper'd head",1036
Act II,Scene III,Friar Laurence,So soon to bid good morrow to thy bed:,1037
Act II,Scene III,Friar Laurence,"Care keeps his watch in every old man's eye,",1038
Act II,Scene III,Friar Laurence,"And where care lodges, sleep will never lie;",1039
Act II,Scene III,Friar Laurence,But where unbruised youth with unstuff'd brain,1040
Act II,Scene III,Friar Laurence,"Doth couch his limbs, there golden sleep doth reign:",1041
Act II,Scene III,Friar Laurence,Therefore thy earliness doth me assure,1042
Act II,Scene III,Friar Laurence,Thou art up-roused by some distemperature;,1043
Act II,Scene III,Friar Laurence,"Or if not so, then here I hit it right,",1044
Act II,Scene III,Friar Laurence,Our Romeo hath not been in bed to-night.,1045
Act II,Scene III,Romeo,That last is true; the sweeter rest was mine.,1046
Act II,Scene III,Friar Laurence,God pardon sin! wast thou with Rosaline?,1047
Act II,Scene III,Romeo,"With Rosaline, my ghostly father? no;",1048
Act II,Scene III,Romeo,"I have forgot that name, and that name's woe.",1049
Act II,Scene III,Friar Laurence,"That's my good son: but where hast thou been, then?",1050
Act II,Scene III,Romeo,"I'll tell thee, ere thou ask it me again.",1051
Act II,Scene III,Romeo,"I have been feasting with mine enemy,",1052
Act II,Scene III,Romeo,"Where on a sudden one hath wounded me,",1053
Act II,Scene III,Romeo,That's by me wounded: both our remedies,1054
Act II,Scene III,Romeo,Within thy help and holy physic lies:,1055
Act II,Scene III,Romeo,"I bear no hatred, blessed man, for, lo,",1056
Act II,Scene III,Romeo,My intercession likewise steads my foe.,1057
Act II,Scene III,Friar Laurence,"Be plain, good son, and homely in thy drift;",1058
Act II,Scene III,Friar Laurence,Riddling confession finds but riddling shrift.,1059
Act II,Scene III,Romeo,Then plainly know my heart's dear love is set,1060
Act II,Scene III,Romeo,On the fair daughter of rich Capulet:,1061
Act II,Scene III,Romeo,"As mine on hers, so hers is set on mine;",1062
Act II,Scene III,Romeo,"And all combined, save what thou must combine",1063
Act II,Scene III,Romeo,By holy marriage: when and where and how,1064
Act II,Scene III,Romeo,"We met, we woo'd and made exchange of vow,",1065
Act II,Scene III,Romeo,"I'll tell thee as we pass; but this I pray,",1066
Act II,Scene III,Romeo,That thou consent to marry us to-day.,1067
Act II,Scene III,Friar Laurence,"Holy Saint Francis, what a change is here!",1068
Act II,Scene III,Friar Laurence,"Is Rosaline, whom thou didst love so dear,",1069
Act II,Scene III,Friar Laurence,So soon forsaken? young men's love then lies,1070
Act II,Scene III,Friar Laurence,"Not truly in their hearts, but in their eyes.",1071
Act II,Scene III,Friar Laurence,"Jesu Maria, what a deal of brine",1072
Act II,Scene III,Friar Laurence,Hath wash'd thy sallow cheeks for Rosaline!,1073
Act II,Scene III,Friar Laurence,"How much salt water thrown away in waste,",1074
Act II,Scene III,Friar Laurence,"To season love, that of it doth not taste!",1075
Act II,Scene III,Friar Laurence,"The sun not yet thy sighs from heaven clears,",1076
Act II,Scene III,Friar Laurence,Thy old groans ring yet in my ancient ears;,1077
Act II,Scene III,Friar Laurence,"Lo, here upon thy cheek the stain doth sit",1078
Act II,Scene III,Friar Laurence,Of an old tear that is not wash'd off yet:,1079
Act II,Scene III,Friar Laurence,"If e'er thou wast thyself and these woes thine,",1080
Act II,Scene III,Friar Laurence,Thou and these woes were all for Rosaline:,1081
Act II,Scene III,Friar Laurence,"And art thou changed? pronounce this sentence then,",1082
