taxonomic_name,common_name,cultivation,sunlight,water,preferred_ph_lower,preferred_ph_upper,nutrients,soil,season,temperature_class,temperature_germination,temperature_growing,days_germination,days_harvest,nutritional_info,energy,sensitivities,description,requirements
Prunus persica,Peach,Miscellaneous,Full sun,Medium,6,7,Medium,NA,Perennial,Hardy,Not applicable.,NA,Not applicable.,Not applicable.,NA,NA,NA,"A native tree of China, grown for its soft fleshed fruit which contains a singe hard stone in the centre and thin fuzzy skin.","Peach and nectarine trees require warmth and sun, as well as a chill period of 600-900 hours at less than 7°C. They are a semi-hardy, surviving in climates where temperatures drop to -20°C, but require warm summers to produce fruit."
Pyrus communis,Pear,Miscellaneous,Full sun,Medium,6,7,Medium,NA,Perennial,Hardy,Not applicable.,NA,Not applicable.,Not applicable.,NA,NA,NA,"A deciduous tree grown for it's soft sweet fruit. The fruit are tear drop in shape, and usually have yellow to green skin and white flesh.","Prefer a cold wet climate with a chill period of between 400 and 800 hours at less that 7 °C , and temperatures rarely going above 32°C. New varieties can withstand hotter climates, so choosing your variety for your climate in important."
Diospyros chinensis,Persimmon,Miscellaneous,Full sun,Medium,5.5,6.5,Low,NA,Perennial,Hardy,Not applicable.,NA,Not applicable.,Not applicable.,NA,NA,NA,Also know as the Sharon fruit. These glossy yellow to orange fruits look like tomatoes and grow on trees that can reach 18 meters high.,"An easy to grow tree that, depending on variety, can be grown where temperatures drop to -12°C in winter. American varieties are best for colder climates, where as the Japanese varieties are better suited to milder climates."
Prunus domestica,Plum,Miscellaneous,Full sun,Medium,6,8,Medium to high,"Clay, Loam",Perennial,Hardy,Not applicable.,NA,Not applicable.,Not applicable.,NA,NA,NA,"A sweet fruit that contains a single stone in the centre. Has many uses, from eating raw to preserving and cooking. There are many varieties which also include damsons and greengages.","Choosing the correct variety for your climate and plot size is essential. The plum tree can vary from being less than 2m high and 0.5m wide to over 5m high. Care is not difficult, but pruning and removing dead wood will ensure successful crop."
Punica granatum,Pomagranate,Miscellaneous,Full sun,Medium,5,6,Medium,NA,Perennial,Hardy,Not applicable.,NA,Not applicable.,Not applicable.,NA,NA,NA,A deciduous fruit producing shrub or tree. Fruits have a tough skin filled with many jewel like seeds covered in red gelatinous flesh.,"Can tolerate temperatures down to -12°C, but require lots of heat to ripen the fruit. They can take up to 5 years to produce fruit."
Rubus idaeus,Raspberry,Miscellaneous,Full sun,Medium,5.5,6.5,Low,NA,Perennial,Hardy,Not applicable.,NA,Not applicable.,Not applicable.,NA,NA,NA,"A small soft red fruit containing many seed containing drouplets. Native to many parts of Europe, it is a high value fresh fruit. Other uses include processing for juice, jams and confectionary.","Most varieties are biennial (fruiting on last years canes). In Autumn the old dead canes are removed, excessive new canes are also removed leaving sufficient canes for next years crop."
Ribes rubrum,Redcurrant,Miscellaneous,Full sun,Medium,6,7,Medium,NA,Perennial,Hardy,Not applicable.,NA,Not applicable.,Not applicable.,NA,NA,NA,"Small shiny berries produced on low bushes. They are quite tart when eaten fresh, but their high pectin content make them ideal for making jellies.","Are strong growing plants that will tolerate most conditions, including poor soil and shade. They do however like plenty moisture."
Juglans,Walnut,Miscellaneous,Full sun/partial shade,Medium,5.5,7.5,Medium,NA,Perennial,Hardy,Not applicable.,NA,Not applicable.,Not applicable.,NA,NA,NA,"The wrinkled edible seed of a deciduous tree. They can be eaten once fully ripe, or pickled when picked green.","Trees can be damaged by by spring frosts and wind. Older varieties will take as much as 10 years to produce nuts, but modern varieties can bear nuts in as little as 4 years."
Ribes rubrum,White currant,Miscellaneous,Full sun,Medium,6,7,Medium,NA,Perennial,Hardy,Not applicable.,NA,Not applicable.,Not applicable.,NA,NA,NA,"Small shiny berries produced on low bushes. They are quite tart when eaten fresh, but their high pectin content make them ideal for making jellies..","Are strong growing plants that will tolerate most conditions, including poor soil and shade. They do however like plenty of moisture."
Castanea sativa,Chestnut,Miscellaneous,Full sun,Medium,5.5,6,Medium,NA,Perennial,Hardy,Not applicable.,NA,Not applicable.,Not applicable.,NA,NA,Will not produce fruit if not grown in full sun.,"Some species of chestnut trees can grow to over 60m high, whereas others are more shrubby in nature. The fruit, contained in a spiny capule, has 2 skins. The first is hard and shiny, the second a thinner skin attached to the seed.","Trees can take upto 20 years before producing fruit. Grafted trees will start fruiting sooner. They require deep, well drained, fertile soil."
Lonicera caerulea,Honey Berry,Miscellaneous,Partial shade,Medium,5,7,Medium,NA,Perennial,Very hardy,Not applicable.,NA,Not applicable.,Not applicable.,NA,NA,NA,A fruit bearing member of the honeysuckle family and related to the blueberry. The fruits are used in the same way as most soft fruits. The sweet juicy fruits taste similar to rapberries and blueberries when eaten fresh.,These plants are frost hardy and grow in a range of soil. They are best grouwn in groups to aid polination rate and resulting fruits.
Calendula officinalis,Calendula,Miscellaneous,Full sun/partial shade,Medium,5.5,7,Low,"Chalk, Loam, Sand",NA,Hardy,NA,NA,NA,NA,NA,NA,NA,"Commonly known as a marigold, the bright yellow or orange flowers of this plant have historically been used for medical and culinary purposes in salads, teas, or oil infusions.","Easy to grow and will reseed themselves. They do well in poor, well drained soil and require minimal care once established."
Nepeta cataria,Catnip,Miscellaneous,Full sun,Low,6,7.5,Low,Well drained soil,NA,Hardy,NA,NA,NA,NA,NA,NA,NA,A member of the mint family. Catnip has antibacterial properties and is used to make teas.,"These seeds are tough, and will need slight damage before they will germinate. They will grow in partial shade, but grow much better in full sun. Over fertilising can reduce the potency of their scent and flavour."
Chamaemelum nobile,Chamomile (Roman chamomile),Miscellaneous,Full sun/partial shade,Low,5.5,7.5,Low,"Loam, Chalk, Sand",NA,Hardy,NA,NA,NA,NA,NA,NA,NA,The dried flowers of the chamomile plant contain many terpenoids and flavonoids contributing to the many benefits that it's claimed to help with.,"A creeping, ground covering perennial. It grows best in partial shade, and like most herbs, does best when not fertilised or watered too often."
Valeriana officinalis,Valerian,Miscellaneous,Full sun,Medium,5.5,7,Low,"Sand, Clay, Chalk, Loam",Perennial,Hardy,NA,NA,NA,NA,NA,NA,NA,The root of this plant is used after drying and making into powder. It is claimed that it helps with sleep disorders and depression. The leaves can be used to make tea.,"Will grow in a wide variety of conditions, but prefers to be kept moist in well drained soil. It grows to about 1m-1.5m high, and 0.5m wide."
Symphytum officinale,Comfrey,Miscellaneous,Partial shade,Medium,6,7,Low,"Chalk, Clay, Sand, Loam",Perrenial,Hardy,NA,NA,NA,NA,NA,NA,NA,"There are many uses of comfrey. It has reported healing properties when used as an external dressing, or consumed as a tea. The nutrient rich leaves can be used as a fertiliser.","Comfrey can live for over 20 years, and will thrive in good soil and full sun. Once established, it requires little maintenance, however, mulching with grass cuttings will help to produce more leaves."
Coriandrum sativum,Coriander,Umbelliferae,Full sun,Medium,6,7,Low,"Loam, Chalk, Sand",Annual,Hardy,NA,NA,NA,NA,NA,NA,NA,"This aromatic herb is used in cooking. The whole plant can be eaten, although the leaves and seeds are most often used; the leaves as a herb, and the seeds as a spice.","Keep the soil damp, but not over watered. Dry soil will cause the plants to flower prematurely, or bolt."
Anethum graveolens,Dill,Umbelliferae,Full sun,Medium,5.5,7,Medium,"Loam, Chalk, Sand",Annual,Hardy,NA,NA,NA,NA,NA,NA,NA,A member of the parsley family. This aromatic herb has feathery green leaves which are best used fresh. The seeds are also used as a spice.,Dill does not like to be transplanted. It may require staking to prevent it falling over.
Thymus vulgaris,Thyme,Miscellaneous,Full sun,Low,5.5,7,Low,"Loam, Chalk, Sand",Perennial,Hardy,NA,NA,NA,NA,NA,NA,NA,This is a woody stemmed plant with an abundance of small leaves which are used to flavour dishes.,"Easy to grow, and suitable for rock gardens. After flowering cut back to retain compactness."
Tanacetum parthenium,Feverfew,Miscellaneous,Full sun,Low,6,8,Low,Most soils,Annual/perannial,Hardy,NA,NA,NA,NA,NA,NA,NA,A flowering plant in the daisy family. It is used for its reported medicinal properties - for the treatment of migraines and other ailments.,"Will grow well in most soils, but not in heavy wet soils. Self seeds, remove dead flowers to prevent this."
Armoracia rusticana,Horseradish,Brassicas,Full sun,Medium,5,7.5,Medium,"Loam, Chalk, Sand, Clay",Perennial,Very hardy,NA,NA,NA,NA,NA,NA,NA,"A root vegetable and a member of the mustard family. The green leaves can be eaten, but it is mainly grown for its root, which is used for is pungent flavour, especially in stews.","An easy to look after herb that prefers light, fertile and deep soil. Can be invasive, so is regularly grown in raised beds."
Cymbopogon citratus,Lemon Grass,Miscellaneous,Full sun,High,5,8,Low,Loam,NA,Very tender,NA,NA,NA,NA,NA,NA,NA,"A tall perennial grass used in cooking or infusion. The inner soft parts of the stalks can be used either fresh, or dried.",Can be grown from stalk bought for cooking by placing in water. It likes a warm sunny spot.
Origanum majorana,Marjoram,Lamiaceae,Full sun,Low,6,8,Low,"Loam, Chalk, Sand",Perennial,Hardy,NA,NA,NA,NA,NA,NA,NA,A perennial herb grown for it's aromatic flavours of sweet pine and citrus.,"Requires regular watering, however, be careful of overwatering as the roots can easily rot."
Mentha spicata,Mint,Lamiaceae,Full sun,Low,7,8,Low,"Chalk, Clay, Sand, Loam",Perennial,Very hardy,NA,NA,NA,NA,NA,NA,NA,"A versatile herb which can be used in hot drinks, in salads, and as a mint sauce (traditionally served with roast lamb). Is also an essential ingredient in the mojito cocktail.","An easy to grow herb that will thrive in rich, moisture retentive, deep soil. Mint will spread if not kept in check."
Origanum vulgare,Oregano,Lamiaceae,Full sun,Low,6,7,Low,"Loam, Chalk, Sand",NA,Hardy,NA,NA,NA,NA,NA,NA,NA,A perennial herb grown for it's aromatic flavours of sweet pine and citrus.,"Requires regular watering, however, be careful of overwatering as the roots can easily rot."
Petroselinum crispum,Parsley,Umbelliferae,Full sun/partial shade,Medium,5,7,Medium,Loam,"Biennial, grown as an annual",Hardy,NA,NA,NA,NA,NA,NA,NA,"Extensivly used in cooking, from a garnish to an essential ingredient in some dishes, such as salsa verde.","The seed needs to be soaked in warm water overnight before planting, and can take several weeks to germinate. It can survive cold winters if mulched."
Rosmarinus officinalis,Rosemary,Miscellaneous,Full sun,Low,5,6,Low,"Sand, Clay, Chalk, Loam",Shrub,Hardy,NA,NA,NA,NA,NA,NA,NA,"An evergreen shrub, with fragrant needle shaped leaves used to flavour dishes.","An easy to grow shrub that prefers poor, well drained soil. Is best cultivated from semi-hard wood cuttings."
Salvia officinalis,Sage,Miscellaneous,Full sun,Low,5.5,6.5,Low,"Sand, Chalk, Loam",Perrenial evergreen,Hardy,NA,NA,NA,NA,NA,NA,NA,The soft greyish green leaves are traditionally used in stuffing. They also have reported medicinal properties to help with digestive problems.,"An easy herb to grow that does well in most well drained soils. Trim back in the autumn to encourage new growth, and stop the stems becoming leggy."
Artemisia dracunculus,Tarragon (French),Miscellaneous,Full sun,Low,6.5,7.5,Low,"Loam, Sand",Perennial,Hardy,NA,NA,NA,NA,NA,NA,NA,Tarragon is reported to be one of the top 4 herbs used in French cooking. It has an intense flavour that is a unique blend of sweet aniseed and mild vanilla. It is essential ingredient in Béarnaise sauce.,"Does not set viable seed, so buying young plants, or taking cuttings is required. Trim back in autumn to encourage new growth and stop the stems becoming leggy."
Fragaria ananassa,Strawberry,Miscellaneous,Full sun,Medium,5.5,6.5,Medium,Loam,Semi-evergreen perrenial,Hardy,NA,NA,NA,NA,NA,NA,NA,"A soft fruit that is cultivated world wide, and appreciated for its characteristic aroma and sweetness. It is eaten fresh, used for making preserves, juices, and many other dishes.","Requires fertile, moist but well drained soil. Planting through polythene, or applying straw keeps the berries clean. This is an ideal plant to grow in containers as this will allow the berries to mature away from moist soil."
Melissa officinalis,Lemon balm,Miscellaneous,Full sun,Medium,6,7.5,low,"Chalk, Clay, Sand, Loam",Perennial,Very hardy,NA,NA,NA,NA,NA,NA,NA,"A member of the mint family, the leaves have a mild lemon sent. It is used to add flavour, or as an infusion in a hot drink.","Will grow in any moisture retentive soil, but will need protected from excessive moisture over the winter."
