taxonomic_name,common_name,cultivation,sunlight,water,preferred_ph_lower,preferred_ph_upper,nutrients,soil,season,temperature_class,temperature_germination,temperature_growing,days_germination,days_harvest,nutritional_info,energy,sensitivities,description,requirements
Allium cepa,Onion (Autumn planted),Allium,Full sun/partial shade,Medium,6,7,Medium,"Loamy, clay and sandy",NA,Hardy,24,NA,6,90-130,NA,NA,NA,Onion is a multi layered bulb which has a sharp pungent flavour. Used raw in salad or cooked to add flavour to dishes.,"Onions can be grown from either seed or a set (small bulb). They are easy to grow and can be planted in the spring, or autumn in most soil types."
Allium fistulosum,Onions (Perennial),Allium,Full sun/partial shade,Medium,6,7,Low,Loamy and sandy,NA,Very hardy,24,NA,6,60 -,NA,NA,NA,"These plants don’t develop bulbs, but have hollow leaves with the distinctive taste of onion. Seeds can also be used as sprouts.","Easy to grow, and only require watering when dry, and feed occasionally. Will grow in most climates."
Allium cepa,Onions (Red),Allium,Full sun/partial shade,Medium,6,7,Medium,"Loamy, clay and sandy",NA,Very hardy,24,NA,6,90-130,NA,NA,NA,Onion is a multi layered bulb which has a sharp pungent flavour. Used raw in salad or cooked to add flavour to dishes.,"Onions can be grown from either seed or a set (small bulb). They are easy to grow and can be planted in the spring, or autumn in most soil types."
Pastinaca sativa,Parsnip,Umbelliferae,Full sun/partial shade,Medium,5.5,7.5,Low,NA,NA,Half hardy,18,10-21,14,80-120,NA,NA,NA,"Closely related to the carrot, and grown for it's swollen root. Becomes sweeter after a frost.","Will grow in most soils, but do best in light rich soils which are stone free."
Capsicum annuum (Grossum group),Bell Pepper,Solanaceae,Full sun/partial shade,Medium,5.5,7,High,Loamy and silty,NA,Tender,30,17-35,8,60-80,NA,31,NA,"Bell or Sweet Peppers come in many different colours, sizes and flavours. They are all categorized by their rating on the Scoville Scale - the standard for describing hotness. Sweet peppers have a rating or 0 or 1 and placed in the Grossum group.","Sweet pepper grows as an annual in well drained soil, but be sure to maintain adequate moisture either with mulch or plastic covering. They are also heat sensitive (above 30ºC), so mulching during the summer months helps keep the soil temperature down."
Solanum tuberosum,Potatoes (Early),Solanaceae,Full sun,Medium,4.5,6,Low,"Well-drained, fertile and high in organic matter. Loamy and clay",NA,Tender,NA,7-26,NA,90-115,NA,NA,NA,"A versatile tuber which is high in starch and a staple ingredient in many meals. Comes in many different varieties, with different cooking properties. Some suited to frying, others to boiling.",Plant once soil temperatures are above 7°C. Potatoes are planted in ridges with the soil drawn up round the stems to protect the swelling tubers from sunlight.
Solanum tuberosum,Potatoes (Main crop),Solanaceae,Full sun,Medium,4.5,6,Low,"Well-drained, fertile and high in organic matter. Loamy and clay",NA,Tender,NA,7-26,NA,100-115,NA,NA,NA,"A versatile tuber which is high in starch and a staple ingredient in many meals. Comes in many different varieties, with different cooking properties. Some suited to frying, others to boiling.",Plant once soil temperatures are above 7°C. Potatoes are planted in ridges with the soil drawn up round the stems to protect the swelling tubers from sunlight.
Portulaca oleracea,Purslane,Miscellaneous,Full sun/partial shade,Low,5.5,7,Low,"Loamy, sandy and silty",NA,Hardy,32,NA,NA,40-100,NA,NA,NA,"Purslane is an annual succulent that is eaten either fresh as a salad, or cooked similar to spinach. Its flavour is slightly sour and salty.","Purslane is a fast-growing annual with succulent leaves and stems, often considered a weed. Will grow in any soil, and does best in warm weather with regular water."
Chenopodium quinoa,Quinoa,Miscellaneous,Full sun,Low,6,7,Low,"Well-drained, fertile and loamy",NA,Tender,18-24,15-20,4,90-120,NA,NA,NA,"Mainly grown for it's seeds which are cooked like rice. The outer coating of the seed is bitter in taste and requires removing. Quinoa is also gluten free, and high in protein.","Quinoa is a cool season crop that requires full sun. Described as disease-free and drought-tolerant, they thrive in rich and well drained soil. Once established, they produce abundant harvests under dry conditions."
Raphanus raphanistrum (subsp. sativus),Radish,Brassica,Full sun/partial shade,Medium,6,7,Low,"Loamy, clay and sandy",NA,Half hardy,30,NA,4,25-50,NA,NA,NA,This swollen root is a crunchy salad vegetable with a sharp sweet flavour.,"A cool season crop which is fast to mature and easy to grow. Requires full sun and moisture. Can be grown as a 'catch crop' between rows of slower maturing vegetables, or as a row marker in slow to germinate crops."
Rheum rhabarbarum,Rhubarb,Miscellaneous,Full sun/partial shade,Medium,5.5,7,Low,NA,perennial,Hardy,21,24,7,x,NA,NA,NA,"The crisp sharp flavoured stalks of this perennial can be eaten raw, but normally cooked with sugar and prepared similar to fruit. The large leaves are not eaten as they contain oxalic acid that can cause poisoning.",Rhubarb prefers an open sunny site with well drained soil. Do not allow the crowns to be covered as they are prone to rotting.
Brassicaceae eruca sativa,Rocket,Brassica,Full sun/partial shade,Medium,6,7,Low,NA,NA,Half hardy,18-22,NA,6,40-90,NA,NA,NA,An edible herb which is used as a leafy salad vegetable. Also used in cooking due to it's strong peppery flavour.,"Plants prefer some shade to keep the leaves tender, and keeping the soil moist and the plants growing will prevent them going to seed. Can be sown throughout the spring and summer for continual cropping."
Tragopogon porrifolius,Salsify,Miscellaneous,Full sun,Medium,6,7.5,Low,Loamy and sandy,NA,Half hardy,21,NA,6,120-,NA,NA,NA,"Used in a similar way to other root vegetables (mashed, boiled or roasted). This creamy fleshed taproot with its oyster like taste makes a welcome change.",An easy slow growing cool weather plant that likes loose rich soil. The edible roots will become fibrous if watering is not even and adequate.
Scorzonera hispanica,Scorzonera (Black salsify),Miscellaneous,Full sun,Medium,6,7,Low,Loamy and sandy,NA,Hardy,21,NA,6,120-,NA,NA,NA,"Used in a similar way to other root vegetables (mashed, boiled or roasted). This creamy fleshed taproot with its oyster like taste makes a welcome change.",An easy slow growing cool weather plant that likes loose rich soil. The edible roots will become fibrous if watering is not even and adequate.
Allium cepa (var. aggregatum),Shallots,Allium,Full sun,Medium,6,7,Low,Loamy,NA,Very hardy,24,NA,21,90-,NA,NA,NA,"Similar to onions, but are smaller and grow in clumps.","Easy to grow and will do well in any well-drained fertile soil. They do not require much attention, but will need a long growing period and a sunny position. Water when weather is dry, and remove flowers as soon as possible."
Rumex acetosa,Sorrel,Miscellaneous,Full sun/partial shade,Medium,5.5,7,Medium,Well drained,NA,Very hardy,20,NA,7,60-,NA,NA,NA,"Sorrel is a sour tasting leafy herb used raw in salads, or used as a herb in cooking.","This perennial plant grows well in a lightly shaded spot, do not allow to dry out. Established plants can be divided."
Glycine max,Soybean,Legume,Full sun,Medium,6,7,Medium,NA,NA,Half hardy,24,NA,NA,90-100,NA,NA,NA,"When to harvest soybean will depend on how you want use the crop. When green they can be cooked and used as vegetables, when the mature and turn brown they can be harvested and stored dry.",Soya is a warm climate plant requiring temperatures of 20-30°C over the growing season. They will also require space as they can grow up to 1.2m high.
Spinacia oleracea,Spinach,Chenopodiaceae,Full sun/partial shade,Medium,6,7.5,Medium,Loamy,NA,Half hardy,21,NA,5,50-65,NA,NA,NA,The green leafs of the spinach plant can be eater raw in salads or cooked as a side dish or as an ingredient for cooking.,Prefers a sunny or slightly shaded plot with moisture retentive soil. Plants will need 30cm spacing and feeding with high nitrogen fertiliser ever 2 weeks.
Tetragonia tetragonioides,Spinach (New Zealand),Miscellaneous,Full sun/partial shade,Medium,6.5,7,Low,NA,NA,Tender,NA,15-24,10-20,55-65,NA,NA,NA,"Used in the same way as spinach, but the leaves are smaller.",Prefers warmer weather than regular spinach. Although drought resistant retaining soil moisture maintains full growth potential.
Beta vulgaris (subsp.cicla),Spinach (Perpetual),Chenopodiaceae,Full sun/partial shade,Medium,6,7,Low,NA,NA,Very hardy,30,NA,4,30-45,NA,NA,NA,"Used in the same way as spinach, but will tolerate dryer conditions and not run to seed.","Easier to grow and more vigorous than true spinach. It likes well worked well drained soil with a high organic content, but will still do well in shadier areas with poor soil."
Allium cepa (var. aggregatum),Spring Onion / Scallions,Allium,Full sun/partial shade,Medium,6,7,Low,NA,NA,Very hardy,24,NA,6,60-,NA,NA,NA,Spring onion have a mild flavour ideal for using in salads or in dishes where onion would be overpowering.,"Can be sown directly where they are to be grown, but ensure the plot has not been freshly manured. Keep well watered."
Cucurbita pepo,Squash (Summer),Cucurbit,Full sun,Medium,6,7,High,Loamy,NA,Tender,35,10-32,4,45-75,NA,NA,NA,"Summer squashes are harvested when immature and the outer skin is still soft and edible. Unlike winter squash, these do not store well.","Summer squash likes a sunny, sheltered position in a soil that is humus rich and moisture retentive. They will require a large area to spread (120cm) and not compete with other plants."
Cucurbita maxima,Squash (Winter),Cucurbit,Full sun,Medium,5.5,7,High,NA,NA,Tender,35,10-32,5,85-120,NA,NA,NA,These vegetables have solid orange flesh that is ideal for many methods of cooking. They also store well.,"Winter squash likes a sunny, sheltered position in a soil that is humus rich and moisture retentive. They will require a large area to spread (120cm) and not compete with other plants."
Brassica napus,Swede / Rutabaga,Brassica,Full sun/partial shade,Medium,5.5,7,Low,NA,NA,Hardy,26,NA,4,80-100,NA,NA,NA,The yellow flesh of the swede is sweeter and milder than the turnip and is traditionally served mashed with potato and haggis in Scotland.,This frost tolerant hardy plant is easy to grow and thrives in most soil types. It can be left in the ground over winter and harvested as required.
Ipomoea batatas,Sweet Potato,Miscellaneous,Full sun,Medium,5.5,6,Medium,"Loamy, sandy and silty",NA,Half hardy,NA,21-26,NA,100-125,NA,NA,NA,"A starchy sweet tasting root vegetable that is best backed, roasted or mashed.",Sweet potatoes are grown from 'slips' which must be hydrated in water before planting. They need full sun and high temperatures to provide good yields.
Zea mayvar. Saccharata,Sweetcorn,Miscellaneous,Full sun,High,6,7,Low,Loamy and clay,NA,Tender,30,16-35,3,70-100,NA,NA,NA,"Sweet corn is a variety of maize which is high in sugar and harvested while immature, at this stage it is considered a vegetable and used cooked. At this stage of maturity it does not store well so should be eaten fresh.","Sweet corn is most successful in long hot summers. As they are wind pollinated they should be grown in blocks not rows. Prefers moist well fertilised soil . Corn is ready when the tassels turn brown, and the juice from the kernels is milky."
Beta vulgari (subsp. vulgaris),Swiss Chard,Chenopodiaceae,Full sun/partial shade,Medium,6,7.5,Low,Loamy and clay,NA,Very hardy,30,NA,4,50-60,NA,NA,NA,Swiss chard is leafy green vegetable. Often the stalk is separated from the leaf and prepared separately.,Grows best in a sunny position in rich soil that is free draining and moisture retentive. One sowing will provide a crop that will last many months.
Brassica rapa (subsp. narinosa),Tatsoi,Brassica,Full sun,Medium,6,7.5,Medium,Loamy soil,NA,Very hardy,NA,NA,4,45-60,NA,NA,NA,"These small, spoon-shaped leaves look similar to spinach only grow to a few cms high. They have a mild mustard-like flavour and are used raw in salads or cooked.","A low growing annual, Tatsoi plants thrive in cool weather, and tolerates light frost which can trigger bolting if exposed in spring, but later can improve tatsoi's flavour, and can be harvested out from under a snowfall."
Solanum lycopersicum (var. cerasiforme),Tomato (Cherry),Solanum,Full sun,Medium,5.5,7.5,high,Loamy soil,NA,Tender,26,16-30,6,65-85,NA,NA,NA,"The tomato is one of the most versatile fruit. Eaten raw in salads, the base of many sauces. It comes in many sizes from small cherry, to large frit that fill your hand.","Tomatoes are not hardy, so don’t expose the plants to frost, cold winds and draughts. Seedlings are best kept at 18°C. They require a lot of watering and are hungry plant."
Solanum lycopersicum,Tomato (Regular),Solanum,Full sun,Medium,5.5,7.5,High,Loamy,NA,Tender,26,16-30,6,65-85,NA,NA,NA,"The tomato is one of the most versatile fruit. Eaten raw in salads, the base of many sauces. It comes in many sizes from small cherry, to large frit that fill your hand.","Tomatoes are not hardy, so don’t expose the plants to frost, cold winds and draughts. Seedlings are best kept at 18°C. They require a lot of watering and are hungry plant."
Vicia faba,Winter Field Beans,Legume,Full sun,Very low,6,7,Medium,NA,NA,Hardy,10,NA,NA,90-180,NA,NA,NA,"Winter Beans are an incredibly generous green manure, providing a very cost-effective means of giving your soil a boost.",Sown in autumn they can also limit the effect of rain on otherwise bare soil. A cool-season annual that can tolerate heavy frost.
Pisum sativum (subsp. arvense (L.) Asch),Winter Peas,Legume,Full sun,Low,6,7,Medium,NA,NA,Very hardy,NA,NA,NA,NA,NA,NA,NA,"Field peas are an incredibly generous green manure, providing a very cost-effective means of giving your soil a boost.","Sown in autumn they can also limit the effect of rain on otherwise bare soil. A cool-season annual, that can tolerate heavy frost."
Ocimum basilicum,Basil,Lamiaceae,Full sun,high,5.5,6.5,Low,"Loam, Sand",NA,Very tender,NA,NA,NA,NA,NA,NA,NA,"A fragrant, easy to grow warm weather leafy herb, that used extensively in Italian dishes.","For best results plant outside once soil is over 20oC. Basil likes moisture, so mulching in hot weather will help retain moisture. Remove flowers as they appear to keep plants productive."
Laurus nobilis,Bay,Miscellaneous,Full sun,Low,5.5,6.5,Low,"Chalk, Clay, Sand, Loam",NA,Hardy,NA,NA,NA,NA,NA,NA,NA,The fragrant leaves of this evergreen tree or shrub are used as a seasoning.,"An attractive and ornamental plant with fragrant leaves, best planted once all danger of frost has passed."
Borago officinalis,Borage,Miscellaneous,Full sun,Medium,5.5,6.5,Low,"Chalk, Clay, Sand, Loam",NA,Hardy,NA,NA,NA,NA,NA,NA,NA,A fast growing annual that produces star shaped blue flowers. The leaves are used to made a hot water infusion.,An easy to grow annual that will thrive in poor soil. It requires a sunny spot and regular watering.
Capsicum chinense,Bonnet Pepper,Solanaceae,Full sun,Medium,7,8.5,Medium,Rich Moist soil,NA,Tender,NA,NA,NA,NA,NA,NA,NA,A chili pepper with a very high Scoville heat unit score.,"Resistant to high temperatures. They like high temperatures with lots of light, and are easily damaged by cold spells of weather."
Matricaria recutita,Chamomile (German chamomile),Miscellaneous,Full sun/partial shade,Low,5.5,7.5,low,"Loam, Chalk, Sand",NA,Hardy,NA,NA,NA,NA,NA,NA,NA,The dried flowers of the chamomile plant contain many terpenoids and flavonoids contributing to the many benefits that it's claimed to help with.,"This upright annual grows best in partial shade, and like most herbs, does best when it is not fertilised or watered too often."
Prunus dulcis,Almond,Miscellaneous,Full sun,Medium,6,7,Medium,Sandy Loam,Perennial,Tender,Not applicable.,NA,Not applicable.,Not applicable.,NA,NA,Suseptable to spring frosts.,"Almond trees have been cultivated for 1000's of years, their fruits are used for making baked goods, confectionary and oil.","Few varieties are self fertile, so require two or more trees for cross pollination and fruit production. They prefer dry hot summers and mild wet winters. Can take up to 8 years to fruit, and will live over 50 years."
Malus,Apple,Miscellaneous,Full sun,Medium,6,7.5,Medium,Loamy,Perennial,Hardy,Not applicable.,NA,Not applicable.,Not applicable.,NA,NA,NA,"A sweet edible fruit which is eaten raw, cooked or juiced. The most widely cultivated fruit tree world wide, with a vast range of tree sizes.","There are thousands of difference varieties that generally fall in to either cooking apples, or dessert apples (for eating). Require little care, but ""chill hours"" are required to set fruit. More than one tree is needed to allow cross pollination."
Prunus armeniaca,Apricot,Miscellaneous,Full sun,Medium,6.5,8,Medium,NA,Perennial,Hardy,Not applicable.,NA,Not applicable.,Not applicable.,NA,NA,"New varieties can be grown in cooler climates, but the blossem must be protected from frost over night.","A relative of the plum, nectarine and peach. The fruit from these trees range in colour from pale yellow to dark orange. They have a soft velvety skin, and soft flesh covering a large kernel.","In warmer climates trees can be freestanding. In cooler climates they are best grown on a warm, sheltered, south facing wall."
Rubus fruticosus agg.,Blackberry,Miscellaneous,Full sun,Medium,6,7,Low,Sandy,Perennial,Very hardy,Not applicable.,NA,Not applicable.,Not applicable.,NA,NA,NA,"Also known as a bramble, the dark almost black fruits comprise of juice filled sweet drouplets. They are traditionally grown along wires, but can also be trained to cover arches and trellis.","Blackberries are vigorous growers and require regular pruning. However as the fruit is produced on last years growth, only prune back the canes once fruiting is finished, then tie back the new canes for next year."
Ribes nigrum,Blackcurrant,Miscellaneous,Full sun,Medium,6,7,Medium,NA,Perennial,Very hardy,Not applicable.,NA,Not applicable.,Not applicable.,NA,NA,NA,"Blackcurrants are woody shrubs that produce fruits high in vitamin C. They can be eaten raw, but are normally used for jams, or as an ingredient in both sweet and savoury dishes. Most blackcurrsts grown commetially are used for making juice.","Fruit is produced on new growth, so old wood or weak shoots should be removed during dormancy. They are easy to grow, but prefer well drained soil in full sun."
Vaccinium corymbosum,Blueberry,Miscellaneous,Full sun,Medium,5,6,Medium,NA,Perennial,Hardy,Not applicable.,NA,Not applicable.,Not applicable.,NA,NA,NA,"Regarded as a super fruit, these ornamental shrubs produce large quantities of fruit once established. The fruit is sweet and varies in size from 5mm to 16mm.","Requires a soil pH of 5.5 or lower. These shrubs require an acidic soil, and will not grow well in the wrong type of soil. They also crop better when planted with another variety."
Prunus avium,Cherry,Miscellaneous,Full sun,Medium,6,7,Medium,NA,Perennial,Hardy,Not applicable.,NA,Not applicable.,Not applicable.,NA,NA,NA,"As a member of the genus Prunus, it is a fleshy stoned fruit. Cherries range in colour from a light red to deep purple. The sweet varieties are used fresh, cooked, and for juice, while the smaller sour varieties tend to be used for preserves.","Most varieties are not self fertilising, so you will require 2 or 3 trees. They will take about 4 years to bear fruit and require deep, well drained soil."
Vaccinium corymbosum,Cranberry,Miscellaneous,Full sun/partial shade,High,5,6,Medium,NA,Perennial,Hardy,Not applicable.,NA,Not applicable.,Not applicable.,NA,NA,NA,"These evergreen dwarf shrubs, or trailing vines, have slender wiry stems. The fruit are larger than the leaves, and are red when ripe. Used for making juice, sauce and jam due to the acidic taste. Cranberry sauce is traditionally served with turkey.","Requires a soil pH of 5.5 or lower to thrive, and prefers to be very moist, boggy soil. Can take up to 3 years to fruit, but can last for decades."
Ficus carica,Fig,Miscellaneous,Full sun/partial shade,Medium,6,6.5,High,All soil types,Perennial,Hardy,Not applicable.,NA,Not applicable.,Not applicable.,NA,NA,NA,"A small tree/large shrub that produces soft sweet fruit that can be used fresh, dried and preserved.","Requires warmth and sun. They thrive in long hot summers, but can also be grown in containers allowing them to be moved indoors over winter."
Ribes grossularia,Gooseberry,Miscellaneous,Full sun,Medium,6,7,Medium,NA,Perennial,Hardy,Not applicable.,NA,Not applicable.,Not applicable.,NA,NA,NA,"An easy to grow soft fruit. The sometimes spiny, translucent fruits grow on small thorny bushes. The varieties range in colour from yellow through to black. Some are quite tart and more suited to cooking and preserving.","Gooseberries thrive in cold winters and warm summers, and can tolerate a shaded space. They prefer a well drained soil containing plenty natural nutrients in the form of well rotted organic matter."
Vitis vinifera,Grape,Miscellaneous,Full sun,Medium,6,7,Medium,NA,Perennial,Hardy,Not applicable.,NA,Not applicable.,Not applicable.,NA,NA,NA,This sweet versatile fruit grows in large clusters on a vine. They are predominantly grown for eating fresh and making wine.,"The vines like deep free draining soil, and plenty summer sunshine for the fruits to ripen. They require support to grow upwards."
Corylus avellana,Hazel,Miscellaneous,Full sun/partial shade,Medium,6.5,7.5,Medium,"Loamy, sandy",Perennial,Hardy,Not applicable.,NA,Not applicable.,Not applicable.,NA,NA,NA,"A small tree or shrub grown for it's hard shelled nuts. Is suited to growing in a garden, producing pretty catkins in the spring and nuts in the autumn.","Are best grown in temperate climates, as hazel trees cannot tolerate long dry seasons or high heat. In the correct climate they are an easy nut to grow, not taking up too much space. As they are wind pollinated, they prefer an open site."
Humulus lupulus,Hops,Miscellaneous,Full sun,Medium,6.5,8,High,NA,Perennial,Hardy,Not applicable.,NA,Not applicable.,Not applicable.,NA,NA,NA,"Hops are the flowers, or seed cones used to flavour beer. Hey are ready for harvest when the cones feel papery and leave a yellow powder when touched. Different varieties taste different, allowing brewers to create particular flavours and aromas.","Although hops are easy to grow, they are day length sensitive and best grown between 35 and 55 degree latitudes. They require a period of winter chilling. Prune all growth in late autumn to early winter."
Actinidia callosa,Kiwi,Miscellaneous,Full sun,Medium,5.5,7,Medium,NA,Perennial,Hardy,Not applicable.,NA,Not applicable.,Not applicable.,NA,NA,NA,"A deciduous climbing plant that's vigorous growth requires plenty of room. The fruits have a light brown textured skin, with lime green flesh on the inside. They are high in vitamin C and generally eaten raw.","Young shoots are extremely vulnerable to frost damage and will require protection in the spring. In mild climates these can be grown in the open, in cooler climates they are best grown on a sheltered west or south facing wall."
Citrus limon,Lemon,Miscellaneous,Full sun,Medium,5.5,7,Medium,NA,Perennial,Tender,Not applicable.,NA,Not applicable.,Not applicable.,NA,NA,NA,"The lemon is an acidic fruit produced by a small evergreen tree. The yellow citrus fruits are native to Asia, and are grown predominantly for their juice, and the rind (which the aromatic oils are extracted from).",All citrus trees require a mild climate and plenty of sun. At temperatures below13°C they will go into dormancy.
Citrus aurantiifolia,Lime,Miscellaneous,Full sun,Medium,5.5,7,Medium,NA,Perennial,Tender,Not applicable.,NA,Not applicable.,Not applicable.,NA,NA,NA,"A citrus fruit ideal for adding flavour to drinks. It is a hybrid fruit consisting of several species: Persian Lime, Desert Lime, Kaffier Lime and Key Lime (C. aurantifolia).","Ensure that it is planted in well draining soil, as limes will not tolerate standing water, nor will they tolerate temperatures below 10°C."
Rubus loganobaccus,Loganberry,Miscellaneous,Full sun/partial shade,Medium,5.5,7,Medium,NA,Perennial,Hardy,Not applicable.,NA,Not applicable.,Not applicable.,NA,NA,NA,"A cross between a raspberry and a blackberry, producing a larger and darker fruit than the raspberry. A very sweet fruit which is ideal for eating raw , using in baking and preserving.","A vigorous plant that requires maintenance. The fruit is produced on last years growth. Only prune back the canes once fruiting is finished, then tie back the new canes for next years fruit."
Prunus persica var. nucipersica,Nectarine,Miscellaneous,Full sun,Medium,5.5,7,Medium,NA,Perennial,Hardy,Not applicable.,NA,Not applicable.,Not applicable.,NA,NA,NA,"A smoothed skinned subspecies of the peach. The nectarine has soft sweet flesh that easily bruises. Eaten fresh, cooked or preserved.","Peach and nectarine trees require warmth and sun, as well as a chill period of 600-900 hours at less than 7°C. They are a semi-hardy, surviving in climates where temperatures drop to -20°C, but require warm summers to produce fruit."
Citrus reticulata,Orange,Miscellaneous,Full sun,Medium,5.5,7,Medium,NA,Perennial,Tender,Not applicable.,NA,Not applicable.,Not applicable.,NA,NA,NA,"A sweet citrus fruit grown for eating fresh, processing, and it's fragrant peel. A hybrid between a pomelo and a mandarin, it the most widely grown fruit tree in the world.","All citrus trees require a mild climate and plenty of sun. At temperatures of under 13 degrees celcius they will go into dormancy. They can take a few years to bear fruit, and during this time will require regular fertiliser to encourage growth."
