Artist ,Album,Title ,Lyrics
Taylor Swift ,Taylor Swift ,Tim McGraw,"He said the way my blue eyes shinx
Put those Georgia stars to shame that night
I said: ""That's a lie.""
Just a boy in a Chevy truck
That had a tendency of gettin' stuck
On back roads at night
And I was right there beside him all summer long
And then the time we woke up to find that summer had gone
But when you think ""Tim McGraw""
I hope you think my favorite song
The one we danced to all night long
The moon like a spotlight on the lake
When you think happiness
I hope you think ""that little black dress""
Think of my head on your chest
And my old faded blue jeans
When you think Tim McGraw
I hope you think of me
September saw a month of tears
And thankin' God that you weren't here
To see me like that
But in a box beneath my bed
Is a letter that you never read
From three summers back
It's hard not to find it all a little bitter sweet
And lookin' back on all of that, it's nice to believe
But when you think ""Tim McGraw""
I hope you think my favorite song
The one we danced to all night long
The moon like a spotlight on the lake
When you think happiness
I hope you think ""that little black dress""
Think of my head on your chest
And my old faded blue jeans
When you think Tim McGraw
I hope you think of me
And I'm back for the first time since then
I'm standin' on your street
And there's a letter left on your doorstep
And the first thing that you'll read
Is when you think ""Tim McGraw""
I hope you think my favorite song
Someday you'll turn your radio on
I hope it takes you back to that place
When you think happiness
I hope you think ""that little black dress""
Think of my head on your chest
And my old faded blue jeans
When you think Tim McGraw
I hope you think of me
Oh, think of me
Mmm
You said the way my blue eyes shined
Put those Georgia stars to shame that night
I said, ""That's a lie.""
"
Taylor Swift ,Taylor Swift ,Picture to Burn,"State the obvious, I didn't get my perfect fantasy
I realize you love yourself more than you could ever love me
So go and tell your friends that I'm obsessive and crazy
That's fine, you won't mind if I say
By the way
I hate that stupid old pickup truck you never let me drive
You're a redneck heartbreak who's really bad at lying
So watch me strike a match on all my wasted time
As far as I'm concerned, you're just another picture to burn
There's no time for tears
I'm just sitting here planning my revenge
There's nothing stopping me
From going out with all of your best friends
And if you come around saying sorry to me
My daddy's gonna show you how sorry you'll be
'Cause I hate that stupid old pickup truck you never let me drive
You're a redneck heartbreak who's really bad at lying
So watch me strike a match on all my wasted time
As far as I'm concerned, you're just another picture to burn
And if you're missing me, you'd better keep it to yourself
'Cause coming back around here would be bad for your health
'Cause I hate that stupid old pickup truck you never let me drive
You're a redneck heartbreak who's really bad at lying
So watch me strike a match on all my wasted time
In case you haven't heard
I really, really hate that
Stupid old pickup truck you never let me drive
You're a redneck heartbreak, who's really bad at lying
So watch me strike a match on all my wasted time
As far as I'm concerned, you're just another picture to burn
Burn, burn, burn, baby, burn
You're just another picture to burn
Baby, burn
"
Taylor Swift ,Taylor Swift ,Teardrops on my Guitar ,"Drew looks at me,
I fake a smile so he won't see,
What I want, what I need,
And everything that we should be,
I'll bet she's beautiful,
That girl he talks about,
And she's got everything that I've had to live without,
Drew talks to me,
AndI laugh 'cause it's just so funny,
That I can't even see
Anyone when he's with me,
He says he's so in love,
He's finally got it right,
I wonder if he knows he's all I think about at night,
He's the reason for the teardrops on my guitar,
The only thing that keeps me wishing on a wishing star,
He's the song in the car I keep singing, don't know why I do
Drew walks by me,
Can he tell that I can't breathe?
And there he goes so perfectly,
The kind of flawless I wish I could be,
She better hold him tight,
Give him all her love,
Look in those beautiful eyes,
And know she's lucky 'cause,
He's the reason for the teardrops on my guitar,
The only thing that keeps me wishing on a wishing star,
He's the song in the car I keep singing, don't know why I do
So I'll drive home alone,
As I turn out the light,
I'll put his picture down,
And maybe get some sleep tonight,
He's the reason for the teardrops on my guitar,
The only one who's got enough of me to break my heart,
He's the song in the car I keep singing, don't know why I do
He's the time taken up,
But there's never enough,
And he's all the I need to fall into,
Drew looks at me,
I fake a smile so he won't see.
"
Taylor Swift ,Taylor Swift ,A Place in This World ,"I don't know what I want, so don't ask me
'Cause I'm still trying to figure it out
Don't know what's down this road
I'm just walking
Trying to see through the rain coming down
Even though I'm not the only one, who feels
The way I do
I'm alone, on my own
And that's all I know,
I'll be strong, I'll be wrong
Oh, but life goes on
Oh, I'm just a girl
Trying to find a place in this world
Got the radio on, my old blue jeans
And I'm wearing my heart on my sleeve
Feeling lucky today, got the sunshine
Could you tell me what more do I need?
And tomorrow's just a mystery, oh yeah
But that's okay
I'm alone, on my own
And that's all I know,
I'll be strong, I'll be wrong
Oh, but life goes on
Oh, I'm just a girl
Trying to find a place in this world
Maybe I'm just a girl on a mission
But I'm ready to fly
I'm alone, on my own
And that's all I know
Oh, I'll be strong, I'll be wrong
Oh, but life goes on
Oh, I'm alone, on my own
And that's all I know
Oh, I'm just a girl
Trying to find a place in this world
Oh, I'm just a girl
Oh, I'm just a girl, oh, oh
Oh, I'm just a girl
"
Taylor Swift ,Taylor Swift ,Cold As You ,"You have a way of coming easily to me
And when you take, you take the very best of me
So I start a fight 'cause I need to feel somethin'
And you do what you want 'cause I'm not what you wanted
Oh, what a shame
What a rainy ending given to a perfect day
Just walk away
Ain't no use defending words that you will never say
And now that I'm sittin' here thinkin' it through
I've never been anywhere cold as you
You put up the walls and paint them all a shade of gray
And I stood there loving you, and wished them all away
And you come away with a great little story
Of a mess of a dreamer with the nerve to adore you
Oh, what a shame
What a rainy ending given to a perfect day
Just walk away
Ain't no use defending words that you will never say
And now that I'm sittin' here thinkin' it through
I've never been anywhere cold as you
You never did give a damn thing, honey
But I cried, cried for you
And I know you wouldn't have told nobody if I died, died for you
Died for you
Oh, what a shame
What a rainy ending given to a perfect day
Oh, every smile you fake is so condescending
Countin' all the scars you've made
Now that I'm sittin' here thinkin' it through
I've never been anywhere cold as you
"
Taylor Swift ,Taylor Swift ,The Outside,"I didn't know what I would find
When I went lookin' for a reason I know
I didn't read between the lines
And, baby, I've got nowhere to go
I tried to take the road less traveled by
But nothin' seems to work the first few times
Am I right?
So how can I ever try to be better?
Nobody ever lets me in
And I can still see you; this ain't the best view
On the outside, lookin' in
I've been a lot of lonely places
I've never been on the outside
You saw me there, but never knew
That I would give it all up to be
A part of this, a part of you
And now it's all too late, so you see
You could have helped if you had wanted to
But no one notices until it's too late to do anything
How could I ever try to be better?
Nobody ever lets me in
And I can still see you; this ain't the best view
On the outside, lookin' in
I've been a lot of lonely places
I've never been on the outside
Oh, yeah
How can I ever try to be better?
Nobody ever lets me in
And I can still see you; this ain't the best view
On the outside, lookin' in
I've been a lot of lonely places
I've never been on the outside
Oh, oh
Oh, oh,
Oh, oh
Oh, oh
Oh, oh
"
Taylor Swift ,Taylor Swift ,Tied Together With A Smile ,"Seems the only one who doesn't see your beauty
Is the face in the mirror looking back at you
You walk around here thinking you're not pretty
But that's not true 'cause I know you
Hold on, baby; you're losing it
The water's high, you're jumping into it
And letting go, and no one knows
That you cry; but you don't tell anyone
That you might not be the golden one
And you're tied together with a smile
But you're coming undone
I guess it's true that love was all you wanted
'Cause you're givin' it away like it's extra change
Hoping it will end up in his pocket
But he leaves you out like a penny in the rain
Oh, 'cause it's not his price to pay
It's not his price to pay
Hold on, baby; you're losing it
The water's high, you're jumping into it
And letting go, and no one knows
That you cry; but you don't tell anyone
That you might not be the golden one
And you're tied together with a smile
But you're coming undone
Hold on, baby; you're losing it
The water's high, you're jumping into it
And letting go, and no one knows
That you cry; but you don't tell anyone
That you might not be the golden one
And you're tied together with a smile
But you're coming undone
You're tied together with a smile
But you're coming undone, oh
Goodbye, baby
With a smile, baby, baby
"
Taylor Swift ,Taylor Swift ,Stay Beautiful ,"Cory's eyes are like a jungle
He smiles; it's like the radio
He whispers songs into my window
In words that nobody knows
There's pretty girls on every corner
They watch him as he's walking home
Saying, does he know
Will you ever know?
You're beautiful
Every little piece, love; don't you know?
You're really gonna be someone
Ask anyone
And when you find everything you've looked for
I hope your love leads you back to my door
Oh, but if it don't, stay beautiful
Cory finds another way to be
The highlight of my day
I'm taking pictures in my mind
So I can save them for a rainy day
It's hard to make a conversation
When he's taking my breath away
I should say ""hey, by the way
You're beautiful
Every little piece, love; don't you know?
You're really gonna be someone
Ask anyone
And when you find everything you've looked for
I hope your love leads you back to my door
Oh, but if it don't, stay beautiful
If you and I are a story
That never gets told
If what you are is a daydream
I'll never get to hold, at least you'll know
You're beautiful
Every little piece, love; don't you know?
You're really gonna be someone
Ask anyone
And when you find everything you've looked for
I hope your love leads you back to my front door
Oh, but if it don't
Will you stay beautiful, beautiful, beautiful
Beautiful, beautiful, beautiful?
Oh, oh, oh
Oh, oh, oh
Oh, but if it don't
Stay beautiful
Stay beautiful
Na, na, na, na, na
"
Taylor Swift ,Taylor Swift ,Should’ve Said No,"It's strange to think the songs we used to sing
The smiles, the flowers, everything: is gone
Yesterday I found out about you
Even now just looking at you: feels wrong
You say that you'd take it all back, given one chance
It was a moment of weakness and you said yes
You should've said no, you should've gone home
You should've thought twice before you let it all go
You should've know that word, bout what you did with her
Would get back to me
And I should've been there, in the back of your mind
I shouldn't be asking myself why
You shouldn't be begging for forgiveness at my feet
You should've said no, baby and you might still have me
You can see that I've been crying
And baby you know all the right things: to say
But do you honestly expect me to believe
We could ever be the same
You say that the past is the past, you need one chance
It was a moment of weakness and you said yes
You should've said no, you should've gone home
You should've thought twice before you let it all go
You should've know that word, bout what you did with her
Would get back to me
And I should've been there, in the back of your mind
I shouldn't be asking myself why
You shouldn't be begging for forgiveness at my feet
You should've said no, baby and you might still have me
I can't resist, before you go, tell me this
Was it worth it
Was she worth this
No, no no no
You should've said no, you should've gone home
You should've thought twice before you let it all go
You should've know that word, bout what you did with her
Would get back to me
And I should've been there, in the back of your mind
I shouldn't be asking myself why
You shouldn't be begging for forgiveness at my feet
You should've said no, baby and you might still have me
"
Taylor Swift ,Taylor Swift ,Mary’s Song ,"She said
""I was seven, and you were nine
I looked at you like the stars that shined
In the sky, the pretty lights.""
And our daddies used to joke about the two of us
Growing up and fallin' in love
And our mamas smiled, and rolled their eyes
And said, ""Oh, my, my, my""
Take me back to the house in the backyard tree
Said you'd beat me up; you were bigger than me
You never did, you never did
Take me back when our world was one block wide
I dared you to kiss me, and ran when you tried
Just two kids, you and I
Oh, my, my, my, my
Well, I was sixteen when suddenly
I wasn't that little girl you used to see
But your eyes still shined, like pretty lights
And our daddies used to joke about the two of us
They never believed we'd really fall in love
And our mamas smiled, and rolled their eyes
And said, ""Oh, my, my, my""
Take me back to the creek beds we turned up
Two AM, ridin' in your truck
And all I need is you next to me
Take me back to the time we had our very first fight
Slammin' of doors 'stead of kissin' goodnight
You stayed outside till the morning light
Oh, my, my, my, my
A few years had gone and come around
We were sittin' at our favorite spot in town
And you looked at me, got down on one knee
Take me back to the time when we walked down the aisle
Our whole town came, and our mamas cried
You said, ""I do, "" and I did too
Take me home where we met so many years before
We'll rock our babies on the very front porch
After all this time, you and I
And I'll be eighty-seven, you'll be eighty-nine
I'll still look at you like the stars that shine in the sky
Oh, my, my, my
"
Taylor Swift ,Taylor Swift ,Our Song ,"I was riding shotgun with my hair undone in the front seat of his car,
He's got a one-hand feel on the steering wheel,
The other on my heart,
I look around, turn the radio down, he says, ""baby is something wrong?""
I say ""nothing, I was just thinking how we don't have a song, "" 
And he says,
Our song is a slamming screen door, 
Sneaking out late tapping on your window,
When we're on the phone and you talk real slow,
'Cause it's late and your mama don't know,
Our song is the way you laugh,
The first date man I didn't kiss her when I should have,
And when I got home, before I said amen,
Asking God if He could play it again.
I was walking up the front porch steps after everything that day,
Had gone all wrong, had been trampled on and lost and thrown away,
Got to the hallway well on my way to my lovin' bed,
I almost didn't notice all the roses,
And the note that said,
Our song is a slamming screen door, 
Sneaking out late tapping on your window,
When we're on the phone and you talk real slow,
'Cause it's late and your mama don't know,
Our song is the way you laugh,
The first date man I didn't kiss her when I should have,
And when I got home, before I said amen,
Asking God if He could play it again.
I've heard every album, listened to the radio,
Waiting for something to come along,
That was as good as our song,
'Cause our song is a slamming screen door,
Sneaking out late tapping on your window,
When we're on the phone, and he talks real slow,
'Cause it's late and his mama don't know,
Our song is the way he laughs,
The first date man I didn't kiss him when I should have,
And when I got home, before I said amen,
Asking God if He could play it again.
I was riding shotgun with my hair undone in the front seat of his car,
I grabbed a pen and an old napkin 
And I wrote down our song.
"
Taylor Swift ,Taylor Swift ,I’m Only Me When I’m With You ,"Friday night beneath the stars
In a field behind your yard
You and I are painting pictures in the sky
Sometimes we don't say a thing
Just listen to the crickets sing
Everything I need is right here by my side
And I know everything about you
I don't wanna live without you
I'm only up when you're not down
Don't wanna fly if you're still on the ground
It's like no matter what I do
Well, you drive me crazy half the time
The other half I'm only trying
To let you know that what I feel is true
And I'm only me when I'm with you
Just a small-town boy and girl
Living in the crazy world
Trying to figure out what is and isn't true
And I don't try to hide my tears
My secrets or my deepest fears
Through it all nobody gets me like you do
And you know everything about me
You say that you can't live without me
I'm only up when you're not down
Don't wanna fly if you're still on the ground
It's like no matter what I do
Well, you drive me crazy half the time
The other half I'm only trying
To let you know that what I feel is true
And I'm only me when I'm with you
When I'm with anybody else
It's so hard to be myself
And only you can tell
I'm only up when you're not down
Don't wanna fly if you're still on the ground
It's like no matter what I do
Well, you drive me crazy half the time
The other half I'm only trying
To let you know that what I feel is true
And I'm only me when I'm with you
"
Taylor Swift ,Taylor Swift ,Invisible ,"She can't see the way your eyes
Light up when you smile
She'll never notice how you stop and stare
Whenever she walks by
And you can't see me wantin' you the way you want her
But you are everything to me
And I just wanna show you
She don't even know you
She's never gonna love you like I want to
And you just see right through me but if you only knew me
We could be a beautiful, miracle, unbelievable
Instead of just invisible
There's a fire inside of you
That can't help but shine through
She's never gonna see the light
No matter what you do
And all I think about is how to make you think of me
And everything that we could be
And I just wanna show you
She don't even know you
She's never gonna love you like I want to
And you just see right through me but if you only knew me
We could be a beautiful, miracle, unbelievable
Instead of just invisible
Like shadows in a faded light
Oh we're invisible
I just wanna open your eyes
And make you realize
I just want to show you, she don't even know you,
Baby let me love you, let me want you"".
She can't see the way your eyes
Light up when you smile
"
Taylor Swift ,Taylor Swift ,A Perfectly Good Heart ,"Why would you wanna break a perfectly good heart
Why would you wanna take our love and tear it all apart now
Why would you wanna make the very first scar
Why would you wanna break a perfectly good heart
Maybe I should've seen the signs, should've read the writing on the wall
And realized by the distance in your eyes that I would be the one to fall
No matter what you say I still can't believe
That you would walk away
It don't make sense to me but
Why would you wanna break a perfectly good heart
Why would you wanna take our love and tear it all apart now
Why would you wanna make the very first scar
Why would you wanna break a perfectly good heart
It's not unbroken anymore
How do I get it back the way it was before
Why would you wanna break a perfectly good heart
Why would you wanna take our love and tear it all apart now
Why would you wanna make the very first scar
Why would you wanna break, would you wanna break a
Why would you wanna break a perfectly good heart
Why would you wanna take our love and tear it all apart now
Why would you wanna make the very first scar
Why would you wanna break a perfectly good heart
"
Taylor Swift ,Fearless,Jump Then Fall ,"I like the way you sound in the morning,
We're on the phone and without a warning
I realize your laugh is the best sound I have ever heard
I like the way I can't keep my focus,
I watch you talk you didn't notice
I hear the words but all I can think is we should be together
Every time you smile, I smile
And every time you shine, I'll shine for you
Whoa oh I'm feeling you baby
Don't be afraid to jump then fall, jump then fall into me
Baby, I'm never gonna leave you,
Say that you wanna be with me too
Cuz I'ma stay through it all so jump then fall
Well I like the way your hair falls in your face
You got the keys to me I love each freckle on your face, oh,
I've never been so wrapped up,
Honey, I like the way you're everything I've ever wanted
I had time to think it all over and all I can say is come closer,
Take a deep breath and jump then fall into me
Every time you smile, I smile
And every time you shine, I'll shine for you
Whoa oh I'm feeling you baby
Don't be afraid to jump then fall, jump then fall into me
Baby, I'm never gonna leave you,
Say that you wanna be with me too
I'ma stay through it all so jump then fall
The bottoms gonna drop out from under our feet
I'll catch you, I'll catch you
When people say things that bring you to your knees,
I'll catch you
The time is gonna come when you're so mad you could cry
But I'll hold you through the night until you smile
Whoa oh I need you baby
Don't be afraid please
Jump then fall, jump then fall into me
Baby, I'm never gonna leave you,
Say that you wanna be with me too
I'ma stay through it all so jump then fall
Jump then fall baby
Jump then fall into me, into me
Every time you smile, I smile
And every time you shine, I'll shine
And every time you're here baby, I'll show you, I'll show you
You can jump then fall, jump then fall, jump then fall 
Into me, into me yeah
"
Taylor Swift ,Fearless,Untouchable ,"Untouchable like a distant diamond sky
I'm reaching out and I just can't tell you why
I'm caught up in you
I'm caught up in you
Untouchable
Burning brighter than the sun
And when you're close I feel like coming undone
In the middle of the night
When I'm in this dream
It's like a million little stars
Spelling out your name
You gotta come on, come on
Say that we'll be together
Come on, come on
Little taste of heaven
It's half full and I won't wait here all day
I know you're saying that you'll be here anyway
But you're untouchable
Burning brighter than the sun
Now that you're close I feel like coming undone
In the middle of the night
When I'm in this dream
It's like a million little stars
Spelling out your name
You gotta come on, come on
Say that we'll be together
Come on, come on
Oh
In the middle of the night
We could form this dream
I wanna feel you by my side
Standing next to me
You gotta come on, come on
Say that we'll be together
Come on, come on
Little taste of heaven
Oh, oh
I'm caught up in you
Oh, oh, oh
Untouchable
Burning brighter than the sun
And when you're close I feel like coming undone
In the middle of the night
When I'm in this dream
It's like a million little stars
Spelling out your name
You gotta come on, come on
Say that we'll be together
Come on, come on
Oh, oh
In the middle of the night
When I'm in this dream
It's like a million little stars
Spelling out your name
You gotta come on, come on
Say that we'll be together
Come on, come on
Little taste of heaven
"
Taylor Swift ,Fearless,Forever & Always ,"Once upon a time, I believe it was a Tuesday when I caught your eye
And we caught onto something
I hold onto the night, you looked me in the eye and told me you loved me
Were you just kidding?
'Cause it seems to me, this thing is breaking down
We almost never speak
I don't feel welcome anymore
Baby what happened? Please tell me
'Cause one second it was perfect, now you're halfway out the door
And I stare at the phone, he still hasn't called
And then you feel so low you cant feel nothing at all
And you flashback to when he said forever and always
Oh, and it rains in your bedroom
Everything is wrong
It rains when you're here and it rains when you're gone
'Cause I was there when you said forever and always
Was I out of line?
Did I say something way too honest, made you run and hide
Like a scared little boy
I looked into your eyes
Thought I knew you for a minute, now I'm not so sure
So here's to everything coming down to nothing
Here's to silence, that cuts me to the core
Where is this going? Thought I knew for a minute, but I don't anymore
And I stare at the phone, he still hasn't called
And then you feel so low you cant feel nothing at all
And you flashback to when he said forever and always
Oh, and it rains in your bedroom
Everything is wrong
It rains when you're here and it rains when you're gone
'Cause I was there when you said forever and always
You didn't mean it baby, I don't think so
Oh back up, baby, back up
Did you forget everything?
Back up, baby, back up
Did you forget everything?
'Cause it rains in your bedroom
Everything is wrong
It rains when you're here and it rains when you're gone
'Cause I was there when you said forever and always
Oh, I stare at the phone, he still hasn't called
And then you feel so low you cant feel nothing at all
And you flashback to when we said forever and always
And it rains in your bedroom
Everything is wrong
It rains when you're here and it rains when you're gone
'Cause I was there when you said forever and always
You didn't mean it baby,
You said forever and always, yeah.
"
