Artist ,Album,Title ,Lyrics
Taylor Swift,Red,Holy Ground ,"I was reminiscing just the other day
While having coffee all alone and Lord, it took me away
Back to a first-glance feeling on New York time
Back when you fit in my poems like a perfect rhyme
Took off faster than a the green light, go
Hey, you skip the conversation when you already know
I left a note on the door with a joke we'd made
And that was the first day
And darlin', it was good
Never lookin' down
And right there where we stood
Was holy ground
Spinnin' like a girl in a brand new dress
We had this big wide city all to ourselves
We blocked the noise with the sound of ""I need you""
And for the first time I had something to lose
And I guess we fell apart in the usual way
And the story's got dust on every page
But sometimes I wonder how you think about it now
And I see your face in every crowd
'Cause darlin', it was good (uh-ey, uh-ey)
Never lookin' down (uh-ey, uh-ey)
And right there where we stood (uh-ey)
Was holy ground (uh-ey, uh-ey, uh-ey, oh-oh)
(Uh-ey, uh-ey, uh-ey, oh-oh)
Tonight I'm gonna dance
For all that we've been through
But I don't wanna dance
If I'm not dancing with you
Tonight I'm gonna dance
Like you were in this room
But I don't wanna dance
If I'm not dancing with you
It was good
Never lookin' down
And right there where we stood
Was holy ground (uh-ey, uh-ey, uh-ey, oh-oh)
(Uh-ey, uh-ey, uh-ey, oh-oh)
Tonight I'm gonna dance
For all that we've been through
But I don't wanna dance
If I'm not dancing with you
Tonight I'm gonna dance
Like you were in this room
But I don't wanna dance
If I'm not dancing with you
"
Taylor Swift,Red,Sad Beautiful Tragic ,"Long handwritten note
Deep in your pocket
Words, how little they mean
When you're a little too late
I stood right by the tracks
Your face in a locket
Good girls, hopeful they'll be and long they will wait
We had a beautiful magic love there
What a sad beautiful tragic love affair
In dreams
I meet you in warm conversation
We both wake
In lonely beds
In different cities
And time
Is taking its sweet time erasing you
And you've got your demons
And darlin' they all look like me
'Cause we had a beautiful magic love there
What a sad beautiful tragic love affair
Distance, timing
Breakdown, fighting
Silence, the train runs off its tracks
Kiss me, try to fix it
Could you just try to listen?
Hang up, give up
For the life of us we can't get back
A beautiful magic love there
What a sad
Beautiful tragic
Beautiful tragic
Beautiful
What we had a beautiful magic love there (uh-uh)
What a sad beautiful tragic love affair
We had a beautiful magic love there
What a sad beautiful tragic love affair
"
Taylor Swift,Red,The Lucky One ,"New to town with a made up name
In the Angel city, chasing fortune and fame
And the camera flashes, make it look like a dream
You had it figured out since you were in school
Everybody loves pretty, everybody loves cool
So overnight you look like a sixties' queen
Another name goes up in lights
Like diamonds in the sky
And they'll tell you now, you're the lucky one
Yeah, they'll tell you now, you're the lucky one
But can you tell me now, you're the lucky one, oh, oh, oooh
Now it's big black cars, and Riviera views
And your lover in the foyer doesn't even know you
And your secrets end up splashed on the news front page
And they tell you that you're lucky
But you're so confused
'Cause you don't feel pretty
You just feel used
And all the young things line up to take your place
Another name goes up in lights
You wonder if you'll make it out alive
And they'll tell you now, you're the lucky one
Yeah, they'll tell you now, you're the lucky one
Can you tell me now, you're the lucky one
Oh, oh, ooh
Oh-oh, oh-oh, oh-oh-oh
Oh, oh, oh-oh
Oh-oh-oh-oh-oh, ooh, oh-oh-ooh
It was a few years later
I showed up here
And they still tell the legend of how you disappeared
How you took the money and your dignity, and got the hell out
They say you bought a bunch of land somewhere
Chose the Rose Garden over Madison Square
And it took some time, but I understand it now
'Cause now my name is up in lights
But I think you got it right
Let me tell you now, you're the lucky one
Let me tell you now, you're the lucky one
Let me tell you now, you're the lucky one, oh, oh, oooh
Yeah they'll tell you now, you're the lucky one
Yeah, they'll tell you now, you're the lucky one
And they'll tell you now, you're the lucky one, oh, oh, oh
Oh, oh-uh, oh, oh
"
Taylor Swift,Red,Everything Has Changed,"All I knew
This morning when I woke
Is I know something now, know something now I didn't before
And all I've seen
Since eighteen hours ago
Is green eyes and freckles and your smile
In the back of my mind making me feel like
I just wanna know you better, know you better, know you better now
I just wanna know you better, know you better, know you better now
I just wanna know you better, know you better, know you better now
I just wanna know you, know you, know you
'Cause all I know is we said hello
And your eyes look like coming home
All I know is a simple name
And everything has changed
All I know is, you held the door
You'll be mine and I'll be yours
All I know since yesterday, yeah 
Is everything has changed
And all my walls
Stood tall painted blue
But I'll take 'em down, take 'em down and open up the door for you
And all I feel
In my stomach, is butterflies
The beautiful kind, making up for lost time
Taking flight, making me feel like
I just wanna know you better, know you better, know you better now
I just wanna know you better, know you better, know you better now
I just wanna know you better, know you better, know you better now
I just wanna know you, know you, know you
'Cause all I know is we said hello
And your eyes look like coming home
All I know is a simple name
And everything has changed
All I know is you held the door
And you'll be mine and I'll be yours
All I know since yesterday, yeah
Is everything has changed
Come back and tell me why
I'm feelin' like I've missed you all this time
(Uh-uh-uh)
And meet me there tonight
And let me know that it's not all in my mind
I just wanna know you better, know you better, know you better now
I just wanna know you, know you, know you
All I know is we said hello
Your eyes look like coming home
All I know is a simple name
And everything has changed
All I know is you held the door
You'll be mine and I'll be yours
All I know since yesterday, yeah
Is everything has changed
All I know is we said hello
So dust off your highest hopes
All I know is pouring rain
And everything has changed
All I know is a new found grace
All my days, I'll know your face
All I know since yesterday, yeah
Is everything has changed
"
Taylor Swift,Red,Starlight ,"I said, ""Oh my, what a marvelous tune""
It was the best night, never would forget how we moved
The whole place
Was dressed to the nines
And we were dancing, dancing
Like we're made of starlight
Like we're made of starlight
I met Bobby on the boardwalk summer of '45
Picked me up late one night out the window
We were seventeen and crazy running wild, wild
Can't remember what song he was playing when we walked in
The night we snuck into a yacht club party
Pretending to be a duchess and a prince
And I said, ""Oh my, what a marvelous tune""
It was the best night, never would forget how we moved
The whole place
Was dressed to the nines
And we were dancing, dancing
Like we're made of starlight, starlight
Like we're made of starlight, starlight
He said, ""Look at you, worrying so much about things you can't change
You'll spend your whole life singing the blues
If you keep thinking that way""
He was tryna to skip rocks on the ocean saying to me
""Don't you see the starlight, starlight
Don't you dream impossible things""
Like, ""Oh my, what a marvelous tune""
It was the best night, never would forget how we moved
The whole place
Was dressed to the nines
And we were dancing, dancing
Like we're made of starlight, starlight
Like we're made of starlight, starlight
Ooh, ooh he's talking crazy
Ooh, ooh dancing with me
Ooh, ooh we could get married
Have ten kids and teach 'em how to dream
""Oh, my what a marvelous tune""
It was the best night, never would forget how we moved
The whole place
Was dressed to the nines
And we were dancing, dancing
Like we're made of starlight, starlight
Like we're made of starlight, starlight
Like we're made of starlight, starlight
Like we dream impossible dreams
Like starlight, starlight
Like we dream impossible dreams
Don't you see the starlight, starlight
Don't you dream impossible things"
Taylor Swift,Red,Begin Again ,"Took a deep breath in the mirror
He didn't like it when I wore high heels, but I do
Turned the lock and put my headphones on
He always said he didn't get this song but I do, I do
Walked in expecting you'd be late
But you got here early and you stand and wait
I walk to you
You pull my chair out and help me in
And you don't know how nice that is, but I do
And you throw your head back laughing like a little kid
I think it's strange that you think I'm funny 'cause he never did
I've been spending the last eight months thinking all love ever does
Is break and burn and end
But on a Wednesday in a café I watched it begin again
You said you never met one girl who
Had as many James Taylor records as you, but I do
We tell stories and you don't know why
I'm coming off a little shy, but I do
But you throw your head back laughing like a little kid
I think it's strange that you think I'm funny 'cause he never did
I've been spending the last eight months thinking all love ever does
Is break and burn and end
But on a wednesday in a café I watched it begin again
And we walk down the block to my car
And I almost brought him up
But you start to talk about the movies
That your family watches
Every single Christmas and I won't
Talk about that
And for the first time
What's past is past
'Cause you throw your head back laughing like a little kid
I think it's strange that you think I'm funny 'cause he never did
I've been spending the last eight months thinking all love ever does
Is break and burn and end
Then on a wednesday in a café I watched it begin again
Then on a wednesday in a café I watched it begin again
"
Taylor Swift,Red,The Moment I Knew,"You should've been there
Should've burst through the door
With that ""Baby, I'm right here"" smile
And it would've felt like
A million little shining stars had just aligned
And I would've been so happy
Christmas lights glisten
I've got my eye on the door
Just waiting for you to walk in
But the time is ticking
People ask me how I've been
As I comb back through my memory
How you said you'd be here
You said you'd be here
And it was like slow motion
Standing there in my party dress
In red lipstick
With no one to impress
And they're all laughing
As I'm looking around the room
But there was one thing missing
And that was the moment I knew
And the hours pass by
Now I just wanna be alone
But your close friends always seem to know
When there's something really wrong
So they follow me down the hall
And there in the bathroom
I try not to fall apart
And the sinking feeling starts
As I say hopelessly
""He said he'd be here""
And it was like slow motion
Standing there in my party dress
In red lipstick
With no one to impress
And they're all laughing
And asking me about you
But there was one thing missing (missing, missing)
And that was the moment I knew
What do you say, when tears are streaming down your face
In front of everyone you know?
And what do you do when the one who means the most to you
Is the one who didn't show?
You should've been here
And I would've been so happy
And it was like slow motion
Standing there in my party dress
In red lipstick
With no one to impress
And they're all standing around me singing
""Happy birthday to you""
But there was one thing missing
And that was the moment I knew
Ooh, I knew
Ooh
You called me later
And said, ""I'm sorry, I didn't make it""
And I said, ""I'm sorry too""
And that was the moment I knew
"
Taylor Swift,Red,Come Back Be Here,"You said it in a simple way
4AM, the second day
How strange that I don't know you at all
Stumbled through the long goodbye
One last kiss, then catch your flight
Right when I was just about to fall
I told myself, don't get attached
But in my mind I play it back
Spinning faster than the plane that took you
And this is when the feeling sinks in
I don't wanna miss you like this
Come back, be here
Come back, be here
I guess you're in New York today
I don't wanna need you this way
Come back, be here
Come back, be here
The delicate beginning rush
The feeling you can know so much
Without knowing anything at all
And now that I can put this down
If I had known what I know now
I never would have played so nonchalant
Taxi cabs and busy streets
That never bring you back to me
I can't help but wish you took me with you
And this is when the feeling sinks in
I don't wanna miss you like this
Come back, be here
Come back, be here
I guess you're in London today
And I don't wanna need you this way
Come back, be here
Come back, be here
ah-ah, oh-oh
Ah-ah, oh-oh
(Aah) ah-ah, oh-oh
This is falling in love in the cruelest way
This is falling for you and you are worlds away
New York, be here
But you're in London and I break down
'Cause it's not fair that you're not around
This is when the feeling sinks in
I don't wanna miss you like this
Come back, be here
Come back, be here
I guess you're in New York today
And I don't wanna need you this way
Come back, be here
Come back, be here
ah-ah, oh-oh
I don't wanna miss you like this
(Aah) ah-ah, oh-oh
come back, be here
(Aah) come back, be here"
Taylor Swift,Red,Girl At Home ,"Don't look at me
You've got a girl at home
And everybody knows that
Everybody knows that, ah-ah
Don't look at me
You've got a girl at home
And everybody knows that
I don't even know her
But I feel a responsibility
To do what's upstanding and right
It's kinda like a code, yeah
And you've been getting closer and closer
And crossing so many lines
And it would be a fine proposition
If I was a stupid girl
But honey, I am no-one's exception
This, I have previously learned
So, don't look at me
You've got a girl at home
And everybody knows that
Everybody knows that
Ah ah, don't look at me
You've got a girl at home
And everybody knows that
Everybody knows that
I see you turn off your phone
And now you got me alone
And I say, don't look at me
You've got a girl at home
And everybody knows that
Everybody knows that
I just wanna make sure
You understand perfectly
You're the kind of man who makes me sad
While she waits up
You chase down the newest thing
And take for granted what you have
And it would be a fine proposition
If I was a stupid girl
And yeah, I might go with it
If I hadn't once been just like her
Don't look at me
You've got a girl at home
And everybody knows that
Everybody knows that
Ah ah, don't look at me
You've got a girl at home
And everybody knows that
Everybody knows that
I see you turn off your phone
And now you've got me alone
And I say, don't look at me
You've got a girl at home
And everybody knows that
Everybody knows that
Call a cab
Lose my number
You're about to lose your girl
Call a cab
Lose my number
Let's consider this lesson learned
Don't look at me
You've got a girl at home
And everybody knows that
Everybody knows that
Ah ah, don't look at me
You've got a girl at home
And everybody knows that
Everybody knows that
Wanna see you pick up your phone
And tell her you're coming home
Don't look at me
You've got a girl at home
And everybody knows that
Everybody knows that
Don't look at me
You've got a girl at home
And everybody knows that
Everybody knows that
It would be a fine proposition
If I hadn't once been just like her
"
Taylor Swift,1989,Welcome to New York,"Walkin' through a crowd, the village is a glow
Kaleidoscope of loud heartbeats under coats
Everybody here wanted somethin' more
Searchin' for a sound we hadn't heard before
And it said
Welcome to New York
It's been waitin' for you
Welcome to New York, welcome to New York
Welcome to New York
It's been waitin' for you
Welcome to New York, welcome to New York
It's a new soundtrack I could dance to this beat, beat forevermore
The lights are so bright but they never blind me, me
Welcome to New York
It's been waitin' for you
Welcome to New York, welcome to New York
When we first dropped our bags on apartment floors
Took our broken hearts, put them in a drawer
Everybody here was someone else before
And you can want who you want
Boys and boys and girls and girls
Welcome to New York
It's been waitin' for you
Welcome to New York, welcome to New York
Welcome to New York
It's been waitin' for you
Welcome to New York, welcome to New York
It's a new soundtrack I could dance to this beat, beat forevermore
The lights are so bright but they never blind me, me
Welcome to New York (New York!)
It's been waitin' for you
Welcome to New York, welcome to New York
Like any great love, it keeps you guessing
Like any real love, it's ever-changing
Like any true love, it drives you crazy
But you know you wouldn't change anything, anything, anything
Welcome to New York
It's been waitin' for you
Welcome to New York, welcome to New York
Welcome to New York
It's been waitin' for you
Welcome to New York, welcome to New York
It's a new soundtrack I could dance to this beat
The lights are so bright but they never blind me
Welcome to New York
New soundtrack
It's been waitin' for you
Welcome to New York
The lights are so bright but they never blind me
Welcome to New York
So bright, they never blind me
Welcome to New York
Welcome to New York
"
Taylor Swift,1989,Blank Space ,"Nice to meet you, where you been?
I could show you incredible things
Magic, madness, heaven, sin
Saw you there and I thought
Oh my God, look at that face
You look like my next mistake
Love's a game, wanna play? Ayy
New money, suit and tie
I can read you like a magazine
Ain't it funny, rumors fly
And I know you heard about me
So hey, let's be friends
I'm dyin' to see how this one ends
Grab your passport and my hand
I can make the bad guys good for a weekend
So it's gonna be forever
Or it's gonna go down in flames
You can tell me when it's over, mm
If the high was worth the pain
Got a long list of ex lovers
They'll tell you I'm insane
'Cause you know I love the players
And you love the game
'Cause we're young and we're reckless
We'll take this way too far
It'll leave you breathless, mm
Or with a nasty scar
Got a long list of ex lovers
They'll tell you I'm insane
But I've got a blank space, baby
And I'll write your name
Cherry lips, crystal skies
I could show you incredible things
Stolen kisses, pretty lies
You're the king, baby, I'm your queen
Find out what you want
Be that girl for a month
Wait, the worst is yet to come, oh no
Screaming, crying, perfect storms
I can make all the tables turn
Rose garden filled with thorns
Keep you second guessin' like
""Oh my God, who is she?""
I get drunk on jealousy
But you'll come back each time you leave
'Cause darling, I'm a nightmare dressed like a daydream
So it's gonna be forever
Or it's gonna go down in flames
You can tell me when it's over, mm
If the high was worth the pain
Got a long list of ex lovers
They'll tell you I'm insane
'Cause you know I love the players
And you love the game
'Cause we're young and we're reckless (oh)
We'll take this way too far
It'll leave you breathless, mm
Or with a nasty scar
Got a long list of ex lovers
They'll tell you I'm insane (insane)
But I've got a blank space, baby
And I'll write your name
Boys only want love if it's torture
Don't say I didn't, say I didn't warn ya
Boys only want love if it's torture
Don't say I didn't, say I didn't warn ya
So it's gonna be forever
Or it's gonna go down in flames
You can tell me when it's over (over), mm
If the high was worth the pain
Got a long list of ex lovers
They'll tell you I'm insane
'Cause you know I love the players
And you love the game
'Cause we're young and we're reckless (yeah)
We'll take this way too far
It'll leave you breathless, mm
Or with a nasty scar
Got a long list of ex lovers
They'll tell you I'm insane
But I've got a blank space, baby
And I'll write your name
"
Taylor Swift,1989,Style ,"Midnight, you come and pick me up, no headlights
Long drive, could end in burning flames or paradise
Fade into view, oh,
It's been a while since I have even heard from you
(Heard from you)
And I should just tell you to leave 'cause I
Know exactly where it leads but I
Watch it go round and round each time
You got that James Dean daydream look in your eye
And I got that red lip, classic thing that you like
And when we go crashing down, we come back every time
'Cause we never go out of style, we never go out of style
You've got that long hair slick back, white t-shirt
And I got that good girl faith and a tight little skirt
And when we go crashing down, we come back every time
'Cause we never go out of style, we never go out of style
So it goes, he can't keep his wild eyes on the road
Takes me home, lights are off he's taking off his coat (Hm yeah)
I say ""I've heard that you've been out and about with some other girl, some other girl""
He says ""What you've heard is true but I
Can't stop thinking about you"" and I
I said ""I've been there too a few times""
'Cause you got that James Dean daydream look in your eye
And I got that red lip, classic thing that you like
And when we go crashing down, we come back every time
'Cause we never go out of style, we never go out of style
You've got that long hair slick back, white t-shirt
And I got that good girl faith and a tight little skirt (A tight little skirt)
And when we go crashing down, we come back every time
'Cause we never go (We never go) out of style, we never go out of style
Take me home
Just take me home
Yeah just take me home, oh
You got that James Dean daydream look in your eye
And I got that red lip, classic thing that you like
And when we go crashing down, we come back every time
'Cause we never go out of style, we never go out of style
"
Taylor Swift,1989,Out of the Woods,"Looking at it now
It all seems so simple
We were lying on your couch
I remember
You took a Polaroid of us
Then discovered (then discovered)
The rest of the world was black and white
But we were in screaming color
And I remember thinking
Are we out of the woods yet? Are we out of the woods yet?
Are we out of the woods yet? Are we out of the woods?
Are we in the clear yet? Are we in the clear yet?
Are we in the clear yet? In the clear yet, good
Are we out of the woods yet? Are we out of the woods yet?
Are we out of the woods yet? Are we out of the woods?
Are we in the clear yet? Are we in the clear yet?
Are we in the clear yet? In the clear yet, good
Are we out of the woods
Looking at it now
Last December (last December)
We were built to fall apart
Then fall back together (back together)
Ooh your necklace hanging from my neck
The night we couldn't quite forget
When we decided (we decided) to move the furniture so we could dance
Baby, like we stood a chance
Two paper airplanes flying, flying, flying
And I remember thinking
Are we out of the woods yet? Are we out of the woods yet?
Are we out of the woods yet? Are we out of the woods?
Are we in the clear yet? Are we in the clear yet?
Are we in the clear yet? In the clear yet, good
Are we out of the woods yet? Are we out of the woods yet?
Are we out of the woods yet? Are we out of the woods?
Are we in the clear yet? Are we in the clear yet?
Are we in the clear yet? In the clear yet, good
Are we out of the woods?
Remember when you hit the brakes too soon
Twenty stitches in a hospital room
When you started crying baby, I did too
But when the sun came up I was looking at you
Remember when we couldn't take the heat
I walked out, I said, I'm setting you free
But the monsters turned out to be just trees
When the sun came up you were looking at me
You were looking at me
Oh!
You were looking at me
Are we out of the woods yet? Are we out of the woods yet?
Are we out of the woods yet? Are we out of the woods? (I remember)
Are we in the clear yet? Are we in the clear yet?
Are we in the clear yet? Are we in the clear yet? (Oh, I remember)
Are we out of the woods yet? Are we out of the woods yet?
Are we out of the woods yet? Are we out of the woods?
Are we in the clear yet? Are we in the clear yet?
Are we in the clear yet? In the clear yet, good
Are we out of the woods yet? Are we out of the woods yet?
Are we out of the woods yet? Are we out of the woods?
Are we in the clear yet? Are we in the clear yet?
Are we in the clear yet? In the clear yet, good
Are we out of the woods yet? Are we out of the woods yet?
Are we out of the woods yet? Are we out of the woods?
Are we in the clear yet? Are we in the clear yet?
Are we in the clear yet? In the clear yet, good
Are we out of the woods yet? Are we out of the woods yet?
Are we out of the woods yet? Are we out of the woods?
Are we in the clear yet? Are we in the clear yet?
Are we in the clear yet? In the clear yet, good
"
