Artist ,Album,Title ,Lyrics
Taylor Swift ,reputation ,Dress,"Our secret moments in your crowded room
They've got no idea about me and you
There is an indentation in the shape of you
Made your mark on me, a golden tattoo
All of this silence and patience, pining in anticipation
My hands are shaking from holding back from you (ah, ah, ah)
All of this silence and patience, pining and desperately waiting
My hands are shaking from holding back from all this (ha, ha, ha, ha)
Say my name and everything just stops
I don't want you like a best friend
Only bought this dress so you could take it off
Take it off (ha, ha, ha)
Carve your name into my bedpost
'Cause I don't want you like a best friend
Only bought this dress so you could take it off
Take it off (ha, ha, ha, ha)
Inescapable, I'm not even gonna try
And if I get burned, at least we were electrified
I'm spilling wine in the bathtub, you kiss my face and we're both drunk
Everyone thinks that they know us, but they know nothing about
All of this silence and patience, pining in anticipation
My hands are shaking from holding back from you (ah, ah, ah)
All of this silence and patience, pining and desperately waiting
My hands are shaking from holding back from all this (ha, ha, ha, ha)
Say my name and everything just stops
I don't want you like a best friend
Only bought this dress so you could take it off
Take it off (ha, ha, ha)
Carve your name into my bedpost
'Cause I don't want you like a best friend
Only bought this dress so you could take it off, take it off (ha, ha, ha, ha)
Only bought this dress so you could take it off, take it off (ha, ha, ha, ha)
Only bought this dress so you could take it off
Flashback when you met me
Your buzzcut and my hair bleached
Even in my worst times, you could see the best of me
Flashback to my mistakes
My rebounds, my earthquakes
Even in my worst lies, you saw the truth of me
And I woke up just in time
Now I wake up by your side
My one and only, my lifeline
I woke up just in time
Now I wake up by your side
My hands shake, I can't explain this (ha, ha, ha, ha)
Say my name and everything just stops
I don't want you like a best friend
Only bought this dress so you could take it off, take it off (ha, ha, ha, ha)
Carve your name into my bedpost
'Cause I don't want you like a best friend
Only bought this dress so you could take it off, take it off (ha, ha, ha, ha)
There is an indentation
In the shape of you
Only bought this dress so you could take it off
You made your mark on me, golden tattoo
Only bought this dress so you could take it off
"
Taylor Swift ,reputation ,This Is Why We Can’t Have Nice Things ,"It was so nice throwing big parties
Jumping to the pool from the balcony
Everyone swimming in a champagne sea
And there are no rules when you show up here
Bass beat rattling the chandelier
Feeling so Gatsby for that whole year
So why'd you have to rain on my parade?
I'm shaking my head
I'm locking the gates
This is why we can't have nice things, darling
Because you break them
I had to take them away
This is why we can't have nice things, honey
Did you think I wouldn't hear all the things you said about me?
This is why we can't have nice things
It was so nice being friends again
There I was giving you a second chance
But you stabbed my back while shaking my hand
And therein lies the issue
Friends don't try to trick you
Get you on the phone and mind-twist you
And so I took an axe to a mended fence
But I'm not the only friend you've lost lately, hm hm
If only you weren't
So shady
This is why we can't have nice things, darling
Because you break them
I had to take them away
This is why we can't have nice (nice things)
Things (baby) honey
Did you think I wouldn't hear all the things you said about me?
This is why we can't have
Here's a toast to my real friends
They don't care about that he said, she said
And here's to my baby
He ain't reading what they call me lately
And here's to my momma
Had to listen to all this drama
And here's to you
'Cause forgiveness is a nice thing to do
I can't even say it with a straight face
This is why we can't have nice things, darling (darling)
Because you break them
I had to take them away
This is why we can't have nice things, honey
Did you think I wouldn't hear all the things you said about me?
This is why we can't have nice things, darling
(And here's to my real friends)
Because you break them, I want to take them 
And here's to my baby
Nice things, honey (they don't care about that he said, she said)
Did you think I wouldn't hear all the things you said about me?
This is why we can't have nice things
"
Taylor Swift ,reputation ,Call It What You Want ,"My castle crumbled overnight
I brought a knife to a gunfight
They took the crown, but it's alright
All the liars are calling me one
Nobody's heard from me for months
I'm doing better than I ever was, 'cause
My baby's fit like a daydream
Walking with his head down
I'm the one he's walking to
So call it what you want, yeah, call it what you want to
My baby's fly like a jet stream
High above the whole scene
Loves me like I'm brand new
So call it what you want, yeah, call it what you want to
All my flowers grew back as thorns
Windows boarded up after the storm
He built a fire just to keep me warm
All the drama queens taking swings
All the jokers dressin' up as kings
They fade to nothing when I look at him
And I know I make the same mistakes every time
Bridges burn, I never learn, at least I did one thing right
I did one thing right
I'm laughing with my lover, making forts under covers
Trust him like a brother, yeah, you know I did one thing right
Starry eyes sparkin' up my darkest night
My baby's fit like a daydream
Walking with his head down
I'm the one he's walking to
So call it what you want, yeah, call it what you want to
My baby's fly like a jet stream
High above the whole scene
Loves me like I'm brand new
(Call it what you want, call it what you want, call it)
So call it what you want, yeah, call it what you want to
I want to wear his initial
On a chain round my neck, chain round my neck
Not because he owns me
But 'cause he really knows me
Which is more than they can say, I
I recall late November, holdin' my breath
Slowly I said, ""You don't need to save me
But would you run away with me?""
Yes (would you run away?)
My baby's fit like a daydream
Walking with his head down
I'm the one he's walking to
(Call it what you want, call it what you want, call it)
So call it what you want, yeah, call it what you want to
My baby's fly like a jet stream
High above the whole scene
Loves me like I'm brand new
(Call it what you want, call it what you want, call it)
So call it what you want, yeah, call it what you want to
Call it what you want, yeah
Call it what you want
To
"
Taylor Swift ,reputation ,New Year’s Day ,"There's glitter on the floor after the party
Girls carrying their shoes down in the lobby
Candle wax and Polaroids on the hardwood floor
You and me from the night before but
Don't read the last page
But I stay when you're lost and I'm scared and you're turning away
I want your midnights
But I'll be cleaning up bottles with you on New Year's Day
You squeeze my hand three times in the back of the taxi
I can tell that it's going to be a long road
I'll be there if you're the toast of the town babe
Or if you strike out and you're crawling home
Don't read the last page
But I stay when it's hard or it's wrong or you're making mistakes
I want your midnights
But I'll be cleaning up bottles with you on New Year's Day
Hold on to the memories, they will hold on to you
Hold on to the memories, they will hold on to you
Hold on to the memories, they will hold on to you
And I will hold on to you
Please don't ever become a stranger whose laugh I could recognize anywhere
Please don't ever become a stranger whose laugh I could recognize anywhere
There's glitter on the floor after the party
Girls carrying their shoes down in the lobby
Candle wax and Polaroids on the hardwood floor
You and me forevermore
Don't read the last page
But I stay when it's hard or it's wrong or we're making mistakes
I want your midnights
But I'll be cleaning up bottles with you on New Year's Day
Hold on to the memories, they will hold on to you
Hold on to the memories, they will hold on to you
Hold on to the memories, they will hold on to you
And I will hold on to you
Please don't ever become a stranger whose laugh I could recognize anywhere
Please don't ever become a stranger whose laugh I could recognize anywhere
"
Taylor Swift ,Lover ,I Forgot That You Existed,"How many days did I spend
Thinkin' 'bout how you did me wrong, wrong, wrong?
Lived in the shade you were throwin'
'Til all of my sunshine was gone, gone, gone
And I couldn't get away from you
In my feelings more than Drake, so yeah
Your name on my lips, tongue tied
Free rent, livin' in my mind
But then something happened one magical night
I forgot that you existed
And I thought that it would kill me, but it didn't
And it was so nice
So peaceful and quiet
I forgot that you existed
It isn't love, it isn't hate
It's just indifference
I forgot that you
Got out some popcorn
As soon as my rep starting going down, down, down
Laughed on the schoolyard
As soon as I tripped up and hit the ground, ground, ground
And I would've stuck around for ya
Would've fought the whole town, so yeah
Would've been right there front row
Even if nobody came to your show
But you showed who you are, then one magical night
I forgot that you existed
And I thought that it would kill me, but it didn't
And it was so nice
So peaceful and quiet
I forgot that you existed
It isn't love, it isn't hate
It's just indifference
I forgot that you
Sent me a clear message
Taught me some hard lessons
I just forget what they were
It's all just a blur
I forgot that you existed
And I thought that it would kill me, but it didn't
And it was so nice
So peaceful and quiet
I forgot that you existed
I did, I did, I did
It isn't hate, it's just indifference
It isn't love, it isn't hate
It's just indifference (so yeah)
"
Taylor Swift ,Lover ,Cruel Summer ,"Fever dream high
In the quiet of the night
You know that I caught it (oh yeah, you're right, I want it)
Bad, bad boys
Shiny toy with a price
You know that I bought it (oh yeah, you're right, I want it)
Killing me slow, out the window
I'm always waiting for you to be waiting below
Devils roll the dice, angels roll their eyes
What doesn't kill me makes me want you more
And it's new
The shape of your body, it's blue
The feeling I've got
And it's ooh, whoa oh
It's a cruel summer
It's cool
That's what I tell 'em, no rules
In breakable Heaven but
Ooh, whoa oh
It's a cruel summer
With you
Hang your head low
In the glow of the vending machine
I'm not dying (oh yeah, you're right, I want it)
We say that we'll just screw it up in these trying times
We're not trying (oh yeah, you're right, I want it)
So cut the headlights
Summer's a knife
I'm always waiting for you
Just to cut to the bone
Devils roll the dice
Angels roll their eyes
And if I bleed
You'll be the last to know
Oh, it's new
The shape of your body, it's blue
The feeling I've got
And it's ooh, whoa oh
It's a cruel summer
It's cool
That's what I tell 'em, no rules
In breakable Heaven but
Ooh, whoa oh
It's a cruel summer
With you
I'm drunk in the back of the car
And I cried like a baby coming home from the bar (oh)
Said, ""I'm fine"", but it wasn't true
I don't wanna keep secrets just to keep you
And I, snuck in through the garden gate
Every night that summer just to seal my fate (oh)
And I screamed, ""For whatever it's worth""
""I love you, ain't that the worst thing you ever heard?""
He looks up, grinning like a devil
It's new
The shape of your body, it's blue
The feeling I've got
And it's ooh, whoa oh
It's a cruel summer
It's cool
That's what I tell 'em, no rules
In breakable Heaven but
Ooh, whoa oh
It's a cruel summer
With you
I'm drunk in the back of the car
And I cried like a baby coming home from the bar (oh)
Said, ""I'm fine"", but it wasn't true
I don't wanna keep secrets just to keep you
And I, snuck in through the garden gate
Every night that summer just to seal my fate (oh)
And I screamed, ""For whatever it's worth""
""I love you, ain't that the worst thing you ever heard?""
"
Taylor Swift ,Lover ,Lover,"We could leave the Christmas lights up 'til January
This is our place, we make the rules
And there's a dazzling haze, a mysterious way about you, dear
Have I known you twenty seconds or twenty years?
Can I go where you go?
Can we always be this close forever and ever?
And ah, take me out, and take me home
You're my, my, my, my lover
We could let our friends crash in the living room
This is our place, we make the call
And I'm highly suspicious that everyone who sees you wants you
I've loved you three summers now, honey, but I want 'em all
Can I go where you go?
Can we always be this close forever and ever?
And ah, take me out, and take me home (forever and ever)
You're my, my, my, my lover
Ladies and gentlemen, will you please stand?
With every guitar string scar on my hand
I take this magnetic force of a man to be my lover
My heart's been borrowed and yours has been blue
All's well that ends well to end up with you
Swear to be overdramatic and true to my lover
And you'll save all your dirtiest jokes for me
And at every table, I'll save you a seat, lover
Can I go where you go?
Can we always be this close forever and ever?
And ah, take me out, and take me home (forever and ever)
You're my, my, my, my
Oh, you're my, my, my, my
Darling, you're my, my, my, my lover
"
Taylor Swift ,Lover ,The Man ,"I would be complex
I would be cool
They'd say I played the field before
I found someone to commit to
And that would be okay
For me to do
Every conquest I had made
Would make me more of a boss to you
I'd be a fearless leader
I'd be an alpha type
When everyone believes ya
What's that like?
I'm so sick of running
As fast as I can
Wondering if I'd get there quicker
If I was a man
And I'm so sick of them
Coming at me again
'Cause if I was a man
Then I'd be the man
I'd be the man
I'd be the man
They'd say I hustled
Put in the work
They wouldn't shake their heads
And question how much of this I deserve
What I was wearing, if I was rude
Could all be separated from my good ideas and power moves
And they would toast to me, oh, let the players play
I'd be just like Leo, in Saint-Tropez
I'm so sick of running
As fast as I can
Wondering if I'd get there quicker
If I was a man
And I'm so sick of them
Coming at me again
'Cause if I was a man
Then I'd be the man
I'd be the man
I'd be the man
What's it like to brag about raking in dollars
And getting bitches and models?
And it's all good if you're bad
And it's okay if you're mad
If I was out flashin' my dollas
I'd be a bitch, not a baller
They'd paint me out to be bad
So it's okay that I'm mad
I'm so sick of running
As fast as I can
Wondering if I'd get there quicker
If I was a man (you know that)
And I'm so sick of them
Coming at me again (coming at me again)
'Cause if I was a man (if I was man)
Then I'd be the man (then I'd be the man)
I'm so sick of running
As fast as I can (as fast as I can)
Wondering if I'd get there quicker
If I was a man (hey)
And I'm so sick of them
Coming at me again (coming at me again)
'Cause if I was a man (if I was man)
Then I'd be the man
I'd be the man
I'd be the man (oh)
I'd be the man (yeah)
I'd be the man (I'd be the man)
"
Taylor Swift ,Lover ,The Archer ,"Combat, I'm ready for combat
I say I don't want that, but what if I do?
'Cause cruelty wins in the movies
I've got a hundred thrown-out speeches I almost said to you
Easy they come, easy they go
I jump from the train, I ride off alone
I never grew up, it's getting so old
Help me hold onto you
I've been the archer
I've been the prey
Who could ever leave me, darling?
But who could stay?
Dark side, I search for your dark side
But what if I'm alright, right, right, right here?
And I cut off my nose just to spite my face
Then I hate my reflection for years and years
I wake in the night, I pace like a ghost
The room is on fire, invisible smoke
And all of my heroes die all alone
Help me hold onto you
I've been the archer,
I've been the prey
Screaming, who could ever leave me, darling?
But who could stay?
(I see right through me, I see right through me)
'Cause they see right through me
They see right through me
They see right through
Can you see right through me?
They see right through
They see right through me
I see right through me
I see right through me
All the king's horses, all the king's men
Couldn't put me together again
'Cause all of my enemies started out friends
Help me hold onto you
I've been the archer
I've been the prey
Who could ever leave me, darling?
But who could stay?
(I see right through me, I see right through me)
Who could stay?
Who could stay?
Who could stay?
You could stay
You could stay
You
Combat, I'm ready for combat
"
Taylor Swift ,Lover ,I Think He Knows ,"I think he knows his footprints
On the sidewalk
Lead to where I can't stop
Go there every night
I think he knows his hands around
A cold glass
Make me wanna know that body
Like it's mine
He got that boyish look that I like in a man
I am an architect, I'm drawing up the plans
It's like I'm seventeen, nobody understands
No one understands
He got my heartbeat
Skipping down 16th Avenue
Got that, oh! I mean
Wanna see what's under that attitude
Like, I want you, bless my soul
And I ain't gotta tell him
I think he knows
I think he knows
I think he knows
When we get all alone
I'll make myself at home
And he'll want me to stay
I think he knows
He better lock it down
Or I won't stick around
'Cause good ones never wait
He got that boyish look that I like in a man
I am an architect, I'm drawing up the plans
He's so obsessed with me, and boy I understand
Boy I understand
He got my heartbeat
Skipping down 16th Avenue
Got that, oh! I mean
Wanna see what's under that attitude
Like, I want you, bless my soul
And I ain't gotta tell him
I think he knows
I think he knows
I want you, bless my
I want you, bless my
I want you, bless my
I want you, bless my soul
Lyrical smile, indigo eyes, hand on my thigh
We can follow the sparks, I'll drive
Lyrical smile, indigo eyes, hand on my thigh
We can follow the sparks, I'll drive
So where we gonna go?
I whisper in the dark
Where we gonna go?
I think he knows
He got my heartbeat
Skipping down 16th Avenue
Got that, oh! I mean
Wanna see what's under that attitude
Like, I want you, bless my soul
And I ain't gotta tell him
I think he knows
I think he knows
I want you, bless my
I want you, bless my
I want you, bless my
I want you, bless my soul
I want you, bless my
I want you, bless my
I want you, bless my soul
I ain't gotta tell him
I think he knows"
Taylor Swift ,Lover ,Miss Americana ,"You know I adore you
I'm crazier for you
Then I was at sixteen
Lost in a film scene
Waving homecoming queens
Marching band playing
I'm lost in the lights
American glory
Faded before me
Now I'm feeling hopeless
Ripped up my prom dress
Running through rose thorns
I saw the scoreboard
And ran for my life
Ah, ah, ah
No cameras catch my pageant smile
I counted days, I counted miles
To see you there
To see you there
It's been a long time coming but
It's you and me
That's my whole world
They whisper in the hallway, ""she's a bad, bad girl"" (okay!)
The whole school is rolling fake dice
You play stupid games, you win stupid prizes
It's you and me
There's nothing like this
Miss Americana and The Heartbreak Prince (okay!)
We're so sad, we paint the town blue
Voted most likely to run away
With you
My team is losing
Battered and bruising
I see the high fives
Between the bad guys
Leave with my head hung
You are the only one
Who seems to care
American stories
Burning before me
I'm feeling helpless
The damsels are depressed
Boys will be boys, then
Where are the wise men?
Darling, I'm scared
Ah, ah, ah
No cameras catch my muffled cries
I counted days, I counted miles
To see you there
To see you there
And now the storm is coming, but
It's you and me
That's my whole world
They whisper in the hallway, ""she's a bad, bad girl"" (okay!)
The whole school is rolling fake dice
You play stupid games, you win stupid prizes
It's you and me
There's nothing like this
Miss Americana and The Heartbreak Prince (okay!)
We're so sad, we paint the town blue
Voted most likely to run away
With you
And I don't want you to (go)
I don't really wanna (fight)
'Cause nobody's gonna (win)
I think you should come home
And I don't want you to (go)
I don't really wanna (fight)
'Cause nobody's gonna (win)
I think you should come home
And I don't want you to (go)
I don't really wanna (fight)
'Cause nobody's gonna (win)
I just thought you should know
And I'll never let you (go)
'Cause I know this is a (fight)
That someday we're gonna (win)
It's you and me
That's my whole world
They whisper in the hallway, ""she's a bad, bad girl""
Oh, I just thought you should know
You should know
It's you and me
There's nothing like this
Miss Americana and The Heartbreak Prince (okay!)
We're so sad, we paint the town blue (paint it blue)
Voted most likely to run away
With you
I don't really wanna (fight)
'Cause nobody's gonna (win)
I think you should come home
And I'll never let you (go)
'Cause I know this is a (fight)
That someday we're gonna (win)
Just thought you should know
You and me
That's my whole world
They whisper in the hallway, ""she's a bad, bad girl""
""She's a bad, bad girl""
"
Taylor Swift ,Lover ,Paper Rings,"The moon is high
Like your friends were the night that we first met
Went home and tried to stalk you on the internet
Now I've read all of the books beside your bed
The wine is cold
Like the shoulder that I gave you in the street
Cat and mouse for a month or two or three
Now I wake up in the night and watch you breathe
Kiss me once 'cause you know I had a long night
(Oh!) Kiss me twice 'cause it's gonna be alright
Three times 'cause I've waited my whole life
(One, two, one two three four!)
I like shiny things, but I'd marry you with paper rings
Uh huh, that's right
Darling, you're the one I want, and
I hate accidents except when we went from friends to this
Uh huh, that's right
Darling, you're the one I want, and
Paper rings and picture frames and dirty dreams
Oh, you're the one I want
In the winter, in the icy outdoor pool
When you jumped in first, I went in too
I'm with you even if it makes me blue
Which takes me back
To the color that we painted your brother's wall
Honey, without all the exes, fights, and flaws
We wouldn't be standing here so proud, so
Kiss me once 'cause I know you had a long night
(Oh!) Kiss you twice 'cause it's gonna be alright
Three times 'cause you waited your whole life
(One, two, one two three four!)
I like shiny things, but I'd marry you with paper rings
Uh huh, that's right
Darling, you're the one I want, and
I hate accidents except when we went from friends to this
Uh huh, that's right
Darling, you're the one I want, and
Paper rings and picture frames and dirty dreams
Oh, you're the one I want
I want to drive away with you
I want your complications too
I want your dreary Mondays
Wrap your arms around me, baby boy
I want to drive away with you
I want your complications too
I want your dreary Mondays
Wrap your arms around me, baby boy
Uh huh
I like shiny things, but I'd marry you with paper rings
Uh huh, that's right
You're the one I want
I hate accidents except when we went from friends to this
Uh huh
Darling, you're the one I want
I like shiny things, but I'd marry you with paper rings
Uh huh, that's right
Darling, you're the one I want, and
I hate accidents except when we went from friends to this
Uh huh, that's right
Darling, you're the one I want, and
Paper rings and picture frames and all my dreams
You're the one I want, and
Paper rings and picture frames and all my dreams
Oh, you're the one I want
You're the one I want, one I want
You're the one I want, one I want
"
Taylor Swift ,Lover ,Cornelia Street ,"We were in the backseat
Drunk on something stronger than the drinks in the bar
""I rent a place on Cornelia Street""
I say casually in the car
We were a fresh page on the desk
Filling in the blanks as we go
As if the street lights pointed in an arrowhead
Leading us home
And I hope I never lose you, hope it never ends
I'd never walk Cornelia Street again
That's the kind of heartbreak time could never mend
I'd never walk Cornelia Street again
And baby, I get mystified by how this city screams your name
And baby, I'm so terrified of if you ever walk away
I'd never walk Cornelia Street again
I'd never walk Cornelia Street again
Windows swung right open, autumn air
Jacket 'round my shoulders is yours
We bless the rains on Cornelia Street
Memorize the creaks in the floor
Back when we were card sharks, playing games
I thought you were leading me on
I packed my bags, left Cornelia Street
Before you even knew I was gone
But then you called, showed your hand
I turned around before I hit the tunnel
Sat on the roof, you and I
I hope I never lose you, hope it never ends
I'd never walk Cornelia Street again
That's the kind of heartbreak time could never mend
I'd never walk Cornelia Street again
And baby, I get mystified by how this city screams your name (city screams your name)
And baby, I'm so terrified of if you ever walk away
I'd never walk Cornelia Street again
I'd never walk Cornelia Street again
You hold my hand on the street
Walk me back to that apartment
Years ago, we were just inside
Barefoot in the kitchen
Sacred new beginnings
That became my religion, listen
I hope I never lose you
I'd never walk Cornelia Street again
Oh, never again
And baby, I get mystified by how this city screams your name
And baby, I'm so terrified of if you ever walk away
I'd never walk Cornelia Street again
I'd never walk Cornelia Street again
I don't wanna lose you, hope it never ends
I'd never walk Cornelia Street again
I don't wanna lose you, yeah
""I rent a place on Cornelia Street""
I say casually in the car
"
