season,season_episode,series_episode,episode_name,episode_notes,air_date,judge1,judge2,judge3,appetizer,entree,dessert,contestant1,contestant1_info,contestant2,contestant2_info,contestant3,contestant3_info,contestant4,contestant4_info
33,8,411,"""An Ugly Turn""",The chefs had to work with ugly ingredients in each basket. Guest judge Saywer was a finalist in Chopped: Grill Masters Napa.,"May 30, 2017",Marc Murphy,Amanda Freitag,Jonathon Sawyer," shrimp heads and shells, stale bagels, black velvet tomatoes, gnarled carrots "," dogfish, radish tops, beef tallow candles, twisted cucumbers "," whipped aquafaba, burnt chocolate chip cookies, cacao beans with pulp, brown bananas",Mauricio Nunez, Chef de Cuisine from Mount Kisco  NY , Miranda Rosenfelt, Chef de Cuisine from Washington  DC , Jordan Lloyd, Executive Chef & Restaurateur from Easton  MD , Nicolas Ferreira, Private Chef from New York  NY 
34,1,412,"""Thanks, Mom!""","The contestants were Food Network chefs competing alongside their mothers for a select charity. Ted Allen was one of the contestants, and the judges took turns performing his hosting duties. The chefs had 30 minutes in the appetizer round instead of the usual 20.","May 9, 2017",Marc Murphy,Amanda Freitag,Marcus Samuelsson," duck breast, baby turnips, quail eggs, rose bud tea "," red snapper, guanciale, sunflower seeds, sorrento lemons "," rhubarb, walnuts, madeleines, blood oranges",Jeff and Pam Mauro ,, Ted and Donna Allen ,, Jet and Mary Tila ,, Chris and Mary Lou Santos ,
34,2,413,"""Grill Game""","This was a grilling-themed episode. The ovens were turned off and the stovetops were outfitted with grill pans and griddles. While Chopped normally obscures brand names, the meat sauce in the entree basket was A1 Steak Sauce, a product of a Chopped sponsor. Chef Campbell is the daughter of Leslie Roark Scott, a finalist in the second season of Chopped Grill Masters.","May 23, 2017",Marc Murphy,Amanda Freitag,Maneet Chauhan," longaniza, grilled stuffed onions, asparagus, frozen cherry daiquiri "," venison rib rack, charred caprese sandwich, baby corn, meat sauce "," roasted marshmallow shots, figs, almonds, grilled peaches and cream cake",Erin Campbell, Competitive BBQ Champ from Yazoo City  MS , Shane Vidovic, Chef and Restaurateur from Lakewood  OH , Eusebio Gongora, Culinary Director from Baton Rouge  LA , Tanya Cauthen, Butcher from Richmond  VA 
34,3,414,"""Greater Tater""","The theme of this episode was potatoes, which were featured in two forms in every basket. Chef Chatman is a line cook for Chopped judge Alex Guarneschelli.","June 6, 2017",Marcus Samuelsson,Amanda Freitag,Ali Khan," purple potatoes, potato tots, garlic chives, Canadian bacon "," Kennebec potatoes, chili cheese fries, porterhouse steaks, fresh wasabi "," loaded baked potatoes, sweet potato pie, dried cranberries, English toffee",Bea Rocchetti, Sous Chef from Farmington Hills  MI , Miguel Franco, Executive Chef from New York  NY , Michael Chatman, Line Cook from New York  NY , Shacafrica Simmons, Caterer from Tallahassee  FL 
34,4,415,"""Father's Day""","This was a home cook, team competition: four fathers paired up with their adult children. The teams were given 30 minutes in the appetizer round instead of 20.","June 13, 2017",Scott Conant,Amanda Freitag,Marc Murphy," ground beef, Japanese eggplant, date syrup, remote control cookie "," salmon fillet, candy cane beets, cassava sticks, fava beans "," bacon gelato, Belgian ale, cactus pear, pretzel bark",Mike Hannah and Melissa Hannah from Cleveland, OH , Mark Sheridan and Kevin Sheridan from Cleveland, OH , Johnny Hall and Yahaira Hall from Brooklyn, NY , Sabi Bivas and Daniel Bivas from Hillsborough, NJ 
34,5,416,"""Got Your Goat?""",,"June 20, 2017",Scott Conant,Amanda Freitag,Alex Guarnaschelli," crawfish tails, peas, processed cheese, vegetable-infused vodka "," goat chops, petite garlic with greens, pickled string beans, root beer barrel candy "," zucchini, caramel popcorn with peanuts, yuzu juice, manchego cheese",Greg Power, Executive Chef from New York  NY , Ashley Jonique, Private Chef from New Orleans  LA , Felix Castro, Executive Pastry Chef from New York  NY , Scott Maki, Executive Chef from New Orleans  LA 
34,6,417,"""Snap Pea to It!""","While Chopped normally obscures brand names, the pomegranate juice in the appetizer round was POM Wonderful, a product of a Chopped sponsor.","June 27, 2017",Scott Conant,Alex Guarnaschelli,Marcus Samuelsson," lamb kebabs, pomegranate juice, Chinese broccoli, avocado toast "," Cornish hens, black rice, snap peas, watermelon radish "," olive oil cake, papaya, kiwi, kefir",Jimmie Rondon, Sous Chef from New York  NY , Allie Lyttle, Chef from Detroit  MI , Willy Anderson, Caterer from Brooklyn  NY , Charly Pierre, Chef and Co-Owner from New Orleans  LA 
34,7,418,"""Bangin' Backyard Cookout""","The theme of this episode was backyard barbecuing. The classic burger fixings in the second round contained onions, tomatoes, and lettuce. The watermelon grill in the third round was half a hollowed out watermelon with fruit skewers on top placed to resemble grill grates.","July 4, 2017",Scott Conant,Alex Guarnaschelli,Elizabeth Heiskell," burger-wrapped hot dogs, half-sour pickles, kasundi, macaroni salad "," beer-can chicken, eggplant, double-smoked bacon, classic burger fixings "," watermelon grill, corn chips, strawberry shortcake, sweet tea vodka",Jessica Johnson, Chef and Restaurateur from Cleveland  OH , Craig Walker, Chef and Restaurateur from New Orleans  LA , Greg Beckham, Chef and Restaurateur from Cleveland  OH , Christine Wendland, Executive Chef from Chesterfield  NJ 
34,8,419,"""Flour Power""",This episode had all female pastry chefs. They were required to bake something in each round. The chefs were given 30 minutes in the appetizer round and 45 minutes in the dessert round to showcase their pastry talents.,"July 11, 2017",Nancy Silverton,Scott Conant,Amanda Freita," piadina dough, skirt steak, bitter melon, vegetable gratin "," pâte à choux dough, chicken breast, kale, roasted mushrooms "," lemon balm, oven-roasted grapes, marshmallow spread, pastry flour",Tracy Wilk, Executive Pastry Chef from New York  NY , Sophie Jaeger, Pastry Chef and Restaurateur from Brooklyn  NY , Anna Fitting, Executive Pastry Chef from New York  NY , Crystal Smith, Pastry Chef from Detroit  MI 
34,9,420,"""Alton's Challenge, Part 1""","This is part 1 of a 5-part tournament where Alton Brown picks the baskets with specific scientific, gastronomic techniques in mind. The theme of this episode is smoke and the contestants are required to infuse smoke into each dish. A basket ingredient in the entree round (the meatballs) was smoked by Alton himself.","October 10, 2017",Alton Brown,Maneet Chauhan,Hugh Acheson," smoked salmon macarons, black garlic, micro radishes, Chilean sea bass "," hard smoked eggs, cardoons, red shishito peppers, smoked meatballs "," pig skin, Anjou pears, mozzarella, suanmeitang",Leah Gourlie, Pastry Chef and Owner from Cleveland  OH , Jamal Bland, Executive Chef from New York  NY , Jessica Chaney, Pastry Chef from Detroit  MI , Gavin Jobe, Chef and Restaurateur from Baton Rouge  LA 
34,10,421,"""Alton's Challenge, Part 2""","This is part 2 of a 5-part tournament where Alton Brown picks the baskets with specific scientific, gastronomic techniques in mind. The theme of this episode is dehydration, with at least one dehydrated ingredient in each round. A basket ingredient in the entree round (the beef jerky) was made by Alton from brined, dehydrated flank steak.","October 17, 2017",Alton Brown,Amanda Freitag,Marcus Samuelsson," instant mashed potatoes, tuna floss, cucumbers with blooms, bacalao "," clams, tomato crisps, olives, beef jerky "," space ice dream, Sharon fruit, dried pomegranate seeds, dehydrated scrambled eggs",Lisa Pucci Delgado, Private Chef from Cleveland  OH , Vinnie Cimino, Chef de Cuisine from Cleveland  OH , Ben Bebenroth, Chef and Restaurateur from Cleveland  OH , Nick Wallace, Executive Chef from Jackson  MS 
34,11,422,"""Alton's Challenge, Part 3""","This is part 3 of a 5-part tournament where Alton Brown picks the baskets with specific scientific, gastronomic techniques in mind. The theme of this episode is molecular gastronomy, with at least one modernist ingredient in each round. A basket ingredient in the entree round (lamb rib roast) was set aside on a separate table. It was cooked sous-vide inside an immersion circulator.","October 24, 2017",Alton Brown,Amanda Freitag,Wylie Dufresn," transparent ravioli, rainbow carrots, crab legs, tapioca maltodextrin "," zucchini blossoms, arugula noodles, poached pears, lamb rib roast "," raindrop cake, blood oranges, popping sorghum, cookie dough ice cream sandwiches",Tiffany Schleigh, Pastry Chef from New York  NY , Louis Goral, Executive Chef from New York  NY , Andrea Anom, Line Cook from New York  NY , Chris Holland, Executive Chef from Sparkill  NY 
34,12,423,"""Alton's Challenge, Part 4""","This is part 4 of a 5-part tournament where Alton Brown picks the baskets with specific scientific, gastronomic techniques in mind. The theme of this episode is fermentation, with at least one fermented/pickled ingredient in each round. A basket ingredient in the appetizer round (champagne) was initially unveiled as a champagne flute, and the chefs were treated to a small lesson from Alton on how fermentation of grapes results in alcohol.","October 31, 2017",Alton Brown,Amanda Freitag,Alex Guarnaschelli," mutton chops, kimchi, cocoa nibs, champagne "," red snapper, sourdough bread, purple cauliflower, natto "," sauerkraut cake, pickled green strawberries, beer, passion fruit",Jason Rodriguez, Executive Chef and Owner from New York  NY , Regan Reik, Executive Chef from Cleveland  OH , Kashi Smith, Chef Tournant from New York  NY , Michael Nelson, Executive Chef from New Orleans  LA 
34,13,424,"""Alton's Challenge, Grand Finale""","This is the final part of a 5-part tournament where Alton Brown picks the baskets with specific scientific, gastronomic techniques in mind. There is no specific theme for the finale. A basket ingredient in the dessert round (sorbet) was shown as created by Alton via a dry ice fire extinguisher and sorbet mixture combined in a food processor. *For the first time in Chopped history, three competitors moved into the dessert round.","November 7, 2017",Alton Brown,Alex Guarnaschelli,George Men," smoked chubs, baby beets, curry ketchup, microwave fried herbs "," pork crown roast, baby artichokes, smen, dried myrtle berries "," dried tarantulas, whole coconut, marzipan fruit, cherry cola sorbet",Michael Nelson, Executive Chef from New Orleans  LA , Nick Wallace, Executive Chef from Jackson  MS  chopped 1st in dessert* , Gavin Jobe, Chef and Restaurateur from Baton Rouge  LA  chopped 2nd in dessert* , Chris Holland, Executive Chef from Sparkill  NY 
35,1,425,"""Clam Clash""","Guest judge Jordan Andino was a contestant from the Chopped season 15 episode, Heads Up!","July 18, 2017",Scott Conant,Amanda Freitag,Jordan Andino," little neck clams, ultra mizuna, vadouvan, banana chips "," red grouper, candy-coated licorice, squid ink, petite purple broccoli "," navy bean pie, guava, cherry spoon fruit, sgroppino al limone",Kristina Mellegard, Private Chef from New York  NY , William Gauger, Chef and Co-Owner from Long Island City  NY , Kimani Hines, Executive Chef from New Rochelle  NY , Julie Cole, Executive Chef from Brooklyn  NY 
35,2,426,"""Clock Shock""",,"July 25, 2017",Scott Conant,Amanda Freitag,Maneet Chauhan," tiger prawns, pea tendrils, corzetti pasta, duck salami "," pork strip steaks, morel mushrooms, artichoke paste, crunchy pizza snacks "," music paper bread, gala apples, bitters, mini cherry lollipops",Omar Mitchell, Chef and Owner from Detroit  MI , Jen Scher, Executive Chef from New York  NY , Giorgio Giacinto, Chef and Owner from New Rochelle  NY , Marcus Woodham, Chef de Cuisine from New Orleans  LA 
35,3,427,"""Food Truck Luck""",All the contestants competing were food truck owners. Chef Musselmani has also competed on the 15th season of Hell's Kitchen.,"September 5, 2017",Scott Conant,Amanda Freitag,Marcus Samuelsson," goat barbacoa tacos, Asian long beans, spring roll wrappers, chicken souvlaki "," lobster rolls, bok choy, ramen noodles, chile de arbol "," tropical fruit pops, candied nuts, chocolate covered bananas, dessert nachos",Suzette Montalvo, Food Truck Owner  'A New Yorican Thing' from Long Island  NY , Andrew Zurica, Food Truck Owner  'Hard Times Sundaes' from New York  NY , Hassan Musselmani, Food Truck Owner  'The Drunken Rooster' from Detroit  MI , Caitlyn Napolitano, Food Truck Co-owner  'Los Viajeros' from New York  NY 
35,4,428,"""Waffles for the Win""",Contestants were tasked to cook dishes paired with waffles.,"September 12, 2017",Maneet Chauhan,Amanda Freitag,Joseph “JJ” Johnson," waffle batter, chicken tenders, chiles de arbol, Lay's Classic potato chips "," liege waffle dough, sliced beef shanks in soy sauce, kumquats, mustard greens "," waffle cookies, buttermilk, creamy organic peanut butter, dried strawberries",Bryan Lindsay, Executive Chef from Brooklyn  NY , Brandi Marter, Chef and Restaurateur from Memphis  TN , Juan Carlos Gonzalez, Executive Chef from New Orleans  LA , Adam Bostwick, Chef and Restaurateur from Cleveland  OH 
35,5,429,"""Comfort Zone""",The theme of this episode was comfort food in every basket.,"September 19, 2017",Marc Murphy,Amanda Freitag,Geoffrey Zakarian," fried chicken, rainbow chard, fingerling potatoes, bacon grease "," meatloaf mix, heirloom tomatoes, chanterelle, mushrooms, boxed mac & cheese "," peanut butter & jelly sandwiches, strawberries, vanilla wafers, chocolate milk",Jayda Atkinson, Catering Chef from New Orleans  LA , Darwell Yeager III, Executive Chef and Owner from Pearl  MS , Jess Dunne, Chef and Owner from Southold  NY , John Powali, Chef from New York  NY 
35,6,430,"""The Beets Go On""",,"September 26, 2017",Marcus Samuelsson,Maneet Chauhan,Amanda Freita," sosis bandari, mostarda, crescent roll dough, corn of the cob "," lobster, mâche, rose petals, Mexican chorizo "," crème brûlée, blackberries, rainbow beets, Italian almond wafers",Melissa Araujo, Caterer from New Orleans  LA , George Georgiades, Chef and Owner from New York  NY , Chase Sanders, Executive Chef from New York  NY , Eric Arboleda, Chef from Colombia 
35,7,431,"""Spooked""","This was a Halloween themed episode. In the appetizer round the ""skull platter"" was prosciutto arranged on a prop skull to look like skin. In the entree round, the ""egg eyeballs"" are poached eggs in a pan, the blood shots are decorative syringes filled with a red syrup, and the ""gory brain"" is a glazed turkey meatloaf loaf shaped like a brain. In the dessert round the ""Halloween candy cake"" was a chocolate cake decorated with various Halloween candies. The ""freaky brie"" was a brie cheese wheel wrapped in puff pastry strips to look like a mummy face.","October 3, 2017",Geoffrey Zakarian,Maneet Chauhan,Amanda Freita," scary skull platter, barmbrack, Halloween party punch, asparagus "," spooky egg eyeballs, blood shots, gory brain, avocados "," Halloween candy cake, vampire's kiss martini, freaky brie, mixed berries",Michael Monzon, Teppanyaki Chef from Los Angeles  CA , Dani Macchia, Private Chef from New York  NY ," Kimberly ""Kim"" Gibson", Chef & Restaurateur from Chagrin Falls  OH , Dustine Gonsalves, Chef de Cusine from Los Angeles  CA 
35,8,432,"""Feel the Burn""",This was a competition revolving around the use of spices in every dish. Chef Hatfield is an actual descendant of the Hatfield family of the famous Hatfield–McCoy feud.,"October 19, 2017",Scott Conant,Amanda Freitag,Maneet Chauhan," spicy chicken feet, Persian cucumbers, mandarins, buffalo cauliflower dip "," five-alarm chili, cinnamon rolls, lamb shoulder, horseradish root "," sriracha lollipops, jalapeño-blueberry cornbread, baby pineapples, white chocolate",Iliana Negron, Executive Chef from Nyack  NY , Alex Diaz, Executive Chef from New York  NY , Ken Hatfield, Chef & Restaurateur from Cleveland  OH , Airis Johnson, Private Chef from Brooklyn  NY 
35,9,433,"""Gimme Gator""",,"October 26, 2017",Scott Conant,Alex Guarnaschelli,Tiffani Faison," king crab legs, fresh cut whole kernel corn, black garlic, coconut vinegar "," alligator, carrot jam, green almonds, calvados "," persian chickpea cookies, strawberry gelatin, bananas, cherimoya",Rudy Straker, Private Chef from Queens  NY , Ben Bruckenthal, Sous Chef from Brooklyn  NY , Tiffany Senin, Chef and Owner from Brooklyn  NY , Jacob Bensley, Sous Chef from New York 
35,10,434,"""Flavor Savor""","Mediterranean ingredients were featured in each basket. Both guest judges, Einat and Michael, were past Chopped winners. .","November 2, 2017",Chris Santos,Einat Admony,Michael Psilaki," rice-stuffed grape leaves, baby octopus, cured olives, bresaola "," dorade, stinging nettles, watermelon radish, village salad "," rosewater syrup, figs, pistachio cream, angel food cake",Cosmo Bisticas, Executive Chef from Brooklyn  NY , George Kringas, Chef and Owner from White Plains  NY , Tara Cianella, Chef and Owner from Nyack  NY , Gabriel Israel, Chef de Cuisine from New York  NY 
35,11,435,"""Pie Jinks""",ach basket contained a pie and the chefs were required to make a pie in every round. The chefs were given 30 minutes in the appetizer round and 45 minutes in both the entree and dessert round in order to properly cook their pies.,"November 9, 2017",Geoffrey Zakarian,Amanda Freitag,Scott Conant," Honeycrisp apples, sour gummies, pumpkin pie, Merguez sausage "," Whipped topping, baby kale blend, pancetta, shepherd’s pie "," Key lime pie, rhubarb, candied ginger, spiced rum",James Graham, Executive Chef from Staten Island  NY , Zack Stapelman, Executive Chef from Brooklyn  NY , Natalie Colledge, Owner & Cullinary Director from Montclair  NJ , Kenneth Temple, Private Chef from New Orleans  LA 
35,12,436,"""An Iron Chef Thanksgiving""","This was a Thanksgiving themed episode. All four contestants were Chopped Champions returning to win money for their charity of choice. Judging them were three Iron Chefs from Iron Chef America (with Alex also being a regular Chopped judge). By winning this episode, Chef Chapman becomes the first four-time Chopped champion.","November 14, 2017",Alex Guarnaschelli,Jose Garces,Marc Forgion," turkey confit, brussels sprouts, Thanksgiving cider cocktail, turkey offal "," cornish hens, haricots verts, Thanksgiving gravy flavored candy, cranberry pomegranate terrine "," sweet potato casserole, pears, port wine cheese, Thanksgiving waffle sandwich",Roxanne Spruance, Executive Chef and Owner from New York  NY  charity: American Farmland Trust , Giorgio Rapicavoli, Executive Chef  from Miami  FL  charity: Our Pride Academy , Hugh Mangum, Executive Chef and Owner from New York  NY  charity: Share Our Strength , Emily Chapman, Sous Chef from New York  NY  charity: Shepherd's Circle Foundation 
35,13,437,"""Espresso Express""",,"November 21, 2017",Scott Conant,Maneet Chauhan,Amanda Freita," cobia, fennel, honeydew melon, ground espresso "," veal sweetbreads, napini, pierogies, black mint paste "," sesame seed candy, mangoes, blackstrap molasses, raspberry snack cakes",Cybille St. Aude, Sous Chef from Long Island  NY , Brandon Williams, Chef de Cuisine from Cleveland  OH , Lawrence Ofori, Executive Chef from New York  NY , Michael Castellon, Sous Chef from New York  NY 
35,14,438,"""Weird Twist""","The theme of the baskets was ""weird food"". (The babbouche in the appetizer round is a Moroccan snail dish.)","November 28, 2017",Scott Conant,Amanda Freitag,Geoffrey Zakarian," babbouche, conehead cabbage, pig's head terrine, black rice ramen "," stuffed lamb intestines, cured tuna heart, garlic ice cream, red runner bean blooms "," queen weaver ants, tang yuan, sweet avocado (cream), szechuan buttons",Jay Reifel, Executive Chef from New York  NY , Tom Coughlan, Executive Chef from Brooklyn  NY , Ana Gonzales, Executive Chef from Memphis  TN , Nick Testa, Executive Chef from New York  NY 
35,15,439,"""Chopped Grand Holiday""","This was a holiday themed episode. All four contestants were Chopped Grand Champions returning to win money for their charity of choice. The chefs were given 30 minutes in the appetizer round instead of the usual 20 to allow time to properly butcher and cook the goose breast. The veggie plate in the appetizer round mainly consisted of broccoli, cauliflower, and cherry tomatoes, arranged to look like a Christmas tree. The festive pretzels in the dessert round were pretzel sticks dipped in green candy coating and sprinkled with silver nonpareils. With his victory in this episode, chef Greenberg is the first male Chopped champion to win four times, as well as the second overall winner to do so.","December 5, 2017",Marc Murphy,Maneet Chauhan,Amanda Freita," goose breast, peppermint bark vodka, Christmas tree veggie plate, Hanukkah gelt cookie cake "," deckle of beef, kugel, porcini mushrooms (in olive oil), hard boiled egg snowmen "," chestnut tree honey, festive pretzels, Santa Claus melon, springerle cookies",Diana Sabater, Chef from Philadelphia  PA  charity: Esperanza , Darius Peacock, Executive Chef from Trenton  NJ  charity: Good Shepherd Services , Sophina Uong, Executive Chef from Oakland  CA  charity: Camp Okizu , Adam Greenberg, Executive Chef from Norwalk  CT  charity: Mowat-Wilson Syndrome 
35,16,440,"""True Grits""","ach basket contained a form of grits. Chef Chester-Tamayo cut herself in the last seconds of the appetizer round, leaving enough blood on her station and plates to deem her dish unsafe to eat. The judges allowed her to bring over her non-contaminated components from her station for them to taste after the other chefs granted her permission to do so.","December 7, 2017",Scott Conant,Amanda Freitag,Marc Murphy," collard greens, pickled watermelon rind, head-on shrimp, hominy grits "," polenta, spiral ham, green beans, pimento cheese "," blue grits, blackberries, lemon oil, boiled peanuts",B.J. Chester-Tamayo, Chef & Owner from Memphis  TN , Jean Gabriel, Chef & Co-Owner from Stamford  CT , Tres Barnard, Chef from New Orleans  LA , Steve Costanzo, Chef & Owner from Stamford  CT 
35,17,441,"""Cocktail Party""","The theme of the episode was cocktail food, with each contestant having to make small dishes suited for a cocktail party. They also had to prepare an alcoholic drink to pair with each dish. The rounds were extended by an extra 10 minutes to account for cocktail preparation (30 minutes in the first round and 40 minutes in the second and third rounds). The guest judge, Lauren Gerrie, was a previous Chopped winner from season 6 ('A Cornish Mess') and part 3 in the 2011 Chopped Champions tournament.","December 19, 2017",Scott Conant,Amanda Freitag,Lauren Gerri," tuna, crab meat cocktail, finger limes, vodka "," filet mignon, cocktail onions, summer truffles, single malt scotch whiskey "," marshmallow spread, fruit cocktail, gold leaf, gin",Josh Moore, Executive Chef from New York  NY , Catt Rolland, Pastry Chef & Sous Chef from New Orleans  LA , Charles Disa, Chef & Caterer from New York  NY , Dave Martin, Chef Consultant from New York  NY 
35,18,442,"""Amped for Ramps""",,"December 26, 2017",Marc Murphy,Tiffani Faison,Dale Tal," calamari, ramps, cherry peppers, liverwurst "," beef kidneys, purple butterfly sorrel, pignoli cookies, ginger beer "," lemongrass, papaya, goat's milk, popcorn jelly beans",Rochelle Honeygan, Sous Chef from Brooklyn  NY , Dallas Martinez, Executive Chef from Cleveland  OH , John Brennan, Chef and Owner from New Haven  CT , Tristen Epps, Executive Chef from Brooklyn  NY 
35,19,443,"""Mardi Gras Goals""",All the contestants were from New Orleans and the theme of the baskets centered around Mardi Gras.,"February 6, 2018",Marc Murphy,Maneet Chauhan,David Gua," shrimp po'boys, tasso ham, kohlrabi, milk punch "," crawfish, Cajun caramel corn, okra, dark roux "," king cake, cherries, café brûlot, praline",Byron Bradley, Chef de Cuisine from New Orleans  LA , Brandon Green, Executive Chef from New Orleans  LA , Austin Kirzner, Executive Chef from New Orleans  LA , Syrena Johnson, Private Chef & Caterer from New Orleans  LA 
35,20,444,"""Dim Sum Yum""",,"March 6, 2018",Scott Conant,Chris Santos,Marc Murphy," hot & sour soup, Tokyo scallions, bubble gum flavored candy, ground pork "," Korean-style short ribs, galangal, sorghum wine, dim sum "," puffed rice cereal treats, mangosteen, cherry blossom paste, hard-boiled quail eggs",Adam Sherris, Sushi Chef from Denver  CO , Caitlin Salisbury, Chef from Kingston  NY , Lina Lynn, Chef and Owner from Jackson  MS , Chris Paulikas, Executive Sous Chef from Philadelphia  PA 
36,1,445,"""Better Duck Next Time""","The 'frankfurter crown roast' in the entrée round was a bunch of hotdogs bundled together in a standing ring to resemble a ""crown roast"" of meat. The 'moose ears' in the dessert round were pieces of fried, sugary dough drizzled with caramel sauce. Guest judge Jonathan Sawyer has previously been a contestant on Chopped (Grill Masters Napa).","December 12, 2017",Scott Conant,Amanda Freitag,Jonathon Sawyer," tiered cheese tower, cavatelli, frozen lima beans, duck tongues "," frankfurter crown roast, small graffiti eggplant, karela juice, goat leg "," moose ears, Saturn peaches, hard cider, Jordan almonds",Jonathan Scinto, Private Chef from Long Island  NY , Amanda Henson, Chef and Owner from Las Vegas  NV , Andrew Welenken, Executive Chef from Louisville  KY , Jamaal Taherzadeh, Executive Chef from Las Vegas  NV 
