season,season_episode,series_episode,episode_name,episode_notes,air_date,judge1,judge2,judge3,appetizer,entree,dessert,contestant1,contestant1_info,contestant2,contestant2_info,contestant3,contestant3_info,contestant4,contestant4_info
13,3,151,"""No Kidding!""","This is the first episode to feature teenage competitors. The contestants were given 30 minutes instead of the usual 20 in the appetizer round. The three eliminated teenagers each received a $1,000 gift certificate to Food Network's online store.","October 2, 2012",Chris Santos,Alex Guarnaschelli,Marcus Samuelsson," gummy bacon, salmon fillets, frozen lima beans, lemon sorbet "," cotton candy, chicken cutlets, Brussels sprouts, French-fried onions "," zucchini, chocolate cake mix, crème fraîche, movie theatre popcorn",Romilly Newman ,age 13  from New York  NY , Joel Allette ,age 17  from New York  NY , Noah Museles ,age 16  from Washington  D.C. , Shania Thomas ,age 17  from New York  NY 
13,4,152,"""Pigging Out!""","This was a ""nose-to-tail"" themed competition. The pig organs in the entrée round consisted of heart, liver, and kidneys, and the chefs were required to use all three of them.","October 23, 2012",Aarón Sánchez,Alex Guarnaschelli,Marcus Samuelsson," pig's head, fava beans, strawberries, Roquefort blue cheese "," pig organs, fiddlehead ferns, morel mushrooms, bourbon cream liqueur "," pig tails, dragonfruit, sorghum flour, lard",Terry Koval, Chef and Restaurateur  Farm Burger  Decatur  GA , Nicole Brisson, Executive Chef  Carnevino at the Palazzo Resort  Las Vegas  NV , Robert Finn, Chef de cuisine  Fatty Crab  New York  NY , Hugh Mangum, Executive Chef and Owner  Mighty Quinn's  New York  NY 
13,5,153,"""Unsung Heroes""","This episodes featured four ""unsung heroes"": people who volunteer in their communities. Grace forgot the chocolate covered almonds in the appetizer. However the judges enjoyed her dish so she moved on.","November 6, 2012",Scott Conant,Alex Guarnaschelli,Chris Santo," bangers, apple chips, asparagus, chocolate-covered almonds "," venison tenderloin, hamantashen, cola, cauliflower "," marshmallow spread, balsamic vinegar, ancho chiles, almond butter cookies",Tony Biggs, Director of Culinary Operations  Second Harvest Food Bank  New Orleans  LA , Linda Miles, Chef and Manager  Chapel Manor Senior Health Care Center / Philabundance  Philadelphia  PA , Keith Lucas, Executive Chef  Manna  Philadelphia  PA , Grace Lichaa, Manager  Capital Area Food Bank  Washington  D.C. 
13,6,154,"""Bird in the Pan""",,"November 27, 2012",Scott Conant,Marco Canora,Marcus Samuelsson," chicory, Ethiopian coffee beans, petite bananas, lamb fries "," Cornish hens, baby beets, celeriac, blueberry balsamic vinegar "," chickpea flour, raspberries, ricotta salata, rose water syrup",Giancarlo Autenzio, Executive Chef  The Astor Room  Queens  NY , Brack May, Chef and Restaurateur  Cowbell  New Orleans  LA , Virginia Willis, Chef and Author  Atlanta  GA , Tabb Singleton, Sous chef  Nola  New Orleans  LA 
13,7,155,"""Thirsty for Victory""","Greg Grossman was 16 years old at the time he competed, making him the youngest chef to appear on Chopped outside the special ""teen chefs"" episodes.","December 11, 2012",Scott Conant,Lee Anne Wong,Marcus Samuelsson," ice cream cones, lump crab meat, baby turnips, pickled ginger "," city chicken, canned peaches, mustard greens, fruit punch-flavored sports drink "," carob syrup, spaghetti squash, figs, walnuts",Greg Grossman, Student at Professional Children's School  New York  NY , Jeremy Langlois, Executive Chef  Houmas House Plantation and Gardens  Darrow  LA , Leslie Parks, Freelance Caterer  New York  NY , Phil Crispo, Assistant Culinary Professor  Culinary Institute of America  Hyde Park  NY 
13,8,156,"""Trout Bout""",,"December 18, 2012",Scott Conant,Alex Guarnaschelli,Chris Santo," brook trout, rhubarb, dried strawberries, lemon verbena "," Scottish red-legged partridge, peanut butter taffy, lacinato kale, red curry paste "," dulce de leche, pineapple, sesame seed buns, apricot paste",Courtney Renn, Personal Chef  Chef Courtney  Atlanta  GA , Jimmy Tessier, Chef de cuisine  Bacio  Tropicana Las Vegas Hotel and Resort  Las Vegas  NV , Akiko Thurnauer, Chef and Restaurateur  Family Recipe  New York  NY , Nathanial Zimet, Chef and Restaurateur  Boucherie  New Orleans  LA 
13,9,157,"""Belly Up""","Chef Klette-Kolton is the business partner of Lauren Gerrie, runner-up of the second Chopped Champions tournament. In the entrée round, Chef Sell dropped his pork belly on the floor and still put it on the plate. The judges did not taste that part of his dish.","January 1, 2013",Scott Conant,Amanda Freitag,Jet Tila," red mullet, shishito peppers, watercress, hot cocoa mix "," pork belly, artichokes, cherrystone clams, baby apples in syrup "," acorn squash, orange sherbet pops, sour cream, wheatgrass",April Neujean, Lead Teacher  The Edible Schoolyard  New Orleans  LA , Chris Sell, Chef and Restaurateur  Chipshop  Brooklyn  NY , Danny Lachs, Chef and Restaurateur  Tortaria  New York  NY , Flannery Klette-Kolton, Caterer  Big Little Get Together  New York  NY 
13,10,158,"""Hecho en the Chopped Kitchen""",This episode featured Latin-themed ingredients. Also Chef Castro competed on season 18 of Hell's Kitchen and was the runner up.,"February 7, 2013",Chris Santos,Aarón Sánchez,Marc Murphy," pig's feet in a jar, tres leches cake, jicama, culantro "," goat chops, churros, tequila, huitlacoche "," whole coconuts, pepitas, piloncillo, yucca",Mike Minor, Executive Chef  Border Grill at Mandalay Bay  Las Vegas  NV , Saul Ortiz-Cruz, Executive Chef  Tacos & Tequila at the Luxor  Las Vegas  NV , Mia Castro, Chef de partie  Las Vegas  NV , Royden Ellamar, Executive Chef  Sensi at the Bellagio  Las Vegas  NV 
13,11,159,"""Make No Mistake""","This episode featured chefs who were eliminated in previous episodes for making egregious mistakes. Unlike past redemption episodes, fans chose the competitors they wanted to see come back, via internet poll.","February 17, 2013",Geoffrey Zakarian,Amanda Freitag,Chris Santo," pulpo, chioggia beets, fava beans, pickled garlic "," wild boar roast, sweet potato chips, nopales, acai berry juice "," tangerines, cranberry sauce, chocolate chip cookies, gorgonzola dolce",Marja Samsom," Caterer  New York  NY  Episode 5.11 – ""Fright Bites"" ", Monica Langowski," Private Chef  Chicago  IL  Episode 7.2 – ""Canned Cheese  Please!"" ", John Sierp," Chef  New York  NY  Episode 3.9 – ""Winging It"" ", Gwen LePape," Executive Chef  New York  NY  Episode 1.8 – ""Coconut  Calamari  Donuts"" "
13,12,160,"""Untrained, Undaunted""",This was the first official amateurs episode (discounting the teen and firefighter specials).,"February 26, 2013",Scott Conant,Alex Guarnaschelli,Marc Murphy," pickled watermelon rind, sushi platter, kohlrabi, bacon bits "," ostrich fan filets, purple asparagus, fish roe in a tube, blueberry wine "," cinnamon chips, baby red grapes, earl grey tea leaves, pound cake",Adrian Ashby, Administrative Assistant from Queens  NY , Maureen Sanchez, Homemaker from Oswego  IL , Michael Press, President of Textile by Elizabeth and James Jeans from White Plains  NY , Kevin Rooney, Mayor of Wyckoff  NJ 
14,1,161,"""Leftovers Overload""",The ingredients used in this episode were leftovers.,"January 6, 2013",Marc Murphy,Amanda Freitag,Maneet Chauhan," matzo ball soup, macaroni and cheese, fried onion blossom, submarine sandwich "," rib-eye steak, mashed potatoes, ketchup packets, Greek salad "," ice cream sundae, old bananas, stale tortilla chips, cola",Shawn Smilie, Executive Chef  The Buffet at Aria  Las Vegas  NV , Jason Robertson, Caterer  Headwaters Café  New Orleans  LA , Nealy Frentz, Chef and Restaurateur  Lola  Covington  LA , Gerald Chin, Chef de Cuisine  The Cosmopolitan Las Vegas  Las Vegas  NV 
14,2,162,"""Chopped Champions: Part 1""","This was the first of a five-part series of episodes, where sixteen past champions competed. The winner of each preliminary round advanced to the finale, where they competed for $50,000. The fish heads used in the entrée round were from striped bass. In the entree round, Chef Sean forgot the crema, but moved on because Chef Sylvain's sauce was too thick.","January 15, 2013",Geoffrey Zakarian,Alex Guarnaschelli,Chris Santo," canned haggis, smoked gouda, celery, prunes "," fish heads, hon-shimeji mushrooms, crema, sugar cookie dough "," spiral ham, green plantains, water chestnuts, spiced rum",Lish Steiling," Assistant Food Stylist  Today  New York  NY  Episode 9.8 – ""Make A Splash!"" ", Sylvain Harribey," Executive Chef  Sofitel  New York  New York  NY  Episode 10.6 – ""On the Line"" ", Sean Scotese," Freelance Chef  New York  NY  Episode 11.11 – ""A Very Piggy Halloween"" ", Kenneth Johnson," Executive Chef  Pescatore  New York  NY  Episode 11.9 – ""Yuzu Never Know""  advances to final round "
14,3,163,"""Chopped Champions: Part 2""","This is part 2 of a 5-part tournament where sixteen past champions competed. Chef Ali cut her finger badly in the Entree round and while being treated her squab overcooked, and she put in her quinoa after the injury making it undercooked. Chef Ali was chopped for these reasons.","January 22, 2013",Scott Conant,Amanda Freitag,Aarón Sánchez," fruitcake, shad roe, vodka, Tokyo scallions "," squab, peanut butter and jelly, red quinoa, karela "," mitmita, sauternes, cream-filled snack cakes, cottage cheese",Rachel Willen," Chef and Culinary Instructor  Foodfix  Clinton  NJ  Episode 11.13 – ""Chopping in a Winter Wonderland"" ", Fatima Ali," Sous chef  Café Centro  New York  NY †  Episode 12.2 – ""A Guts Reaction"" ", Walter D'Rozario," Chef de cuisine  Junoon  New York  NY  Episode 10.1 – ""The Big Scoop"" ", Vinson Petrillo," Executive Sous chef  Caviar Russe  New York  NY  Episode 9.12 – ""Yakety Yak Yak Yak""  advances to final round "
14,4,164,"""Chopped Champions: Part 3""","This is part 3 of a 5-part tournament where sixteen past champions competed. In round 2, Chef Jun accidentally dropped his frog legs, but his dish, albeit a small portion, impressed the judges enough for it to contribute to his ultimate victory.","January 29, 2013",Scott Conant,Maneet Chauhan,Geoffrey Zakarian," smoked eel, cream cheese spread, quince paste, hericots verts "," frog legs, yuzu marmalade, gin, firm tofu "," jackfruit, araucana eggs, coconut macaroons, chocolate covered pretzels",Lester Walker," Sous chef  Copia  New York  NY  Episode 11.2 – ""Chewing the Caul Fat"" ", Corwin Kave," Executive Chef  Fatty Crab / Fatty 'Cue  New York  NY / St. John  VI  Episode 11.5 – ""Plenty of Fish"" ", Elise Kornack," Chef and Entrepreneur  Aquavit  New York  NY  Episode 10.2 – ""Chop on Through"" ", Jun Tanaka," Executive Chef  Pearl Restaurant  London  England  Episode 8.1 – ""Easy Peasy?""  advances to final round "
14,5,165,"""Chopped Champions: Part 4""",This is part 4 of a 5-part tournament where sixteen past champions competed.,"February 5, 2013",Aarón Sánchez,Alex Guarnaschelli,Amanda Freita," sour apple martini mix, mortadella, white asparagus, fennel "," calf's liver, fava greens, honey wine, halloumi "," maraschino cherries, Greek yogurt, canned espresso, corn nuts",Kris Wessel," Chef and Restaurateur  Red Light  Miami  FL  Episode 11.8 – ""Own It!"" ", Helen Park," Executive Chef  New York  NY  Episode 9.6 – ""Time & Space"" ", Jean-Louis Gerin," Chef and Restaurateur  Restaurant Jean-Louis  Greenwich  CT  Episode 11.10 – ""Reversal of Fortune"" ", Rob Evans," Chef and Restaurateur  Hugo's / Duckfat  Portland  ME  Episode 9.7 – ""Everything's Rosy""  advances to final round "
14,6,166,"""Chopped Champions: Finale""","This is the final part of a 5-part tournament where sixteen past champions competed. This episode's winner received $50,000. Chef Tanaka is the first Grand Champion to settle in a different country.","February 12, 2013",Geoffrey Zakarian,Alex Guarnaschelli,Amanda Freita," pig ears, ramps, pine nuts, apple strudel "," abalone, curry leaves, serrano ham, amaranth grain "," carrot juice, almond flour, candied ginger, honeycomb",Kenneth Johnson," Executive Chef  Pescatore  New York  NY  Episode 11.9 – ""Yuzu Never Know"" ", Vinson Petrillo," Executive Sous chef  Caviar Russe  New York  NY  Episode 9.12 – ""Yakety Yak Yak Yak"" ", Rob Evans," Chef and Restaurateur  Hugo's / Duckfat  Portland  ME  Episode 9.7 – ""Everything's Rosy"" ", Jun Tanaka," Executive Chef  Pearl Restaurant  London  England  Episode 8.1 – ""Easy Peasy?"" "
14,7,167,"""Just for the Halibut""",,"March 12, 2013",Marc Murphy,Lee Anne Wong,Scott Conant," black radishes, smoked beef tongue, garbanzo beans, Italian anchovies "," halibut, aquavit, Chinese spinach, Mexican chorizo "," banana chips, sugar cane, almond butter, umeboshi",Anne Churchill, Caterer & Tour Chef  New Orleans  LA , Stephan Bogardus, Chef de cuisine  The North Fork Table & Inn  Southold  NY , Jamie Adams, Executive Chef  Veni Vidi Vici  Atlanta  GA , Steve Benjamin, Executive Chef  L'Atelier de Joël Robuchon  Las Vegas  NV 
14,8,168,"""Redemption Intention""",This episode featured four past runners-up returning for a second chance to win.,"March 19, 2013",Marc Murphy,Alex Guarnaschelli,Amanda Freita," sea cucumber, enokitake mushrooms, white balsamic vinegar, rotisserie chicken "," duck tongue, pineapple, chestnuts, pork shoulder "," zucchini blossoms, dry roasted peanuts, anise liqueur, mamey",Tony Kang," Sous Chef  Upper Brookville  NY  Episode 12.1 – ""Sunny Side Apps"" ", Vito Facciabene," Chef  Bronx  NY  Episode 11.8 – ""Own It!"" ", Kate Lee Squibb," Sous Chef  South Portland  ME  Episode 9.12 – ""Yakety Yak Yak Yak"" ", Cara Thompson," Sous Chef  Miami  FL  Episode 8.2 – ""Ladies First!"" "
14,9,169,"""Chopped All-Stars: Food Network vs. Cooking Channel""","This is the second tournament of the season. This time it's a 5-part charity tournament. As with previous celebrity/all-star tournaments, the winner gets $50,000 for their charity. This heat featured two Food Network personalities and two Cooking Channel personalities.","April 7, 2013",Geoffrey Zakarian,Maneet Chauhan,Chris Santo," banana bread, veggie terrine, galangal, mango juice "," rack of venison, potato pierogies, okra, seafood pepper pot soup "," Okinawan sweet potatoes, coconut flakes, calvados, marshmallows",Nadia G. ,Charity: Club Tech  The Boys & Girls Club of America , Gabriele Corcos ,Charity: Feeding America , Jeff Mauro ,Charity: University of Chicago Medicine Comer Children's Hospital , Sunny Anderson ,Charity: N Street Village  advances to final round 
14,10,170,"""Chopped All-Stars: Mega Chefs""",This is part 2 of a 5-part charity tournament. This heat featured celebrity chefs.,"April 14, 2013",Chris Santos,Maneet Chauhan,Marcus Samuelsson," black sea bass, wakame, cream soda, black garlic "," precooked oxtail, labneh in olive oil, mustard greens, fruit cocktail "," peanut brittle, Mexican chocolate, grape tomatoes, sponge cake snacks",Chuck Hughes ,Charity: Cedars Cancer Institute , Elizabeth Falkner ,Charity: Edible Schoolyard Project , Richard Blais ,Charity: Alliance for a Healthier Generation , Gavin Kaysen ,Charity: Children's Cancer Research Fund  advances to final round 
14,11,171,"""Chopped All-Stars: Judges""","This is part 3 of a 5-part charity tournament. This heat featured Chopped judges, all of whom have competed on Chopped previously except for Scott Conant.","April 21, 2013",Geoffrey Zakarian,Marcus Samuelsson,Aarón Sánchez," diver scallops, harissa, pink grapefruit, speck "," capon, ramps, canned pizza sauce, burrata "," ruby port, olive oil gelato, dried apricots, French toast sticks",Marc Murphy ,Charity: Share Our Strength , Alex Guarnaschelli ,Charity: Alex's Lemonade Stand , Amanda Freitag ,Charity: God's Love We Deliver , Scott Conant ,Charity: Keep Memory Alive  advances to final round 
14,12,172,"""Chopped All-Stars: Celebrities""","This is part 4 of a 5-part charity tournament. This heat featured celebrities from television, music, and sports. Joey Fatone, Judy Gold, and Johnny Weir have all appeared on Rachael vs. Guy: Celebrity Cook-Off: Joey on Season 1, Johnny on Season 2, Judy on Season 3. Laila Ali and Joey Fatone have previously competed against each other on Dancing with the Stars with Ali placing third and Fatone placing second.","April 28, 2013",Geoffrey Zakarian,Maneet Chauhan,Marcus Samuelsson," vanilla cupcakes, chicken tenders, avocados, kochujang "," skirt steak, matzo crackers, sweet orange gelatin cups, collard greens "," circus peanuts, passion fruit purée, graham cracker cereal, curry powder",Judy Gold ,Charity: Project A.L.S. , Johnny Weir ,Charity: Human Rights Campaign Foundation , Joey Fatone ,Charity: The Fatone Family Foundation , Laila Ali ,Charity: Healthy Child Healthy World  advances to final round 
14,13,173,"""Chopped All-Stars: Finale!""","This is the final part of a 5-part charity tournament where winners of the previous four episodes battle to win $50,000 for their charity. The entrée cooking time was extended to 40 minutes to allow the chefs to butcher the goat.","May 5, 2013",Geoffrey Zakarian,Aarón Sánchez,Marcus Samuelsson," soft-shell crabs, crunchy peanut butter, sake, sea beans "," suckling goat, broccoli rabe, farro, cheddar filled pretzels "," freeze dried grapes, marrow bones, Marcona almonds, cannoli cream",Sunny Anderson ,Charity: N Street Village , Laila Ali ,Charity: Healthy Child Healthy World , Gavin Kaysen ,Charity: Children's Cancer Research Fund , Scott Conant ,Charity: Keep Memory Alive 
15,1,174,"""Heads Up!""",,"April 2, 2013",Scott Conant,Amanda Freitag,Aarón Sánchez," microwavable chocolate cake, baby tatsoi, artichoke liqueur, lamb's head "," Arctic char, concentrated vinegar, smoked butter, purple spinach "," yellow rice, persimmons, sugar cane drink, pine nuts",Ingrid Wright, Sous chef  Exchange Alley  New York  NY , Eleanor Wolper, Executive Chef  New York  NY , Jordan Andino, Executive Chef  SideBAR  New York  NY , Bruce Kalman, Executive Chef  The Churchill  Los Angeles  CA 
15,2,175,"""Viewers Choice Baskets""","All the ingredients in the baskets were chosen by viewers via social media; specifically: Pinterest, Facebook, and Twitter.","April 9, 2013",Scott Conant,Amanda Freitag,Geoffrey Zakarian," durian, lime gelatin, imitation crab meat, crunchy cheese curls "," chicken in a can, clam chowder, potato tots, skirt steak "," kale, fruit cocktail, cottage cheese, marrow bones",John Herndon, Executive Chef  Umami Burger Restaurant Group  Los Angeles  CA , Rory Philipson, Chef and Owner  The Blue Bottle Cafe  Hopewell  NJ , Tre Ghoshal, Chef and Owner  Adara  Montclair  NJ , Luke Reyes, Executive Chef  The Corner Door  Culver City  CA 
15,3,176,"""Aussie Awesome""",The basket ingredients were Australian themed.,"April 16, 2013",Scott Conant,Marc Murphy,John Li," vegetable yeast spread, barramundi, rucola, gummy snake "," Australian beer, T-bone steak, bosc pears, chocolate biscuits "," lamingtons, lemon verbena, wattleseeds, blueberry pomegranate lollies",McCaily Cranna, Sous chef  Hudson's on the Bend  Austin  TX , Bruce Barber, Caterer  Aussie Chef Catering  Sherman Oaks  CA , Michael Bryant, Executive Chef  Eva Restaurant  Los Angeles  CA ," Mai-Khanh ""Maiki"" Le", Chef de cuisine  Josie  Santa Monica  CA 
15,4,177,"""Without Missing a Beet""",,"April 30, 2013",Marc Murphy,Chris Santos,Aarón Sánchez," banana chips, frozen grilled chicken breasts, candy cane beets, cherry jelly beans "," pink beans, sofrito, striped bass, coconut chocolate bars "," frozen yogurt, amaretti cookies, candied orange peels, red curry paste",Ashley Hough, Personal Chef  Los Angeles  CA , Angela Majko, Sushi Chef  Uchiko  Austin  TX , Rouha Sadighi, Chef de cuisine  Penelope Café  New York  NY , Taji Marie, Caterer  Simple Gourmet  Redondo Beach  CA 
15,5,178,"""Momumental""","This was a special episode where the contestant were mothers (and amateur/home cooks). They wore street clothes rather than the customary chef coats while competing, but were given chef coats by Ted Allen at the end of the episode.","May 7, 2013",Marc Murphy,Alex Guarnaschelli,Maneet Chauhan," coffee, pheasant, escarole, peanut butter blossom cookies "," carrot baby food, pork butt, mustard greens, red quinoa "," bison grass vodka, guava paste, pistachios, crustless peanut butter and jelly sandwiches",Gio Bellino, Homemaker from Sands Point  NJ , Anette Kreipke, Former Advertiser and Homemaker from Ridgefield  NJ , Heidi Greening, Homemaker from Georgetown  TX , Diana Sabater, Police Officer from Philadelphia  PA 
15,6,179,"""Amazing Amateurs""","This was an official amateurs episode which was preceded by an unofficial amateurs episode (Momumental). The contestants wore regular clothes during the competition but winner Marisa Biaggi received an authentic Chopped chef's coat at the end, in addition to the prize money. Nate did not clean his scallops in the appetizer resulting in his elimination. Nate also cut himself in Round 1.","May 14, 2013",Geoffrey Zakarian,Alex Guarnaschelli,Aarón Sánchez," dragon fruit, guanciale, sunflower sprouts, scallops "," pork chops, yacon, broccoli rabe, burgundy truffles "," honey soaked nuts, organic red wine, calamansi limes, salted butter crackers",Nate Echelberger, Pastor of Gateway Church in Austin  TX , Melissa Campbell, Training Administrator from Los Angeles  CA , Rique Uresti, Spin Instructor from New York  NY , Marisa Biaggi, Content Producer and Strategist/PR from New York  NY 
15,7,180,"""Breakfast, Lunch and Dinner!""","In this episode, the appetizer course was replaced with a breakfast course, the entrée with lunch, and the dessert with dinner. Chef Cain works at Red Rooster Harlem, owned by Chopped judge Marcus Samuelsson.","May 21, 2013",Amanda Freitag,Aarón Sanchez,Maneet Chauhan," black forest bacon, ricotta pancakes, smoked salmon, prune juice "," quiche lorraine, purple cauliflower, blue shrimp, rosé wine "," chateaubriand, horseradish root, tawny port, stone crab claws",Fred Eric, Chef and Restaurateur  Fred 62  Los Angeles  CA , Natalie Cain, Line Cook  Red Rooster Harlem  Harlem  NY , Chris Leahy, Executive Chef  Lexington Brass  New York  NY , Brandon Boudet, Chef and Restaurateur  101 Coffee Shop  Dominick's  Little Dom's  and Tom Bergin's Tavern  Los Angeles  CA 
15,8,181,"""Military Salute""",The contestants in this episode were retired members of the U.S. military with professional cooking experience. Each round featured an item that might be found in a military pantry.,"May 28, 2013",Scott Conant,Amanda Freitag,Chris Santo," freeze dried roast beef, torshi, rainbow chard, mint yogurt soda "," Afghan flatbread, goat chops, zucchini, survival candy "," pomegranate, pilot bread crackers, fruit chews, freeze dried carrots",Victor Vinson, Chef  U.S. Army  retired / Personal Chef from Huntington Beach  CA , Judy Cage-McLean, Chef  U.S. Army  retired / Caterer from Spring Lake  NC , Jacoby Ponder, Chef  U.S. Navy  retired / Personal Chef from Virginia Beach  VA , Robbie Myers, U.S. Army  retired / Senior Food Service Manager from Adams Center  NY 
15,9,182,"""Cook Your Butt Off!""","ach of the chefs had lost significant amounts of weight through better diet and exercise, and were tasked with making light dishes.","May 30, 2013",Scott Conant,Alex Guarnaschelli,Marcus Samuelsson," dried goji berries, bitter melon, duck breast, kumquats "," coconut oil, black cod, dinosaur kale, pork rinds "," clotted cream, passion fruit purée, spirulina, angel food cake",Elizabeth Mwanda, Founder  Winning Diabetics  New York  NY , Chris Avtges, Food Service Director  Eastern Connecticut State University  Willimantic  CT , Joel Gargano, Executive Chef  Higher One  New Haven  CT , Phillip Dell, Private Chef  Sin City Chefs  Newport Beach  CA 
15,10,183,"""Better Saffron Than Sorry""","Chef Ramborger was the first deaf chef to participate in the show. He was accompanied by interpreter Lydia Callis, best known as the ASL interpreter for Michael Bloomberg during his Hurricane Sandy press conference.","June 4, 2013",Elizabeth Karmel,Maneet Chauhan,Marcus Samuelsson," mussels, blue cheese stuffed olives, saffron, añejo tequila "," amaranth leaves, blackberries, lamb fries, curd chile "," argan oil, apricots, fresh pasta sheets, cheese spread",Christian Dolias, Chef  Cutthroat Culinary  Las Vegas  NV , Kurt Ramborger, Caterer  Austin  TX , David Fuñe, Executive Chef  Vizzi Truck / Temecula Creek Inn  Los Angeles  CA / Temecula  CA , Martha Esquivel, Executive Chef  Luminarias Restaurant  Monterey Park  CA 
15,11,184,"""Take Heart""",Chef Frish serves as sous chef for Iron Chef Marc Forgione on Iron Chef America.,"June 6, 2013",Marc Murphy,Maneet Chauhan,Amanda Freita," shishito peppers, ground pork, grape jelly, sausage gravy "," sticky rice, bok choy, key lime juice, lamb hearts "," coconut jam, shredded phyllo dough, ginger ale, peanut caramel candy bars",Ian Kokkeler, Chef  Trace Restaurant at W Austin  Austin  TX , Charles Slonaker, Food Truck Chef  Go Chew Los Angeles  CA , Monique King, Chef and Owner  Firefly Bistro  South Pasadena  CA , Barry Frish, Chef de cuisine  Restaurant Marc Forgione  New York  NY 
15,12,185,"""Wheatgrass Roots""",This was a vegetarian and vegan-themed episode; the only animal product was the local honey.,"June 18, 2013",Amanda Freitag,Marc Murphy,Alex Guarnaschelli," rice wrappers, morel mushrooms, chia seeds, dandelion greens "," etrog citron, golden beets, wheatgrass, tempeh "," cranberries, green tea powder, edamame, local honey",David Garrido, Chef and Owner  Garrido's  Austin  TX , Sonya Coté, Executive Chef and Owner  Hillside Farmacy  Austin TX , Mustapha Rahiim, Executive Chef  New York  NY , Rich Landau, Chef and Owner  Vedge  Philadelphia  PA 
