season,season_episode,series_episode,episode_name,episode_notes,air_date,judge1,judge2,judge3,appetizer,entree,dessert,contestant1,contestant1_info,contestant2,contestant2_info,contestant3,contestant3_info,contestant4,contestant4_info
1,1,1,"""Octopus, Duck, Animal Crackers""",This is the first episode with only three official ingredients in a basket (dessert round). There would be no hard set limit until season 4.,"January 13, 2009",Marc Murphy,Alex Guarnaschelli,Aarón Sánchez," baby octopus, bok choy, oyster sauce, smoked paprika "," duck breast, green onions, ginger, honey "," prunes, animal crackers, cream cheese",Summer Kriegshauser, Private Chef and Nutrition Coach  New York  NY , Perry Pollaci, Private Chef and Sous chef  Bar Blanc  New York  NY , Katie Rosenhouse, Pastry Chef  Olana Restaurant  New York  NY , Sandy Davis, Catering Chef  Showstoppers Catering at Union Theological Seminary  New York  NY 
1,2,2,"""Tofu, Blueberries, Oysters""","This is the first of a few episodes with five official ingredients in a basket (entrée round), as well as three ingredients in the appetizer round.","January 20, 2009",Aarón Sánchez,Alex Guarnaschelli,Marc Murphy," firm tofu, tomato paste, prosciutto "," daikon, pork loin, Napa cabbage, Thai chiles, Blue Point oysters "," phyllo dough, gorgonzola cheese, pineapple rings, blueberries",Raymond Jackson, Private Caterer and Culinary Instructor  Westchester County  NY , Klaus Kronsteiner, Chef de cuisine  Liberty National Golf Course  Jersey City  NJ , Christopher Jackson, Executive Chef and Owner  Ted and Honey  Brooklyn  NY , Pippa Calland, Owner and Chef  Chef for Hire LLC  Newville  PA 
1,3,3,"""Avocado, Tahini, Bran Flakes""",,"January 27, 2009",Aarón Sánchez,Alex Guarnaschelli,Marc Murphy," lump crab meat, dried shiitake mushrooms, pink grapefruit, bran cereal "," ground beef, cannellini beans, tahini paste, grape jelly "," brioche, cantaloupe, pecans, avocados",Margaritte Malfy, Executive Chef and Co-owner  La Palapa  New York  NY , Rachelle Rodwell, Chef de cuisine  SoHo Grand Hotel  New York  NY , Chris Burke, Private Chef  New York  NY , Andre Marrero, Chef tournant  L’Atelier de Joël Robuchon  New York  NY 
1,4,4,"""Banana, Collard Greens, Grits""","In the appetizer round, Chef Chuboda refused to use bananas in his dish, leading to his elimination. In the dessert round, Chef Gonzales accidentally used salt instead of sugar in his dish, asserting that this resulted in his elimination.","February 3, 2009",Scott Conant,Amanda Freitag,Geoffrey Zakarian," ground beef, wonton wrappers, cream of mushroom soup, bananas "," scallops, collard greens, anchovies, sour cream "," maple syrup, black plums, almond butter, walnuts, quick grits",Sean Chudoba, Executive Chef  Ayza Wine Bar  New York  NY , Kyle Shadix, Chef  Registered Dietician and Culinary Consultant  New York  NY , Luis Gonzales, Executive Chef  Knickerbocker Bar & Grill  New York  NY , Einat Admony, Chef and Owner  Taïm  New York  NY 
1,5,5,"""Yucca, Watermelon, Tortillas""",,"February 10, 2009",Geoffrey Zakarian,Alex Guarnaschelli,Marc Murphy," watermelon, canned sardines, pepper jack cheese, zucchini "," beef shoulder, yucca, raisins, ancho chiles, dill pickles "," flour tortillas, prosecco, Canadian bacon, roasted chestnuts",John Keller, Personal Chef  New York  NY , Andrea Bergquist, Executive Chef  New York  NY , Ed Witt, Executive Chef / Wine Director  Bloomingdale Road and Wine Directory  New York  NY , Josh Emett, Chef de cuisine  Gordon Ramsay at The London  New York  NY 
1,6,6,"""Canned Peaches, Rice Cakes, Beets""",,"February 17, 2009",Chris Santos,Alex Guarnaschelli,Aarón Sánchez," asparagus, chorizo, button mushrooms, canned peaches "," rice cakes, chicken thighs, plantains, fruit punch, cocktail onions "," beets, goat cheese, quick cook oatmeal, crystallized ginger",Cindi Avila, Catering Manager and Chef  Crisp  New York  NY , Lucas Manteca, Chef/Restaurateur  Sea Salt and Quahog's Restaurants  Stone Harbor  NJ , Robert Burmeister, Executive Chef and Co-Owner  Chow Gourmet Kitchen  Staten Island  NY , Chris Coleman, Private Executive Chef  Long Island  NY 
1,7,7,"""Quail, Arctic Char, Beer""","In the appetizer Melinda did not get her quail on 1 plate. As a result, she was eliminated.","February 24, 2009",Scott Conant,Alex Guarnaschelli,Amanda Freita," endive, frozen peas, quail, red seedless grapes "," watercress, tamarind paste, creamed corn, Arctic char "," pitted dates, frozen pie crust, caramel candy, stout beer",Melinda Dorn, Sous chef and Instructor  New York  NY , Ralph Battista Jr., Executive Chef  Butterfield 8  New York  NY , Lior Lev Sercarz, Chef and Entrepreneur  La Boîte à Biscuits and La Boîte à Epices  New York  NY , Abe Lopez, Chef de cuisine  Pacifico  Center Valley  PA 
1,8,8,"""Coconut, Calamari, Donuts""","In the appetizer round, Chef LePape failed to get any food onto his plates. The judges allowed him to bring the pan from the oven to the tasting table after the other competitors offered their permission. Despite this, Chef LePape was eliminated.","March 3, 2009",Aarón Sánchez,Alex Guarnaschelli,Chris Santo," turbot, nori sheets, pistachios, coconut "," rainbow chard, papaya, granola, parsnips, calamari "," plain donuts, smoked gouda, white chocolate, dried apricots",Gwen LePape, Executive Chef  Frederick's Restaurant  New York  NY , Francesco Peluso, Executive Chef  Peluso's Italian Specialties  Clifton  NJ , Dave Ogren, Executive Chef  Almos Restaurant  New York  NY , Mina Newman, Executive Chef  Christos Steakhouse  Astoria  NY 
1,9,9,"""Mac & Cheese, Cola, Bacon""",Chef Lustberg has also competed on the ninth season of Hell's Kitchen (U.S. season 9).,"March 10, 2009",Chris Santos,Amanda Freitag,Marc Murphy," boxed macaroni and cheese, artichokes, tilapia "," eggplant, ground pork, poblano chiles, avocados, cola "," oranges, grapefruit, semi-sweet chocolate chips, bacon",David Goldwhite, Private Personal Chef  New York  NY , Gypsy Gifford, Executive Chef  Cafe Pinot  Los Angeles  CA , William Lustberg, Sous chef / saucier  Waldorf-Astoria Hotel  New York  NY , James Briscione, Chef Instructor  Institute of Culinary Education  New York  NY 
1,10,10,"""String Cheese, Jicama, Gingersnaps""",This is the first episode to feature four male chefs.,"March 17, 2009",Scott Conant,Amanda Freitag,Geoffrey Zakarian," chicken wings, soba noodles, celery, string cheese "," striped bass, pimento peppers, jicama, mangoes, brie cheese "," ginger snaps, crème fraîche, instant coffee, carrots",Jonathan Jernigan, Executive Chef  Catering by Jonathan  Willingboro  NJ , King Phojanakong, Executive Chef  Kuma Inn  New York  NY , Soulayphet Schwader, Executive Chef  Talay Restaurant  New York  NY , Darius Peacock, Executive Chef  Exceptional Taste Catering  Trenton  NJ 
1,11,11,"""Jumbo Shrimp, Pepperoncini, Cereal""",,"March 24, 2009",Geoffrey Zakarian,Alex Guarnaschelli,Amanda Freita," peanut butter, Granny Smith apples, jumbo shrimp "," kielbasa, pepperoncini, fingerling potatoes, tarragon "," marshmallow spread, chocolate puff cereal, semi-sweet chocolate chips, dried strawberries",Alina Eisenhauer, Pastry Chef  Sweet  Woodstock  CT , Todd Miller, Executive Chef  STK  New York  NY , Michael Giletto, Executive Chef  Cherry Valley Country Club  Skillman  NJ , Jackie Lee, Private Chef  New York  NY 
1,12,12,"""Chocolate, Mussels and Figs""",,"March 31, 2009",Aarón Sánchez,Alex Guarnaschelli,Geoffrey Zakarian," beef tenderloin, cucumber, Asian pears, bittersweet chocolate "," mussels, canned tomatoes, pita bread, celery root "," black mission figs, slivered almonds, lemons",Michael Selicious, Executive Chef  Wickets Inn  Onset  MA , Nigel Spence, Owner and Executive Chef  Ripe Kitchen and Bar  Mt. Vernon  NY , Melissa Levy, Executive Chef  IBM  Newburgh  NY , Gavin Mills, Executive Chef  Broadway East  New York  NY 
1,13,13,"""Strawberries, Turkey and Gummi Bears""",,"April 7, 2009",Scott Conant,Amanda Freitag,Aarón Sánchez," salmon, radicchio, ginger, strawberries "," turkey breast, baby turnips, pearl onions, coconut flakes "," blackberries, kiwi, wonton wrappers, gummy bears",Victor Cabezas, Chef and Owner  Misaví  Totowa  NJ , Jonathan Contes, Chef and Part Owner  Eat Mosaic  St. James  Long Island  NY , Amy Roth, Chef and Owner  Amy Kate Catering  New York  NY , Michael Carrino, Chef and Owner  Restaurant Passionné  Montclair  NJ 
2,1,14,"""A Prickly Situation""","The judges caught Chef Lemoine plating past time limits. As a result, the judges eliminated him.","June 14, 2009",Aarón Sánchez,Alex Guarnaschelli,Chris Santo," brioche, fennel, sea urchin "," blackstrap molasses, red snapper, parsley root, dried cranberries "," bulgur wheat, pomegranate juice, pineapple, green papaya",Peter Klein, Executive Chef and Part Owner  Chow Bar  New York  NY , Ross Gill, Executive Chef and General Manager  Home Restaurant  New York  NY , Yvan Lemoine, Chef  New York  NY , Natalia Machado, Junior Executive Chef  Industria Argentina  New York  NY 
2,2,15,"""Salty Veggies & Heated Battles""",,"June 16, 2009",Chris Santos,Alex Guarnaschelli,Marc Murphy," sea beans, ginger ale, pork tenderloin "," baby artichokes, cashew butter, monkfish, Thai chiles "," jicama, pepitas, blueberries",Fritz Knipschildt, Chef and Chocolatier  Knipschildt Chocolatier  Norwalk  CT , Cheryl Perry, Chef and Culinary Instructor  New York  NY , David Rotter, Executive Chef  Campo  New York  NY , Jason Zukas, Chef Consultant  Bocca Fina  Queens  NY 
2,3,16,"""High Hopes""",Chef Puzio did not finish her plates in Round 1 resulting in her elimination. The judges also were very disappointed in every first course. The bison in the second basket was a thick-cut sirloin steak.,"June 23, 2009",Scott Conant,Amanda Freitag,Marc Murphy," calamari, Brussels sprouts, Asian pears "," bison, dried mango, leeks, Belgian-style ale "," ancho chiles, semi-sweet chocolate, black plums",Nicole Puzio, Executive Chef  Ox Restaurant  Jersey City  NJ , David Kirschner, Sous chef  W Hotel  Hoboken  NJ , Michael Ferraro, Executive Chef  Delicatessen  New York  NY , John Lawson, Sous chef  Gordon Ramsay at The London  New York  NY 
2,4,17,"""Floundering Around""",,"June 30, 2009",Scott Conant,Amanda Freitag,Aarón Sánchez," beef shoulder, fish sauce, canned pumpkin "," flounder, yellow plantains, baby bok choy, mini watermelon "," tomatillos, crème fraîche, plain donuts",Massimo Felici, Executive Chef  Ristorante DeGrezia  New York  NY , Christine Campbell, Butcher and Private Chef  Long Island  NY , Julio Lazzarini, Executive Chef and Owner  Orillas Tapas Bar and Restaurant  Wilmington  DE , Marc Spooner, Production Chef  Great Performances Catering  New York  NY 
2,5,18,"""Pride on the Plate""","Throughout each course, Chef Matarese failed to complete any of his dishes. Chef Mansukhani went on to compete on the tenth season of Hell's Kitchen (under the surname 'Gurnani').","July 7, 2009",Chris Santos,Alex Guarnaschelli,Marc Murphy," duck breast, polenta, sharon fruit "," rainbow trout, baby turnips, tamarind concentrate, serrano ham "," sliced almonds, Okinawan sweet potatoes, brioche, sambuca",Shaya Klechevsky, Personal Chef and Instructor  At Your Palate  New York  NY , Pasquale Frola, Executive Sous Chef  Naples 45  New York  NY , Giuliano Matarese, Executive Chef  Arte Café  New York  NY , Roshni Mansukhani, Executive Sous chef and Private Chef  Boston  MA 
2,6,19,"""Pretty Please with a Pepper on Top""",,"July 14, 2009",Geoffrey Zakarian,Alex Guarnaschelli,Chris Santo," ground turkey, piquillo peppers, gooseberries "," top round of lamb, coconut flakes, snap peas, quick grits "," celery, blood oranges, frozen pie crust, jaggery",Barbara Sibley, Executive Chef and Owner  La Palapa Cocina Mexicana  New York  NY , Christopher Nguyen, Chef Consultant  Keo Asian Restaurant  York  PA , Paul Viggiano, Chef de cuisine  Docs Steakhouse  Sparta  NJ , Tyler Anderson, Executive Chef  The Copper Beech Inn  Essex  CT 
2,7,20,"""Pods, Grills and Sticky Fingers""",Chef Orchid got eliminated in the Appetizer for only getting shrimp on 1 plate and forgetting to plate the raisins.,"July 28, 2009",Scott Conant,Amanda Freitag,Geoffrey Zakarian," jumbo shrimp, edamame, golden raisins "," flank steak, grape juice, goat cheese, lemongrass "," coffee liqueur, avocados, boiled ginkgo nuts, honeycomb",Moha Orchid, Private Chef  New York  NY , Maristella Innocenti, Owner and Chef  Matilda  New York  NY , Matthew Zappoli, Owner and Executive Chef  Tre Amici  Long Branch  NJ , Joe Bayley, Sous chef  Cobblestone Foods  New York  NY 
2,8,21,"""A Wish Upon A Starfruit""",,"August 11, 2009",Aarón Sánchez,Alex Guarnaschelli,Marc Murphy," red currant jam, merguez sausage, broccoli "," chicken breast, dandelion greens, starfruit, cherry liqueur "," grape leaves, sesame seeds, honeydew melon, pickled ginger",Ming Lu, Line Cook  Le Cirque  New York  NY , Pedro Diáz, Sous chef  Fresh Direct  New York  NY , Lisa Schoen, Executive Chef and Food Stylist  Mad River Post and In Your Kitchen  New York  NY , Cody Utzman, Chef and Restaurateur  Brooklyn Standard  New York  NY 
2,9,22,"""Buckwheat Blunders and Twists of Fate""","Chef Amitzur cut himself in Round 1 and continued making his dish with no gloves, or band-aid however the producer made him throw his dish away forcing him to redo his dish.","August 25, 2009",Chris Santos,Alex Guarnaschelli,Aarón Sánchez," olive oil packed tuna, English cucumbers, buckwheat flour "," knockwurst, pretzels, ramps, mangosteen "," biscuit dough, pistachios, dried hibiscus flowers, black olives",Simon Lange, Chef and Restaurateur  Apartment 138  Brooklyn  NY , Rory O'Farrell, Executive Chef  Ayza Wine & Chocolate Bar  New York  NY , Mor Amitzur, Executive Chef  The View at the Marriott Marquis  New York  NY , Diane DiMeo, Private Chef  Red Box Bistro  New York  NY 
2,10,23,"""Chopped Champions Event, Round One: The Ultimate Face-off""","This is the first ""Chopped Champions"" event, featuring winners of past episodes. There were four loosely connected parts, wherein the winner of this episode got $10,000 and the chance to compete in the next special episode against three new past champions, potentially winning up to $40,000 with each round they get through.","September 8, 2009",Geoffrey Zakarian,Alex Guarnaschelli,Marc Murphy," crayfish, red seedless grapes, fiddlehead ferns "," quail, guava nectar, udon noodles, dinosaur kale "," baby kiwi, Israeli couscous, rice paper, saffron",Michael Carrino," Chef and Owner  Restaurant Passionné  Montclair  NJ  Episode 1.13 – ""Strawberries  Turkey and Gummi Bears"" ", Sandy Davis," Catering Chef  Union Theological Seminary  New York  NY  Episode 1.1 – ""Octopus  Duck  Animal Crackers"" ", Natalia Machado," Junior Executive Chef  Industria Argentina  New York  NY  Episode 2.6 – ""A Prickly Situation"" ", James Briscione," Chef Instructor  Institute of Culinary Education  New York  NY  Episode 1.9 – ""Mac & Cheese  Cola  Bacon""  advances to next episode "
2,11,24,"""Chopped Champions Event, Round Two: Best of the Best""","Three new Chopped champions competed against the winner of the Chopped Champions Event, Round One. The winner of this episode got $10,000 and the chance to compete in the next episode against three different past champions. The previous winner lost in the dessert basket, meaning a new chef got the chance to potentially add more money to their winnings in the next special episode (up to $30,000).","September 15, 2009",Scott Conant,Jody Williams,Aarón Sánchez," cockles, kohlrabi, pita bread "," ground chicken, green tea leaves, mustard oil, braeburn apples "," chocolate wafers, manchego cheese, passionfruit, goji berries",Pippa Calland," Owner and Chef  Chef for Hire LLC  Newville  Pennsylvania  Episode 1.2 – ""Tofu  Blueberries  Oysters"" ", Gavin Mills," Executive Chef  Broadway East  New York  NY  Episode 1.12 – ""Chocolate  Mussels and Figs"" ", James Briscione ,returning champion , Einat Admony," Chef and Owner  Taïm  New York  NY  Episode 1.4 – ""Banana  Collard Greens  Grits""  advances to next episode "
2,12,25,"""Chopped Champions Event, Round Three: All-Stars Showdown""","Three new Chopped champions competed against the winner of the Chopped Champions Event, Round Two. The winner of this episode got $10,000 and the chance to compete in the next episode against three different past champions. Once again, the previous winner got knocked out (in the entrée basket) so a new chef got the chance to potentially add more money to their winnings in the next special episode (up to $20,000).","September 22, 2009",Chris Santos,Geoffrey Zakarian,Marc Murphy," lavash bread, preserved lemons, squab "," bluefish, papaya, ginger snaps, beef jerky "," butter crackers, grapefruit, feta cheese, gin",Jackie Lee," Private Chef  New York  NY  Episode 1.11 – ""Jumbo Shrimp  Pepperoni  Cereal"" ", Einat Admony ,returning champion , Andre Marrero," Chef tournant  L’Atelier de Joël Robuchon  New York  NY  Episode 1.3 – ""Avocado  Tahini  Bran Flakes"" ", Cody Utzman," Chef and Restaurateur  Brooklyn Standard  New York  NY  Episode 2.8 – ""A Wish Upon a Starfruit""  advances to next episode "
2,13,26,"""Chopped Champions Event, Round Four: Bring It!""","This is the last of the special Chopped Champion Event episodes. Three Chopped champions competed against the winner of the Chopped Champions Event, Round Three. A new champion dethroned the previous winner in the appetizer round meaning none of the winners in all four episodes won more than one episode. The winner of this episode got $10,000.","September 29, 2009",Scott Conant,Alex Guarnaschelli,Aarón Sánchez," lobster, bananas, endive "," pork loin, watercress, galia melon, taro root "," matzo, pomegranate molasses, roasted chestnuts, baby fennel",Cody Utzman ,returning champion , Diane DiMeo," Private Chef  Red Box Bistro  New York  NY  Episode 2.9 – ""Buckwheat Blunders and Twists of Fate"" ", John Lawson," Sous chef  Gordon Ramsay at The London  New York  NY  Episode 2.2 – ""High Hopes"" ", Darius Peacock," Executive Chef  Exceptional Taste Catering  Trenton  NJ  Episode 1.10 – ""String Cheese  Jicama  Gingersnaps"" "
3,1,27,"""When Chefs Collide""",,"October 13, 2009",Geoffrey Zakarian,Scott Conant,Aarón Sánchez," Manila clams, kumquats, croissants "," ground pork, camembert, sweet vermouth, haricots verts "," carrots, goat cheese, quick grits, pomelo",Peter Giannakas, Chef and Restaurateur  Ovelia Psistaria Bar  New York  NY , Angie Shaghaghi, Chef Instructor  Creative Cooks  New York  NY , Cisse Elhadji, Chef and Restaurateur  Ponty Bistro  New York  NY , Dean Yasharian, Executive Sous chef  Bar Boulud  New York  NY 
3,2,28,"""Oh My Goshy, Umeboshi""","Chef Esmonde cut herself during the entrée round. After attempting to put on a glove that did not fit, she took it off and tossed her salad with her hands despite her open wound. As a result, the judges did not eat the salad and chopped her for her poor sanitation. Chef Baruch is a sous chef for semi-regular Chopped judge Sue Torres.","October 20, 2009",Aarón Sánchez,Jody Williams,Geoffrey Zakarian," peas, peaches, eel "," shrimp, oatmeal, butternut squash, umeboshi "," parsnips, limoncello, soda crackers, sharp cheddar cheese",Jeffrey Baruch, Executive Chef  London Lennie's Seafood Restaurant  New York  NY , Barbara Esmonde, Executive Chef  Mediterranean Catering  Wynnewood  PA , Peter Karapanagiotis, Executive Chef  Privé Mediterranean Restaurant  Philadelphia  PA , Jeremy Duclut, Executive Chef  Georges' Bar and Restaurant  Wayne  PA 
3,3,29,"""Judge Knows Best""",Chef Dobias did not get his plantain cake on the plate in the dessert round despite getting all 4 ingredients on the plate. The judges offered he could bring up his cakes. However his competitor had to offer his consent and said no. Despite this Chef Dobias won due to the mistakes his opponent made throughout the meal.,"October 27, 2009",Chris Santos,Scott Conant,Marc Murphy," hamachi, quail eggs, dried cherries "," beef tenderloin, mango, gruyère cheese, kochujang "," ripened plantains, prosecco, crystallized ginger, bacon",Fabian Ludwig, Executive Chef  Gramercy Park Hotel  New York  NY , Ayesha Nurdjaja, Executive Chef  Il Bordello  New York  NY , Joshua Whigham, Sous chef  Jack's Luxury Oyster Bar  New York  NY , Joe Dobias, Chef and Restaurateur  Joe Doe Restaurant  New York  NY 
3,4,30,"""A Nori Story""",,"November 3, 2009",Josh Capon,Alex Guarnaschelli,Geoffrey Zakarian," beef tenderloin, nori, maple syrup "," broccoli rabe, crystallized ginger, five year aged gouda, mahi-mahi "," cherries, pumpernickel bread, curry powder, yuzu juice",Adele DiBiase, Chef and Restaurateur  Bona Vita Osteria  Summit  NJ , Malik Fall, Chef and Restaurateur  Boucarou Lounge  New York  NY , Michael Bicocchi, Executive Chef  Flex Mussels  New York  NY , PJ Calapa, Sous chef  Nobu Fifty Seven  New York  NY 
3,5,31,"""Sticking To It""",,"November 10, 2009",Geoffrey Zakarian,Alex Guarnaschelli,Chris Santo," turkey breast, Kirby cucumbers, graham crackers "," black cod, puffed rice cereal, pineapple, chorizo "," mangoes, puff pastry, coffee beans, rose water",Melinda Beaulieu, Private Chef and Nutritionist  New York  NY , David Amorelli, Executive Chef  Coffee Shop  New York  NY , Dominick Feragola, Sous chef  Broadway East  New York  NY , Luisa Fernandes, Executive Chef  Georgia's Cafe and Bakery  New York  NY 
3,6,32,"""Season's Choppings""",The chefs were given 45 minutes in the entrée round rather than the normal 30 to allow time to properly cook the turkey.,"December 8, 2009",Scott Conant,Alex Guarnaschelli,Aarón Sánchez," venison tenderloin, quince, eggnog "," kale, rutabaga, marshmallows, turkey "," garnet yams, brie, sparkling wine, cranberries",Megan Fells, Chef and Restaurateur  The Artist's Palate  Poughkeepsie  NY , Jason Tilmann, Executive Chef  NYY Steak  New York  NY , Keith Geter, Chef  Artisanal  New York  NY , Jon Bignelli, Sous chef  wd~50  New York  NY 
3,7,33,"""Flower Power""",,"March 14, 2010",Geoffrey Zakarian,Sue Torres,Marc Murphy," chicken breast, kiwi, zucchini blossoms "," scallops, cranberry juice, artichokes, burdock root "," blackberries, apple cider, shredded phyllo dough, fresh chickpeas",Bill Feldman, Chef and Entrepreneur  New York  NY , Keith Jodway, Consulting Chef  New York  NY , Lola Garand, Consulting Chef  New York  NY , Tommy Lee, Executive Chef  Battery Gardens  New York  NY 
3,8,34,"""Sweet Redemption""",This was the first episode to feature four past runners-up competing for a chance to redeem themselves and win.,"March 21, 2010",Aarón Sánchez,Scott Conant,Marc Murphy," littleneck clams, Yukon Gold potatoes, rhubarb "," striped bass, corn tortillas, applesauce, okra "," carrot juice, white chocolate chips, baby beets, hominy",Michael Giletto," Executive Chef  Cherry Valley Country Club  Skillman  NJ  Episode 1.12 – ""Jumbo Shrimp  Pepperoni  Cereal"" ", Katie Rosenhouse," Pastry Chef  Olana Restaurant  New York  NY  Episode 1.1 – ""Octopus  Duck  Animal Crackers"" ", Chris Burke," Private Chef  New York  NY  Episode 1.3 – ""Avocado  Tahini  Bran Flakes"" ", Amy Roth," Chef and Owner  Amy Kate Catering  New York  NY  Episode 1.13 – ""Strawberries  Turkey and Gummi Bears"" "
3,9,35,"""Winging It""",,"March 28, 2010",Geoffrey Zakarian,Sue Torres,Chris Santo," sake, green seedless grapes, chicken wings "," horseradish, catfish, treviso, Japanese eggplant "," cherry tomatoes, silken tofu, ginger snaps, cocoa nibs",Linda Laestadius, Pastry Chef  The Bear Cafe  Woodstock  NY , Lizzie Singh-Brar, Executive Chef  Fanny  Brooklyn  NY , John Sierp, Executive Chef  White Cloud Catering  New York  NY , Justin Gaines, Executive Sous chef  Zanaro's Italian Restaurant  White Plains  NY 
3,10,36,"""In A Pinch""",This was the first episode where two female chefs faced each other in the final round.,"April 5, 2010",Scott Conant,Alex Guarnaschelli,Marc Murphy," red cherry peppers, mortadella, soft shell crabs "," baby bananas, black-eyed peas, poblano chiles, ostrich steak "," lychees, phyllo dough, Canadian bacon, candy canes",Damien Brassel, Executive Chef  Knife + Fork  New York  NY , Lonnie Dyner, Executive Chef  Le Petit Marché  New York  NY , Susan Crocker, Catering Chef  Holberts Catering and Backyard Bistro  Montgomery  NY , Pnina Peled, Chef de cuisine  The New York Helmsley Hotel  New York  NY 
3,11,37,"""Raw Enthusiasm""",,"April 12, 2010",Scott Conant,Alex Guarnaschelli,Aarón Sánchez," apricots, macadamia nuts, oysters "," cucumber, buttermilk, pork loin, canned jackfruit "," sugar cookie dough, bittersweet chocolate, figs, yellow miso paste",Mark Twersky, Cullinary Instructor  The French Culinary Institute  New York  NY , Deborah Gorman, Catering Chef  The Good Knife  New York  NY , Arvin Dhansew, Catering Chef  Relish Caterers  New York  NY , Martin Brock, Executive Chef  Atria  New York  NY 
3,12,38,"""Against the Tide""","This was the first episode to feature an ingredient, violet mustard, that the judges were not familiar with.","April 19, 2010",Mark Bittman,Amanda Freitag,Aarón Sánchez," habanero chiles, bittersweet chocolate, fresh sardines "," strawberries, celery root, lamb loin chops, Swiss cheese "," corn tortillas, dried chipotle peppers, blueberries, violet mustard",Michael Madigan, Chef and Restaurateur  Snails and Quails / Farm 2 Bistro  New York  NY / Nutley  NJ , Andres Barrera, Executive Chef  City Winery  New York  NY , Laurielle Clark, Private Chef  New York  NY , Erik Weatherspool, Chef and Restaurateur  Bistro 44  Toms River  NJ 
