Contestant,Birthday,Birthplace,Hometown,Description,Season
Danny Gokey,24-Apr-80,"Milwaukee, Wisconsin","Milwaukee, Wisconsin","Gokey first began singing in church with his family, and has been a worship leader for his church in Milwaukee, Faith Builders International Ministries, for several years. Four weeks before Gokey auditioned for American Idol, in July 2008, his wife Sophia underwent surgery due to congenital heart disease. She later died from complications regarding the extensive surgery. He was eliminated from the Top 3 on May 13, 2009.",8
Allison Iraheta,27-Apr-92,"Glendale, California",NA,"Iraheta began singing at an early age, performing at small venues for her family and friends. In 2006, Iraheta won the Telemundo television series QuinceaÃ±era, where she won $50,000 and a recording contract, where only the prize money was granted. She was eliminated from the Top 4 on May 6. In making the final she became the series' youngest finalist at sixteen and turned seventeen during the Top 5 week. Her debut album, Just Like You, was released on December 1, 2009, with the single ""Friday I'll Be Over U"".",8
Matt Giraud,11-May-85,"Dearborn, Michigan","Kalamazoo, Michigan","Giraud grew up in Ypsilanti, Michigan, where he graduated from Lincoln High School in 2003. Initially eliminated from the Top 13, Giraud was chosen by the judges to rejoin the competition during the Wild Card round.  Giraud was the lowest vote-getter during the Top 7, but was saved by the judges and eventually eliminated in Top 5.  He released an album called Perspective in 2003 and another in 2006 called Mind Body and Soul.",8
Anoop Desai,20-Dec-86,"Cary, North Carolina",NA,"Desai is an only child, whose father was born in India and mother was born in South Africa. He began his career as an actor for the television station WRAL-TV in Raleigh, North Carolina in a local television series entitled CentralXpress.com, and played the character ""Raj"". Desai attended Carnage Middle School and Phillips Middle School, then later went on to attend East Chapel Hill High School, graduating in 2004. Desai's performance as a soloist on the song ""She Has No Timewas included on the 2007 iteration of the annual BOCA (Best of College A Cappella) compilation album. Desai has credited his decision to audition for American Idol to the death of a friend, Eve Carson, who was murdered. Initially eliminated from the Top 13, he was chosen by the judges to rejoin the competition during the Wild Card round.  His advancement to the finals made Idol history, making it a top 13.",8
Lil Rounds,20-Oct-84,"Memphis, Tennessee","Memphis, Tennessee","Shortly before her audition on Idol, a tornado hit Memphis, forcing Rounds to temporarily live in a motel. Her grandfather once worked with the musician B.B. King.  Her performance of Dolly Parton's ""I Will Always Love Youin the Hollywood round impressed the judges; however, she failed to impress the judges in the finals and was eliminated in joint-seventh place with Anoop Desai.",8
Scott MacIntyre,22-Jun-85,"Scottsdale, Arizona","Scottsdale, Arizona","MacIntyre is the first legally blind person to audition for American Idol. MacIntyre began practicing music at the age of six. Home-schooled until the age of fourteen, he later attended Arizona State University's Barrett Honors College and Herberger College of the Arts soon afterwards. In 2005, USA Today named him one of its twenty College Academic All-Stars. He obtained his master's degree at Royal Holloway, University of London and the Royal College of Music, where he studied on a Marshall Scholarship. MacIntyre produced his first CD when he was eleven, and has recorded five more CDs since then. He was accepted to both Oxford University and Cambridge University for further graduate-level education.",8
Megan Joy,18-Sep-85,"Sandy, Utah",NA,"Initially eliminated from the Top 13, Joy was chosen by the judges to rejoin the competition during the Wild Card round. In high school, Joy unsuccessfully tried out for numerous performance groups, including choir, and never had any singing lessons before her audition on Idol. Joy graduated from Taylorsville High School in Taylorsville, Utah in 2003. She has one son named Ryder.",8
Michael Sarver,28-Mar-81,"Sulphur, Louisiana","Jasper, Texas","Sarver, an oil rig worker, began singing at the age of twelve, and has written over 890 songs for himself since that time. Sarver graduated from Sulphur High School in 1998.",8
Lee DeWyze,2-Apr-86,"Mount Prospect, Illinois",NA,"He performed The Fray's ""You Found Meduring Hollywood week.  Prior to his appearance on American Idol, he had worked in various jobs, including as a paint salesman and a trading floor clerk at the Chicago Mercantile Exchange.  He also appeared as an actor in a short low-budget film 'Deadscapes: Broken Road.'  When he was 17, he was signed to Wuli Records and had released two CDs â€“ So I'm Told and Slumberland. He was declared the winner on May 26.  He was signed to RCA Records after the competition and released an album Live It Up on November 16, 2010.",9
Crystal Bowersox,4-Aug-85,"Elliston, Ohio","Elliston, Ohio","She auditioned for Idol to try to make a better life for her son.  Her Hollywood performance of Aretha Franklin's ""(You Make Me Feel Like) A Natural Womanimpressed the judges and fellow contestants alike.  She had performed as a singer from the age of 10 and moved to Chicago aged 17, frequently working as a busker at train stations there.  She was diagnosed with Type 1 diabetes when she was six, and while on the show, she suffered diabetic complication and was hospitalized which resulted in the Top 20 performance nights for the male and female contestants being switched.  She became the runner-up and was signed to Jive Records.  Her debut album Farmer's Daughter was released on December 14, 2010.",9
Casey James,31-May-82,"Princeton, Texas",NA,"He performed professionally after finishing school, but suffered a serious motorcycle accident when he was 21.  He took his shirt off during audition after prompting from Kara DioGuardi and Randy Jackson, and Kara's interest in him became a recurring joke in the season.  He is an accomplished guitarist and demonstrated his skill with his Hollywood round performance of Ray Charles's ""I Don't Need No Doctorand Top 20 performance of Gavin DeGraw's ""I Don't Want to Be.He had never previously watched the show before he auditioned. He was eliminated as a third-place finisher on May 19. He was signed to Sony Music Nashville after the show.",9
Michael Lynche,31-May-83,"Orlando, Florida",NA,"Petersburg, Florida auditioned in Orlando, Florida with Todd Duncan' ""Unchained Melody"".  He worked as personal trainer prior to Idol.  His is married and his daughter was born during Hollywood round, and the unfolding drama of his wife's labor was heavily featured during the Hollywood round where he performed John Mayer's ""Waiting on the World to Change"".  He was saved by the judges when he became the lowest vote-getter on April 7, 2010, but finally he was eliminated at fourth place on May 12.",9
Aaron Kelly,2-Apr-93,"Davenport, Florida","Sonestown, Pennsylvania","His audition song was Miley Cyrus's ""The Climb"", and performed Sarah McLachlan's ""Angelduring the Hollywood rounds but forgot his words. He was adopted by his aunt and uncle at age 5.  He had performed from a young age, and was a finalist on PAX-TV's America's Most Talented Kid at the age of 11.  He was in 2010 the youngest American Idol contestant to reach Top 12. He was eliminated at fifth place on May 5.",9
Siobhan Magnus,15-Mar-90,"Barnstable, Massachusetts",NA,"Before Idol she performed as the lead vocalist of her band, Lunar Valve, and she worked as a glassblower in Hyannis, Massachusetts.  She performed  Stevie Wonder's ""Living for the City in the Hollywood rounds.  She was noted in the show for her ability to sustain a long high-pitched note.  She was eliminated as sixth-placed finisher on April 28.",9
Tim Urban,1-May-89,"Tacoma, Washington","Duncanville, Texas",He performed David Cook's Come Back To Me during the Hollywood round.  He did not qualify initially for the semi-finals but was chosen as a replacement for Chris Golightly who was disqualified for having a prior record deal.  He finished at seventh place on April 21.,9
Katie Stevens,8-Dec-92,"Southbury, Connecticut","Middlebury, Connecticut","She looked after her Portuguese grandmother who suffered from Alzheimer's disease, and she is fluent in Portuguese.  She performed Jean DuShon's ""For Once in My Lifein the Hollywood rounds where Kara DioGuardi considered her a possible season's winner.  She finished eighth place on April 14 in a double elimination, due to judges' save being used the previous week.",9
Andrew Garcia,8-Oct-85,"Moreno Valley, California",NA,"He had a good sized following on YouTube prior to auditioning on Idol.  He impressed the judges with his performance of Paula Abdul's ""Straight Upduring the Hollywood rounds, but failed to interest the judges in the later rounds. He was eliminated as joint eighth-place finishers together with Katie Stevens on April 14.",9
Didi Benami,25-Oct-86,"Knoxville, Tennessee","Knoxville, Tennessee","She auditioned in Los Angeles, California with The Beatles' ""Hey Jude"".  She was inspired to audition by her best friend who died in a traffic accident.  She was notable during the Hollywood rounds for her performance of Kara DioGuardi-penned Katharine McPhee's song ""Terrified. She finished tenth after being eliminated on March 31.",9
Scotty McCreery,9-Oct-93,"Garner, North Carolina","Garner, North Carolina","He auditioned in Milwaukee, Wisconsin, with Josh Turner's ""Your Manand Travis Tritt's ""Put Some Drive in Your Country"". He reprised ""Your Manin the Hollywood rounds but forgot the words to Lee Ann Womack's ""I Hope You Dance"". He also performed ""Get Readywith the group ""The Guapsand became involved in the drama when Clint Jun Gamboa ousted young Jacee Badeaux from their group. For his final solo he performed Josh Turner's ""Long Black Train"". McCreery was announced as the winner on May 25, and was signed to 19/Interscope/Mercury Nashville. His debut album, Clear as Day, was released on October 4, 2011.",10
Lauren Alaina,8-Nov-94,"Rossville, Georgia","Rossville, Georgia","She auditioned in Nashville, Tennessee, with Faith Hill's ""Like We Never Loved At Alland Aerosmith's ""I Don't Want to Miss a Thingwhich she also reprised for the Hollywood rounds. She also performed ""Unchained Melodytwice, once for the first solo in the Hollywood rounds and again for the final solo. She also performed Soul Brothers Six's ""Some Kind of Wonderfulin a girl group which was notable for getting Steven Tyler to sit on the chair while they performed around him. She performed ""Hello, Goodbyefor the Las Vegas' Beatles round with Scotty McCreery and Denise Jackson. Alaina was announced as the runner-up and was signed to 19/Interscope/Mercury Nashville, and her debut album, Wildflower, was released on October 11, 2011.",10
Haley Reinhart,9-Sep-90,"Wheeling, Illinois","Wheeling, Illinois","She originally auditioned in Chicago in the ninth season and did not advance to the Hollywood round. She auditioned in Milwaukee, Wisconsin, with The Beatles' ""Oh! Darling"". She performed Corinne Bailey Rae's ""Breathlessin the first solo round. In the group round she forgot her words of the song but still made it through, and in the Hollywood rounds she performed Billie Holiday's ""God Bless the Child"". In the Las Vegas group round, she performed The Beatles' ""The Long and Winding Roadwith Naima Adedapo and Jacob Lusk. For her final solo she performed The Shirelles' song ""Baby It's You"". Reinhart was eliminated on May 19, coming in 3rd place. Reinhart was signed to Interscope Records after the show. Her first single, ""Free"", was released on March 20, 2012, and her debut album, Listen Up!, was released on May 22.",10
James Durbin,6-Jan-89,"Santa Cruz, California",NA,"He originally auditioned in the eighth season and was not selected. He auditioned in San Francisco, California, with Muddy Waters's ""You Shook Meand Aerosmith's ""Dream On"". He performed The Beatles' ""Oh! Darlingfor his solo in the Hollywood round, Queen's ""Somebody to Lovewith the group ""Deep Veesin the group round and Sam Cooke's ""A Change Is Gonna Comefor his final solo. He was the lead singer with a band The Hollywood Scars prior to Idol. He has Tourette and Asperger's syndromes. Durbin was eliminated on May 12, coming in 4th place.  He was signed to Wind-up Records in with an album, Memories of a Beautiful Disaster released on November 21, 2011.",10
Jacob Lusk,23-Jun-87,"Compton, California","Compton, California","Before American Idol, he worked as a spa concierge. He auditioned in Los Angeles, California. He was first shown in the group stage of the competition where he performed with fellow finalist Naima Adedapo, Vegas contestant Sophia Shorai, and Matthew Nuss, and Da'Quela Payne. Randy Jackson considered his performance of Billie Holiday's ""God Bless the Childduring the Hollywood rounds the best ever seen on Idol. He also performed The Temptations' ""Get Readywith Naima Adedapo in the group ""Ebony, Ivory, and Every"", and Leon Russell's ""A Song for Youfor his final solo. In the Top 24 round, he earned standing ovation for his performance of ""A House Is Not a Homeby Luther Vandross. After singing ""No Airby Jordin Sparks and Chris Brown and ""Love Hurtsby The Everly Brothers, Lusk was eliminated on May 5, coming in 5th place. Lusk would go on to front the gospel-soul trio Gabriels.",10
Casey Abrams,12-Feb-91,"Idyllwild, California","Idyllwild, California","He auditioned in Austin, Texas, with Ray Charles' ""I Don't Need No Doctor"". He impressed the judges with his performance of ""Georgia on My Mindin Hollywood week. He also performed Ella Fitzgerald's ""Lullaby of Birdland"", The Temptations' ""Get Readywith the group ""Night Owlsin the Hollywood rounds, ""A Hard Day's Nightwith Chris Medina in the Las Vegas's Beatles round, and Kansas Joe McCoy's ""Why Don't You Do Right?for his final solo. He played the double bass and melodica on the show. He suffers from ulcerative colitis which resulted in him missing the Top 13 result show. He got the one judges' save of the season on the Top 11 show. Abrams was eliminated on April 28, coming in 6th place. Abrams was signed to Concord Music Group after the show.",10
Stefano Langone,27-Feb-89,"Kent, Washington","Kent, Washington","He auditioned in San Francisco, California, with Marvin Gaye's ""I Heard It Through the Grapevine"". He performed Stevie Wonder's ""Sir Dukein the Hollywood week, ""Get Backfor the Las Vegas round with James Durbin, and his own composition ""Come Homefor his final solo. He survived a near-fatal car accident in 2009 being hit by a drunk driver. Langone was chosen by the judges as one of the Wild Cards to join the Top 13 finalists. Langone was eliminated on April 21, coming in 7th place. Langone was signed to Hollywood Records after the show. He released his debut single ""I'm on a Rollfeaturing New Boyz and Rock Mafia on April 24, 2012.",10
Paul McDonald,29-Aug-84,"Huntsville, Alabama","Huntsville, Alabama","He auditioned in Nashville, Tennessee, with Rod Stewart's ""Maggie May"". Prior to Idol, he was the lead singer of the band Hightide Blues formed in 2005 and renamed The Grand Magnolias in 2010. He performed Fleetwood Mac's ""Landslideand his own composition ""American Dreamsfor his final solo. McDonald was eliminated on April 14, coming in 8th place.",10
Pia Toscano,14-Oct-88,"Howard Beach, New York",NA,"She had auditioned for Idol four times before and made it through Hollywood in the sixth season and did not continue further. She auditioned in Jersey City, New Jersey, and was a make-up artist. She sang the national anthem at a Mets game. Pia Toscano and Karen Rodriguez get together to duet The Beatles' ""Can't Buy Me Loveon Las Vegas, they also went to New York's LaGuardia Arts School together. She also performed Bruno Mars's ""Grenadefor the group round in Hollywood and Alicia Keys's ""Doesn't Mean Anythingfor her final solo. Toscano was eliminated on April 7, coming in 9th place. Toscano was signed to Interscope Records after the show, releasing her debut single ""This Timeon July 11, 2011. Pia auditioned five times.",10
Naima Adedapo,5-Oct-84,"Milwaukee, Wisconsin","Milwaukee, Wisconsin","She auditioned in Milwaukee, Wisconsin, with Donny Hathaway's version of ""For All We Know"". She was doing janitorial duties at the Summerfest in Milwaukee before she auditioned on Idol. She performed Beatles' ""The Long and Winding Roadtogether with Jacob Lusk and Haley Reinhart during the Las Vegas round, and Corinne Bailey Rae's ""Put Your Records Onfor her final solo. Adedapo was chosen by the judges to join the competition during the Wild Card round. Adedapo was eliminated on March 31, coming in 10th with Thia Megia.",10
Phillip Phillips,20-Sep-90,"Leesburg, Georgia","Leesburg, Georgia","He attended Lee County High School. He graduated Albany Technical College, but had to miss the graduation ceremony due to being on American Idol. He auditioned in North Charleston, singing ""Superstitionby Stevie Wonder and Michael Jackson's ""Thrillerwith the guitar. He performed ""I Only Have Eyes For Youwith Heejun Han, Neco Starr, and Jairon Jackson during Hollywood Week. Many people have compared his vocal style to that of Dave Matthews, whom he has also noted as an influence. Phillips was announced the winner on May 23. Philips' coronation song, ""Home"", was a success with sales of 5.4 million copies in the United States.",11
Jessica Sanchez,4-Aug-95,"San Diego, California",NA,"Sanchez auditioned in San Diego. She performed ""It Doesn't Matter Anymorewith DeAndre Brackensick and Candice Glover in Las Vegas. During the Sing For Your Life green mile round, Sanchez performed ""The Prayerby Andrea Bocelli. Before Idol, she was known for her appearance on the first season of America's Got Talent where she was brought back by judge Brandy during the show's wildcard round. Sanchez also participated in the YouTube edition of ""We Are the Worldalong with 56 other YouTube artists, including American Idol season 10 finalist Thia Megia. She was saved from elimination by the judges after receiving the lowest number of votes in the top seven round, making her the first female contestant to be saved by the judges and eventually the first Asian American contestant on American Idol to advance to the finale. Sanchez was announced the runner-up on May 23, 2012.",11
Joshua Ledet,9-Apr-92,"Westlake, Louisiana","Westlake, Louisiana","He writes songs and lyrics for and attends the House of Prayer Holiness Church. He auditioned in Houston, Texas. He originally auditioned for American Idol season 10, but he did not make it past the audition stage. He was dubbed ""Mantasia(as being the male version of American Idol season three winner Fantasia Barrino) during the semi-finals. He performed ""Blue Suede Shoeswith Shannon Magrane, Amber Holcomb, and Curtis Finch Jr. His musical influences are his mother, Christina Aguilera, Whitney Houston, Michael Jackson, Fantasia Barrino, James Brown, Luther Vandross, Stevie Wonder and Elton John. He was eliminated on May 17, coming in third place.",11
Hollie Cavanagh,5-Jul-93,"Liverpool, Merseyside",NA,"She originally auditioned for season 10, but she was eliminated in the green mile round and was encouraged by Jennifer Lopez that she could win the competition in a couple of years with practice. Hollie sang ""Mr. Sandmanwith Naomi Gillies and Marissa Pontecorvo in Las Vegas. Hollie's only appearance in season 11 was during the Top 42 green mile round. She sang ""Changeby American Idol season four winner Carrie Underwood for the Sing for Your Life round. She was eliminated on May 10, coming in fourth place. She auditioned in Galveston.",11
Skylar Laine,1-Feb-94,"Brandon, Mississippi","Brandon, Mississippi","She is the second finalist to hail from Mississippi, with the previous one being Jasmine Murray from season eight. She auditioned in Galveston, singing ""Hell on Heelsby Pistol Annies. In Las Vegas, she performed ""Dedicated to the One I Lovewith Colton Dixon, Chase Likens, and Cari Quoyeser. Her musical influences include George Jones, Waylon Jennings, and Miranda Lambert. She was eliminated on May 3, coming in fifth place.",11
Elise Testone,29-Jul-83,"Mount Pleasant, South Carolina",NA,"She auditioned in North Charleston with the song ""Get It While You Canby Janis Joplin. Prior to Idol, she was a voice instructor in Mount Pleasant, South Carolina, and she performed regularly, either solo or with one of several bands, in Charleston, South Carolina. In 2011, her band, the Freeloaders, won the Funk/Soul/R&B Artist of the Year award in the Charleston City Paperâ€™s Music issue. Testone received additional recognition from the Charleston City Paper in 2011, winning the staff pick for Best Tribute for Elise Testoneâ€™s James Brown Dance Party. She has performed as an opening act for various other artists, including Snoop Dogg, Nappy Roots, Seven Mary Three, and Kevin Costnerâ€™s band, Modern West. She was eliminated on April 26, coming in sixth place. Her debut album, In This Life was released on February 11, 2014.",11
Colton Dixon,19-Oct-91,"Murfreesboro, Tennessee","Murfreesboro, Tennessee","He auditioned in North Charleston with his younger sister, Schyler. He originally auditioned for season 10 along with Schyler in the Nashville, Tennessee, auditions, but she was cut in the group round and then he was cut in the green mile round. Dixon returned in season 11, however he did not plan to audition, initially planning to simply accompany his sister Schyler to her audition. The judges implored Dixon to audition as well, where he sang David Cook's ""Permanent"". Colton performed ""Dedicated to the One I Lovewith Skylar Laine, Chase Likens, and Cari Qouyeser in Las Vegas. In Las Vegas, Schyler was eliminated, bringing Colton to tears. He performed the Coldplay song ""Fix You"", and dedicated it to his sister. He was eliminated on April 19, coming in seventh place. Prior to his elimination, Dixon had never been in the Bottom 3. His debut album A Messenger was released on January 29, 2013.",11
DeAndre Brackensick,21-Oct-94,"San Jose, California",NA,"He auditioned in San Diego, California. He originally auditioned for American Idol season 10, but he was cut in the green mile round. He performed ""It Doesn't Matter Anymorewith Jessica Sanchez and Candice Glover in Las Vegas. He was an active participant in Oak Grove High School's Theater Arts program and the president of the school's Polynesian Club when he attended. He was eliminated on April 5, coming in eighth place.",11
Heejun Han,20-Apr-89,"Flushing, New York","Flushing, New York","He and his family migrated to Queens from Anyang, Gyeonggi, South Korea, when he was a child. Before American Idol, he was a non-profit organizer, working with children with special needs. He has spoken of suffering from emotional depression and credited the children that he worked with for helping him to recover from his illness. He has also said that the children motivated him to audition for American Idol. He auditioned in Pittsburgh with ""How Am I Supposed to Live Without You"". His audition brought Jennifer Lopez to tears, and Steven Tyler stated ""I think you are really great. I think you could be the American Idol"". He is the first Korean American to make the finals on American Idol. He was eliminated on March 29, coming in ninth place.",11
Erika Van Pelt,12-Dec-85,"South Kingstown, Rhode Island",NA,"She auditioned in Pittsburgh, Pennsylvania, with song ""Will You Love Me Tomorrowby The Shirelles. She draws her influences anywhere from Aretha Franklin, Chaka Khan, Joss Stone, Jill Scott, and Kim Burrell. She has a passion for rhythm and blues, soul, country, jazz, rock and classical. She was eliminated on March 22, coming in tenth place. Her debut album, My Independence was released on October 8, 2013.",11
Shannon Magrane,21-Oct-95,"Tampa, Florida","Tampa, Florida","She is the daughter of Tampa Bay Rays broadcaster and former St. Louis Cardinals pitcher Joe Magrane. She auditioned in North Charleston, South Carolina, with the song ""Something's Got a Hold on Meby Etta James. She was eliminated on March 15, coming in eleventh place.",11
Jermaine Jones,18-Nov-86,"Pine Hill, New Jersey",NA,"He auditioned in Portland, Oregon. He attended Overbrook High School. Before Idol, he worked as a vocal instructor at Highest Praise Performing Arts Center. Jones was not originally chosen for the semi-finals, but he was called back after the top 24 selection filming, making him the 25th semi-finalist and thirteenth male semi-finalist. Standing 6 feet 8 and a half inches tall, he was dubbed ""The Gentle Gianton the show. His musical influences are his mother and John Legend. On March 13, he was disqualified for concealing arrests and outstanding warrants. He is the second Idol contestant to be disqualified during the finals, as Corey Clark was disqualified in the second season, and he came in twelfth place.",11
Jeremy Rosado,24-Mar-92,"Valrico, Florida","Valrico, Florida","Rosado previously auditioned for American Idol four times. He was eliminated on March 8, coming in thirteenth place. He is the fourth wild card finalist to be the eliminated first in the finals, with his female predecessors being Leah LaBelle (season three), Jasmine Murray (season eight), and Ashthon Jones (season ten). His musical influences are Francesca Battistelli, Kirk Franklin, and Israel Houghton. His debut single, Don't be Afraid was released on April 2, 2013.",11
