Contestant,Birthday,Birthplace,Hometown,Description,Season
Candice Glover,22-Nov-89,"Beaufort, South Carolina","Beaufort, South Carolina","She lives in St. Helena Island, South Carolina. She auditioned in Charlotte, singing ""Syrup & Honey"". She previously auditioned in the ninth and eleventh seasons, where she made it to the Las Vegas round during the eleventh season and grouped with that season's finalists DeAndre Brackensick and Jessica Sanchez. She performed Alicia Keys's ""Girl on Firein her final solo in the Hollywood rounds. Glover performed ""(You Make Me Feel Like) A Natural Womanat the sudden death round which received high praises from the judges. She performed ""Ordinary Peopleat the semi-finals. At Top 6 Week Glover performed ""Lovesongher performance earned high praise and was called the best performance in the show's history. Her musical influences are Christina Aguilera and Jazmine Sullivan. Glover was announced as the winner on May 16. Her debut album, Music Speaks was released on February 17, 2014.",12
Kree Harrison,17-May-90,"Woodville, Texas","Woodville, Texas","She auditioned in Oklahoma City. Her father died in an airplane crash when she was 12, and her mother died in a car accident after Kree turned 19. She also signed a deal with Lyric Street Records when she was twelve but was dropped after creative differences. She has also had a song publishing deal. She performed ""Sin Wagonat the group round in Hollywood. Harrison performed ""Starsas her final solo in the Hollywood rounds which received praises from the judges. Then, she sang ""Up to the Mountain (MLK song)in the sudden death rounds. She sang ""Strongerat the semi-finals. She stated that her musical influence is her family. Harrison was the runner-up.",12
Angie Miller,17-Feb-94,"Beverly, Massachusetts","Beverly, Massachusetts","She auditioned in New York City singing ""Mamma Knows Best.She stated at her audition that she is partially deaf, with twenty percent hearing loss in her right ear and forty percent in her left ear. Prior to auditioning for American Idol Miller established a successful YouTube channel gaining over 3.7 million views. Miller performed her original composition ""You Set Me Freefor her final solo in the Hollywood rounds receiving standing ovation from the judges. She sang Jessie J's ""Nobody's Perfectat the Vegas sudden death rounds and she sang ""Never Goneat the semi-finals. Her personal musical influences are Jessie J and BeyoncŽ Knowles. Miller was eliminated on May 9 coming in third place. Prior to her elimination, Miller had never been in the bottom group. During the season finale, she sang a duet with her idol Jessie J, singing ""Domino"". After the performance Jessie J invited her to go on tour in Europe with her to perform her original song ""You Set Me Free"". ""You Set Me Freewas also released on iTunes the night of the season finale.",12
Amber Holcomb,17-Mar-94,"e Dion, Karen Carpenter",NA,"She originally auditioned in the eleventh season, but was cut in the Las Vegas round, where she grouped with Curtis along with the eleventh season finalists Shannon Magrane and Joshua Ledet. She performed ""My Funny Valentinein Vegas sudden death rounds which received standing ovation from the judges. Holcomb performed ""I Believe in You and Meat the semi-final voting round receiving standing ovation from all of the judges. Prior to Idol, she graduated from Dekaney High School in 2012. Her musical influences are Celine Dion, Karen Carpenter and Whitney Houston. Holcomb was eliminated on May 2 coming in fourth place.",12
Janelle Arthur,12-Dec-89,"Oliver Springs, Tennessee",NA,"She auditioned in Charlotte, where she sang ""Where the Blacktop Ends"". She has auditioned twice before, in seasons the tenth and eleventh seasons. In the tenth season, she was cut in the group round, and in the eleventh season she made it to the Las Vegas round. Arthur performed ""I Told You Soat the Hollywood rounds. Then, she performed ""Just a Kissat the Vegas sudden death rounds. She sang ""If I Can Dreamat the semi-final round. Prior to Idol, Arthur was a Zumba instructor. Her musical influences are Vince Gill and Eva Cassidy. After singing, ""When I Call Your Nameand ""Dumb Blonde"", Arthur was eliminated on April 18 coming in fifth place.",12
Lazaro Arbos,27-Dec-90,"Naples, Florida",NA,"He auditioned in Chicago, where he sang ""Bridge over Troubled Water"". He sang ""The Edge of Gloryat the Hollywood rounds as his final solo. Arbos performed ""Tonight I Wanna Cryat the Vegas sudden death rounds. He performed ""Feeling Goodat the semi-finals. When Lazaro was six, he began stuttering to the point where he could barely talk. He has gone through speech and language therapy, but it never improved his stutter. His musical influence is Selena. He was eliminated on April 11 coming in sixth place.",12
Burnell Taylor,14-Apr-93,NA,NA,"He auditioned in Baton Rouge, singing ""I'm Herewhich received standing ovation from the judges. He sang ""Jar of Heartsat the Hollywood rounds. Taylor performed ""This Timeat the Vegas sudden death rounds. He also performed the same song at the semi-finals. He stated in his audition that he and his family were survivors of Hurricane Katrina. His musical influence is India.Arie. After his performance of ""You Give Love a Bad Name"", he was eliminated on April 4 coming in seventh place.",12
Devin Velez,22-Apr-94,NA,NA,"He auditioned in Chicago as well. Velez sang ""What a Wonderful Worldat the Hollywood rounds. Then, he sang ""Listenat the sudden death rounds. Velez performed ""Somos Novios (It's Impossible)at the semi-final round. He draws his musical influences from artists including Israel Houghton, Cece Winans, Smokie Norful, Donnie McClurkin, BeyoncŽ Knowles, and his mother. After his performance of ""The Tracks of My Tears"", he was eliminated on March 28 coming in eighth place.",12
Paul Jolley,27-Jan-90,"Palmersville, Tennessee","Palmersville, Tennessee","He auditioned in Baton Rouge, singing ""I Won't Let Go"". He sang Carrie Underwood's ""Blown Awayat the Hollywood rounds. He sang ""Tonight I Wanna Cryat the Vegas sudden death rounds. Jolley performed ""Just a Foolat the semi-final round. His musical style came from his family. He dubbed himself as the male version of Carrie Underwood. After his performance of ""Eleanor Rigby"", he was eliminated on March 21 coming in ninth place.",12
"Curtis Finch, Jr.",19-Aug-88,NA,NA,"(born August 19, 1988) is from St. Louis, Missouri. He has previously auditioned in the fourth and eleventh seasons, where he made it to the Las Vegas round, where he grouped with Amber along with eleventh season finalists Shannon Magrane and Joshua Ledet. He had performed ""Jar of Heartsas his final solo in the Hollywood rounds. Finch sang ""Superstarat the sudden death rounds. He performed ""I Believe I Can Flyat the semi-final round. His personal musical style is his gospel background. He was the first finalist eliminated on March 14 coming in tenth place.",12
Caleb Johnson,23-Apr-91,"Asheville, North Carolina","Asheville, North Carolina","He previously auditioned in the tenth and eleventh seasons, but he was cut off during the selection of top 25. He auditioned in Atlanta where he performed an original song ""Into the Void"".  In the Hollywood round he first performed ""Sympathy for the Devil"", followed a performance of ""Too Closein a group which included CJ Harris, and ""Radioactivefor the last solo. He was announced as the winner on May 21. Johnson is the second returning contestant to win Idol after Candice Glover in the previous season.",13
Jena Irene,13-Jul-96,"Farmington Hills, Michigan",NA,"She auditioned in Detroit with Adele's ""Rolling in the Deep"".  She performed ""Video Gamesduring the Hollywood for the first solo, Alex Clare's ""Too Closefor the group round, and her own composition ""Unbreakable Mefor the Final Judgement. She cites Paramore and Incubus as her greatest musical influences. She is the first female Wild Card contestant and the second Wild Card contestant after Clay Aiken in the second season to advance to the finale. She was announced as the runner-up.",13
Alex Preston,6-May-93,"Mont Vernon, New Hampshire",NA,"He performed an original song ""Fairytalesfor his audition. During Hollywood week, he performed ""Scream and Shoutfor the first solo, and his own composition ""Fairytalesfor the final solo. He was eliminated on May 15, 2014, and came in third place. Prior to his elimination, Preston had never been in the bottom 3 or in the bottom 2 before.",13
Jessica Meuse,19-Oct-90,"Round Rock, Texas","Slapout, Alabama","She auditioned in Atlanta singing one of her own songs, ""Blue-Eyed Lie"". She reprised the song for the top 8 and sung another original, ""Done"", during Hollywood Week. Prior to auditioning she had written over sixty original songs and self-released a debut album, called ""What's So Hard About Bein' a Man"", in 2011. She was eliminated on May 8, coming in fourth place.",13
Sam Woolf,19-Apr-96,"Bradenton, Florida","Bradenton, Florida","He auditioned in Boston, singing ""Lego Houseby Ed Sheeran. He sang ""Waiting on the World to Changeon the first round in Hollywood, and his original composition entitled ""I Triedin the final solo of the Hollywood Round. He was saved from elimination by the judges after receiving the lowest number of votes in the top eight round. He was eliminated on May 1, coming  in fifth place.",13
C.J. Harris,28-Jan-91,"Jasper, Alabama","Jasper, Alabama","J. Harris (born January 28, 1991, died January 15, 2023)  is from Jasper, Alabama. He auditioned in Salt Lake City, where he sang ""Soulshine"". He performed ""Troublein the first Hollywood round, and was in a group with fellow finalist Caleb Johnson, performing the Alex Clare song ""Too Close"". For the final solo he performed ""Bring It On Home to Me"", however, he was asked to perform again in the Final Judgement to compete against Casey Thrasher, and chose to sing ""Whipping Post"". He was eliminated on April 24, coming in sixth place. Harris died on January 15, 2023, after suffering a heart attack, making him the sixth American Idol finalist to die, following Willie Spence in 2022, Nikki McKibbin in 2020, Leah LaBelle in 2018, Rickey Smith in 2016, and Michael Johns in 2014.",13
Dexter Roberts,12-Jul-91,"Fayette, Alabama","Fayette, Alabama","He performed ""Drivefor his audition, and for the group round he was part of the group Backstreet Cowboys together with Casey Thrasher and fellow finalist Ben Briley, performing the song ""I Want It That Way"".  For the final solo he performed an original song, ""Farmer's Grandson"". He was eliminated on April 17, 2014, coming in seventh place.",13
Malaya Watson,24-Sep-97,"Southfield, Michigan","Southfield, Michigan","She is a tuba player of the marching band of Southfield High School. She auditioned in Detroit with Aretha Franklin's ""Ain't No Way"". In the first round in Hollywood, she sang ""Brand New Meby Alicia Keys. She performed ""I Believein the final solo on Hollywood round. She cites her two grandfathers and her father as her personal musical influences. She described her style in singing from Sly Stone and BeyoncŽ. She is the second youngest contestant in American Idol history that has reached the live show, next to tenth season contestant, Thia Megia. She was eliminated on April 10, coming in eighth place.",13
Majesty Rose,29-Feb-92,"Goldsboro, North Carolina","Goldsboro, North Carolina","She auditioned in Atlanta, where she sang Coldplay's ""Violet Hill"". Prior on auditioning, she was a pre-school teacher and she graduated in Eastern Wayne High School on 2011. In Hollywood, she performed ""1234and ""Stars"". She was eliminated on March 27, coming in ninth place.",13
MK Nobilette,20-Aug-93,"San Francisco, California",NA,"She auditioned in San Francisco with ""If I Were Your Woman,"" and advanced to Hollywood, where she was one of many contestants who had to ""sing for their lives,or get back on the plane home. For the Hollywood rounds she chose an Allen Stone song for the a cappella round, which was not aired. She performed ""Royalsin the group round.  For her final Hollywood solo she did ""The A Teamby Ed Sheeran. She is the first openly gay finalist to be publicly acknowledged on the show. She was eliminated on March 20, 2014, and came in tenth place. She also did not appear or sing in the live finale, due to being ill at that time.",13
Ben Briley,19-Mar-89,"Gallatin, Tennessee","Gallatin, Tennessee","He auditioned in Atlanta, singing ""Arms of a Woman"". He performed ""Starsin the final solo of the Hollywood Round, and was in a group called Backstreet Cowboys with fellow finalist Dexter Roberts, performing the Backstreet Boys song ""I Want It That Way"".  Ben Briley and Neco Starr both appeared before the judges for the Final Judgement, however the judges could not decide whom to choose, and sent both to a vote by fans, which was won by Briley. He was eliminated on March 13, coming in eleventh place.",13
Emily Piriz,28-Jan-96,"Orlando, Florida","Orlando, Florida","She auditioned in Atlanta, singing ""Mamma Knows Bestby Jessie J. She sang ""Nothing but the Wateron the first round in Hollywood. She performed ""Starsin the final solo of the Hollywood Round. Prior on joining this competition, she also auditioned in The X Factor USA. She cites Pink and Kelly Clarkson as her musical influences. She was eliminated on March 6, coming in twelfth place.",13
Kristen O'Connor,19-Apr-89,"Sebastian, Florida","Sebastian, Florida","She auditioned in Atlanta, singing ""Good Morning Heartache"". She performed ""Treasurein the Hollywood group rounds with her fellow finalist, Sam Woolf. She performed ""Unconditionallyon the Hollywood Rounds.  She cites Christina Aguilera and Jessie J as her musical influences. Prior on joining this competition, she was a nurse. She was eliminated on February 27, coming in thirteenth place. She is the fifth wild card finalist to be the eliminated first in the finals, with her predecessors Leah LaBelle, Jasmine Murray, Ashthon Jones and Jeremy Rosado.",13
Nick Fradiani,15-Nov-85,"Guilford, Connecticut","Guilford, Connecticut","Fradiani was the vocalist of Beach Avenue which got recognition after they won in the Battle of the Bands at Mohegan Sun in 2011. They auditioned for the ninth season of America's Got Talent, but were eliminated during Judgement Week. His father was a musician, who performs in clubs and in cruise ships. He taught his son to play drums, piano and guitar. Fradiani graduated in high school in 2004. He has a bachelor's degree in History from Wheaton College in Norton, Massachusetts. He resumed his music career by playing solo gigs. Fradiani continuously got gigs with his band, which was on hiatus during his participation on Idol. He and his girlfriend auditioned in New York City, and his golden ticket song was Peter Gabriel's ""In Your Eyes"". During Hollywood Week, he sang ""Babylonby David Gray. He sang Train's ""Drops of Jupiter (Tell Me)during the House of Blues Showcase, earning his spot in the Top 24. He was the third alumnus of America's Got Talent to be a finalist in Idol, with his predecessors Thia Megia of the tenth season and eleventh season runner-up Jessica Sanchez. He was announced as the winner on May 13.",14
Clark Beckham,15-May-92,"White House, Tennessee",NA,"He was a musician in the streets of Nashville. Beckham's father was a professional musician, playing guitar for the Righteous Brothers and Dolly Parton. His mother was a court reporter before she quit her job to be a music teacher. He attended Lee University, a Christian-liberal arts school in Cleveland, Tennessee. He was studying to be a teacher in history and physical education. He competed in the Battle of the Bands and toured with the campus choir. Beckham plays a number of instruments. At the age of nine, he started playing drums. He played guitar at the age of twelve and piano at the age of sixteen. In a Christian Post interview Beckham noted he was a worship leader and feels God is his biggest influence. He prayed on whether to audition for Idol and plans to continue with a career in Christian music following the competition. Beckham sang James Brown's ""It's a Man's Worldduring his audition. In his first solo performance in Hollywood rounds, he sang Otis Reding's ""Try a Little Tenderness"". He advances in the Top 24 after he sang ""Georgia on My Mindby Ray Charles in the House of Blues Showcase Week. He cites Marvin Gaye, Stevie Wonder, Al Green, Michael Jackson and Michael BublŽ as his musical influences. He was announced as the runner-up.",14
Jax,NA,"East Brunswick, New Jersey",NA,"Singing since she was five, she taught herself how to play the piano. At the age of twelve, she moved to New York City and left public school for home-schooling to pursue her music career with a professional voice coach in New York City. Her father was a firefighter in New York City who was injured during the September 11, 2001 attacks and retired, because of this he was able to accompany, and bond with her at lessons, shows, auditions, and recordings. In high school, she starred in musicals such as ""Aladdinand ""Annie"". She was also a member of about five bands and ended up touring a lot. In mid-2014, Jax studied at New York University in London where she won a BMI John Lennon songwriting program. She auditioned in New York City with her rendition of The Beatles' ""I Want to Hold Your Hand"". She also sang ""Toxicby Britney Spears during her first solo audition in Hollywood Week. For her final solo performance, she sang The Beatles' ""Let it Be"". She earned her spot in the Top 24 in the House of Blues Showcase after she performed Lady Gaga's ""You & I"". She was the last female contestant eliminated on May 12, coming in third place. Prior to her elimination, Jax had never been in the bottom 2.",14
Rayvon Owen,27-Jun-91,"Richmond, Virginia",NA,"At his young age, he sang with the Sunbeam Choir at Antioch Baptist Church. He joined the Richmond Boys Choir in middle school and later, joined the Harlem Boys Choir. He graduated from Henrico High School's Center for the Arts. He attended college at Belmont University in Nashville, Tennessee. He auditioned in San Francisco with his rendition of Katy Perry's ""Wide Awake"". Owen sang ""Ordinary Peopleby John Legend in his first solo performance and Otis Reding's ""Try a Little Tendernessin his final solo performance, during Hollywood week. He performed during the Showcase week in the House of Blues with Sam Smith's ""Lay Me Down"", earning his spot in the semi-finals.  He cites Lionel Richie, John Legend, Katy Perry, and Stevie Wonder as his musical influences. He was eliminated on May 6, coming in fourth place.",14
Tyanna Jones,8-Aug-98,"Jacksonville, Florida","Jacksonville, Florida","Jones is the middle of eleven children. She spent months living homeless with her family in the local pastor church. She started singing with the choir as voice major in Douglas Anderson School of the Arts at the age of five She and her mother flew to San Francisco, which was the last venue of auditions, after they earned enough money for the trip. For her audition, she sang ""Wingsby Little Mix, to earn her ticket. During the Hollywood Rounds, she sang Olly Murs' ""Dance with Me Tonightin her first solo performance and ""Tryby Colbie Caillat in her final solo performance. She performed during the Showcase week in the House of Blues with BeyoncŽ's ""Love on Top"", earning her spot in the semi-finals. She cites Prince, Michael Jackson and Beyonce as musical influences. She was eliminated on April 29, coming in fifth place.",14
Quentin Alexander,11-Dec-94,"New Orleans, Louisiana",NA,"Alexander's mentor and drama instructor at school, Troy Populous, encouraged him to channel his creative energy into drama class. Populous could see Alexander had charisma, an 'it' factor, and Alexander agreed that he was able to channel his frustration into ""something beautiful, which at the time was theater."" Alexander says that many artists have made impacts on him with a few of his biggest inspirations as Erykah Badu, David Bowie, Andre 3000, Jimi Hendrix, Lenny Kravitz, Lorde, Sia ""and the list goes on for miles.He sang ""Royalsby Lorde for his audition in New Orleans. During the final round of Hollywood week, he sang ""Riptideby Vance Joy. He earns the spot in the Top 24 after he sang ""Youthby Foxes during the showcase week in the House of Blues. He was eliminated on April 22, coming in sixth place.",14
Joey Cook,30-Mar-91,"Woodbridge, Virginia",NA,"When she is not working, she performs in the streets of Richmond. During her audition, she performed ""King of Spainby The Tallest Man on Earth. Cook sang Miranda Lambert's ""Keroseneduring her first solo performance in the Hollywood rounds. She also sang ""Across the Universeby The Beatles for her final solo round performance. Cook landed the spot in the top 24 after she performed ""Sweet Peaby Amos Lee in the House of Blues Showcase Round. Her performance of Fancy during the top 11 was well received by the judges and earned a standing ovation from Keith Urban.  She played the accordion, ukulele, banjo, as well as the mandolin during the course of the season.  Joey is a member of the band Mammoth Indigo. She was eliminated on April 15, coming in seventh place.",14
Qaasim Middleton,13-Jan-95,"Brooklyn, New York","Brooklyn, New York","He is the son of actors and professional musicians Keith Middleton and Toni Seawright. His mother was Miss Mississippi in 1987. She has sung backing vocals for Tina Turner, Teena Marie and Laura Branigan, among many others. His father was a cast member of the stage musical, ""Stompfor 20 years. Middleton was formerly a musician and actor in Nickelodeon's television show The Naked Brothers Band. He auditioned in New York City with ""Sir Dukeby Stevie Wonder. He performed Ed Sheeran's ""Give Me Loveduring his final Hollywood solo round. He sang ""Satisfactionby Allen Stone, earning his spot in the Top 24 in the House of Blues showcase week. Middleton was the recipient of the one and only ""judges' saveof the season, which kept him from elimination during the second week of the Top 11. However, he was eliminated on April 8, coming in eighth place.",14
Daniel Seavey,2-Apr-99,"Vancouver, Washington","Vancouver, Washington","Seavey was a sophomore student at Union High School in Camas. At his young age, He played guitar, violin, cello, viola, piano, mandolin, ukulele, bass and drums. His father was a pastor at Living Water Community Church. He sang Leonard Cohen's ""Hallelujah& Paula Abdul's ""Straight Upduring his audition in San Francisco. During the Hollywood Rounds, he sang Ed Sheeran's ""Thinking Out Loudin his first solo performance and ""I See Fire"", also sung by Sheeran, in his final solo performance. He performed again ""Straight Upin the House of Blues, earning his spot in the top 24. Seavey was the youngest contestant at the age of 15 to compete in the show. He was eliminated on April 1, coming in ninth place. Seavey would later join the group Why Don't We.",14
Adanna Duru,10-Oct-96,"Diamond Bar, California",NA,"At the age of 10, Duru wrote her first song, ""Come Back to Me"". She played guitar and piano on the song, which was about world peace. She performed in musicals during middle school. For three years, she was a member of her high school choir. She was a contestant on the third season of The Voice where she was defaulted to Adam Levine's team, but was eliminated in the Battle Rounds. She auditioned in San Francisco with Lady Gaga's ""You & I"". She performed ""It's a Man's, Man's, Man's Worldby James Brown during the House of Blues Showcase where she got standing ovation by Jennifer Lopez, earning her spot in the Top 24. Adanna's biggest musical influences are Michael Jackson, Justin Timberlake, Janet Jackson, BeyoncŽ and Lady Gaga. She was eliminated on March 25, along with Maddie Walker, tied at tenth place.",14
Maddie Walker,23-Dec-97,"Ankeny, Iowa","Ankeny, Iowa","She previously auditioned in the thirteenth season but was cut during the group round on Hollywood Week. She returned to audition again in New York City with Gwen Sebastian's ""Suitcase"". She sang ""Already Goneby Sugarland during her first solo round in Hollywood week. She also sang ""Don't Yaby Brett Eldredge in her final solo performance. During the House of Blues Showcase, she sang ""Big Girls Don't Cry"". She was cut during the top 24 selection but was called back by the judges, whom they were undecided, to have a sing-off with fellow singer, Rachel Hallack, to earn the spot in the semi-finals. Thus, the judges decided to send Walker through the Top 24. She was eliminated on March 25, along with Adanna Duru, tied at tenth place.",14
Sarina-Joi Crowe,27-Jun-95,"Columbia, Tennessee",NA,"She originally auditioned for the tenth season of American Idol, but was cut on the last day of the Hollywood Round. Crowe also auditioned for the twelfth and thirteenth seasons, where she was cut in the green mile round. For her fourth appearance, she returned to audition in Nashville, Tennessee with ""Love Runs Outby OneRepublic. She sang Jessie J's ""Big White Roomin the House of Blues Showcase Week where she was able to earn her spot in the Top 24. She was the first finalist to be eliminated on March 12, coming in twelfth place.",14
