Contestant,Birthday,Birthplace,Hometown,Description,Season
Kelly Clarkson,24-Apr-82,"Fort Worth, Texas","Burleson, Texas","She performed Aretha Franklin's version of ""Respectand Vanessa Williams' ""Save The Best For Lastin the Hollywood rounds.",1
Justin Guarini,28-Oct-78,"Columbus, Georgia","Doylestown, Pennsylvania","He performed  Oleta Adams' version of ""Get Herein the Hollywood rounds.",1
Nikki McKibbin,28-Sep-78,"Grand Prairie, Texas",NA,"She had previously been on Popstars and auditioned with Gloria Gaynor's ""I Will Surviveand Whitney Houston's ""One Moment in Time.She performed The Righteous Brothers' version of ""Unchained Melodyin the Hollywood rounds. McKibbin died on November 1, 2020, after suffering an aneurysm, making her the fourth American Idol finalist to die, following Leah LaBelle in 2018, Rickey Smith in 2016, and Michael Johns in 2014.",1
Tamyra Gray,26-Jul-79,"Takoma Park, Maryland","Atlanta, Georgia","She had appeared on TV commercials and worked with other artists before auditioning for Idol, and was crowned Miss Atlanta in 1998.  She performed Oleta Adams' version of ""Get Herein Hollywood.",1
R. J. Helton,17-May-81,"Pasadena, Texas","Cumming, Georgia","J. Helton (born May 17, 1981, in Pasadena, Texas, 21 years old at the time of the show) is from Cumming, Georgia, and auditioned in Atlanta with The Jackson 5's ""Never Can Say Goodbye"". He had made demo CDs before appearing on American Idol.",1
Christina Christian,21-Jun-81,"Brooklyn, New York",NA,".Christina Christian (born June 21, 1981, in Brooklyn, New York, 21 years old at the time of the show) and auditioned in Miami, Florida with Stevie Wonder's ""Isn't She Lovely? She performed Diana Ross' version of ""Ain't No Mountain High Enoughin Hollywood",1
Ryan Starr,21-Nov-82,"Sunland, California",NA,"Her audition song was Bill Withers' ""Lean On Me. She performed Bill Withers' ""Ain't No Sunshinein the Hollywood rounds.",1
AJ Gil,5-Jul-84,"San Diego, California","Tacoma, Washington",NA,1
Jim Verraros,8-Feb-83,"Chicago, Illinois",NA,"He grew up with Deaf parents and is fluent in ASL (American Sign Language). He performed Diana Ross' ""Ain't No Mountain High Enoughin Hollywood.",1
EJay Day,13-Sep-81,"Lawrenceville, Georgia",NA,"He auditioned in Atlanta with Oleta Adams' ""Get Here.""",1
Ruben Studdard,12-Sep-78,"Frankfurt, Germany","Birmingham, Alabama",NA,2
Clay Aiken,30-Nov-78,"Raleigh, North Carolina",NA,"He studied at the University of North Carolina at Charlotte, where he graduated with a degree in special education.",2
Kimberley Locke,3-Jan-78,"Hartsville, Tennessee","Nashville, Tennessee",NA,2
Joshua Gracin,18-Oct-80,"Westland, Michigan","Oceanside, California","He auditioned in Los Angeles with O-Town's ""All or Nothing"".",2
Trenyce,31-Mar-80,"Memphis, Tennessee","Bartlett, Tennessee","She turned down a record deal at 14 and she auditioned using her full name, LaShundra ""TrenyceCobbins.",2
Carmen Rasmusen,25-Mar-85,"Edmonton, Alberta","Bountiful, Utah",She did not make the semi-final initially but was brought back for the wild card show and put through to the final.,2
Kimberly Caldwell,25-Feb-82,"Katy, Texas",NA,NA,2
Rickey Smith,10-May-79,"Keene, Texas",NA,"He worked as a teacher before the show. Smith was killed in a car crash on May 6, 2016, making him the second American Idol finalist to die after seventh season finalist, Michael Johns.",2
Corey Clark,13-Jul-80,"San Bernardino, California",NA,"He was disqualified hours after the website The Smoking Gun revealed his misdemeanor charges of battery and resisting arrest on March 31, 2003.",2
Julia DeMato,7-Mar-79,"Danbury, Connecticut","Brookfield, Connecticut",NA,2
Charles Grigsby,15-Sep-78,"Oberlin, Ohio",NA,NA,2
Vanessa Olivarez,7-Apr-81,"Atlanta, Georgia","Atlanta, Georgia",NA,2
Fantasia Barrino,30-Jun-84,"High Point, North Carolina",NA,"Her audition songs were Lauryn Hill's ""Killing Me Softly with His Songand Tina Turner's ""Proud Mary"".  She has performed from a young age with her family who had released a CD.  She performed Aretha Franklin's ""Thinkin the Hollywood rounds. At 19Â years, 10Â months and 26Â days, Barrino became the first teenage contestant to win American Idol.",3
Diana DeGarmo,16-Jun-87,"Birmingham, Alabama","Snellville, Georgia","She was on the show America's Most Talented Kid in 2002 as well as other TV shows.  She performed Ike & Tina Turner's ""A Fool in Lovein the Hollywood rounds. At 16Â years, 7Â months and 26Â days, she was the youngest contestant reach into the finals until Thia Megia and Lauren Alaina made to the finals in the tenth season. She was also the youngest runner-up in the history of American Idol.",3
Jasmine Trias,3-Nov-86,"Mililani, Hawaii","Mililani, Hawaii","She is the first Asian American contestant in American Idol who made it to the final three, followed by Jessica Sanchez in the eleventh season.",3
LaToya London,29-Dec-78,"Oakland, California","Oakland, California",NA,3
George Huff,4-Nov-80,"Houston, Texas",NA,"He performed Luther Vandross' ""Here and Nowin the Hollywood rounds.",3
John Stevens,28-Jul-87,"Buffalo, New York",NA,"He performed Tony Bennett's ""I Left My Heart in San Franciscoin Hollywood. He was the youngest male contestant to reach into the finals until Daniel Seavey in the fourteenth season.",3
Jennifer Hudson,12-Sep-81,NA,NA,NA,3
Jon Peter Lewis,7-Nov-79,"Lincoln, Nebraska","Rexburg, Idaho","He was dubbed the 'pen salesman' by Simon Cowell.  He performed The Jackson 5's ""I Want You Back"".",3
Camile Velasco,1-Sep-85,"Makati, Philippines","Haiku, Maui",NA,3
Amy Adams,25-Jul-79,"Kansas City, Kansas","Bakersfield, California","She performed Jennifer Rush's ""The Power of Lovein Hollywood.",3
Matthew Rogers,16-Sep-78,"Rancho Cucamonga, California",NA,NA,3
Leah LaBelle,8-Sep-86,"Toronto, Canada",NA,"She auditioned with her birth name Leah Vladowski. Her family was originally from Bulgaria, and immigrated to the United States. She performed Diana Ross' ""Theme from Mahogany (Do You Know Where You're Going To)at the Hollywood rounds. In 2011, LaBelle signed to Epic Records. LaBelle was killed in a car crash alongside her boyfriend Rasual Butler on January 31, 2018, making her the third American Idol finalist to die, following Rickey Smith in 2016 and Michael Johns in 2014.",3
Carrie Underwood,10-Mar-83,"Muskogee, Oklahoma",NA,"Louis, Missouri with Bonnie Raitt's ""I Can't Make You Love Me"".  She performed Candi Staton's ""Young Hearts Run Freein Hollywood week but forgot part of the lyrics.",4
Bo Bice,1-Nov-75,"Huntsville, Alabama","Helena, Alabama","He performed The Box Tops's ""The Letter"", The Temptations' ""Get Readyfor the group round in the Hollywood week.  He wanted to introduce rock to American Idol.  Prior to Idol he performed professionally and released an album with his band Purge.",4
Vonzell Solomon,18-Mar-84,"Baxley, Georgia",NA,"She is proficient in the martial arts.  She performed Whitney Houston's ""How Will I Knowin the Hollywood round. She performed as a guest singer for Postmodern Jukebox.",4
Anthony Fedorov,4-May-85,"Yalta, Ukraine","Trevose, Pennsylvania","He had difficulty breathing when he was little and had a tracheotomy about which his doctor expressed concern that he might not be able to speak again.  He performed Diana Ross' ""When You Tell Me That You Love Meand reprised Jon Secada's ""Angelduring Hollywood week.",4
Scott Savol,30-Apr-76,"Cleveland, Ohio",NA,"He performed Four Tops's ""I Can't Help Myselfin the group round in Hollywood week.",4
Constantine Maroulis,17-Sep-75,"Brooklyn, New York",NA,"He wanted to bring an edgy New York City's rock and roll to American Idol.  Prior to Idol he was in a band Pray for the Soul of Betty and worked in musical theater. In the Hollywood week, he performed The Box Tops's ""The Letterand Four Tops's ""I Can't Help Myselffor the group round.",4
Anwar Robinson,21-Apr-79,"Newark, New Jersey",NA,"He was a music teacher before Idol.  He performed Four Tops's ""I Can't Help Myselffor the group round in the Hollywood.",4
Nadia Turner,11-Jan-77,"Miami, Florida",NA,NA,4
Nikko Smith,28-Apr-82,"San Diego, California",NA,"Louis, Missouri and auditioned there with his birth name Osborne Smith.  He performed Stevie Wonder's ""All I Do"".  In Hollywood, he performed The Temptations' Get Ready in Bo Bice's group.",4
Jessica Sierra,11-Nov-85,"Tampa, Florida",NA,"She worked as a nanny before Idol.  In the Hollywood week, she performed Diana Ross' ""When You Tell Me That You Love Me""",4
Mikalah Gordon,14-Jan-88,"Las Vegas, Nevada",NA,"She performed Dusty Springfield's ""You Don't Have to Say You Love Mein the Hollywood rounds.",4
Lindsey Cardinale,5-Feb-85,"Hammond, Louisiana","Ponchatoula, Louisiana","She performed The Supremes' ""Ain't No Mountain High Enoughduring Hollywood week.",4
Ayla Brown,28-Jul-88,"Wrentham, Massachusetts","Wrentham, Massachusetts","She originally auditioned in Boston, singing ""Ain't No Mountain High Enough"".",5
Kinnik Sky,13-May-77,"Duluth, Georgia","Duluth, Georgia","She auditioned in Greensboro. She was grouped with Nicole Turk, Celeste Scalone and Tyra Schwartz during the group rounds.",5
Heather Cox,16-Nov-83,"Jonesville, North Carolina","Jonesville, North Carolina",She auditioned in Denver. Grouped with Halicia Thompson and Kellie Pickler during Hollywood group performances.,5
Brenna Gethers,7-Oct-80,"Mount Vernon, New York",NA,"She auditioned in Boston, and was known for her ""cattyattitude. She became the lead singer for Bomb Squad, a funk-rock band that won an American Music Award for Best New Music in 2003.",5
Stevie Scott,10-Oct-84,NA,NA,"She auditioned in Denver. She sang ""Gold by Spandau Balletduring performances in Hollywood. She was eliminated on February 23, 2006, along with Becky O'Donohue, Bobby Bennett, and Patrick Hall.",5
"Rebecca ""Becky"" O'Donohue",13-Jul-80,"Dobbs Ferry, New York",NA,"Her original audition was in Boston with her twin sister (who did not sing due to recent throat surgery). Simon Cowell praised her looks, but said no to her voice. She was let through to Hollywood by Randy Jackson and Paula Abdul.",5
Gedeon McKinney,1-Oct-88,"Memphis, Tennessee","Memphis, Tennessee","He intended to audition in Memphis, but the auditions there were canceled due to the city's role in relief efforts for Hurricane Katrina. He raised funds to travel to the Chicago auditions by putting on a benefit concert. His elimination was a surprise to many, including Simon Cowell, who had criticized him previously. McKinney's father, Tony McKinney, also a performing artist, died in December 2005 before the show aired. In 2018, his younger sister, Evvie won the first season of The Four: Battle for Stardom.",5
"William ""Will"" Makar",2-Mar-89,"The Woodlands, Texas",NA,"In high school, Will starred in several musical productions, including The Woodlands College Park High School Musical in January 2006, the performance of which began the day after the airing of his American Idol audition and was covered by local media. He has also performed for Presidents Clinton and Bush and with singer Celine Dion as part of the Houston Children's Chorus. He has performed the National Anthem at many sporting events and was also a member of the band Last Born. During the Hollywood rounds, he performed Fly Me to the Moon with David Radford and Kevin Covais. Will was signed to Double Deal Brand Records, which also signed fellow Top 16 semifinalist Ayla Brown, and released his debut single titled ""I Won't Make It Outon iTunes on April 27, 2007.",5
"JosŽ ""Sway"" Penala",23-Jan-78,NA,NA,"He was the only Asian-American who made it to the semifinals that season. He has performed with such groups as DnH and 6th Day. When he competed, on stage, Penala often wore a Fedora hat and coat and military dog tags. He developed friendships with Elliott Yamin, Taylor Hicks, and Chris Daughtry during the season. Elliott was also his Hollywood Week group mate and later his roommate.",5
David Radford,22-Mar-88,"Crystal Lake, Illinois",NA,"In addition to singing, David plays the trumpet. He originally auditioned in Chicago.",5
Patrick Hall,24-Sep-77,"Gravette, Arkansas","Gravette, Arkansas","During the Hollywood rounds, Simon Cowell called him 'very likable', and compared him to Clay Aiken. He received many positive comments during these rounds. To separate himself from the Clay Aiken comparison, however, he chose to perform ""Come to My Windowin the first week of the Top 24. He was eliminated that week.",5
"Bobby Bennett, Jr.",4-Jun-86,"Denver, Colorado","Denver, Colorado","(born June 4, 1986) is from Denver, Colorado, where his audition was held. He is most known for his rousing rendition of the song ""Copacabanaand was named the ""showmanof the semifinalists. He also made an appearance in the March 21 episode on which Barry Manilow performed.",5
Jordin Sparks,22-Dec-89,"Glendale, Arizona",NA,"She was a contestant on America's Most Talented Kid in 2003 and also appeared on the program's Tournament of Champions, on which she sang the Celine Dion ballad ""Because You Loved Mein her auditions. She is the daughter of former NFL defensive back Philippi Sparks. With her win, Jordin became the youngest Idol yet and joins the ranks of Kelly Clarkson, Carrie Underwood and Taylor Hicks by winning without ever appearing in the bottom two or three.",6
Blake Lewis,21-Jul-81,"Bothell, Washington","Bothell, Washington","He is a former member of the a cappella group KickShaw. Claiming to be the city's beatboxing champion, Lewis sampled a hip hop tune to the judges before rendering Seal's ""Crazy"". He passed the auditions but Simon commented to him that ""you are not as good as you think you are"", reminding him not to be cocky and overconfident in the future.",6
Melinda Doolittle,6-Oct-77,"Brentwood, Tennessee","Brentwood, Tennessee","Despite being a professional back-up singer, she admitted she was still tense and nervous about competing in the show. She auditioned with ""For Once in My Lifepopularized by Stevie Wonder, and was met with universal praise from the three judges on her vocal ability. The judges did express concern about her nerves and told her to believe in herself. Her elimination the week before the finale had Simon Cowell looking disappointed, as he felt that she deserved to be in the finale for ""week to week consistency"".",6
LaKisha Jones,13-Jan-80,"Flint, Michigan",NA,"Viewers were first introduced to Jones during the ""Best of the Restepisode. After her audition in New York, LaKisha celebrated with her family and cried tears of happiness with her daughter. She is also the runner up of the Houston show, KPRC Local 2 Gimme the Mike, in 2005. She listed Fort Meade, Maryland as home on her application, and also has a Houston following.",6
Chris Richardson,19-Feb-84,"Chesapeake, Virginia","Chesapeake, Virginia","He is from Chesapeake, Virginia, and auditioned in New York with Leon Russell's A Song for You as interpreted by Donny Hathaway.  During Richardson's audition Randy compared him to Justin Timberlake.",6
Phil Stacey,21-Jan-78,"Jacksonville, Florida","Jacksonville, Florida","He auditioned in Memphis and is from Jacksonville, Florida. He missed the birth of his daughter, McKayla, to audition for Idol. He performed two songs before getting through to Hollywood: ""My Girland ""Let's Get It On"".",6
Sanjaya Malakar,10-Sep-89,"Federal Way, Washington",NA,"He auditioned in Seattle with his sister Shyamali, singing ""Signed, Sealed, Delivered I'm Yours"". He is from Federal Way, Washington, the same town as Amy Krebs. After Sanjaya's audition, Simon commented that he had a better voice than his sister. Both made it to Hollywood, but Sanjaya was shown tearfully embracing his sister when he made it to the top 40 in Hollywood and she was cut.",6
Haley Scarnato,15-Jun-82,"San Antonio, Texas",NA,"She sang ""I Can't Make You Love Meby Bonnie Raitt during her audition. She lives in San Antonio, Texas.",6
Gina Glocksen,4-Jul-84,"Naperville, Illinois","Naperville, Illinois","She originally auditioned in Chicago during season five and made it to Hollywood, but she was cut before the Top 40.",6
Chris Sligh,13-Apr-78,"Greenville, South Carolina",NA,"He auditioned in Birmingham and sang ""Kiss from a Roseby Seal, after which Paula gave a standing ovation and stated, ""I like you very much"".",6
Stephanie Edwards,5-Nov-87,"Savannah, Georgia",NA,She auditioned in Memphis.,6
Brandon Rogers,11-Dec-77,"North Hollywood, California",NA,"He auditioned in Los Angeles and is from North Hollywood, California. Rogers has been a backup singer to established artists, performing on Justin Timberlake and Christina Aguilera's 2003 Justified and Stripped Tour and Anastacia's 2005 Encore Tour. After hearing his audition song, the judges (including guest judge Olivia Newton-John) were impressed with his vocals. Simon Cowell later mentioned he was the best auditioner coming from that city.",6
David Cook,20-Dec-82,"Houston, Texas",NA,"Cook's interest in music began early in life; he received his first guitar at the age of 2.  He formed a band while still at high school called Axium, which was chosen as the best band in Kansas City in 2004. He later joined Midwest Kings in Tulsa, but left to pursue a solo project where he released an album titled Analog Heart.  Prior to Idol, he worked as a bartender at the ""Blank Slatein Tulsa, where he  also occasionally played shows.  He enjoys doing crossword puzzles in his spare time and calls himself a ""word nerd"".  His Hollywood performance of Bryan Adams's ""(Everything I Do) I Do It for Youdid not impress Simon Cowell, but did so with his second performance, Edwin McCain's ""I'll Be"".  He wore an orange wristband to support a seven-year-old fan with leukemia from top-12 week onward. He was never in the ""bottom three"".  On May 21, 2008, he was declared the winner.  He was signed to RCA Records and released a self-titled album on November 18, 2008.",7
David Archuleta,28-Dec-90,"Miami, Florida","Murray, Utah","In 2003, at the age of 12, he sang on several episodes of the television show Star Search and went on to win the season finale and the $100,000 grand prize.  In one episode, he competed against AlexandrŽa Lushington, who was a fellow semifinalist this season. He suffered from vocal paralysis after that show, which affected one of his vocal cords.  He impressed the judges with his performance of Gnarls Barkley's ""Crazyand Bryan Adams's ""Heavenduring the Hollywood round.  He was never in the ""bottom threeand finished as the season-seven runner-up. He was signed to Jive Records.",7
Syesha Mercado,2-Jan-87,"Bridgeport, Connecticut","Sarasota, Florida","She is a student at Florida International University and has been singing and dancing since she was a child. During Hollywood week, she became ill and almost completely lost her voice. In preparation for her final Hollywood performance with Aretha Franklin's ""Chain of Fools"", she went on voice rest and wrote down everything she had to say on a pad of paper.  Prior to American Idol, she appeared on the short-lived US version of Star Academy (known as The One: Making a Music Star when it aired on ABC in July 2006 for two weeks).  Kara DioGuardi, who was one of the coaches on the Endemol franchise, joined Idol for season eight.  She was voted off as a third-place finisher.",7
Jason Castro,25-Mar-87,"Rockwall, Texas",NA,"He started in music playing the drums. In high school, he played for a band, Keeping Lions, which has since disbanded.  In 2006, he appeared on Cheyenne Kimball's MTV reality TV series, as her real-life dating interest. Castro is the first person in his family, which is originally from Colombia, to be born in the United States. He is a student at Texas A&M University, with a construction science major and music minor. He began growing his hair out for dreadlocks during his senior year of high school.  He exited the competition in fourth place.",7
Brooke White,2-Jun-83,"Mesa, Arizona",NA,"During her audition, she admitted to never having seen an R-rated movie, prompting Cowell to state that the show will ""bring her over to the dark side.In 2005, she released an album titled Songs from the Attic under New Millennium Records.  She performed Carole King's ""Beautifulon Hollywood week.  She finished in fifth place.  After the contest, she started her own record label, June Baby Records, with Randy Jackson, and released an album, High Hopes & Heartbreak.",7
Carly Smithson,12-Sep-83,"Dublin, Ireland",NA,"Smithson previously signed a recording contract with major US label MCA Records and released an album in 2001 entitled Ultimate High under her birth name, Carly Hennessy. The album sold about 300 copies in the first three months following its release. Smithson was originally auditioned in Las Vegas during the fifth season, but was dropped from the show due to a problem with her visa.  She auditioned in San Diego with Whitney Houston's ""I'm Every Woman"", and performed Leo Sayer's version of ""When I Need Youand Heart's version of  ""Alonein the Hollywood rounds. She finished sixth in the show.",7
Kristy Lee Cook,18-Jan-84,"Selma, Oregon",NA,"She sold her prized horse  to afford the trip to audition in Philadelphia, where she auditioned with ""Amazing Grace"", a song she also performed during the Hollywood week. In 2001, she was signed to a major label, Arista Nashville. Cook also signed with Britney Spears' production company, and Spears herself was supposed to have a cameo in Cook's first video. At the time of signing, she was managed by the former manager of LeAnn Rimes.",7
Michael Johns,20-Oct-78,"Perth, Western Australia",NA,"He moved to the U.S. from Australia in 1998 and lived in Buckhead, Atlanta for six years, performing at local venues solo and with local band Film. Afterwards, he lived in Los Angeles. After recording a demo and traveling to Los Angeles to showcase for a number of labels in 2001, he signed with Maverick Records and formed a rock band called The Rising. Before focusing on his singing career, he was a sportsman, winning a tennis scholarship and playing Australian rules football for the USAFL club Atlanta Kookaburras. During the Hollywood round, he performed The Doors' ""Light My Firebut it was his performance of Queen's Bohemian Rhapsody that was one of the highlights of that week.  He was eliminated on April 10 and finished in eighth place. Johns died on August 1, 2014, making him the first American Idol finalist to die.",7
Ramiele Malubay,6-Sep-87,"Miramar, Florida",NA,"Prior to auditioning on Idol, she was a nursing student at Broward Community College and worked part-time at a sushi restaurant. She started Polynesian dancing when she was in the first grade and started singing at the age of 12. Since the age of 12, Ramiele has sung at various Filipino-American events.  She performed Aretha Franklin's ""Until You Come Back to Meand The Kiki Dee Band's ""I've Got The Music In Meat the Hollywood rounds.  She was eliminated in ninth place.",7
Chikezie Eze,11-Sep-85,"Inglewood, California",NA,"During the competition, he dropped using his last name because it was so frequently mispronounced ('eh-zee' and not 'EE-zee'). He previously auditioned for the show's sixth season, and made it into the Hollywood round, where he was cut before the top 44. Before auditioning for Idol, he worked as a Transportation Security Administration officer at Los Angeles International Airport.",7
Amanda Overmyer,26-Oct-84,"Mulberry, Indiana","Mulberry, Indiana","She received a nursing degree from Ivy Tech Community College and deals predominantly in respiratory issues. She has been the lead singer of several local hard rock bands, including Steeleto and Ruinaces. A week before the Hollywood week, she was injured in a serious car accident.  She performed The Doors' ""Light My Fireat the Hollywood rounds.  After the season ended, she married her fiancŽ Casey Taylor.",7
David Hernandez,31-May-83,"Glendale, Arizona","Glendale, Arizona","He was a student at Arizona State University with a major in broadcast journalism. He gave up his apartment to move to Hollywood. Until September 30, 2007, Hernandez worked as a male stripper named ""Cadenat Dick's Cabaret in Phoenix, Arizona, performing fully nude and giving lap dances to male patrons. This did not prevent him from being on the show.  He performed Stephen Stills's ""Love the One You're Withon Hollywood week.  He was voted off in 12th place.",7
Kris Allen,21-Jun-85,"Jacksonville, Arkansas","Conway, Arkansas","Allen's interest in music began at an early age; he taught himself how to play guitar at the age of 13, as well as numerous other instruments. Prior to Idol, he worked as a worship leader at New Life Church in Maumelle, Arkansas, and is a member of Chi Alpha Campus Ministries at the University of Central Arkansas, where he is a business major. Allen was announced the winner on May 20. He went on to release his first official single, ""No Boundaries"", which was written by Idol judge Kara DioGuardi. As a part of winning Idol, Allen was signed by Jive Records and 19 Entertainment.",8
Adam Lambert,29-Jan-82,"Indianapolis, Indiana",NA,"Lambert grew up in Rancho PeÃ±asquitos, San Diego, California and attended Deer Canyon Elementary School, Mesa Verde Middle School, and Mt. Carmel High School, where he took part in theater and choir, and also performed with the school's jazz band. Lambert has been a stage actor since the age of ten, performing in such productions as You're a Good Man, Charlie Brown and Wicked.  He joined the band The Citizen Vein briefly.  He also worked as a demo singer, and those recordings were released after his appearance on Idol in the album Take One. Lambert roomed with Kris Allen during the show. Lambert was the runner-up.  He was signed to RCA Records after the show and released his debut album For Your Entertainment.",8
