grade	publication	text	date
100	Pocket Gamer UK	Animal Crossing; New Horizons, much like its predecessors, operates outside of the boundaries of most games. While the most tension you'll ever feel is while sprinting away from wasps, there's a warmth and comfort in the code which you won't find almost anywhere else.	2020-03-16
100	Forbes	Know that if you’re overwhelmed with the world, stuck inside, or adrift in a life that you know will look totally different next week — get Animal Crossing.	2020-03-16
100	Telegraph	With a game this broad and lengthy, there’s more to discuss than I could fit in one review, but suffice it to say, this a game that Nintendo have clearly worked incredibly hard to get right. It shines at every moment, from the wind rustling through the trees, to the sunset glinting off the water to the jaunty tunes at the start of the day fading into more relaxing melodies in the evening. Add dozens of much needed quality of life features (hello player customisation, autosave, couch co-op, and eight-player online play) and it all adds up to the perfect DIY recipe for the most chilled out, relaxing, and engaging life simulator ever.	2020-03-16
100	VG247	Animal Crossing: New Horizons is everything I hoped it would be, and it’s yet another stellar release that showcases a confident Nintendo at its best. It is excellent, and is easily another must-own Switch title – at least, if you can understand and embrace Animal Crossing’s uniquely lazy pace.	2020-03-16
100	Nintendo Insider	Above all else, Animal Crossing: New Horizons is an unbeatable feel-good experience and an essential purchase for anyone that owns a Nintendo Switch. As heartwarming as it is wholesome, Nintendo has delivered meaningful changes that help to structure your peaceful island existence. Every day has the potential to offer something new, and, thanks to that, it will be a game that many will enjoy investing countless hours (and Bells) in. Oh, and heroically leaping across rivers with the Vault Pole will never get old.	2020-03-16
100	Trusted Reviews	Animal Crossing: New Horizons is the best game I've played this year, and immediately cements itself as one of the generation's defining experiences. Fans will be playing it for years, watching as the seasons roll by and unveil the true potential of what has been created here.	2020-03-16
100	VGC	Nintendo's comforting life sim is a tranquil haven at a time the world needs it most.	2020-03-16
100	God is a Geek	A beautiful, welcoming game that is everything and anything you want it to be. This is one you'll play all year and beyond, and it's exactly what the world needs right now.	2020-03-16
100	Nintendo Life	Animal Crossing: New Horizons takes Animal Crossing and not only drags it back onto home consoles, but improves upon every single facet imaginable. There's more to do, more to see, more to change, more to mould, and more to love; fans and first-time players are going to find themselves losing hours at a time gathering materials, creating new furniture, and making their island undeniably theirs. Every moment is unashamedly blissful, with excellently-written characters that truly feel alive and an island paradise that gives infinitely back more than you put in. Back when Animal Crossing: New Leaf hit the shelves all those years ago and created a whole new generation of fans, many people were wondering how Nintendo could possibly top it, but here we have our answer. This is a masterpiece that has been well worth waiting for.	2020-03-16
100	Daily Star	Similar to how Breath of the Wild and Odyssey reimagined 3D Zelda and Mario, New Horizons represents an exciting new milestone for the Animal Crossing series. By truly handing the player the reins, Nintendo has delivered a deeply customisable and effortlessly joyous experience which is, quite simply, an essential purchase for all Switch owners.	2020-03-16
100	CGMagazine	Animal Crossing: New Horizons takes everything good about Animal Crossing and improves it ten-fold.	2020-03-16
95	Multiplayer.it	New Horizons is the crown jewel in the beloved Animal Crossing franchise: Nintendo managed to surpass every expectation by refining the gameplay with a plethora of features which improve visuals, quality of life and customization.	2020-03-16
95	GamesBeat	Animal Crossing: New Horizons is fantastic. It is the best Animal Crossing game ever made.	2020-03-16
94	The Games Machine	If you've never played a game in the series, New Horizons is a great start. On the other hand, if you are already familiar with Animal Crossing, you will find a good amount of nostalgia but also pleasant little news, which will make this new adventure worthy of being lived day by day.	2020-03-16
94	Wccftech	Animal Crossing: New Horizons is the biggest reinvention of the series' mechanics and core gameplay loop, and that also makes it the best entry yet. This is a completely new kind of Animal Crossing experience, while retaining everything you loved about the previous games. You'll spend hours catching fish and bugs, making money to pay off your loan, and do it while having more power over how you customise your experience than ever before. I adore Animal Crossing: New Horizons, and this is quickly becoming one of my most-played games on Nintendo Switch. If you've ever had a love slow-paced social sims like Animal Crossing or The Sims, this game is essential.	2020-03-16
93	SpazioGames	Animal Crossing: New Horizons easily wins the best entry in the series title, bringing in much needed new content in the franchise.	2020-03-16
93	Areajugones	Animal Crossing: AC is back with New horizons. A game that feels big, polished and absolutely addictive. Nintendo has managed to create yet another entry in the series that has enough changes without leaving behind the feeling and philosophy of Animal Crossing.	2020-03-16
92	IGN Italia	Animal Crossing: New Horizons changes the game in a lot of subtly but meaningful ways, giving it more depth, freedom and a better flow.	2020-03-16
92	COGconnected	I always knew Animal Crossing games as something you played for like, 30 minutes a day at most. Grab some fruit, chat to your neighbors, call it a day. This game will take over your whole dang life, but in a really fun way. If you’ve ever had even a whiff of interest in this franchise, Animal Crossing: New Horizons will be an absolute slam dunk. Don’t sleep on this one for a second.	2020-03-16
91	Nintenderos	Start from scratch on a deserted island, collect resources to help its growth, form a small community, progress to get an idyllic place we dream of and, when we think that there is nothing else on the horizon, millions of players will share with us their own vision of our own story. A different and deep game, something that is undoubtedly a sensation that lovers of video games should experience.	2020-03-16
90	VideoGamer	Animal Crossing: New Horizons is beautiful and peaceful, offering safe harbour from the stresses of everyday life. There’s so much to do and so much to see, so what’s wrong with making a back seat?	2020-03-16
90	Millenium	With fully customizable gameplay and a game experience that changes daily, Animal Crossing New Horizons is the perfect companion for a dream life. Having kept the basics and the principles of the franchise, Nintendo has introduced some great new features that allow even more total immersion in this bubble of tranquility. Whether it's with the ability to shape your island as you wish, more customisation than ever before, or the addition of a crafting system, while keeping the basics of the franchise, this new game fully meets the expectations of fans and will even manage to convert even the most skeptical.	2020-03-16
90	Gamer.nl	The amazing, relaxing gameplay we love is now available in a beautiful new look. The new quests and crafting systems are great for both newcomers and fans of the series and it is great to see Animal Crossing grow without losing its charm.	2020-03-16
90	GamePro Germany	Animal Crossing New Horizons did everything right by jumping on the switch. The controls are pleasant, the crafting is clear and the challenges are so diversified that they will motivate hobbyists and craftsmen for a long time.	2020-03-16
90	Meristation	Animal Crossing: New Horizons is the best entry of the series so far, but it is not the ultimate Animal Crossing yet. There are some minor flaws, but nothing really noticeable. Its quality of life details, the daily routine of grabbing some fruit, chatting to your neighbors or looking for surprises, plus the very new mechanics are so delightful that we can only say good things about one of the most rewarding Nintendo experiences yet.	2020-03-16
90	Gameblog.fr	The fresh thrill of discovering an uninhabited atoll tends to fade once such wild life gets cosier with crafted items, buildings, shops and incoming residents, until it looks like a village from the previous iterations. But the larger size of this wholly reshapable island, the customization's vertiginous level and the improved community interactions create an even more fertile ecosystem, hence Animal Crossing can slowly though decidedly stare further, towards New Horizons, equipped with an ever updating NookPhone.	2020-03-16
90	Game Informer	New Horizons has a lot to see and do, and much of the joy comes from discovering it on your own. I still get a kick out of the real-time elements, such as how a construction project that takes a day to complete takes a real day’s time to finish, or how the various merchants keep actual store hours. That little hook keeps me excited to check back in later when I end each session. Animal Crossing: New Horizons has something new to experience every day, and, best of all, it’s built on a foundation of joy and earnestness that’s all too rare. If the tradeoff is that I have to craft a few fishing poles, I guess it’s worth it in the end.	2020-03-16
90	USgamer	Animal Crossing: New Leaf remains the pinnacle of the series, but New Horizons brings with it a bunch welcome quality of life changes, such as terraforming the island to your every whim. The addition of crafting isn't a burden as I worried it would be. In fact, it becomes a fun objective to work toward, effectively diversifying the usual chores of selling bugs and fish to pay your never-waning debts to that rascally raccoon. With real-world headlines more harrowing than ever, there's never been a better time to go on vacation within Animal Crossing: New Horizons.	2020-03-16
90	My Nintendo News	Animal Crossing: New Horizons is a beautifully relaxing title – exactly as it should be. With so much to offer in the coming months, such as seasonal events and new NPC characters we have yet to encounter, it’s a rewarding game that takes pride in its little moments of heart-warming joy. If you’re an Animal Crossing fan, you don’t want to miss this.	2020-03-16
90	XGN	Animal Crossing New Horizons delivers on all fronts. Even though you know what to expect, the game manages to surprise you in meaningful ways that'll keep you playing for hundreds of hours. The localisation could've been better, but that doesn't impact the fun that you're guaranteed to have.	2020-03-16
90	Screen Rant	Nintendo Switch gets another must-own exclusive as Animal Crossing: New Horizons delivers on the expectations of fans without scaring off newcomers.	2020-03-16
90	TheSixthAxis	Animal Crossing: New Horizons is the perfect island escape, drawing you in to play day after day. All of the charms of the series' previous games are here, but with gorgeous new graphics, DIY crafting and the eventual ability to remodel your island, you can really create the island settlement of your dreams.	2020-03-16
90	Vandal	Animal Crossing is back with the most complete entry so far, full of options to make this virtual world truly yours. It makes the series feel fresh while keeping its essence intact.	2020-03-16
90	IGN	Animal Crossing: New Horizons is an expanded, polished, next-generation reboot of a classic Nintendo game that's full of surprises.	2020-03-16
90	Metro GameCentral	Animal Crossing finally gets a sequel that moves the franchise forward, in a surprisingly timely release that is perfect for this year in terms of both its gameplay and its philosophy.	2020-03-16
90	Eurogamer Italy	Animal Crossing: New Horizons is refined by the technological evolution of the last decade and the experience gathered with New Leaf and the various spin-off titles: the new game has a soul that has always been present in the franchise, but never fully expressed as today . All that remains is to wait for the launch and hope for a far-sighted management of the free updates and (not yet confirmed) microtransactions, crowning a title very close to conceptual and executive perfection.	2020-03-16
90	GamesRadar+	There continues to be nothing quite like Animal Crossing, and New Horizons proves that there's life in the old Nook yet.	2020-03-16
88	Hobby Consolas	Animal Crossing New Horizons adds new customization elements, tools, objects and activities to the classic formula. It´s not a game for everybody, but fans will love it.	2020-03-16
86	Power Unlimited	Under the illusion of a relaxed island existence, this Animal Crossing gives you more to do, experience and build than ever before, all in a thoughtful, pleasant, time-and-time seductive way, making it the ultimate AC. An enrichment of my existence where I hope to spend many days, months and years.	2020-03-16
85	Everyeye.it	Animal Crossing reaffirms how important it is also to have an alternative: a welcoming and relaxed space where to stop. And relax. And breathe ...	2020-03-16
85	Jeuxvideo.com	The series has managed to evolve without betraying the spirit of the previous parts: to spend peaceful days and do what we want, without pressure. Possibly, New Horizons is the breath of fresh air we needed.	2020-03-16
85	3DJuegos	Animal Crossing: New Horizons is a right evolution in the series, based on customization, looting and crafting. Definitely, the biggest title in the AC franchise, but also a very conservative one.	2020-03-16
85	Destructoid	Based on what I have been able to experience, it's what I've wanted Animal Crossing to be for many years.	2020-03-16
85	Critical Hit	Animal Crossing: New Horizons is a game that manages to be wholeheartedly cathartic, relaxing and adorable for every second you play despite some legacy flaws and clunky menus that may vex just a little too much.	2020-03-16
82	IGN Spain	Animal Crossing debuts on Nintendo Switch with New Horizons, a game that draws heavily from users of previous titles feedback, but with too slow a progression in comparison.	2020-03-16
80	4Players.de	Nintendo's island adventure can be boring at times, but also tremendously recreative – in any case it is unbelievably charming.	2020-03-16
80	Post Arcade (National Post)	It’s a blissfully lighthearted and colourful game filled with charm, humour — I giggled aloud the first time I caught a black bass, described in-game as “the most metal of all fish” — and a much needed sense of normalcy that comes at a time when we could all use a little pick-me-up.	2020-03-16
80	GAMINGbible	While New Horizons doesn't do much - or anything at all, really - to win over anyone who didn't get Animal Crossing previously, veteran fans and interested newcomers alike will find 2020's sweetest, most wholesome game yet.	2020-03-16
90	GRYOnline.pl	In case of Animal Crossing, a dull slogan like this game is addictive becomes true. I have been, with utmost pleasure, fishing, and planting flowers; I have decorated my house and talked to the residents of the island, and it was all fun. And even though I've spend more than 5o hours with New Horizons, there are still lots I of things haven't seen. If you own a Switch and like a splendid grind, you simply have to play it.	2020-03-17
80	Digital Trends	New Horizons is packed with delight. It’s fun, with rare cross-generation appeal. The deserted island theme had some worried the latest entry would stray from the traditional model, but those fears should quickly be alleviated. It does, however, allow for new experiences and prevent the series from feeling stale almost 20 years after its debut.	2020-03-17
100	Cubed3	As in the past games, this is rich with culture, community, humour, and charm. There's a reason why the series has such a dedicated fan base - and with such hype, there's always the worry that the expectations may not match reality. However, New Horizons exceeds expectations in every way. It proves to be the ideal gateway game for many people and, with added touches of magic, Animal Crossing: New Horizons is perfect for players old and new.	2020-03-18
92	Atomix	Animal Crossing: New Horizons is just the game we wanted and much more. This franchise demonstrates once more why it is so special.	2020-03-19
100	TheGamer	Playing New Horizons was well worth the wait. The game is relaxing, enjoyable, well thought out, and fantastic chilled out fun for all ages. Right now, we really need a distraction from the chaos around us, and this game has come at the perfect time. So relax, hop on that plane, and enjoy your new life on the beach, in the woods, or even by the river. The choice is yours.	2020-03-22
95	Pure Nintendo	Animal Crossing: New Horizons hit every checkbox for me. It’s clear in their handling of New Horizons that Nintendo truly cares about this series and understands its value to its audience.	2020-03-23
90	Games.cz	Animal Crossing: New Horizons will easily become your lovely new daily routine. Every day you’ll be coming back and discovering something new, you won’t be feeling alone even in sinlgeplayer and you’ll become a part of a community that will transform a tropical island into a paradise on Earth (just forget about the couch coop, though).	2020-03-23
90	Carole Quintaine	Animal Crossing New Horizons is simply adorable! Its world full of colors, its cute look and its multitude of possibilities make it an absolutely awesome and extremely generous game. The crafting allows a very satisfying experience, you can do just about anything on your island and transform it radically at your leisure. This exotic adventure is a real piece of paradise and the feeling of freedom is total.	2020-03-23
85	NintendoWorldReport	Animal Crossing: New Horizons is a whole new approach to the series. While it has created some downsides, I can't understate how great this game has come together. The overall flow has been expanded with Nook Miles goals, DIY projects, and very lively animal friends. What I'm impressed by is how I was never left without something to do, and how I could see the world improve around me. There are a few things that New Horizons could have explained better, but they are also part of the more free flowing future that the franchise wants. Even after all these years, there is a daily routine that I hold dear and makes me adore the various elements that glue this game together. It has been sharply dialed up to eleven, without disagrading any newcomers.	2020-03-23
80	JeuxActu	Animal Crossing New Horizons is a good entry in the series with it's new features like terraforming and crafting, but overall it's not a revolution, and it surely won't convince gamers who dislike the IP.	2020-03-23
98	Cheat Code Central	Animal Crossing: New Horizons could end up being the most important game of 2020. It certainly will be one of its best. It will be the coping mechanism that helps people both recover from and overcome the dark things around them.	2020-03-24
93	LevelUp	Thanks to new customization possibilities, a lot of classic charm and many QOL improvements, Animal Crossing: New Horizons stands as the best of the franchise so far. This game builds a community sense in different levels, something that we need at present time.	2020-03-24
90	Shacknews	There’s no arguing that Animal Crossing isn’t for everyone. But, if you’ve been a fan of the series before, and you’re looking for something juicy to sink your teeth into, then New Horizons is everything you could ever want from the franchise and then some.	2020-03-24
90	GameSpew	There has never been a better time for a new Animal Crossing game to arrive. It cannot fix what’s going on in the world right now, but Animal Crossing: New Horizons gives us the joyful, meditative escape that so many of us desperately need right now. Whether you’re young or old, you’ll find something to like. What isn’t to love about customising your dream island and being able to sit on a bench by the beach, listening to the waves, just because you can? Nothing I can think of, that’s for sure.	2020-03-24
80	GameCrate	New Horizons is a great evolution for the Animal Crossing franchise. As always Nintendo has integrated some amazing innovations into the formula, but in the process made some really weird design decisions that detract from the fun.	2020-03-24
90	Digitally Downloaded	We all need games like Animal Crossing: New Horizons, and while I don't think it's perfect by any means, and some of the new elements this time around come at the expense of what made previous titles so wonderful, the winning charm is still there in full. This will be Nintendo's biggest game of 2020, and with good reason - everyone who has been looking forward to it will be absolutely delighted by what Nintendo has delivered.	2020-03-25
90	Edge Magazine	To play New Horizons is to retreat to a fairer, kinder place, where even the supposed bad guy is a philanthropist who gives you interest-free loans you can pay off at your leisure. Animal Crossing has always been a pleasure; never has it felt quote so essential. [Issue#344, p.110]	2020-03-26
90	Worth Playing	Animal Crossing: New Horizons offers players a plethora of things to do at a very measured pace. The slow build does well to lull players into a cadence and get them used to some of the basics before going full bore — while still managing to be a relaxing jaunt. Solo play is near-perfect with the new additions that make this feel different from previous outings, while multiplayer is a treat even if some of the methods can feel slightly archaic. Ultimately, this is the kind of long-term game you want to get addicted to because it has a wealth of things to discover and do.	2020-03-26
90	Gamer.no	Quotation forthcoming.	2020-03-26
100	Switch Player	Time apart can be good for the soul and New Horizons is proof of just that. Seven years in the making, this is the definitive Animal Crossing experience. This is as close as it gets to Animal Crossing perfection.	2020-03-27
90	Game Revolution	A perfect entry-point for series’ newcomers and a warm comfort blanket for veterans, this is what I wanted out of my favorite series’ Switch debut.	2020-03-27
90	Vgames	With an addictive and rewarding gameplay, great multiplayer aspect, good writing and a huge amount of content, this is quite literally the best Animal Crossing has ever been.	2020-03-28
81	Video Chums	This latest Animal Crossing delivers the same charm and laidback fun that fans love. Plus, it provides more structure with its nifty Nook Miles system. In the end, this is a game that you'll be glad to pick up and play in short bursts for weeks, months, or even years.	2020-03-28
100	We Got This Covered	Animal Crossing: New Horizons is the perfect getaway from daily life, putting players in a serene world where the only thing that matters is catching fish and arranging furniture. Its crafting system creates a sense of ownership over the island while also doubling as a creative outlet. It's an absolutely delightful and refreshing experience.	2020-03-30
100	DarkStation	Sometimes, playing a video game really is the best distraction from the real world. If you’re looking for an escape to an idyllic place of relaxation and quirky animals, where you can be creative, productive, or just chill in a virtual environment, Animal Crossing: New Horizons is the right game at the right time.	2020-03-30
95	GamingTrend	Animal Crossing: New Horizons is easily the best Animal Crossing game to date. This life simulator is the most immersive, feature-filled, and customizable to date, having exponentially amplified all the charm and addicting qualities of New Leaf. A must have for any fan of the series, or anyone who simply needs a distraction from the current state of the real world.	2020-03-30
90	Twinfinite	New Horizons is the definitive Animal Crossing experience—that much is clear after a relatively short amount of time spent with it. And with the promise of future holiday updates, it’s guaranteed that fans both new and old will return to their islands again and again for many years to come.	2020-03-30
90	BaziCenter	Animal Crossing: New Horizons is yet another title that you can clearly see Nintendo's mark on it. It aims only to entertain, and it succeeds. If you are looking to distant yourself from all the violence and adrenaline that most games on the market are offering right now, then this is a perfect match for you.	2020-03-31
90	FNintendo	Animal Crossing: New Horizons is the premiere of the series on the Nintendo Switch and it makes the player feel right at home, whether newcomers or the more experienced ones. With an array of new elements and mechanics but keeping its formula well anchored in the series' conventions, New Horizons will delight its players thanks to a marvelous game environment and world development, and its hefty rewards, packing enough content to leave everyone growing attached and enveloped by its experience.	2020-04-01
100	Player 2	If you’ve never played Animal Crossing before, New Horizons will suck you into its ostensibly calm island world like nothing else. For series veterans, you will eagerly surrender to this whirlpool, only to emerge in time for the next entry in the series.	2020-04-02
