grade	publication	text	date
100	Gaming Age	Being able to play the game with family in the same household may require a bit much (multiple Switch consoles and copies of the game) but when you get it all up and running, it is a great way to spend your time stuck at home. I’ve spent hours with the game every day since launch, and have yet to come close to being exhausted with it, and seemingly never run out of things to do. So, if for some reason you have yet to pick this one up, I’d definitely recommend doing so.	2020-04-02
90	Malditos Nerds	If Animal Crossing was always a very simple concept with very complex features, New Horizons is a toy hammer with the capacity to forge a universe, powered by each player's imagination. It's must-have game in the library of every Nintendo Switch user that perfectly exemplifies Nintendo's idiosyncrasy. Similar to a bonsai, It offers something that can be cared for and appreciated every single day.	2020-04-02
90	DualShockers	“New Horizons makes it easy, appealing, and effortless to hop back in each day and find something new to do and to expand your island even more.	2020-04-03
90	Game Rant	Animal Crossing: New Horizons refines the formula, but doesn't dramatically shake it up. This is still a laid-back game that ultimately lets the player choose what they're going to do at any given moment, but those choices are still primarily limited to what existed in the prior games.	2020-04-05
90	GameSpot	New Horizons has a slower pace even than other Animal Crossing games, and at times, that can feel unnecessarily restrictive. But there's still plenty to do, and each of those activities feeds into the next brilliantly for a rewarding and relentlessly cheerful experience. New Horizons certainly came at the right time, and its strengths are particularly comforting right now. I'm as excited to see what random events await me each morning as I am glad to have it during hard times, and that's sure to keep me coming back for the foreseeable future.	2020-04-05
95	Nintendo Enthusiast	Animal Crossing: New Horizons ultimately helped me better appreciate the importance of being able to spend time with others. With or without a pandemic, this is one of the best games to have graced Nintendo Switch yet. It’s the purest and most engaging form of Eguchi’s vision, and there’s an unparalleled belonging and meaning that’ll draw me back in for a long time to come.	2020-04-06
90	Gameplanet	New Horizons is the near-perfect installment ahead of the 20th anniversary of the series. There is so much to do in this game, and Nintendo has really pushed the limits for the series with the amount of creative freedom they’ve handed over to the player. The only thing that lets it down is the clunkiness of an otherwise delightful multiplayer feature. Still, this is exactly the kind of game I want to be stuck at home with.	2020-04-06
90	Noisy Pixel	Animal Crossing: New Horizons ends up being worth the wait between mainline entries. Even with some omissions and issues with the one island per system, the streamlined gameplay and customization show just how much this series has grown over the years. There is so much to do here that it will easily keep me busy crafting, customizing, and collecting for months if not years to come.	2020-04-06
80	New Game Network	New Horizons draws from familiar Animal Crossing elements while building upon and redecorating them with its fun island motif. It's still fairly minimalistic, but I liken it to a warm honey tea - it may be simple and subdued, but still provides a relaxing, enjoyable experience.	2020-04-06
90	App Trigger	While Animal Crossing: New Horizons has some design annoyance, like conversation menus and online play, there’s so much that’s good that it heavily outweighs the bad. With an addictive gameplay loop and the ability to play however you want, Animal Crossing: New Horizons is a system seller — a great game for veterans of the series, newcomers, gamers and non-gamers. And one that the whole family can enjoy.	2020-04-07
80	M3	Initially we were a little skeptical of Animal Crossing: New Horizons. Our expectations were so high, but we got bored by the repetitive tasks. However, after about five hours something happens with the game. The Animal Crossing spirit engulfs us for real, and we reach for our Switch as soon as we get the chance. Not to put us in for hours, but just to check the location of our island a few minutes at a time. It is a game that we don't love intensely, but rather a game that follows us through the days. And we suspect that will be the case for a long while.	2020-04-07
80	AusGamers	Despite early frustration, Animal Crossing: New Horizon is not only a game I’ll be returning to but also a life worth revisiting. With time comes maturity and now that I know the rules and how to break them each visit can be a holiday or a monetary expedition to create a hoarder’s paradise. Animal Crossing: New Horizons lets you do what you want, at your own pace, as long as you’ve got the Bells to pay for it.	2020-04-07
100	GameSkinny	The latest Animal Crossing is also the best, full of life, charm, and near-endless ways to make your very own island paradise.	2020-04-08
90	The Sydney Morning Herald	This is by far the nicest iteration of the game to date, with both more guided objectives and more options for self-led tomfoolery, wrapped in a much higher definition version of the familiar rustic-meets-plushies visual and audio motifs.	2020-04-08
90	Attack of the Fanboy	It's an exceptional game, with few faults to speak of, and players who have even the slightest inkling of interest should check it out as soon as possible.	2020-04-08
90	Easy Allies	Two weeks worth of New Horizons makes us want even more. Several parts of the day-to-day grind should be accelerated or skipped, but so much of it has already been impressively streamlined compared to prior entries. The series has been a welcoming companion on any console, but it feels especially at home on the Switch, whether you’re visiting a friend’s wonderland online, taking your tropical getaway on the road, checking your progress first thing in the morning, or gathering some last-minute supplies before you turn in for the night. This is the best Animal Crossing has ever been, and this virtual paradise is a wonderful place to escape to.	2020-04-08
88	Game World Navigator Magazine	New Horizons always has something new in store. For example, on the way to your regular fishing spot you can suddenly make acquaintance with a hippie, fly to his island and come back with some great photos. [Issue#244, p.58]	2020-04-08
91	Nintendojo	With additions like terraforming and crafting, the player’s capacity for expression and customization is greater than ever. Coupled with a huge array of neighbor animals to form bonds with, as well as activities to partake in, New Horizons will keep players busy for a very long time. Times are tough for many right now, but perhaps a trip to this digital world will be enough to offer some respite from the storm that is reality.	2020-04-09
90	Merlin'in Kazanı (Turkey)	Animal Crossing New Horizons, the new stop for those who are overwhelmed by city life, opens the doors to a new life for players.	2020-04-09
90	GameOver.gr	Animal Crossing: New Horizons is an ideal escape from the harsh reality of early 2020 and an open window to a peaceful and calm world, where everything is waiting for us to exploit, modify and create.	2020-04-10
90	Cultured Vultures	New Horizons is a great continuation of an already fantastic series of games, and paying back Tom Nook’s loan has never been so fun.	2020-04-10
80	MMORPG.com	As much as I love Animal Crossing, I suppose I expected just a lot more than what we’ve seen in New Leaf and Pocket Camp. I would even throw my hands up in elation if Gyroids made their triumphant return as audible and visual furniture once again.  Despite some of these minor misgivings, and lost opportunities in my estimation, Animal Crossing: New Horizons delivers on an island building simulation that will not disappoint. If you’re headed to the island, say “Hi” to Nook for me.	2020-04-10
70	Slant Magazine	By consolidating so much power in your hands, the game threatens to upend the Animal Crossing vision of community living.	2020-04-12
90	Hardcore Gamer	Animal Crossing has always been a series where every little thing leads to something productive. Doing nothing and staring off into the sky is relaxing, decorating houses is fun and catching critters feels rewarding. There’s never been a real “point” to Animal Crossing but that’s what makes it enjoyable, as every person can enjoy and do what they like at their own pace. New Horizons nails this feeling more than ever, with so many options and lots of things to collect and enjoy. While it’s easy to play in short bursts, it’s often hard to stop playing when ideas keep coming and experimentation is so much fun when there’s little to no consequences. New Horizons is by far the best Animal Crossing and anyone looking for a way to relax or get creative should not miss out.	2020-04-13
90	Impulsegamer	Animal Crossing New Horizons is pure fun and proves that this game still has it! So what are you waiting for, go out there and build your island and meet a colourful assortment of animals that will call your island home! Recommended from start to finish and then back again!	2020-04-16
90	PLAY! Zine	Animal Crossing: New Horizons is a definitive Animal Crossing experience, no fan should miss. Lots of great additions, make for the most customizable game the series ever had. Build homes and furniture, but also change entire island landscapes, in this everlasting source - of things to do.	2020-04-17
95	GameGrin	New Horizons is simply the best Animal Crossing game to date. New features have been expertly developed, the pacing is perfect whilst retaining the magical charm the series has always been based upon. The latest in a growing line of must-own Switch titles.	2020-04-22
90	NF Magazine	I can't wait to see what the future will hold. [Issue #46 – May/June 2020, p. 68]	2020-05-01
80	PCMag	Animal Crossing: New Horizons brings the most laid-back game series ever to the Nintendo Switch, putting you on a desert island where you can just chill out, fish, catch bugs, and decorate.	2020-05-01
